conference_code,session_name,paper_id,title,authors,institutions,abstract,presentation_url,presentation_available,paper_url,paper_available,poster_url,poster_available,doi,page_number
CYCLOTRONS2013,,WEPPT028,Proposal for High Power Cyclotrons Test Site in Catania,L. Calabretta; D. Campo; L. Celona; L. Cosentino; C. Cui; G. Gallo; D. Rifuggiato; INFN/LNS; Catania; Italy; J.R. Alonso; W.A. Barletta; A. Calanna; D. Campo; J.M. Conrad; MIT; Cambridge; Massachusetts; USA; BCSI; Vancouver; BC; Canada; INFN/LNL; Legnaro (PD); Italy; The IsoDAR and DAEδALUS experiments will use cyclotrons to deliver high intensity (10 mA peak current) proton beams to neutrino-producing targets. To achieve these very high currents; we plan to inject and accelerate molecular H2+ ions in the cyclotrons. To understand high intensity H2+ injection into the central region of a compact cyclotron; and to benchmark space-charge dominated simulation studies; central-region tests are being conducted. Building on the first experiments at Best Cyclotrons; Vancouver (Abstract 1261); a larger-scale test cyclotron will be built at INFN-LNS in Catania. This cyclotron will be designed for 7 MeV/n (Q/A = 0.5; H2+ or He++). After the first year of operation dedicated at optimization of the central region for the injection of high intensity Q/A = 0.5 beams; the cyclotron will be modified to allow the acceleration of H− up to an energy of 28 MeV. The main characteristics of the machine and the planned test stand will be presented.,,,https://proceedings.jacow.org/CYCLOTRONS2013/talks/weppt028_talk.pdf,False,https://proceedings.jacow.org/CYCLOTRONS2013/papers/weppt028.pdf,True,https://proceedings.jacow.org/CYCLOTRONS2013/posters/weppt028_poster.pdf,False,https://doi.org/10.18429/JACoW-CYCLOTRONS2013-WEPPT028,378
CYCLOTRONS2013,,WEPPT029,The Cyclotron Complex for the DAEδALUS Experiment,A. Calanna; D. Campo; J.M. Conrad; MIT; Cambridge; Massachusetts; USA; INFN/LNS; Catania; Italy; M. Haj Tahar; F. Méot; BNL; Upton; Long Island; New York; USA; The cyclotron complex for the DAEδALUS CP-Violation neutrino experiment consists of a compact cyclotron able to accelerate high-current (5 electrical milliamp) H2+ beams up to an energy of 60 MeV/amu; cleanly extract this beam with a conventional septum arrangement; and transport it to a superconducting ring cyclotron able to accelerate the beam up to 800 MeV/amu. H2+ is dissociated with thin stripping foils for efficient extraction as protons for transport to a megawatt-class target for neutrino production. The injection cyclotron will be similar to the one proposed for the IsoDAR experiment (Paper,,,https://proceedings.jacow.org/CYCLOTRONS2013/talks/weppt029_talk.pdf,False,https://proceedings.jacow.org/CYCLOTRONS2013/papers/weppt029.pdf,True,https://proceedings.jacow.org/CYCLOTRONS2013/posters/weppt029_poster.pdf,False,https://doi.org/10.18429/JACoW-CYCLOTRONS2013-WEPPT029,381
CYCLOTRONS2013,,WEPPT030,High Intensity Compact Cyclotron for ISODAR Experiment,"D. Campo; J.R. Alonso; W.A. Barletta; L.M. Bartoszek; A. Calanna; J.M. Conrad; M. Toups; MIT; Cambridge; Massachusetts; USA; PSI; Villigen PSI; Switzerland; L. Calabretta; C. Cui; G. Gallo; INFN/LNS; Catania; Italy; R. Gutierrez-Martinez; L.A. Winslow; UCLA; Los Angeles; USA; Columbia University; New York; USA; CIAE; Beijing; People's Republic of China; IsoDAR is an experiment proposed to look for the existence of sterile neutrinos. These are additional neutrino states beyond the ""standard"" 3-nu paradigm; are predicted to exist to explain anomalies in several neutrino experiments. In IsoDAR (Isotope Decay At Rest); electron antineutrinos produced in a target ~15 meters from a kiloton-scale detector would oscillate into and out of the sterile state within the extent of the detector; producing a sinusoidal event rate as a function of distance from the target. The nu-e-bar flux arises from decay of 8Li; produced when a high-current beam of protons or deuterons strikes a beryllium target either directly; or via secondary neutrons that interact in a large; ultra-pure 7Li sleeve surrounding the target. A compact Q/A = 0.5 cyclotron with top energy of 60 MeV/amu will be installed underground close to KamLAND. This cyclotron is a prototype for the DAEδALUS cyclotron chain (Paper",,,https://proceedings.jacow.org/CYCLOTRONS2013/talks/weppt030_talk.pdf,False,https://proceedings.jacow.org/CYCLOTRONS2013/papers/weppt030.pdf,True,https://proceedings.jacow.org/CYCLOTRONS2013/posters/weppt030_poster.pdf,False,https://doi.org/10.18429/JACoW-CYCLOTRONS2013-WEPPT030,384
CYCLOTRONS2013,,WEPPT031,High Intensity Beam Studies Using the KURRI FFAGs,S. Machida; C. Gabor; D.J. Kelliher; C.R. Prior; C.T. Rogers; S.L. Sheehy; STFC/RAL/ASTeC; Chilton; Didcot; Oxon; United Kingdom; Y. Ishi; J.-B. Lagrange; Y. Mori; T. Uesugi; Kyoto University; Research Reactor Institute; Osaka; Japan; Increasing the repetition rate of FFAG accelerators is one way of obtaining high average beam current. However; in order to achieve beam powers of up to 10 MW for applications like ADSR; the number of particles per bunch has to be approximately the same order in an FFAG as in a high power synchrotron. Collective effects such as space charge then become crucial issues. To understand high current beam behaviour in FFAGs; an international collaboration has been established to carry out an experimental programme using the FFAGs at Kyoto University's Research Reactor Institute; KURRI. The goal is to demonstrate acceleration of high bunch charge and identify the fundamental limitations. In this paper; we will show simulation results toward the first beam experiment which is planned for later in 2013.,,,https://proceedings.jacow.org/CYCLOTRONS2013/talks/weppt031_talk.pdf,False,https://proceedings.jacow.org/CYCLOTRONS2013/papers/weppt031.pdf,True,https://proceedings.jacow.org/CYCLOTRONS2013/posters/weppt031_poster.pdf,False,https://doi.org/10.18429/JACoW-CYCLOTRONS2013-WEPPT031,387
CYCLOTRONS2013,,WEPSH003,Development of New Combined System for Production of FDG and NaF Radiopharmaceuticals,F. Dehghan; H. Afarideh; S. Jaloo; AUT; Tehran; Iran; Tehran University of Medical Sciences; Research Center for Nuclear Medicine; Tehran; Iran; J.-S. Chai; J.-S. Chai; M. Ghergherehchi; SKKU; Suwon; Republic of Korea; In this work; we present a new combined system which produces FDG and NaF in separate runs. The needed for synthesis this radiopharmaceuticals are obtained by bombardment of highly enriched water with proton. The aim is development of routine systems to use with baby cyclotrons. In this study; the various chemical steps and required reagents as well as different reagent delivery methods has been investigated. This evaluation has been done with purpose of optimizing the performance of a conceptually simple device integrated into a fully automated synthesis procedure for radiosynthesis of FDG and NaF. In this system; we have used AVR microcontroller to control the process and LabVIEW software for monitoring the operation of system. Furthermore; Geiger Muller counters have been used to determine the activity to insure the accuracy of the systems operation.,,,https://proceedings.jacow.org/CYCLOTRONS2013/talks/wepsh003_talk.pdf,False,https://proceedings.jacow.org/CYCLOTRONS2013/papers/wepsh003.pdf,True,https://proceedings.jacow.org/CYCLOTRONS2013/posters/wepsh003_poster.pdf,False,https://doi.org/10.18429/JACoW-CYCLOTRONS2013-WEPSH003,390
CYCLOTRONS2013,,WEPSH006,Zn Radioisotope Production by Cyclotron,M. Ghergherehchi; J.-S. Chai; J.-S. Chai; SKKU; Suwon; Republic of Korea; AUT; Tehran; Iran; Natural Cu target was irradiated with proton beam in the energy range of 15 to 30 MeV at a beam current of 100 μA for 15 min. In this irradiation radioisotope of 62Zn produced as a generator and then decay to 62Cu radioisotope. The 62Cu is emitting β+ and known to PET radioisotope. Excitation function of 62Cu via natCu (p; 2n) 62Zn; 62Cu and 62Cu (d; 3n) 62Zn reactions were calculated using Alice and Talys codes and then were compared with the reported measurement by experimental data and ENDF-2011 data. Production yield versus target thickness were evaluated with attention to reaction cross section data obtained from Alice and Talys codes; and stopping power and range of protons in target materials using SRIM code. The production yield also examined experimentally and found that the optimum irradiation yield achieved to be 5.9 mci/μAh at protons of 100 μA current and 30 MeV energy. A radiolabeling process also was performed using 62ZnCl2 and antitumor compound; bleomycin (BLM) as a possible tumor imaging.,,,https://proceedings.jacow.org/CYCLOTRONS2013/talks/wepsh006_talk.pdf,False,https://proceedings.jacow.org/CYCLOTRONS2013/papers/wepsh006.pdf,True,https://proceedings.jacow.org/CYCLOTRONS2013/posters/wepsh006_poster.pdf,False,https://doi.org/10.18429/JACoW-CYCLOTRONS2013-WEPSH006,393
CYCLOTRONS2013,,WEPSH007,Radiochromic Film as a Dosimetric Tool for Low Energy Proton Beams,S. Devic; S. Aldelaijan; F.M. Alrumayan; F. Alzorkani; B.M. Moftah; M. Shehadeh; King Faisal Specialist Hospital and Research Centre; Riyadh 11211; Kingdom of Saudi Arabia; EBT3 and HDV2 GAFCHROMICTM films were tested for dose measurements at a 26.5 MeV and 6 mm Bragg peak proton beam. Beam output was calibrated using IAEA TRS-398 reference dosimetry protocol with calibrated chamber in water. Films were calibrated in terms of dose to water by exposing calibration film pieces within a solid water phantom at depth of 3 mm. EBT3 films were irradiated to doses of up to 10 Gy with both 4 MV photon and 26.5 MeV proton beams; while pieces of the HDV2 radiochromic films were irradiated to doses of up to 128 Gy proton beam. Irradiated pieces of the EBT3 films were tested for activation using Germanium detector. Their energy spectra were measured over a period of 40 minutes. EBT3 film model response was 3 times higher for protons than photons. When irradiated in proton beam the EBT3 was 24 times more sensitive than HDV2 films. For the EBT3 film model; few proton-activated processes were identified resulting in short-lived radioisotopes. EBT3 film can be used for measurements for doses of up to 10 Gy using a green color channel of the scanned images; while the red color channel of the HDV2 scanned film images can be used for measurements of much higher doses.,,,https://proceedings.jacow.org/CYCLOTRONS2013/talks/wepsh007_talk.pdf,False,https://proceedings.jacow.org/CYCLOTRONS2013/papers/wepsh007.pdf,True,https://proceedings.jacow.org/CYCLOTRONS2013/posters/wepsh007_poster.pdf,False,https://doi.org/10.18429/JACoW-CYCLOTRONS2013-WEPSH007,397
CYCLOTRONS2013,,WEPSH008,Characterization of the CS30 Cyclotron at KFSH&RC for Radiotherapy Applications,Belal Moftah; PhD; Riyadh; Kingdom of Saudi Arabia; S. Aldelaijan; F.M. Alrumayan; F. Alzorkani; S. Devic; M. Shehadeh; King Faisal Specialist Hospital and Research Centre; Riyadh 11211; Kingdom of Saudi Arabia; The 26.5 MeV beam of the CS30 Cyclotron at King Faisal Specialist Hospital and Research Centre (KFSH&RC) was characterized dosimetrically for the use in radiobiological experiments for pre-clinical and radiotherapy studies. Position of the beam’s Bragg peak was measured with a stack of 60 pieces of HDV2 model GAFCHROMICTM films (105 microns thick each). This film type was specifically designed for measurement of very high doses; ranging up to 1; 000 Gy. Output of the proton beam was calibrated using IAEA TRS-398 reference dosimetry protocol with calibrated parallel plate chamber in water. The response of the film was calibrated in terms of dose to water by exposing calibration film pieces within a solid water phantom. The position of the Bragg peak was found to be at around 6 mm when 10 to 20 nA proton beam current was used. Pieces of radiochromic film were irradiated at 40; 70 and 100 cm from the primary collimator; where the Gaussian shaped beam profiles had values of 12; 26; 45 mm FWHM respectively. Proton beam characteristics in terms of the output and beam size appear to be acceptable for pre-clinical studies.,,,https://proceedings.jacow.org/CYCLOTRONS2013/talks/wepsh008_talk.pdf,False,https://proceedings.jacow.org/CYCLOTRONS2013/papers/wepsh008.pdf,True,https://proceedings.jacow.org/CYCLOTRONS2013/posters/wepsh008_poster.pdf,False,https://doi.org/10.18429/JACoW-CYCLOTRONS2013-WEPSH008,400
CYCLOTRONS2013,,WEPSH010,Proton Therapy at the Institut Curie – CPO: Operation of an IBA C235 Cyclotron Looking Forward Scanning Techniques,A. Patriarca; S.J. Meyroneinc; Institut Curie - Centre de Protonthérapie d'Orsay; Orsay; France; Since 1991; more than 6100 patients (mainly eye and head & neck tumours) were treated at the Institut Curie – Centre de Protonthèrapie d’Orsay using Double Scattering proton beam delivery technique. After 19 years of activity; a 200 MeV synchrocyclotron has been shut down and replaced by a 230 MeV C235 IBA proton cyclotron. This delivers beam to two passive fixed treatment rooms and to one universal nozzle equipped gantry. In the past two years of operation more than 95.5% of the scheduled patients (near 500/year) were treated. We have realised; according to IBA recommendations; preventive maintenance (i.e. RF final amplifier) and we have improved some diagnostic tools (i.e. Main Coil monitoring) allowing us to reduce the number of downtime events from 499 in 2011 to 351 in 2012. In order to improve cancer treatment capabilities we are now involved in the transition towards scanning particle therapy; requiring even more accurate quality assurance protocols. We describe here the main cyclotron issues (ion source; deflector) and what is needed to perform a proper scanning technique; the main goal being the enhancement of our reliability performances.,,,https://proceedings.jacow.org/CYCLOTRONS2013/talks/wepsh010_talk.pdf,False,https://proceedings.jacow.org/CYCLOTRONS2013/papers/wepsh010.pdf,True,https://proceedings.jacow.org/CYCLOTRONS2013/posters/wepsh010_poster.pdf,False,https://doi.org/10.18429/JACoW-CYCLOTRONS2013-WEPSH010,403
CYCLOTRONS2013,,WEPSH043,Performance of IBA New Conical Shaped Niobium [18O] Water Targets,F.G. Devillet; J. Courtyn; J.-M. Geets; M. Ghyoot; E.K. Kral; O. Michaux; B. Nactergal; V. Nuttens; IBA; Louvain-la-Neuve; Belgium; R. Mooij; L.R. Perk; BV Cyclotron VU; Amsterdam; The Netherlands; Background: Because of an ever increasing demand for Fluoride-18 (18F-); efforts are made to increase the performance of the 18F-target systems. Moreover; given the particularly high cost of 18O enriched water; only a small volume of this target material is desired. Procedure: Four conical shaped targets* with different target chamber sizes (Conical 6 – 2.4ml; Conical 8 – 3.2ml; Conical 12 - 5ml; Conical 16 - 7ml) were tested using IBA Cyclone® 18 MeV cyclotrons. The targets were filled with different volumes of 18O water (enrichment >92%) and irradiated with 18 MeV protons on target with beam currents up to 145 μA for 30–150 minutes. Fluoride-18 saturation activity yields and pressure curves were completed. Radionuclidic impurities were measured; even if the new target is using the same principle of Niobium body with Havar® window. Conclusions: Reliable operation in a production environment has been observed at beam currents up to 145 μA using less 18O enriched water as compared to the currently available IBA target systems without affecting the yield. The new design with less Orings and direct insertion of flow line into the niobium chamber has proven its effectiveness.,,*Patent application: WO 2012/055970 A1,https://proceedings.jacow.org/CYCLOTRONS2013/talks/wepsh043_talk.pdf,False,https://proceedings.jacow.org/CYCLOTRONS2013/papers/wepsh043.pdf,True,https://proceedings.jacow.org/CYCLOTRONS2013/posters/wepsh043_poster.pdf,True,https://doi.org/10.18429/JACoW-CYCLOTRONS2013-WEPSH043,406
CYCLOTRONS2013,,WE3PB01,Experimental Study of Resonance Crossing with a Paul Trap,KEK; Ibaraki; Japan; T. Planche; R.A. Baartman; Y.-N. Rao; TRIUMF; Canada's National Laboratory for Particle and Nuclear Physics; Vancouver; Canada; The νr=3/2 resonance; driven by the third harmonic of the magnetic gradient errors; causes modulation of the radial beam density in the TRIUMF cyclotron. Since extraction is by H- stripping; this modulation induces unwanted fluctuations of the current split between the two high-energy beam lines. To compensate field imperfections; the cyclotron has sets of harmonic correction coils at different radii; each set constituted of 6 pairs of coils placed in a 6-fold symmetrical manner. The 6-fold symmetry of this layout cannot create a third harmonic of arbitrary phase; and so a single set of harmonic coils cannot provide a full correction of third harmonic errors driving the νr=3/2 resonance. However; the outermost two sets of harmonic correction coils are azimuthally displaced. We took advantage of it to achieve a full correction of the resonance. This greatly improved the beam current stability in the high-energy beam lines. To further improve the current stability in the high-energy beam lines; we implemented an active feedback system. This feedback system acts on the amplitude of the first harmonic Bz correction produced by outermost set of harmonic coils.; D. Winklehner; D.G. Cole; D. Leitner; G. Machicoane; L. Tobos; NSCL; East Lansing; Michigan; USA; Space charge compensation is a well-known phenomenon for high current injector beam lines. For beam lines using mostly magnetic focusing elements and for pressures above 10-6 mbar; compensation (neutralization) up to 98% has been observed. However; due to the low pressures required for the efficient transport of high charge state ions; ion beams in ECR injector lines are typically only partly neutralized and space charge effects are present. With the dramatic performance increase of the next generation Electron Cyclotron Resonance Ion Sources (ECRIS) it is possible to extract tens of mA of beams from ECR plasmas. Realistic beam transport simulations are important to meet the acceptance criteria of subsequent accelerator systems and have to include non-linear effects from space charge; but also space charge compensation. In this contribution we report on measurements of space charge compensation in the ECRIS low energy beam lines of the Coupled Cyclotron Facility at NSCL using a retarding field analyzer. Results are discussed and compared to simulations.; A. Sen; S. Brandenburg; M.A. Hofstee; KVI; Groningen; The Netherlands; UMCG; Groningen; The Netherlands; During the acceleration of intense low energy heavy ion beams in the AGOR cyclotron feedback between beam intensity and pressure; driven by beam loss induced desorption; is observed. This feedback limits the attainable beam intensity. Calculations and measurements of the pressure dependent transmission for various beam agree reasonably well. Calculation of the trajectories of ions after a charge change shows that the desorption is mainly due to ions with near extraction energies; hitting the outer wall at a shallow angle of incidence. For heavy ions like 206Pb27+ several charge exchanges are needed before the orbit becomes unstable. Our calculations indicate that these ions make thousands of turns before finally hitting the wall. They therefore are a large fraction of the circulating ions and may contribute to vacuum degradation through restgas ionization. Ion induced desorption for relevant ions and materials has been measured; it explains the observations in the cyclotron semi-quantitatively.,Space Charge Compensation Measurements in the  Injector Beam Lines of the NSCL Coupled Cyclotron Facility,"The effect of resonance crossing on beam stability is studied systematically by employing a novel tabletop experimental tool and a multiparticle simulation code. A large number of ions are confined in a compact linear Paul trap to reproduce the collective beam behavior. We can prove that the ion plasma in the trap is physically equivalent to a charged-particle beam propagating through a strong focusing channel. The plasma confinement force is quickly ramped such that the trap operating point traverses linear and nonlinear resonance stop bands as in cyclotrons and FFAGs. Slides WE3PB01 [9.757 MB] Improvement of the Current Stability from the TRIUMF Cyclotron Slides WE3PB02 [1.007 MB] Slides WE3PB03 [8.833 MB] Transmission of Heavy Ion Beams in the AGOR Cyclotron This work has been financially supported by the Foundation FOM, the Dutch funding agency NWO and the EU-FP7, Grant Agreement n° 262010 - ENSAR. Slides WE3PB04 [5.272 MB]",https://proceedings.jacow.org/CYCLOTRONS2013/talks/we3pb01_talk.pdf,True,https://proceedings.jacow.org/CYCLOTRONS2013/papers/we3pb01.pdf,True,https://proceedings.jacow.org/CYCLOTRONS2013/posters/we3pb01_poster.pdf,False,https://doi.org/10.18429/JACoW-CYCLOTRONS2013-WE3PB01,409
CYCLOTRONS2013,,WE3PB02,Improvement of the Current Stability from the TRIUMF Cyclotron,T. Planche; R.A. Baartman; Y.-N. Rao; TRIUMF; Canada's National Laboratory for Particle and Nuclear Physics; Vancouver; Canada; The νr=3/2 resonance; driven by the third harmonic of the magnetic gradient errors; causes modulation of the radial beam density in the TRIUMF cyclotron. Since extraction is by H- stripping; this modulation induces unwanted fluctuations of the current split between the two high-energy beam lines. To compensate field imperfections; the cyclotron has sets of harmonic correction coils at different radii; each set constituted of 6 pairs of coils placed in a 6-fold symmetrical manner. The 6-fold symmetry of this layout cannot create a third harmonic of arbitrary phase; and so a single set of harmonic coils cannot provide a full correction of third harmonic errors driving the νr=3/2 resonance. However; the outermost two sets of harmonic correction coils are azimuthally displaced. We took advantage of it to achieve a full correction of the resonance. This greatly improved the beam current stability in the high-energy beam lines. To further improve the current stability in the high-energy beam lines; we implemented an active feedback system. This feedback system acts on the amplitude of the first harmonic Bz correction produced by outermost set of harmonic coils.; D. Winklehner; D.G. Cole; D. Leitner; G. Machicoane; L. Tobos; NSCL; East Lansing; Michigan; USA; Space charge compensation is a well-known phenomenon for high current injector beam lines. For beam lines using mostly magnetic focusing elements and for pressures above 10-6 mbar; compensation (neutralization) up to 98% has been observed. However; due to the low pressures required for the efficient transport of high charge state ions; ion beams in ECR injector lines are typically only partly neutralized and space charge effects are present. With the dramatic performance increase of the next generation Electron Cyclotron Resonance Ion Sources (ECRIS) it is possible to extract tens of mA of beams from ECR plasmas. Realistic beam transport simulations are important to meet the acceptance criteria of subsequent accelerator systems and have to include non-linear effects from space charge; but also space charge compensation. In this contribution we report on measurements of space charge compensation in the ECRIS low energy beam lines of the Coupled Cyclotron Facility at NSCL using a retarding field analyzer. Results are discussed and compared to simulations.; A. Sen; S. Brandenburg; M.A. Hofstee; KVI; Groningen; The Netherlands; UMCG; Groningen; The Netherlands; During the acceleration of intense low energy heavy ion beams in the AGOR cyclotron feedback between beam intensity and pressure; driven by beam loss induced desorption; is observed. This feedback limits the attainable beam intensity. Calculations and measurements of the pressure dependent transmission for various beam agree reasonably well. Calculation of the trajectories of ions after a charge change shows that the desorption is mainly due to ions with near extraction energies; hitting the outer wall at a shallow angle of incidence. For heavy ions like 206Pb27+ several charge exchanges are needed before the orbit becomes unstable. Our calculations indicate that these ions make thousands of turns before finally hitting the wall. They therefore are a large fraction of the circulating ions and may contribute to vacuum degradation through restgas ionization. Ion induced desorption for relevant ions and materials has been measured; it explains the observations in the cyclotron semi-quantitatively.,Space Charge Compensation Measurements in the  Injector Beam Lines of the NSCL Coupled Cyclotron Facility,"Slides WE3PB02 [1.007 MB] Slides WE3PB03 [8.833 MB] Transmission of Heavy Ion Beams in the AGOR Cyclotron This work has been financially supported by the Foundation FOM, the Dutch funding agency NWO and the EU-FP7, Grant Agreement n° 262010 - ENSAR. Slides WE3PB04 [5.272 MB]",https://proceedings.jacow.org/CYCLOTRONS2013/talks/we3pb02_talk.pdf,True,https://proceedings.jacow.org/CYCLOTRONS2013/papers/we3pb02.pdf,True,https://proceedings.jacow.org/CYCLOTRONS2013/posters/we3pb02_poster.pdf,False,https://doi.org/10.18429/JACoW-CYCLOTRONS2013-WE3PB02,414
