conference_code,session_name,paper_id,title,authors,institutions,abstract,presentation_url,presentation_available,paper_url,paper_available,poster_url,poster_available,doi,page_number
CYCLOTRONS2013,,TU3PB01,Bunch-Shape Measurements at PSI’s High-power Cyclotrons and Proton Beam Lines,"PSI; Villigen PSI; Switzerland; Longitudinal-transversal 2D-density distributions of the bunched 2.2 mA CW proton beam can now be measured at the 13 last turns of the Injector 2 cyclotron; at several locations in the connecting beam line to the Ring cyclotron; at the first two turns of the Ring cyclotron (all at energies around 72 MeV); as well as behind the Ring cyclotron (at 590 MeV). In the large part; distributions can be taken from several angles of view; separated each by 45°. The measurement systems at our facility have evolved with time; this paper gives the present status; performance; limits and typical results. Due to the limited space; we refer in the large part to our previous publications [1; 2; 3] and concentrate on recent findings and measurements and ideas for next steps.; M.M. Strohmeier; J.Y. Benitez; M.K. Covo; C.M. Lyneis; B. Ninemire; L. Phair; P. Pipersky; D.S. Todd; LBNL; Berkeley; California; USA; Mevion; Littleton; Massachusetts; USA; Operators at the 88-Inch Cyclotron have many tuning parameters to optimize transmission from injection through extraction. However; the only diagnostics they have had were a Faraday Cup at the exit of the machine and a so called ""Dee-Probe"" which gives a current-vs-radius (IvR) measurement. Motivated by low transmission of the Cyclotron and to address how tuning can affect the beam; we have developed an optical beam viewer whose radial position within the cyclotron can be adjusted remotely. This viewer allows us to image the beam cross section and its axial position with very high spatial resolution as a function of radius. In this paper; we describe the mechanical development of the device which consists of a Kbr scintillator crystal; a fiber bundle and a digital camera and we present data from its initial commissioning.; H. Imao; T. Dantsuka; M. Fujimaki; N. Fukunishi; H. Hasebe; O. Kamigaito; M. Kase; H. Kuboki; K. Kumagai; T. Maie; H. Okuno; T. Watanabe; Y. Watanabe; K. Yamada; Y. Yano; RIKEN Nishina Center; Wako; Japan; Intensity upgrade of uranium beams is one of the main concerns at the RIKEN Radioactive Isotope Beam Factory (RIBF). The lifetime problem of carbon-foil strippers due to the high energy loss of uranium beams around 10~MeV/u was a principal bottleneck for the intensity upgrade in the acceleration scheme at the RIBF. We have developed a re-circulating He-gas stripper as an alternative to carbon foils for the acceleration of high-power uranium beams. The new stripping system was actually operated in user runs with U35+ beams of more than 1 puA. Electron-stripped U64+ beams were stably delivered to subsequent accelerators without serious deterioration of the system for six weeks. The new He-gas stripper; which removed the primary bottleneck in the high-intensity uranium acceleration; greatly contributed the tenfold increase of the average output intensity of the uranium beams from the previous year.; Y.-N. Rao; R.A. Baartman; I.V. Bylinskii; V.A. Verzilov; TRIUMF; Canada's National Laboratory for Particle and Nuclear Physics; Vancouver; Canada; PSI; Villigen PSI; Switzerland; We made important developments on the extraction probes and stripping foils at TRIUMF. One of the issues we had was the 7Be contamination being observed near the 1A stripper; and relatedly; stripping foils warped or even broke during use. This was deemed due to over-heating in the foil and the frame. Another issue was related to the beam spills. Beam spills are primarily caused by the large angle scattering from the stripping foil. It was thus suggested that thinner foils be used to minimize the scattering. In view of these 2 issues; improvements were made such that (1) highly-orientated pyrolytic graphite foils; of thickness around 2 mg/cm2; are now used; (2) Tantalum frame is now used in place of the previous stainless steel. These changes; plus additional heat relief features introduced; have resulted in 4 times longer lifetime with the foil; and 5 to 10 times reduction to the tank contamination level around the extraction probe. Also; these improvements have led to significantly reduced amount of beam spill monitor trips. This paper presents these developments and outcomes; including the simulations and calculations performed.",Funding: TRIUMF receives funding via a contribution agreement through the National Research Council of Canada.,Slides TU3PB01 [9.393 MB] Development of a Scintillator Probe Based on Fiber Optics for Radial Beam Diagnostics of the Ion Beam of the 88-Inch Cyclotron Slides TU3PB02 [4.936 MB] R&D of Helium Gas Stripper for Intense Uranium Beams Slides TU3PB03 [11.983 MB] TRIUMF Extraction Foil Developments and Contamination Reduction Slides TU3PB04 [4.798 MB],https://proceedings.jacow.org/CYCLOTRONS2013/talks/tu3pb01_talk.pdf,True,https://proceedings.jacow.org/CYCLOTRONS2013/papers/tu3pb01.pdf,True,https://proceedings.jacow.org/CYCLOTRONS2013/posters/tu3pb01_poster.pdf,False,https://doi.org/10.18429/JACoW-CYCLOTRONS2013-TU3PB01,257
CYCLOTRONS2013,,TU3PB02,Development of a Scintillator Probe Based on Fiber Optics for Radial Beam Diagnostics of the Ion Beam of the 88-Inch Cyclotron,"M.M. Strohmeier; J.Y. Benitez; M.K. Covo; C.M. Lyneis; B. Ninemire; L. Phair; P. Pipersky; D.S. Todd; LBNL; Berkeley; California; USA; Mevion; Littleton; Massachusetts; USA; Operators at the 88-Inch Cyclotron have many tuning parameters to optimize transmission from injection through extraction. However; the only diagnostics they have had were a Faraday Cup at the exit of the machine and a so called ""Dee-Probe"" which gives a current-vs-radius (IvR) measurement. Motivated by low transmission of the Cyclotron and to address how tuning can affect the beam; we have developed an optical beam viewer whose radial position within the cyclotron can be adjusted remotely. This viewer allows us to image the beam cross section and its axial position with very high spatial resolution as a function of radius. In this paper; we describe the mechanical development of the device which consists of a Kbr scintillator crystal; a fiber bundle and a digital camera and we present data from its initial commissioning.; H. Imao; T. Dantsuka; M. Fujimaki; N. Fukunishi; H. Hasebe; O. Kamigaito; M. Kase; H. Kuboki; K. Kumagai; T. Maie; H. Okuno; T. Watanabe; Y. Watanabe; K. Yamada; Y. Yano; RIKEN Nishina Center; Wako; Japan; Intensity upgrade of uranium beams is one of the main concerns at the RIKEN Radioactive Isotope Beam Factory (RIBF). The lifetime problem of carbon-foil strippers due to the high energy loss of uranium beams around 10~MeV/u was a principal bottleneck for the intensity upgrade in the acceleration scheme at the RIBF. We have developed a re-circulating He-gas stripper as an alternative to carbon foils for the acceleration of high-power uranium beams. The new stripping system was actually operated in user runs with U35+ beams of more than 1 puA. Electron-stripped U64+ beams were stably delivered to subsequent accelerators without serious deterioration of the system for six weeks. The new He-gas stripper; which removed the primary bottleneck in the high-intensity uranium acceleration; greatly contributed the tenfold increase of the average output intensity of the uranium beams from the previous year.; Y.-N. Rao; R.A. Baartman; I.V. Bylinskii; V.A. Verzilov; TRIUMF; Canada's National Laboratory for Particle and Nuclear Physics; Vancouver; Canada; PSI; Villigen PSI; Switzerland; We made important developments on the extraction probes and stripping foils at TRIUMF. One of the issues we had was the 7Be contamination being observed near the 1A stripper; and relatedly; stripping foils warped or even broke during use. This was deemed due to over-heating in the foil and the frame. Another issue was related to the beam spills. Beam spills are primarily caused by the large angle scattering from the stripping foil. It was thus suggested that thinner foils be used to minimize the scattering. In view of these 2 issues; improvements were made such that (1) highly-orientated pyrolytic graphite foils; of thickness around 2 mg/cm2; are now used; (2) Tantalum frame is now used in place of the previous stainless steel. These changes; plus additional heat relief features introduced; have resulted in 4 times longer lifetime with the foil; and 5 to 10 times reduction to the tank contamination level around the extraction probe. Also; these improvements have led to significantly reduced amount of beam spill monitor trips. This paper presents these developments and outcomes; including the simulations and calculations performed.",Funding: TRIUMF receives funding via a contribution agreement through the National Research Council of Canada.,Slides TU3PB02 [4.936 MB] R&D of Helium Gas Stripper for Intense Uranium Beams Slides TU3PB03 [11.983 MB] TRIUMF Extraction Foil Developments and Contamination Reduction Slides TU3PB04 [4.798 MB],https://proceedings.jacow.org/CYCLOTRONS2013/talks/tu3pb02_talk.pdf,True,https://proceedings.jacow.org/CYCLOTRONS2013/papers/tu3pb02.pdf,True,https://proceedings.jacow.org/CYCLOTRONS2013/posters/tu3pb02_poster.pdf,False,https://doi.org/10.18429/JACoW-CYCLOTRONS2013-TU3PB02,262
CYCLOTRONS2013,,TU3PB03,R&D of Helium Gas Stripper for Intense Uranium Beams,H. Imao; T. Dantsuka; M. Fujimaki; N. Fukunishi; H. Hasebe; O. Kamigaito; M. Kase; H. Kuboki; K. Kumagai; T. Maie; H. Okuno; T. Watanabe; Y. Watanabe; K. Yamada; Y. Yano; RIKEN Nishina Center; Wako; Japan; Intensity upgrade of uranium beams is one of the main concerns at the RIKEN Radioactive Isotope Beam Factory (RIBF). The lifetime problem of carbon-foil strippers due to the high energy loss of uranium beams around 10~MeV/u was a principal bottleneck for the intensity upgrade in the acceleration scheme at the RIBF. We have developed a re-circulating He-gas stripper as an alternative to carbon foils for the acceleration of high-power uranium beams. The new stripping system was actually operated in user runs with U35+ beams of more than 1 puA. Electron-stripped U64+ beams were stably delivered to subsequent accelerators without serious deterioration of the system for six weeks. The new He-gas stripper; which removed the primary bottleneck in the high-intensity uranium acceleration; greatly contributed the tenfold increase of the average output intensity of the uranium beams from the previous year.; Y.-N. Rao; R.A. Baartman; I.V. Bylinskii; V.A. Verzilov; TRIUMF; Canada's National Laboratory for Particle and Nuclear Physics; Vancouver; Canada; PSI; Villigen PSI; Switzerland; We made important developments on the extraction probes and stripping foils at TRIUMF. One of the issues we had was the 7Be contamination being observed near the 1A stripper; and relatedly; stripping foils warped or even broke during use. This was deemed due to over-heating in the foil and the frame. Another issue was related to the beam spills. Beam spills are primarily caused by the large angle scattering from the stripping foil. It was thus suggested that thinner foils be used to minimize the scattering. In view of these 2 issues; improvements were made such that (1) highly-orientated pyrolytic graphite foils; of thickness around 2 mg/cm2; are now used; (2) Tantalum frame is now used in place of the previous stainless steel. These changes; plus additional heat relief features introduced; have resulted in 4 times longer lifetime with the foil; and 5 to 10 times reduction to the tank contamination level around the extraction probe. Also; these improvements have led to significantly reduced amount of beam spill monitor trips. This paper presents these developments and outcomes; including the simulations and calculations performed.,Funding: TRIUMF receives funding via a contribution agreement through the National Research Council of Canada.,Slides TU3PB03 [11.983 MB] TRIUMF Extraction Foil Developments and Contamination Reduction Slides TU3PB04 [4.798 MB],https://proceedings.jacow.org/CYCLOTRONS2013/talks/tu3pb03_talk.pdf,True,https://proceedings.jacow.org/CYCLOTRONS2013/papers/tu3pb03.pdf,True,https://proceedings.jacow.org/CYCLOTRONS2013/posters/tu3pb03_poster.pdf,False,https://doi.org/10.18429/JACoW-CYCLOTRONS2013-TU3PB03,265
CYCLOTRONS2013,,TU3PB04,TRIUMF Extraction Foil Developments and Contamination Reduction,Y.-N. Rao; R.A. Baartman; I.V. Bylinskii; V.A. Verzilov; TRIUMF; Canada's National Laboratory for Particle and Nuclear Physics; Vancouver; Canada; PSI; Villigen PSI; Switzerland; We made important developments on the extraction probes and stripping foils at TRIUMF. One of the issues we had was the 7Be contamination being observed near the 1A stripper; and relatedly; stripping foils warped or even broke during use. This was deemed due to over-heating in the foil and the frame. Another issue was related to the beam spills. Beam spills are primarily caused by the large angle scattering from the stripping foil. It was thus suggested that thinner foils be used to minimize the scattering. In view of these 2 issues; improvements were made such that (1) highly-orientated pyrolytic graphite foils; of thickness around 2 mg/cm2; are now used; (2) Tantalum frame is now used in place of the previous stainless steel. These changes; plus additional heat relief features introduced; have resulted in 4 times longer lifetime with the foil; and 5 to 10 times reduction to the tank contamination level around the extraction probe. Also; these improvements have led to significantly reduced amount of beam spill monitor trips. This paper presents these developments and outcomes; including the simulations and calculations performed.,Funding: TRIUMF receives funding via a contribution agreement through the National Research Council of Canada.,Slides TU3PB04 [4.798 MB],https://proceedings.jacow.org/CYCLOTRONS2013/talks/tu3pb04_talk.pdf,True,https://proceedings.jacow.org/CYCLOTRONS2013/papers/tu3pb04.pdf,True,https://proceedings.jacow.org/CYCLOTRONS2013/posters/tu3pb04_poster.pdf,False,https://doi.org/10.18429/JACoW-CYCLOTRONS2013-TU3PB04,269
CYCLOTRONS2013,,TU4PB01,Mapping of the New IBA Superconducting Synchrocyclotron (S2C2) for Proton Therapy,J. van de Walle; W.J.G.M. Kleeven; C. L'Abbate; V. Nuttens; Y. Paradis; IBA; Louvain-la-Neuve; Belgium; M. Conjat; J. Mandrillon; P. Mandrillon; AIMA; Nice; France; The magnetic field in the Superconducting Synchrocyclotron (S2C2) has been measured with a newly developed mapping system during the commissioning of the machine at IBA. The major difference with other mapping systems at IBA is the usage of a search coil; which provides high linearity over a large magnetic field range and the possibility to measure in a more time economic way. The first mapping results of the S2C2 were compared with,,,https://proceedings.jacow.org/CYCLOTRONS2013/talks/tu4pb01_talk.pdf,True,https://proceedings.jacow.org/CYCLOTRONS2013/papers/tu4pb01.pdf,True,https://proceedings.jacow.org/CYCLOTRONS2013/posters/tu4pb01_poster.pdf,False,https://doi.org/10.18429/JACoW-CYCLOTRONS2013-TU4PB01,272
CYCLOTRONS2013,,TU4PB02,Structural and Magnetic Properties of Cast Iron for Cyclotrons,E. Forton; S. Zaremba; IBA; Louvain-la-Neuve; Belgium; E. Ferrara; F. Fiorillo; L. Martino; E. Olivetti; L. Rocchino; INRIM; Turin; Italy; At IBA; the steels used to build the magnets of the Cyclone 230 are cast on demand; using very strict criteria; casting procedure; requirements and quality control. Among the various steps performed at the foundry; a thermal annealing is made. In this work; we assess the usefulness of such thermal treatment. In this communication; samples of pure iron cast ingots (maximum concentration of C = 31 ppm; N = 94 ppm; O = 31 ppm; S = 65 ppm) have been magnetically and structurally characterized. Progressive magnetic softening was observed upon successive annealing steps. These changes of the magnetic properties were ascribed to the relief of internal stresses. Various results; obtained by means of X-ray diffraction; electron microscope and precise determination of magnetization curve and hysteresis loop; will be presented and commented.; K.E. Melconian; S. Assadi; K.C. Damborsky; J.N. Kellams; P.M. McIntyre; N. Pogue; A. Sattarov; Texas A&M University; College Station; Texas; USA; A superconducting strong focusing cyclotron is being developed for high current applications. Alternating-gradient focusing is provided by an array of ~ 6T/m superconducting beam transport channels which lie in the sectors along the arced beam trajectory of each orbit of the cyclotron. The ~1T sector dipoles; corrector dipoles; and Panofsky type quadrupoles utilize MgB2 superconductor operating in the range 15-20 K. The quadrupole windings make it possible to produce strong focusing of the transverse phase space throughout acceleration. The trim dipole makes it possible to maintain isochronicity and to open the orbit spacing at injection and extraction. The design; development and prototype progress will be presented.; N.V. Avreline; W. Gyles; R.L. Watt; ACSI; Richmond; B.C.; Canada; A new magnetic field mapper was designed and built to provide increased accuracy of cyclotron magnetic field measurements. This mapper was designed for mapping the magnetic fields of TR-19; TR-24; and TR-30 cyclotron magnets manufactured by Advanced Cyclotron Systems Inc. A Group3 MPT-141 Hall Probe (HP) with measurement range from 2 G to 21 kG was used in the mapper’s design. The analogue monitor output was used to allow fast reading of the Hall voltage. Use of a fast ADC NI9239 module and error reduction algorithms; based on a polynomial regression method; allowed the reduction of noise to 0.2 G. The HP arm was made as a carbon fibre foam sandwich. This rigid structure kept the HP arm in a flat plane within 0.1 mm. In order to measure the high gradient field; the design of this mapper provided high resolution of HP arm angle within 0.0005° and of radial position within 25 μm. A set of National Instrument interfaces connected through a network to a desktop computer were used as a base of control and data acquisition systems. The mapper was successfully used to map TR-19 and TR-24 cyclotron magnets.,,Slides TU4PB02 [3.139 MB] Superconducting Beam Transport Channel for a Strong-Focusing Cyclotron Slides TU4PB03 [4.020 MB] Methods of Increasing Accuracy in Precision Magnetic Field Measurements of Cyclotron Magnets Slides TU4PB04 [4.572 MB],https://proceedings.jacow.org/CYCLOTRONS2013/talks/tu4pb02_talk.pdf,True,https://proceedings.jacow.org/CYCLOTRONS2013/papers/tu4pb02.pdf,True,https://proceedings.jacow.org/CYCLOTRONS2013/posters/tu4pb02_poster.pdf,False,https://doi.org/10.18429/JACoW-CYCLOTRONS2013-TU4PB02,275
CYCLOTRONS2013,,TU4PB03,Superconducting Beam Transport Channel for a Strong-Focusing Cyclotron,K.E. Melconian; S. Assadi; K.C. Damborsky; J.N. Kellams; P.M. McIntyre; N. Pogue; A. Sattarov; Texas A&M University; College Station; Texas; USA; A superconducting strong focusing cyclotron is being developed for high current applications. Alternating-gradient focusing is provided by an array of ~ 6T/m superconducting beam transport channels which lie in the sectors along the arced beam trajectory of each orbit of the cyclotron. The ~1T sector dipoles; corrector dipoles; and Panofsky type quadrupoles utilize MgB2 superconductor operating in the range 15-20 K. The quadrupole windings make it possible to produce strong focusing of the transverse phase space throughout acceleration. The trim dipole makes it possible to maintain isochronicity and to open the orbit spacing at injection and extraction. The design; development and prototype progress will be presented.; N.V. Avreline; W. Gyles; R.L. Watt; ACSI; Richmond; B.C.; Canada; A new magnetic field mapper was designed and built to provide increased accuracy of cyclotron magnetic field measurements. This mapper was designed for mapping the magnetic fields of TR-19; TR-24; and TR-30 cyclotron magnets manufactured by Advanced Cyclotron Systems Inc. A Group3 MPT-141 Hall Probe (HP) with measurement range from 2 G to 21 kG was used in the mapper’s design. The analogue monitor output was used to allow fast reading of the Hall voltage. Use of a fast ADC NI9239 module and error reduction algorithms; based on a polynomial regression method; allowed the reduction of noise to 0.2 G. The HP arm was made as a carbon fibre foam sandwich. This rigid structure kept the HP arm in a flat plane within 0.1 mm. In order to measure the high gradient field; the design of this mapper provided high resolution of HP arm angle within 0.0005° and of radial position within 25 μm. A set of National Instrument interfaces connected through a network to a desktop computer were used as a base of control and data acquisition systems. The mapper was successfully used to map TR-19 and TR-24 cyclotron magnets.,,Slides TU4PB03 [4.020 MB] Methods of Increasing Accuracy in Precision Magnetic Field Measurements of Cyclotron Magnets Slides TU4PB04 [4.572 MB],https://proceedings.jacow.org/CYCLOTRONS2013/talks/tu4pb03_talk.pdf,True,https://proceedings.jacow.org/CYCLOTRONS2013/papers/tu4pb03.pdf,True,https://proceedings.jacow.org/CYCLOTRONS2013/posters/tu4pb03_poster.pdf,False,https://doi.org/10.18429/JACoW-CYCLOTRONS2013-TU4PB03,278
CYCLOTRONS2013,,TU4PB04,Methods of Increasing Accuracy in Precision Magnetic Field Measurements of Cyclotron Magnets,N.V. Avreline; W. Gyles; R.L. Watt; ACSI; Richmond; B.C.; Canada; A new magnetic field mapper was designed and built to provide increased accuracy of cyclotron magnetic field measurements. This mapper was designed for mapping the magnetic fields of TR-19; TR-24; and TR-30 cyclotron magnets manufactured by Advanced Cyclotron Systems Inc. A Group3 MPT-141 Hall Probe (HP) with measurement range from 2 G to 21 kG was used in the mapper’s design. The analogue monitor output was used to allow fast reading of the Hall voltage. Use of a fast ADC NI9239 module and error reduction algorithms; based on a polynomial regression method; allowed the reduction of noise to 0.2 G. The HP arm was made as a carbon fibre foam sandwich. This rigid structure kept the HP arm in a flat plane within 0.1 mm. In order to measure the high gradient field; the design of this mapper provided high resolution of HP arm angle within 0.0005° and of radial position within 25 μm. A set of National Instrument interfaces connected through a network to a desktop computer were used as a base of control and data acquisition systems. The mapper was successfully used to map TR-19 and TR-24 cyclotron magnets.,,Slides TU4PB04 [4.572 MB],https://proceedings.jacow.org/CYCLOTRONS2013/talks/tu4pb04_talk.pdf,True,https://proceedings.jacow.org/CYCLOTRONS2013/papers/tu4pb04.pdf,True,https://proceedings.jacow.org/CYCLOTRONS2013/posters/tu4pb04_poster.pdf,False,https://doi.org/10.18429/JACoW-CYCLOTRONS2013-TU4PB04,283
