conference_code,session_name,paper_id,title,authors,institutions,abstract,presentation_url,presentation_available,paper_url,paper_available,poster_url,poster_available,doi,page_number
IBIC2012,,TUPA37,FPGA Based Fast Orbit Feedback System for the Australian Synchrotron,Y.E. Tan; T.D. Cornall; S.A. Griffiths; S. Murphy; E. Vettoor; ASCo; Clayton; Victoria; Australia,An initial design for a Fast Global Orbit Feedback System based on FPGAs has been proposed for the Australian Synchrotron Light Source (ASLS). The design uses a central processor (Xilinx Virtex 6) for all the computations and fast optical connections to distribute the computed data to corrector magnet power supplies. The network topology consists of two fibre optic rings. The first ring is used by the Libera Electron's to aggregate the beam position data at 10 kHz using Instrumentation Technologies' Grouping algorithm. The second ring is used to transmit the computed data. The cycle frequency of the feedback is 10 kHz with a targeted total latency of under 350 us. We shall give an overview of the design goals and discuss the merits of the current implementation. We shall also present the measured bandwidth of the stainless steel vacuum chamber and test results from initial prototyping work.,,https://proceedings.jacow.org/IBIC2012/talks/tupa37_talk.pdf,False,https://proceedings.jacow.org/IBIC2012/papers/tupa37.pdf,True,https://proceedings.jacow.org/IBIC2012/posters/tupa37_poster.pdf,False,https://doi.org/10.18429/JACoW-IBIC2012-TUPA37,437
IBIC2012,,TUPA41,Ultra-short Electron Bunch and X-ray Temporal Diagnostics with an X-band Transverse Deflecting Cavity,P. Krejcik; Y. Ding; J.C. Frisch; Z. Huang; H. Loos; J.W. Wang; M.-H. Wang; SLAC; Menlo Park; California; USA; DESY; Hamburg; Germany; LBNL; Berkeley; California; USA,The technique of streaking an electron bunch with a RF deflecting cavity to measure its bunch length is being applied in a new way at the Linac Coherent Light Source with the goal of measuring the femtosecond temporal profile of the FEL photon beam. A powerful X-band deflecting cavity is being installed downstream of the FEL undulator and the streaked electron beam will be observed at an energy spectrometer screen at the beam dump. The single-shot measurements will reveal which time slices of the streaked beam have contributed to the FEL process by virtue of their greater energy loss and energy spread relative to the non-lasing portions of the electron bunch. Since the diagnostic is located downstream of the undulator it can be operated continuously without interrupting the beam to the users. The resolution of the new X-band system will be compared to the existing S-band RF deflecting diagnostic systems at SLAC and consideration is given to the required RF phase stability tolerances required for acceptable beam jitter on the monitor. Simulation studies show that about 1 fs (rms) time resolution is achievable in the LCLS over a wide range of FEL wavelengths and pulse lengths.,,https://proceedings.jacow.org/IBIC2012/talks/tupa41_talk.pdf,False,https://proceedings.jacow.org/IBIC2012/papers/tupa41.pdf,True,https://proceedings.jacow.org/IBIC2012/posters/tupa41_poster.pdf,False,https://doi.org/10.18429/JACoW-IBIC2012-TUPA41,441
IBIC2012,,TUPA42,Diagnostics Beamline Optimisation and Image Processing for Sub-ps Streak Camera Bunch Length Measurement,C.A. Thomas; I.P.S. Martin; G. Rehm; Diamond; Oxfordshire; United Kingdom; Low alpha beam lattice at Diamond can generate bunch length as small as 0.6ps. In order to be able to measure reliably such a short bunch; we have been optimising the optical design of the visible Diagnostics beamline; and we have implemented image processing; taking into account the point spread function of the streak camera. The beamline optical design has removed a large chirp of 15ps/150nm bandwidth to 2ps /200nmbandwidth. It has also permit the transport of almost all the available power; increasing the power by a factor 20; yet maintaining the possibility to focus the beam down to less than 20um into the streak camera for the best static streak camera point spread function. The deconvolution technique implemented extends the performance of the streak camera to bunch length measurement much smaller than the 1ps PSF of the streak camera. In this paper we present these two essential features required to measure sub-ps bunched with a streak camera.,,,https://proceedings.jacow.org/IBIC2012/talks/tupa42_talk.pdf,False,https://proceedings.jacow.org/IBIC2012/papers/tupa42.pdf,True,https://proceedings.jacow.org/IBIC2012/posters/tupa42_poster.pdf,False,https://doi.org/10.18429/JACoW-IBIC2012-TUPA42,445
IBIC2012,,TUPA43,First Operation of the Electro-optical Sampling Diagnostics of the FERMI@Elettra FEL,M. Veronese; A. Abrami; E. Allaria; M. Bossi; M.B. Danailov; M. Ferianis; L. Fröhlich; S. Grulja; M. Predonzani; F. Rossi; G. Scalamera; C. Spezzani; M. Trovò; M. Tudor; Elettra-Sincrotrone Trieste S.C.p.A.; Basovizza; Italy,,The FERMI@Elettra seeded FEL has demanding specifications in terms of longitudinal properties of the electron beam. Several diagnostics are installed along the linac. At the entrance of the FEL1 undulator chain an electro optical sampling (EOS) station based on the spatial encoding scheme is installed. The EOS provides both time jitter and longitudinal profile measurements in a non-destructive way. The layout of this system is described and the first operational measurement results obtained are reported. The paper includes also the capability of this diagnostics to perform the temporal coarse alignment of the seed laser to the electron beam. Finally a discussion on the future developments foreseen for this system is given.,https://proceedings.jacow.org/IBIC2012/talks/tupa43_talk.pdf,False,https://proceedings.jacow.org/IBIC2012/papers/tupa43.pdf,True,https://proceedings.jacow.org/IBIC2012/posters/tupa43_poster.pdf,False,https://doi.org/10.18429/JACoW-IBIC2012-TUPA43,449
IBIC2012,,TUPA44,Status of the LCLS Experiment Timing System,J.C. Frisch; C. Bostedt; R.N. Coffee; A.R. Fry; N. Hartmann; J. May; D.J. Nicholson; S. Schorb; S.R. Smith; SLAC; Menlo Park; California; USA; X-ray / optical laser pump - probe experiments are used for a significant fraction of the scientific work performed at LCLS. The experimental laser systems are locked to the timing of the electron beam through a combination of RF and optical fiber based systems. The remaining ~100 femtosecond RMS jitter of the X-rays relative to the optical laser is measured shot-to-shot by both a RF timing detector; and by direct X-ray to optical cross-correlation; and the result is used to correct the experiment timing to 10s of femtoseconds. We present the present status of the system and plans for future upgrades.,,,https://proceedings.jacow.org/IBIC2012/talks/tupa44_talk.pdf,False,https://proceedings.jacow.org/IBIC2012/papers/tupa44.pdf,True,https://proceedings.jacow.org/IBIC2012/posters/tupa44_poster.pdf,False,https://doi.org/10.18429/JACoW-IBIC2012-TUPA44,453
IBIC2012,,TUPA46,Streak Camera Measurements at ALBA: Bunch Length and Energy Matching,U. Iriso; F.F.B. Fernández; CELLS-ALBA Synchrotron; Cerdanyola del Vallès; Spain; This report describes the electron beam longitudinal studies performed at ALBA Storage Ring using the streak camera. We first show the usual studies involving precise bunch length measurements and related beam parameters like energy spread or momentum compaction factor. Next; the studies to match the injected beam in energy and phase are reported and compared with simulations.,,,https://proceedings.jacow.org/IBIC2012/talks/tupa46_talk.pdf,False,https://proceedings.jacow.org/IBIC2012/papers/tupa46.pdf,True,https://proceedings.jacow.org/IBIC2012/posters/tupa46_poster.pdf,False,https://doi.org/10.18429/JACoW-IBIC2012-TUPA46,458
IBIC2012,,TUPA47,Middle-infrared Prism Spectrometer for Single-shot Bunch Length Diagnostics at the LCLS,T.J. Maxwell; Y. Ding; A.S. Fisher; J.C. Frisch; H. Loos; SLAC; Menlo Park; California; USA; DESY; Hamburg; Germany; Modern high-brightness accelerators such as laser plasma wakefield and free-electron lasers continue the drive to ever-shorter bunches. At low-charge (< 20 pC); bunches as short as 10 fs are reported at the Linac Coherent Light Source (LCLS). Advanced time-resolved diagnostics approaching the fs-level have been proposed requiring the support of rf-deflectors; modern laser systems; or other complex systems. Though suffering from a loss of phase information; spectral diagnostics remain appealing by comparison as compact; low-cost systems suitable for deployment in beam dynamics studies and operations instrumentation. Progress in mid-IR imaging and detection of the corresponding micrometer-range power spectrum has led to the continuing development of a single-shot; 1.2 - 40 micrometer prism spectrometer for ultra-short bunch length monitoring. In this paper we report further analysis and experimental progress on the spectrometer installation at LCLS.,,,https://proceedings.jacow.org/IBIC2012/talks/tupa47_talk.pdf,False,https://proceedings.jacow.org/IBIC2012/papers/tupa47.pdf,True,https://proceedings.jacow.org/IBIC2012/posters/tupa47_poster.pdf,False,https://doi.org/10.18429/JACoW-IBIC2012-TUPA47,463
IBIC2012,,TUPB48,Beam Instrumentation for the COSY Electron Cooler,V. Kamerdzhiev; L.J. Mao; K. Reimers; FZJ; Jülich; Germany; E.A. Bekhtenev; V.N. Bocharov; M.I. Bryzgunov; A.V. Bubley; A.P. Denisov; G.V. Karpov; V.M. Panasyuk; V.V. Parkhomchuk; V.B. Reva; BINP SB RAS; Novosibirsk; Russia; HIM; Mainz; Germany,,The report deals with beam instrumentation of the electron cooler for COSY storage ring. The electron cooler is an electrostatic accelerator designed for beam energy up to 2 MeV and electron current up to 3 A with recuperation. The electron beam is immersed in longitudinal magnetic field so the electron motion is strongly magnetized. The control electrode in the electron gun is composed of four electrically isolated sectors. Applying AC voltage to one sector allows tracing of motion of that particular part of the beam. The electron beam shape is registered with the combination of 4-sector electron gun and the BPMs. This method allows observing both dipole and quadruple (galloping) modes of electron beam oscillation. Compass probe for measuring and tuning the direction of magnetic field in the cooling section is described. A profile monitor based on a few small Faraday cups for measuring distribution of the electron beam is presented.,https://proceedings.jacow.org/IBIC2012/talks/tupb48_talk.pdf,False,https://proceedings.jacow.org/IBIC2012/papers/tupb48.pdf,True,https://proceedings.jacow.org/IBIC2012/posters/tupb48_poster.pdf,False,https://doi.org/10.18429/JACoW-IBIC2012-TUPB48,468
IBIC2012,,TUPB49,Electron Cloud Density Measurements using Resonant TE Waves at CesrTA,J.P. Sikora; M.G. Billing; D.O. Duggins; Y. Li; D. L. Rubin; R.M. Schwartz; K.G. Sonnad; CLASSE; Ithaca; New York; USA; LBNL; Berkeley; California; USA; The Cornell Electron Storage Ring has been reconfigured as a test accelerator (CesrTA) with beam energies ranging from 2 GeV to 5 GeV of either positrons or electrons. Research at CesrTA includes the study of the growth; decay and mitigation of electron clouds in the storage ring. Electron Cloud (EC) densities can be measured by resonantly exciting the beam-pipe with microwaves. The EC density will change beam-pipe's resonant frequency by an amount that is proportional to the local electric field squared of the standing waves. When the EC density is not uniform; it is especially important to know the standing wave pattern in order to obtain an absolute EC density measurement. We will present our current understanding of this technique in the context of new test sections of beam-pipe installed in August 2012. This will include bench measurements of standing waves in the beam-pipe; simulations of this geometry and recent EC density measurements with beam.,"Funding: This work is supported by the US National Science Foundation PHY-0734867, PHY-1002467, and the US Department of Energy DE-FC02-08ER41538, DE-SC0006505.",,https://proceedings.jacow.org/IBIC2012/talks/tupb49_talk.pdf,False,https://proceedings.jacow.org/IBIC2012/papers/tupb49.pdf,True,https://proceedings.jacow.org/IBIC2012/posters/tupb49_poster.pdf,False,https://doi.org/10.18429/JACoW-IBIC2012-TUPB49,471
IBIC2012,,TUPB51,Gatling Gun Test Stand Instrumentation,D.M. Gassner; I. Ben-Zvi; J.C. Brutus; C. Liu; M.G. Minty; A.I. Pikin; O.H. Rahman; E.J. Riehn; J. Skaritka; E. Wang; BNL; Upton; Long Island; New York; USA; In order to reach the design eRHIC luminosity 50mA of polarized electron current is needed. This is far beyond what the present state-of-the-art polarized electron cathode can deliver. A high average polarized current injector based on the Gatling Gun principle is being designed. This technique will employ multiple cathodes and combine their multiple bunched beams along the same axis. A proof-of-principle test bench will be constructed that includes a 220 keV Gatling Gun; beam combiner; diagnostics station; and collector. The challenges for the instrumentation systems and the beam diagnostics that will measure current; profile; position; and halo will be described.,,,https://proceedings.jacow.org/IBIC2012/talks/tupb51_talk.pdf,False,https://proceedings.jacow.org/IBIC2012/papers/tupb51.pdf,True,https://proceedings.jacow.org/IBIC2012/posters/tupb51_poster.pdf,False,https://doi.org/10.18429/JACoW-IBIC2012-TUPB51,474
IBIC2012,,TUPB53,Abort Diagnostics and Analysis during KEKB Operation,H. Ikeda; J.W. Flanagan; T. Furuya; M. Tobiyama; KEK; Ibaraki; Japan; Mitsubishi Electric System & Service Co.; Ltd; Tsukuba; Japan; KEKB has stopped since June 2010 for upgrading the luminosity 40 times; i.e. SuperKEKB. During the operation of 11 years; a pair of controlled beam abort systems worked more than 10000 times to protect the hardware components of KEKB accelerator and the detector against the high intensity beams of LER and HER. Optimization of the abort trigger was necessary to balance efficient operation with the safety of the hardware. Therefore; we analyzed one-by-one all of the aborts; and continually adjusted the abort system. The diagnostic system was based on a high-sampling-rate data logger that recorded beam currents; RF signals and beam loss monitor signals. The beam oscillation signals; vacuum pressure and detector dose rate were also examined. This paper describes the typical abort causes; optimizations of abort levels; and abort statistics over approximately eight years after having arrived at high beam current operation.,,,https://proceedings.jacow.org/IBIC2012/talks/tupb53_talk.pdf,False,https://proceedings.jacow.org/IBIC2012/papers/tupb53.pdf,True,https://proceedings.jacow.org/IBIC2012/posters/tupb53_poster.pdf,False,https://doi.org/10.18429/JACoW-IBIC2012-TUPB53,477
IBIC2012,,TUPB57,Extreme Light Infrastructure (ELI Beamlines) - Research and Technology with new Ultra-short Pulse Intense Laser driven Sources of Energetic Photons and Charged Particles,L. Pribyl; L. Juha; G. Korn; T. Levato; B. Rus; S. Ter-Avetisyan; Czech Republic Academy of Sciences; Institute of Physics; Prague; Czech Republic; INFN/LNS; Catania; Italy; LOA; Palaiseau; France; We will be giving an overview on the development of the 'ELI-Beamline facility'; which will be a high-energy; repetition-rate laser pillar of the ELI (Extreme Light Infrastructure) project. It will be an international facility for both academic and applied research; slated to provide user capability since the beginning of 2016. The main purpose of the facility is the generation and applications of laser driven high-brightness X-ray sources and accelerated particles (electrons; protons and ions). The laser system will be delivering pulses with length ranging between 10 and 150 fs and will provide high-energy Petawatt and 10-PW peak powers. We will concentrate on the development of short photon wavelength (20 eV-100 keV) laser driven sources and their practical implementation. The sources are either based on direct interaction of the laser beam with a gaseous or solid target or will first accelerate electrons which then will interact with laser produced wigglers or directly injected into undulators. The main planned short pulse laser driven x-ray sources and their parameters will be presented together with requirements on the relevant beam detectors.,,,https://proceedings.jacow.org/IBIC2012/talks/tupb57_talk.pdf,False,https://proceedings.jacow.org/IBIC2012/papers/tupb57.pdf,True,https://proceedings.jacow.org/IBIC2012/posters/tupb57_poster.pdf,False,https://doi.org/10.18429/JACoW-IBIC2012-TUPB57,482
IBIC2012,,TUPB60,Beam Diagnostics of Central Japan Synchrotron Radiation Research Facility Accelerator Complex,M. Hosaka; A. Mano; H. Morimoto; E. Nakamura; K. Takami; T. Takano; Y. Takashima; N. Yamamoto; Nagoya University; Nagoya; Japan; KEK; Ibaraki; Japan; UVSOR; Okazaki; Japan; SAGA; Tosu; Japan; A. Murata; K. Nakayama; Toshiba; Yokohama; Japan; JASRI/SPring-8; Hyogo-ken; Japan; A new synchrotron radiation facility; Central Japan Synchrotron Radiation Research Facility is built in Aichi area. The light source accelerator complex consists of a 1.2 GeV compact electron storage ring and a full energy injector for top-up operation. The key equipments of the accelerator are four 5 T superconductive bending magnets. Although the acceleration energy of the storage ring is relatively low; synchrotron radiation from the superconductive bending magnet reaches hard X-ray region and can be provided for more than 10 beamlines. Construction of the facility started in 2010 and finished in Apr. 2012. Commissioning of the accelerator complex started in Mar. 2012. We adapted a turn-by-turn beam position monitoring system based on a digital oscilloscope developed at the UVSOR. In the presentation; we report on details of beam diagnostics conducted during the commissioning.,,,https://proceedings.jacow.org/IBIC2012/talks/tupb60_talk.pdf,False,https://proceedings.jacow.org/IBIC2012/papers/tupb60.pdf,True,https://proceedings.jacow.org/IBIC2012/posters/tupb60_poster.pdf,False,https://doi.org/10.18429/JACoW-IBIC2012-TUPB60,486
IBIC2012,,TUPB61,The First Experience with the LHC Beam Gas Ionisation Monitor,M. Sapinski; W. Andreazza; B. Dehning; A. Guerrero; M. Patecki; R. Versteegen; CERN; Geneva; Switzerland,,The Beam Gas Ionisation Monitors (BGI) are used to continuously measure the beam size at the LHC. This paper describes the detectors and their operation and discusses the issues encountered during the commissioning. It also discusses the various calibration procedures used to correct for non-uniformity of Multi-Channel plates and to correct the beam size for effects affecting the electron trajectory after ionisation.,https://proceedings.jacow.org/IBIC2012/talks/tupb61_talk.pdf,False,https://proceedings.jacow.org/IBIC2012/papers/tupb61.pdf,True,https://proceedings.jacow.org/IBIC2012/posters/tupb61_poster.pdf,False,https://doi.org/10.18429/JACoW-IBIC2012-TUPB61,489
IBIC2012,,TUPB63,Development of Turn-by-turn Beam Diagnostic System using Undulator Radiation,M. Masaki; A. Mochihashi; H. Ohkuma; S. Takano; K. Tamura; JASRI/SPring-8; Hyogo-ken; Japan; At the diagnostic beamline II (BL05SS) of the SPring-8 storage ring; a turn-by-turn beam diagnostic system using undulator radiation has been developed to observe fast phenomena such as stored beam oscillations during the top-up injections; blowups of beam size and energy spread coming from the instabilities of a high current single bunch and so on. The fast diagnostic system observes a spatial profile of the undulator radiation on a selected harmonic number. Especially; the higher harmonic radiations than the 10th-order are sensitive to the energy spread. A fluorescence screen (YAG:Ce) with afterglow of several tens of nano-second converts the radiation profile into visible light image. The imaging optics makes the horizontal and vertical profiles as two line images by one-dimensional focusing using cylindrical lenses. A fast-gated CCD camera with image intensifier simultaneously captures the two line images. The kinetics readout mode of the fast CCD camera is used to register the spatial profiles of several tens of turns in one flame. The principle and experimental setup of the turn-by-turn diagnostic system; and examples of beam observations will be presented.,,,https://proceedings.jacow.org/IBIC2012/talks/tupb63_talk.pdf,False,https://proceedings.jacow.org/IBIC2012/papers/tupb63.pdf,True,https://proceedings.jacow.org/IBIC2012/posters/tupb63_poster.pdf,False,https://doi.org/10.18429/JACoW-IBIC2012-TUPB63,492
IBIC2012,,TUPB64,Methods to Reduce the System Error for High Power MSSW Emittance Meter,S.X. Peng; J. Chen; Z.Y. Guo; P.N. Lu; H.T. Ren; Y. Xu; Z.X. Yuan; J. Zhao; PKU; Beijing; People's Republic of China; Recently a new Multi-Slit Single-Wire (MSSW) type high power beam emittance meter named as HIBEMU-5 has developed in Peking University (PKU). Compared to previous MSSW devices; HIBEMU-5 greatly reduced the system error from 16.4% to 3.7% by specific designs to solve the incomplete short-slit sampling and fixed slit-wire distance. The problems of previous PKU devices are analyzed in part one. In part two; we describe the specific updating methods to solve its short-slit disadvantage by re-designing a longer-slit board with sufficient cooling; detail the mechanical scheme of changing the slit-wire distance for different beam divergence. The commissioning results given at part three prove that this new long slits design is successful to complete the beam sampling without being distorted by high power H+ beam. And the movable wire cup is able to locate the best measurement position for different beam focusing.,,,https://proceedings.jacow.org/IBIC2012/talks/tupb64_talk.pdf,False,https://proceedings.jacow.org/IBIC2012/papers/tupb64.pdf,True,https://proceedings.jacow.org/IBIC2012/posters/tupb64_poster.pdf,False,https://doi.org/10.18429/JACoW-IBIC2012-TUPB64,496
IBIC2012,,TUPB65,Transverse-acceptance Measurement System for the JAEA AVF Cyclotron,H. Kashiwagi; S. Kurashima; N. Miyawaki; S. Okumura; JAEA/TARRI; Gunma-ken; Japan; We are developing an acceptance measurement system to evaluate transverse phase-space matching of the emittance of an injection beam to the acceptance of the AVF cyclotron. The system is composed of a phase-space collimator in the low energy section and a beam intensity monitor in the high energy section. The phase-space collimator; which consists of two pairs of slits; allows very small-emittance beams to be injected into the cyclotron by limiting position and divergence angle of the beam from an ion source. The beam intensity monitor is used to obtain the ratio of beam intensity at the collimator to that at the monitor. In acceptance measurement; the small-emittance beams at various positions in a transverse phase-plane are injected to determine the distribution of relative transmission in the phase plane. In preliminary tests; only a part of acceptance was able to be measured because the injection-beam emittance from ion sources does not cover the whole acceptance. To expand the measurement area; a steering magnet has been added in the system. The magnet scans the injection beam in phase planes in synchronization with the acceptance measurement to simulate the large emittance.,,,https://proceedings.jacow.org/IBIC2012/talks/tupb65_talk.pdf,False,https://proceedings.jacow.org/IBIC2012/papers/tupb65.pdf,True,https://proceedings.jacow.org/IBIC2012/posters/tupb65_poster.pdf,False,https://doi.org/10.18429/JACoW-IBIC2012-TUPB65,499
IBIC2012,,TUPB69,Numerical Analysis on the Gain-reduction Characteristics of Multi-wire Proportional Chambers,K. Katagiri; T. Furukawa; K. Noda; NIRS; Chiba-shi; Japan; Several MWPC (Multi-Wire Proportional Chamber) monitors are installed to diagnosis the beam profiles in the high-energy beam transport at HIMAC (Heavy Ion Medical Accelerator in Chiba) synchrotrons. When the intensity of the incident beams are much high; the gain reduction of the output signal from the MWPC monitor occurs due to the space charge effect of positive ions around the anode wires. The gain reduction is expected to be improved by changing geometric parameters; such as anode radius and distance between electrodes. In order to investigate the gain-reduction characteristics for different geometric parameters; we performed numerical simulation using a numerical code. The numerical code was developed using a two-dimensional drift-diffusion model to evaluate the gas gain including the reduction effect caused by the space charge effect of the moving positive ions. We investigate the gain-reduction rate for several parameters of the anode distance when changing the beam intensity. From these results; we discuss desirable distances between the anode wires to improve the gain reduction.,,,https://proceedings.jacow.org/IBIC2012/talks/tupb69_talk.pdf,False,https://proceedings.jacow.org/IBIC2012/papers/tupb69.pdf,True,https://proceedings.jacow.org/IBIC2012/posters/tupb69_poster.pdf,False,https://doi.org/10.18429/JACoW-IBIC2012-TUPB69,502
