conference_code,session_name,paper_id,title,authors,institutions,abstract,presentation_url,presentation_available,paper_url,paper_available,poster_url,poster_available,doi,page_number
IBIC2012,,MOIA01,Accelerator Projects at KEK,KEK; Ibaraki; Japan; This is a short talk to introduce accelerator projects at KEK including the Super B-Factory (SuperKEKB); Photon Factory (PD/PF-AR) and the high-intensity proton machine J-PARC. Some R&D efforts for future such as the International Linear Collider (ILC/STF/ATF) and the Energy Recovery Linac will be also overviewed. It may briefly mention on critical issues related to beam instrumentation for each project.,,,https://proceedings.jacow.org/IBIC2012/talks/moia01_talk.pdf,True,https://proceedings.jacow.org/IBIC2012/papers/moia01.pdf,False,https://proceedings.jacow.org/IBIC2012/posters/moia01_poster.pdf,False,https://doi.org/10.18429/JACoW-IBIC2012-MOIA01,
IBIC2012,,MOIA02,Progress of Beam Instumentation in J-PARC Linac,JAEA/J-PARC; Tokai-mura; Japan; J-PARC; one of the high intensity proton accelerators; achieved the output power of 300 kW at the downstream rapid cycling synchrotron with a beam energy of 181 MeV and a beam current of 15 mA. When an upgrade of an ion source which can provide 50 mA and the installation of the additional acceleration cavities for the energy upgrade up to 400 MeV are completed; output power can reach 1MW. To meet with the requirements of the high intensity beam diagnostics; we prepare several measures against high intensity proton related issues. The following subjects have been reported among many subjects: development of strip-line type beam position monitors; beam current monitors; phase monitors and transverse profile monitors. And the subjects of the beam diagnostic for the energy upgraded linac including the longitudinal beam profile monitor and the developing laser based profile monitor will be mentioned. A big earthquake occurred on May 11; 2011. We successfully recovered to have commercial operation; but a partial recovery is still undergoing. Influence of the quake on the J-PARC linac is also mentioned.,,,https://proceedings.jacow.org/IBIC2012/talks/moia02_talk.pdf,True,https://proceedings.jacow.org/IBIC2012/papers/moia02.pdf,True,https://proceedings.jacow.org/IBIC2012/posters/moia02_poster.pdf,False,https://doi.org/10.18429/JACoW-IBIC2012-MOIA02,1
IBIC2012,,MOCB01,Beam Instrumentation for the SuperKEKB Rings,H. Fukuma; A. Arinaga; J.W. Flanagan; H. Ikeda; H. Ishii; S. Kanaeda; K. Mori; M. Tejima; M. Tobiyama; KEK; Ibaraki; Japan; G. Bonvicini; H. Farhat; R.S. Gillard; Wayne State University; USA; University of Hawaii; Honolulu; HI; USA; The electron-positron collider KEKB B-factory is currently being upgraded to SuperKEKB. The design luminosity of 8 x 1035 /cm2/s will be achieved using beams with low emittance of several nm and doubling beam currents to 2.6 A in the electron ring (HER) and 3.6 A in the positron ring (LER). A beam position monitor (BPM) system of HER and LER will be equipped with super-heterodyne detectors; turn by turn log ratio detectors with fast gates to measure optics parameters during collision operation and detectors of BPMs near the collision point (IP) for orbit feedback to maintain stable collision. New X-ray beam profile monitors based on the coded aperture method will be installed aiming at bunch by bunch measurement of the beam profile. A large angle beamstrahlung monitor detecting polarization of the synchrotron radiation generated by beam-beam interaction will be installed near IP to obtain information about the beam-beam geometry. The bunch by bunch feedback system will be upgraded using low noise frontend electronics and new 12 bits iGp digital filters. An overview of beam instrumentation of SuperKEKB rings will be given in this paper.,,,https://proceedings.jacow.org/IBIC2012/talks/mocb01_talk.pdf,True,https://proceedings.jacow.org/IBIC2012/papers/mocb01.pdf,True,https://proceedings.jacow.org/IBIC2012/posters/mocb01_poster.pdf,False,https://doi.org/10.18429/JACoW-IBIC2012-MOCB01,6
IBIC2012,,MOCB02,"A Generic BPM Electronics Platform for European XFEL, SwissFEL and SLS",B. Keil; R. Baldinger; R. Ditter; W. Koprek; R. Kramert; G. Marinkovic; M. Roggli; M. Stadler; D.M. Treyer; PSI; Villigen PSI; Switzerland; PSI is currently developing the 2nd generation of a generic modular electronics platform for linac and storage ring BPMs and other beam diagnostics systems. The first platform; developed in 2004 and based on a generic digital back-end with Xilinx Virtex 2Pro FPGAs; is currently used at PSI for proton accelerator BPMs; resonant stripline BPMs at the SwissFEL test injector facility; and a number of other diagnostics and detector systems. The 2nd platform will be employed e.g. for European XFEL BPMs; a new SLS BPM system; and the SwissFEL BPM system. This paper gives an overview of the architecture; features and applications of the new platform; including interfaces to control; timing and feedback systems. Differences and synergies of the different BPM and non-BPM applications will be discussed.,,,https://proceedings.jacow.org/IBIC2012/talks/mocb02_talk.pdf,True,https://proceedings.jacow.org/IBIC2012/papers/mocb02.pdf,True,https://proceedings.jacow.org/IBIC2012/posters/mocb02_poster.pdf,False,https://doi.org/10.18429/JACoW-IBIC2012-MOCB02,11
IBIC2012,,MOCB03,Modeling and Performance Evaluation of DCCTs in SSRF,Z.C. Chen; Y.B. Leng; Y. Xiong; W.M. Zhou; SSRF; Shanghai; People's Republic of China; Direct Current Current Transformer (DCCT) is the most commonly used high precision current monitor in modern particle accelerators including Shanghai Synchrotron Radiation Facility (SSRF). Three types of noise have been observed in the output signal of the DCCT in the storage ring of SSRF: power line noise; beam current related narrow band noise and random square wave noise from nowhere. This article will discuss the noise removal algorithms in SSRF and the performance of the DCCTs afterwards.,,,https://proceedings.jacow.org/IBIC2012/talks/mocb03_talk.pdf,True,https://proceedings.jacow.org/IBIC2012/papers/mocb03.pdf,True,https://proceedings.jacow.org/IBIC2012/posters/mocb03_poster.pdf,False,https://doi.org/10.18429/JACoW-IBIC2012-MOCB03,16
IBIC2012,,MOCB04,Vertical Emittance Measurements using a Vertical Undulator,K.P. Wootton; R.P. Rassool; G. Taylor; The University of Melbourne; Melbourne; Australia; M.J. Boland; B.C.C. Cowie; R.T. Dowd; Y.E. Tan; ASCo; Clayton; Victoria; Australia; CERN; Geneva; Switzerland; With vertical dimensions of several microns; direct measurement of beam size is approaching diffraction limits of visible light and hard x-ray emittance diagnostics. We report on the development of a new vertical electron beam size measurement and monitoring technique which utilizes a vertical undulator. An APPLE-II type undulator was phased to produce a horizontal magnetic field; deflecting the electron beam in the vertical plane. The measured ratios of undulator spectral peak heights are evaluated by fitting to simulations of the apparatus. Vertical electron beam emittances of several picometres have been observed at the Australian Synchrotron storage ring. With this apparatus immediately available at most existing electron and positron storage rings; we find this to be an appropriate and novel vertical emittance diagnostic.,,,https://proceedings.jacow.org/IBIC2012/talks/mocb04_talk.pdf,True,https://proceedings.jacow.org/IBIC2012/papers/mocb04.pdf,True,https://proceedings.jacow.org/IBIC2012/posters/mocb04_poster.pdf,False,https://doi.org/10.18429/JACoW-IBIC2012-MOCB04,20
IBIC2012,,MOCC01,UV/X-ray Diffraction Radiation for Non-intercepting Micron-scale Beam Size Measurement,L.M. Bobb; N. Chritin; T. Lefèvre; CERN; Geneva; Switzerland; CLASSE; Ithaca; New York; USA; L.M. Bobb; V. Karataev; JAI; Egham; Surrey; United Kingdom; Diffraction Radiation (DR) is produced when a relativistic charged particle moves in the vicinity of a medium. The electric field of the charged particle polarizes the target atoms which then oscillate; emitting radiation with a very broad spectrum. The spatial-spectral properties of DR are sensitive to a range of electron beam parameters. Furthermore; the energy loss due to DR is so small that the electron beam parameters are unchanged. Therefore DR can be used to develop non-invasive diagnostic tools. The aim of this project is to measure the transverse (vertical) beam size using incoherent DR. To achieve the micron-scale resolution required by CLIC; DR in the UV and X-ray spectral-range must be investigated. During the next few years; experimental validation of such a scheme will be conducted on the CesrTA at Cornell University; USA. Here we present the current status of the experiment preparation.,,,https://proceedings.jacow.org/IBIC2012/talks/mocc01_talk.pdf,True,https://proceedings.jacow.org/IBIC2012/papers/mocc01.pdf,True,https://proceedings.jacow.org/IBIC2012/posters/mocc01_poster.pdf,False,https://doi.org/10.18429/JACoW-IBIC2012-MOCC01,24
IBIC2012,,MOCC03,The First Electron Bunch Measurement by means of DAST Organic EO Crystals,Y. Okayasu; S. Matsubara; T. Togashi; JASRI/SPring-8; Hyogo-ken; Japan; JAEA/Kansai; Kyoto; Japan; A. Iwasaki; S. Owada; The University of Tokyo; Tokyo; Japan; RIKEN ASI; Sendai; Miyagi; Japan; RIKEN Advanced Science Insititute; Sendai; Miyagi; Japan; K. Ogawa; T. Sato; H. Tomizawa; RIKEN SPring-8 Center; Sayo-cho; Sayo-gun; Hyogo; Japan; RIKEN; Saitama; Japan; Pilot user experiments via the seeded FEL have been demonstrated at the Prototype Test Accelerator (VUV-FEL); SPring-8 from July; 2012. A precise measurement of the electron bunch charge distribution (BCD) is crucial key to keep spatial and temporal overlaps between high-order harmonic (HH) laser pulses and electron bunches. R&D of the 3D-BCD monitor with a single-shot detection has been extensively promoted at SPring-8. The monitor adopts a spectral decoding based Electro-Optic (EO) sampling technique that is non-destructive and enables real-time reconstruction of the 3D-BCD with a temporal resolution of 30- to 40-fs (FWHM). So far; such EO sampling based BCD monitors have been developed by utilizing inorganic EO crystals such as ZnTe and their temporal resolutions are limited to ~130 fs (FWHM). As a part of this project; the first BCD measurement with an organic EO crystal DAST has been successfully demonstrated at the facility. Signal intensities; temporal resolutions and radiation related issues via both ZnTe and DAST are discussed.,,,https://proceedings.jacow.org/IBIC2012/talks/mocc03_talk.pdf,True,https://proceedings.jacow.org/IBIC2012/papers/mocc03.pdf,True,https://proceedings.jacow.org/IBIC2012/posters/mocc03_poster.pdf,False,https://doi.org/10.18429/JACoW-IBIC2012-MOCC03,29
IBIC2012,,MOCC04,Improvement of Screen Monitor with Suppression of Coherent-OTR Effect for SACLA,S. Matsubara; Y. Otake; RIKEN/SPring-8; Hyogo; Japan; SES; Hyogo-pref.; Japan; RIKEN Spring-8 Harima; Hyogo; Japan; The construction of SACLA (SPring-8 Angstrom Compact free electron LAser) was already completed and it is under operation. A screen monitor (SCM) system has been developed and was installed in order to obtain a direct image of a transverse beam profile with a spatial resolution of about 10 um; which is required to investigate electron-beam properties; such as a beam emittance. The SCM originally has a stainless steel target as a OTR radiator or a Ce:YAG crystal as a scintillation target. At the beginning of the SACLA operation; strong coherent OTR (COTR); which made an incorrect beam profile; was observed after bunch compressors. In order to suppress the COTR on the SCM; the stainless steel target was replaced to the Ce:YAG scintillation target. Since the COTR was still generated from the Ce:YAG target; a spatial mask was employed. The mask was mounted on the center of the optical line of the SCM; because the COTR light is emitted forward within ~1/γ radian; while the scintillation light has not angular dependence. Clear beam profiles with a diameter of a few tens of micro-meter are observed by means of the SCMs with this simple improvement.,,,https://proceedings.jacow.org/IBIC2012/talks/mocc04_talk.pdf,True,https://proceedings.jacow.org/IBIC2012/papers/mocc04.pdf,True,https://proceedings.jacow.org/IBIC2012/posters/mocc04_poster.pdf,False,https://doi.org/10.18429/JACoW-IBIC2012-MOCC04,34
IBIC2012,,MOIC02,"Electron Beam Diagnostic System for the Japanese XFEL, SACLA",H. Maesaka; H. Ego; C. Kondo; T. Ohshima; Y. Otake; H. Tomizawa; RIKEN SPring-8 Center; Sayo-cho; Sayo-gun; Hyogo; Japan; S. Matsubara; T. Matsumoto; K. Yanagida; JASRI/SPring-8; Hyogo; Japan; An x-ray free-electron laser (XFEL) based on self-amplified spontaneous emission (SASE) requires a highly brilliant electron beam. The Japanese XFEL facility; SACLA; requires a normalized emittance less than 1 mm mrad and a peak current more than 3 kA. To achieve this high peak current; 1 A beam with 1 ns duration from a thermionic electron gun is compressed down to 30 fs by means of a multi-stage bunch compressor system. Therefore; the beam diagnostic system for SACLA was designed for the measurements of the emittance and bunch length at each compression stage. We developed a high-resolution transverse profile monitor and a temporal bunch structure measurement system with a C-band rf deflector cavity etc. In addition; precise overlapping between an electron beam and radiated x-rays in the undulator section is necessary to ensure the XFEL interaction. Therefore; we employed a C-band sub-micron resolution RF-BPM to fulfill the demanded accuracy of 4 um. The beam diagnostic system surely contributed to the first x-ray lasing at a wavelength of 1.2 Angstrom. We present a design strategy of the whole beam diagnostic system and the achieved performance for each monitor.,,,https://proceedings.jacow.org/IBIC2012/talks/moic02_talk.pdf,True,https://proceedings.jacow.org/IBIC2012/papers/moic02.pdf,True,https://proceedings.jacow.org/IBIC2012/posters/moic02_poster.pdf,False,https://doi.org/10.18429/JACoW-IBIC2012-MOIC02,38
IBIC2012,,MOPA01,Design Study of the Striplines for the Extraction Kicker of the CLIC Damping Rings,C. Belver-Aguilar; A. Faus-Golfe; IFIC; Valencia; Spain; CERN; Geneva; Switzerland; CIEMAT; Madrid; Spain; Pre-Damping Rings (PDRs) and Damping Rings (DRs) are needed to reduce the beam emittance and; therefore; to achieve the luminosity requirements for the CLIC main linac. Several stripline kicker systems will be used to inject and extract the beam from the PDRs and DRs. Results of initial studies of the stripline cross-section and the beam coupling impedance; for a non-tapered beam pipe; have previously been reported. In this paper; we present the analysis to study the final choice of the cross-section design; based on impedance matching and field inhomogeneity requirements; the power reflected in the transition between an electrode and the input coaxial feedthrough; and the predicted beam coupling impedance. Mechanical tolerances for the stripline manufacturing process are presently being studied. The striplines are planned to be prototyped by December 2012.,,,https://proceedings.jacow.org/IBIC2012/talks/mopa01_talk.pdf,False,https://proceedings.jacow.org/IBIC2012/papers/mopa01.pdf,True,https://proceedings.jacow.org/IBIC2012/posters/mopa01_poster.pdf,False,https://doi.org/10.18429/JACoW-IBIC2012-MOPA01,47
IBIC2012,,MOPA02,degree Electron Beam Bending System using Two Sector Magnets for Therapy Application,S.D. Dhole; S. Akhter; V.N. Bhoraskar; B.J. Patil; University of Pune; Pune; India; S.T. Chavan; R. Krishnan; S.N. Pethe; SAMEER; Mumbai; India; The 270 degree doubly achromatic beam bending magnet system using two sector magnets has been designed mainly for treating cancer and skin diseases. The main requirements of the design of two magnet system is to focus an electron beam having a spot size less than 3 mm X 3 mm; energy spread within 3% and divergence angle <= 3 mrad at the target. To achieve these parameters the simulation was carried out using Lorentz-3EM software. The beam spot; divergence angle and energy spread were observed with respect to the variation in angles of sector magnets and drift distance. From the simulated results; it has been optimized that the first and second magnet has an angle 195 degree and 75 degree and the drift distance 64 mm. It is also observed that at the 1396; 2878 and 4677 A-turn; the optimized design produces 3324; 6221 and 9317 Gauss of magnetic field at median plane require to bend 6; 12 and 18 MeV electron respectively. The output parameters of the optimized design are energy spread 3 %; divergence angle ~ 2.8 mrad and spot size 2.6 mm.,,,https://proceedings.jacow.org/IBIC2012/talks/mopa02_talk.pdf,False,https://proceedings.jacow.org/IBIC2012/papers/mopa02.pdf,True,https://proceedings.jacow.org/IBIC2012/posters/mopa02_poster.pdf,False,https://doi.org/10.18429/JACoW-IBIC2012-MOPA02,50
IBIC2012,,MOPA04,An Electron Beam Profile Monitor for the Race-track Microtron,S.D. Dhole; V.N. Bhoraskar; B.J. Patil; N.S. Shinde; University of Pune; Pune; India; In electron irradiation experiments on materials such as semiconductors; solar cells etc.; an uniformity and the charge distribution in the electron beam is very important. Therefore; an electron beam current monitor and its electronic system have been designed and built to measure the distribution of a beam current either in the horizontal or vertical direction along with the beam dimensions. To obtain X-Y beam profile; a special type of Faraday Cup was designed which mainly consists of charge collecting electrodes made up of thin copper strips. Each strip having dimensions 0.5 mm wide; 4 mm thick and 20 mm long were fixed parallel to each other and separation between them was ~ 0.5 mm. This multi electrode Faraday was mounted at the extraction port of the Race Track Microtron; where 1 MeV electron beam allowed to fall on it. The beam characterization in the form of current and uniformity were measured. The current from each strip were measured using an electronic circuit developed based on the multiplexing principle. The uniformity of the beam can be measured with an accuracy of 10%. The minimum and maximum dimensions which can be measured are 3 mm and 15 mm respectively.,,,https://proceedings.jacow.org/IBIC2012/talks/mopa04_talk.pdf,False,https://proceedings.jacow.org/IBIC2012/papers/mopa04.pdf,True,https://proceedings.jacow.org/IBIC2012/posters/mopa04_poster.pdf,False,https://doi.org/10.18429/JACoW-IBIC2012-MOPA04,54
IBIC2012,,MOPA06,"VIMOS, New Capabilities for an Optical Safety System",K. Thomsen; J. Devlaminck; PSI; Villigen PSI; Switzerland; VIMOS is a dedicated safety system developed at the Spallation Neutron Source SINQ at the Paul Scherrer Institut; PSI; in Switzerland. VIMOS very directly monitors the correct current density distribution of the proton beam on the target by sampling the light emitted from a glowing mesh heated by the passing protons. The design has been optimized for obtaining maximum sensitivity and timely detection of beam irregularities relying on standard well-proven components. Recently it has been demonstrated that technical boundary conditions like radiation level and signal strength should allow for upgrading the system to a sensitive diagnostic device delivering quantitative and image-resolved values for the proton current density distribution on the SINQ target. By determining the temperature of the glowing mesh from the signals in two separate wavelength bands the temperature distribution over the mesh can be derived und subsequently the incident proton beam current density distribution. Work aimed at investigating the feasibility of adding these diagnostic abilities to VIMOS shows initial promising results. The status of the project and preliminary findings will be reported.,,,https://proceedings.jacow.org/IBIC2012/talks/mopa06_talk.pdf,False,https://proceedings.jacow.org/IBIC2012/papers/mopa06.pdf,True,https://proceedings.jacow.org/IBIC2012/posters/mopa06_poster.pdf,False,https://doi.org/10.18429/JACoW-IBIC2012-MOPA06,57
IBIC2012,,MOPA07,Development of a Phase Probe for the NIRS Small Cyclotron HM-18,S. Hojo; A. Goto; T. Honma; K. Katagiri; A. Sugiura; NIRS; Chiba-shi; Japan; AEC; Chiba; Japan; The small cyclotron HM-18 of the National Institute of Radiological Sciences (NIRS) has been operated for use in RI production since 1994. The HM-18 allows us to accelerate protons and deuterons at fixed energies of 18 and 9 MeV; respectively. It has four trim coils for generation of the isochronous fields. Until recently; currents of the four trim coils had been adjusted only by monitoring the output beam intensity. In order to exactly produce the isochronous fields; a new phase probe has been installed in the HM-18. The phase probe has a simple structure in which four copper electrode plates of 60 mm x70 mm in area are glued to a copper base plate with a polyimide insulator between them. The thicknesses of the copper plates and the polyimide are 0.1 mm. This structure has an advantage that it can be easily installed in the cyclotron; only one part of a pair of upper and lower electrodes; which is usually adopted; is simply attached on the surface of the (lower) sector pole. The development of the phase probe and some results of a preliminary beam test using it are reported.,,,https://proceedings.jacow.org/IBIC2012/talks/mopa07_talk.pdf,False,https://proceedings.jacow.org/IBIC2012/papers/mopa07.pdf,True,https://proceedings.jacow.org/IBIC2012/posters/mopa07_poster.pdf,False,https://doi.org/10.18429/JACoW-IBIC2012-MOPA07,60
IBIC2012,,MOPA08,Various Usages of Wall Current Monitors for Commissioning of RF Systems in J-PARC Synchrotrons,F. Tamura; M. Nomura; A. Schnase; T. Shimada; M. Yamamoto; JAEA/J-PARC; Tokai-Mura; Naka-Gun; Ibaraki-Ken; Japan; K. Hara; K. Hasegawa; C. Ohmori; M. Toda; M. Yoshii; KEK; Tokai; Ibaraki; Japan; Wall current monitors (WCM) for rf system commissioning are installed in the J-PARC synchrotrons; the RCS and the MR. The WCM signals are used as the input of the beam loading compensation system; and also used diagnosis to adjust the rf system parameters. Since the rf and beam frequency is in the range of a few MHz; direct measurement of the WCM signals is possible. For the diagnosis; the WCM signals are taken by an oscilloscope with the revolution clock signal generated by the LLRF control system; and slices of the WCM waveform with lengths of the revolution periods are generated. By stacking the slices; one can get a mountain plot; which shows motions of bunches and variations of the bunch shapes. Also; time variations of the bunching factor; which are important for acceleration of high intensity proton beams; are obtained. The harmonic analysis is performed on the WCM signal and the cavity voltage monitor signal. By using complex amplitudes of them; one can calculate the impedance seen by the beam. In this presentation; we show examples of the analyses described above. The rf parameters for high intensity beams have been successfully adjusted by using these analyses.,,,https://proceedings.jacow.org/IBIC2012/talks/mopa08_talk.pdf,False,https://proceedings.jacow.org/IBIC2012/papers/mopa08.pdf,True,https://proceedings.jacow.org/IBIC2012/posters/mopa08_poster.pdf,False,https://doi.org/10.18429/JACoW-IBIC2012-MOPA08,63
IBIC2012,,MOPA09,Comparison of Three Different Concepts of High Dynamic Range and Dependability Optimised Current Measurement Digitisers for Beam Loss Systems,W. Viganò; B. Dehning; E. Effinger; G.G. Venturini; C. Zamantzas; CERN; Geneva; Switzerland; The first concept is based on current to frequency conversion; enhanced with an ADC for extending the dynamic range and decreasing the response time. A summary of 3 years worth of operational experience with such a system for LHC beam loss monitoring will be given. The second principle is based on an adaptive current to frequency converter implemented in an ASIC. The basic parameters of the circuit are discussed and compared with measurements. Several measures are taken to harden both circuits against single event effects and to make them tolerant for operation in radioactive environments. The third circuit is based on a fully differential integrator for enhanced dynamic range; where laboratory and test installation measurements will be presented. All circuits are designed to avoid any dead time in the acquisition and have reliability and fail safe operational considerations taken into account.,,,https://proceedings.jacow.org/IBIC2012/talks/mopa09_talk.pdf,False,https://proceedings.jacow.org/IBIC2012/papers/mopa09.pdf,True,https://proceedings.jacow.org/IBIC2012/posters/mopa09_poster.pdf,False,https://doi.org/10.18429/JACoW-IBIC2012-MOPA09,66
IBIC2012,,MOPA10,Diamond Detectors for LHC,E. Griesmayer; P. Kavrigin; CIVIDEC Instrumentation; Wien; Austria; T. Baer; B. Dehning; D. Dobos; E. Effinger; H. Pernegger; CERN; Geneva; Switzerland; BTU; Cottbus; Germany; Diamond detectors are installed at the LHC as fast beam loss monitors. Their excellent time resolution make them a useful beam diagnostic tool for bunch-to-bunch beam loss observations; which is essential for the understanding of fast beam loss scenarios at the LHC.,,,https://proceedings.jacow.org/IBIC2012/talks/mopa10_talk.pdf,False,https://proceedings.jacow.org/IBIC2012/papers/mopa10.pdf,True,https://proceedings.jacow.org/IBIC2012/posters/mopa10_poster.pdf,False,https://doi.org/10.18429/JACoW-IBIC2012-MOPA10,71
