conference_code,session_name,paper_id,title,authors,institutions,abstract,presentation_url,presentation_available,paper_url,paper_available,poster_url,poster_available,doi,page_number
linac2016,,TUPLR025,Optimal Nitrogen Doping Level to Reach High Q0,D. Gonnella; T. Gruber; J.J. Kaufman; P.N. Koufalis; M. Liepe; J.T. Maniscalco; Cornell University (CLASSE); Cornell Laboratory for Accelerator-Based Sciences and Education; Ithaca; New York; USA; New continuous wave (CW) accelerators such as LCLS-II at SLAC require many SRF cavities operating in the medium field region at unprecedented high Q. In order to achieve this demanding goal; nitrogen-doping of the SRF cavities will be used. Nitrogen-doping has been shown to affect the BCS resistance both by a lowering of Rbcs at low fields and by the introduction of an anti-Q slope which enables the Q to continue increasing as the RF field is increased. The exact strength of this anti-Q slope is heavily dependent on the doping recipe and specifically the mean free path of the RF penetration layer of the doped cavities. In addition to its effect on Rbcs; the mean free path affects the amount of residual resistance obtained due to trapped magnetic flux. We have analyzed nine cavities prepared with different levels of nitrogen-doping to understand how BCS and residual resistance are affected by changes in the mean free path. Here we present a model based on these experimental results to predict the optimal doping level to reach the maximum Q at 16 MV/m based on the ambient magnetic field conditions. We find that if the cavities can be cooled with small amounts of trapped flux; moderate nitrogen-doping is better; while if they will have large amounts of trapped flux; lighter dopings should be used.,,reference for this paper ※ https://doi.org/10.18429/JACoW-,https://proceedings.jacow.org/linac2016/talks/tuplr025_talk.pdf,False,https://proceedings.jacow.org/linac2016/papers/tuplr025.pdf,True,https://proceedings.jacow.org/linac2016/posters/tuplr025_poster.pdf,False,https://doi.org/10.18429/JACoW-LINAC2016-TUPLR025,523
linac2016,,TUPLR027,Magnetic Field Management in LCLS-II 1.3 GHz Cryomodules,S.K. Chandrasekaran; A. Grassellino; C.J. Grimm; G. Wu; Fermilab; Batavia; Illinois; USA; The ambient magnetic field at the SRF cavity surface of the LCLS-II 1.3 GHz cryomodules is specified to be less than 0.5 μT (5 mG). Multiple methods were designed to lower the magnetic fields inside the prototype cryomodule. The resulting ambient magnetic field in this cryomodule just prior to its first cool down was <0.15 μT (1.5 mG); as measured using fluxgates inside and outside the cavity helium vessels.,,reference for this paper ※ https://doi.org/10.18429/JACoW-,https://proceedings.jacow.org/linac2016/talks/tuplr027_talk.pdf,False,https://proceedings.jacow.org/linac2016/papers/tuplr027.pdf,True,https://proceedings.jacow.org/linac2016/posters/tuplr027_poster.pdf,False,https://doi.org/10.18429/JACoW-LINAC2016-TUPLR027,527
linac2016,,TUPLR028,Alternative Design for the RISP Pre-Stripper Linac,B. Mustapha; Z.A. Conway; M.P. Kelly; P.N. Ostroumov; A.S. Plastun; ANL; Argonne; USA; J.-H. Jang; H. Jin; H.J. Kim; J.-W. Kim; IBS; Daejeon; Republic of Korea; In a collaborative effort between Argonne's Linac Development Group and the RISP project team at the Korean Institute for Basic Science; we have developed an alternative design for the pre-stripper section of the RISP driver linac. The proposed linac design takes advantage of the recent accelerator developments at Argonne; namely the ATLAS upgrades and the Fermilab PIP-II HWR Cryomodule. In particular; the state-of-the-art performance of QWRs and HWRs; the integrated steering correctors and clean BPMs for a compact cryomodule design. To simplify the design and avoid frequency transitions; we used two types of QWRs at 81.25 MHz. The QWRs were optimized for β ~ 0.05 and ~ 0.11 respectively. Nine cryomodules are required to reach the stripping energy of 18.5 MeV/u. Following the lattice design optimization; end-to-end beam dynamics simulations including all sources of machine errors were performed. The results showed that the design is tolerant to errors with no beam losses observed for nominal errors. However; the robustness of the design could be further improved by a modified RFQ design; better optimized with the multi-harmonic buncher located upstream. This could lead to a significant reduction in the longitudinal beam emittance; offering much easier beam tuning and more tolerance to errors. The proposed design and the simulation results will be presented and discussed.,,reference for this paper ※ https://doi.org/10.18429/JACoW-,https://proceedings.jacow.org/linac2016/talks/tuplr028_talk.pdf,False,https://proceedings.jacow.org/linac2016/papers/tuplr028.pdf,True,https://proceedings.jacow.org/linac2016/posters/tuplr028_poster.pdf,False,https://doi.org/10.18429/JACoW-LINAC2016-TUPLR028,531
linac2016,,TUPLR029,FRIB HWR Tuner Development,S. Stark; A. Facco; S.J. Miller; P.N. Ostroumov; J.T. Popielarski; K. Saito; B.P. Tousignant; T. Xu; FRIB; East Lansing; USA; INFN/LNL; Legnaro (PD); Italy; S.M. Gerbick; M.P. Kelly; ANL; Argonne; USA; During the last two years the HWR pneumatic tuner development at FRIB evolved from the first prototypes to the final production design. A lot of warm testing and several cryogenic integrated tests with cavity were performed to optimize the tuner features. The main challenges included the bellow bushings binding and very tight space limitations for the assembly on the rail. The final design; based on the acquired experience; was prepared in collaboration with ANL and entered the preproduction phase.,"Funding: * This material is based upon work supported by the U.S. Department of Energy Office of Science under Cooperative Agreement DE-SC0000661, the State of Michigan and Michigan State University",reference for this paper ※ https://doi.org/10.18429/JACoW-,https://proceedings.jacow.org/linac2016/talks/tuplr029_talk.pdf,False,https://proceedings.jacow.org/linac2016/papers/tuplr029.pdf,True,https://proceedings.jacow.org/linac2016/posters/tuplr029_poster.pdf,False,https://doi.org/10.18429/JACoW-LINAC2016-TUPLR029,535
linac2016,,TUPLR030,First FRIB β=0.53 Prototype Coldmasss Build,D.R. Victory; K. Elliott; B. Oja; J.T. Popielarski; M.S. Wilbur; FRIB; East Lansing; USA; The β=0.53 coldmass consists of eight Superconducting Radio Frequency (SRF) β=0.53 cavities; eight Fundamental mode Power Couplers (FPC); and one 8 T solenoid. This is the first coldmass with this version of cavity and it has brought new challenges to overcome. The Facility for Rare Isotope Beams (FRIB) contains 18 cryomodules with β=0.53 cavity coldmasses; and this type of coldmass is the highest power and most produced ones in FRIB. During the final cleaning stage and the cavity assembly; particle detection equipment is used to verify the cavity cleanliness levels for cavity certification test and for coldmass assembly. This method allows for cleanliness detection of specific areas inside the cavity at any time a vacuum flange is off. The fixtures; techniques and procedures used to build the β=0.53 coldmasses will be presented.,"Funding: This material is based upon work supported by the U.S. Department of Energy Office of Science under Cooperative Agreement DE SC0000661, the State of Michigan and Michigan State University.",reference for this paper ※ https://doi.org/10.18429/JACoW-,https://proceedings.jacow.org/linac2016/talks/tuplr030_talk.pdf,False,https://proceedings.jacow.org/linac2016/papers/tuplr030.pdf,True,https://proceedings.jacow.org/linac2016/posters/tuplr030_poster.pdf,False,https://doi.org/10.18429/JACoW-LINAC2016-TUPLR030,538
linac2016,,TUPLR033,First FRIB β=0.041 Production Coldmass Build,K. Elliott; S.J. Miller; B. Oja; J.T. Popielarski; L. Popielarski; D.R. Victory; M.S. Wilbur; T. Xu; FRIB; East Lansing; USA; JLab; Newport News; Virginia; USA; Three β=0.041 cryomodules are required for the Facility for Rare Isotope Beams (FRIB) accelerator. Cleanroom assembly of all three coldmasses for these cryomodules has been completed. The cleanroom assembly includes; the superconducting radio frequency (SRF) cavities; the superconducting solenoids; fundamental power couplers (FPC); beam position monitors; alignment rail; and transport cart. This paper will provide an overview of the techniques and procedures used to assemble this cavity string such that it can be used in the FRIB accelerator.,"Funding: This material is based upon work supported by the U.S. Department of Energy Office of Science under Cooperative Agreement DE SC0000661, the State of Michigan and Michigan State University.",reference for this paper ※ https://doi.org/10.18429/JACoW-,https://proceedings.jacow.org/linac2016/talks/tuplr033_talk.pdf,False,https://proceedings.jacow.org/linac2016/papers/tuplr033.pdf,True,https://proceedings.jacow.org/linac2016/posters/tuplr033_poster.pdf,False,https://doi.org/10.18429/JACoW-LINAC2016-TUPLR033,541
linac2016,,TUPLR035,RF Analysis of Electropolishing for EXFEL Cavities Production at Ettore Zanon Spa,DESY; Hamburg; Germany; M. Giaretta; A. Gresele; A. Visentin; Ettore Zanon S.p.A.; Nuclear Division; Schio; Italy; After successful finishing of superconducting cavities mass production at Ettore Zanon S.p.A. (EZ) for the European XFEL (EXFEL); the authors had the possibility to provide a detailed analysis of the electropolishing (EP) process. The analysis of EP material removal is based on specified RF measurements and was used for the determination of both; the ratio between cavity's iris and equator and uniformity in different cells. A comparison of the RF measurements results with mechanical measurements is presented.,,,https://proceedings.jacow.org/linac2016/talks/tuplr035_talk.pdf,False,https://proceedings.jacow.org/linac2016/papers/tuplr035.pdf,True,https://proceedings.jacow.org/linac2016/posters/tuplr035_poster.pdf,True,https://doi.org/10.18429/JACoW-LINAC2016-TUPLR035,544
linac2016,,TUPLR038,The DTL Post Coupler - An Ingenious Invention Turns 50,"CERN; Geneva; Switzerland; IPM; Tehran; Iran; In September 1967; the patent for ""A method and device for stabilization of the field distribution in drift tube linac"" has been filed by Edward A. Knapp; Donald A. Swenson; and James M. Potter of Los Alamos National Laboratory. It is this invention which to a good part led to the success of highly efficient Alvarez drift tube linacs (DTLs) in that it considerably reduces field errors. The explanation for why the post coupler when tuned correctly has such a strong stabilizing effect has been given at the time in an accompanying paper by describing the modal confluence of the accelerating mode band with the post-coupler mode band; turning a comparatively sensitive 0-mode structure into a stable pi/2-mode like structure. As ingenious as the invention of the post-coupler appears; as poor has been the way of finding its optimum length by relying mainly on trial and error. With the design of the Linac4 DTL at CERN; a new technique has been derived by a DTL equivalent circuit model. Understanding stabilization on an almost cell by cell level provides a new way of optimizing post-couplers of an entire structure with few measurements and even without the extraction of the circuit model itself. Previous approaches to post-coupler stabilization are reviewed and the new; straightforward and accurate technique is described and demonstrated in the stabilization of the Linac4 DTL structures.",,reference for this paper ※ https://doi.org/10.18429/JACoW-,https://proceedings.jacow.org/linac2016/talks/tuplr038_talk.pdf,False,https://proceedings.jacow.org/linac2016/papers/tuplr038.pdf,True,https://proceedings.jacow.org/linac2016/posters/tuplr038_poster.pdf,False,https://doi.org/10.18429/JACoW-LINAC2016-TUPLR038,547
linac2016,,TUPLR040,The RF System of Thomx,M. El Khaldi; R. Marie; H. Monard; F. Wicek; LAL; Orsay; France; M. Diop; L.R. Lopes; A. Loulergue; M. Louvet; P. Marchand; F. Ribeiro; R. Sreedharan; SOLEIL; Gif-sur-Yvette; France; The RF system of the ThomX electron storage ring consists in a 500 MHz single cell copper cavity of the ELETTRA type; powered with a 50 kW CW solid state power amplifier (SSPA); and the associated Low Level RF feedback and control loops. The low operating energy of 50/70 MeV makes the impedances of the cavity higher order modes (HOMs) particularly critical for the beam stability. Their parasitic effects on the beam can be cured by HOM frequency shifting techniques; based on a fine temperature tuning and a dedicated plunger. A typical cavity temperature stability of ± 0.05°C within a range from 30 up to 70 °C can be achieved by a precise control of its water cooling temperature. On the other hand; the tuning of the cavity fundamental mode is achieved by changing its axial length by means of a motor-driven mechanism. A general description of the system and the state of its progress are reported together with some considerations of the effects of beam cavity interactions.,,reference for this paper ※ https://doi.org/10.18429/JACoW-,https://proceedings.jacow.org/linac2016/talks/tuplr040_talk.pdf,False,https://proceedings.jacow.org/linac2016/papers/tuplr040.pdf,True,https://proceedings.jacow.org/linac2016/posters/tuplr040_poster.pdf,False,https://doi.org/10.18429/JACoW-LINAC2016-TUPLR040,551
linac2016,,TUPLR041,"Manufacturing, Assembly and Tests of the LIPAc Medium Energy Beam Transport Line (MEBT)",I. Podadera; P. Abramian; B. Brañas; J. Calero; J. Castellanos; J.M. García; D. Gavela; A. Guirao; J.L. Gutiérrez; D. Jiménez-Rey; M. Lafoz; D. López; L.M. Martínez; E. Molina Marinas; J. Mollá; C. Oliverpresenter; A. Soleto; F. Toral; R. Varela; V. Villamayor; CIEMAT; Madrid; Spain; UNED; Madrid; Spain; IREC; Sant Adria del Besos; Spain; LIPAc* will be a 9 MeV; 125 mA CW deuteron accelerator which aims to validate the technology that will be used in the future IFMIF-DONES accelerator**. The acceleration of the beam will be carried out in two stages. An RFQ will increase the energy up to 5 MeV before a Superconducting RF (SRF) linac made of a chain of eight Half Wave Resonators bring the particles to the final energy. Between both stages; a Medium Energy Beam Transport line (MEBT)*** is in charge of transporting and matching the beam between the RFQ and the SRF. The transverse focusing of the beam is controlled by five quadrupole magnets with integrated steerers; grouped in one triplet and one doublet. Two buncher cavities surrounding the doublet handle the longitudinal dynamics. Two movable collimators are also included to purify the beam optics coming out the RFQ and avoid losses in the SRF. In this contribution; the final integrated design of the beamline will be shown; together with the auxiliaries. The manufacturing of all the components and the integration in the beamline will be depicted. The final tests carried out to the beamline prior to the installation in the accelerator will be also reported.; * P. Cara et al.,,,https://proceedings.jacow.org/linac2016/talks/tuplr041_talk.pdf,False,https://proceedings.jacow.org/linac2016/papers/tuplr041.pdf,True,https://proceedings.jacow.org/linac2016/posters/tuplr041_poster.pdf,False,https://doi.org/10.18429/JACoW-LINAC2016-TUPLR041,554
linac2016,,TUPLR044,Design and Operation of Pulsed Power Systems Built to ESS Specifications,M.K. Kempkes; M.P.J. Gaudreau; M.G. Munderville; I. Roth; Diversified Technologies; Inc.; Bedford; Massachusetts; USA; Sigma Phi Electronics; Wissembourg; France; Sigmaphi; Vannes; France; Diversified Technologies; Inc. (DTI); in partnership with SigmaPhi Electronics (SPE) has built three long pulse solid-state klystron transmitters to meet spallation source requirements. Two of the three units are installed at CEA Saclay and the National Institute of Nuclear and Particle Physics (IN2P3); where they will be used as test stands for the European Spallation Source (ESS). The systems delivered to CEA and IN2P3 demonstrate that the ESS klystron modulator specifications (115 kV; 25 A per klystron; 3.5 ms; 14 Hz) have been achieved in a reliable; manufacturable; and cost-effective design. There are only minor modifications required to support transition of this design to the full ESS Accelerator; with up to 100 klystrons. The systems will accommodate the recently-determined increase in average power (~660 kW); can offer flicker-free operation; are equally-capable of driving Klystrons or MBIOTs; and are designed for an expected MTBCF of over ten years; based on operational experience with similar systems.,,reference for this paper ※ https://doi.org/10.18429/JACoW-,https://proceedings.jacow.org/linac2016/talks/tuplr044_talk.pdf,False,https://proceedings.jacow.org/linac2016/papers/tuplr044.pdf,True,https://proceedings.jacow.org/linac2016/posters/tuplr044_poster.pdf,False,https://doi.org/10.18429/JACoW-LINAC2016-TUPLR044,558
linac2016,,TUPLR045,Thyratron Replacement,I. Roth; M.P.J. Gaudreau; M.K. Kempkespresenter; M.G. Munderville; Diversified Technologies; Inc.; Bedford; Massachusetts; USA; Semiconductor thyristors have long been used as a replacement for thyratrons in low power or long pulse RF systems. To date; however; such thyristor assemblies have not demonstrated the reliability needed for installation in short pulse; high peak power RF stations used with many pulsed electron accelerators. The fast rising current in a thyristor tends to be carried in a small region; rather than across the whole device; and this localized current concentration can cause a short circuit failure. An alternate solid-state device; the insulated-gate bipolar transistor (IGBT); can readily operate at the speed needed for the accelerator; but commercial IGBTs cannot handle the voltage and current required. It is; however; possible to assemble these devices in arrays to reach the required performance levels without sacrificing their inherent speed. Diversified Technologies; Inc. (DTI) has patented and refined the technology required to build these arrays of series-parallel connected switches. DTI is currently developing an affordable; reliable; form-fit-function replacement for the klystron modulator thyratrons at SLAC capable of pulsing at 360 kV; 420 A; 6μs; and 120 Hz.,,reference for this paper ※ https://doi.org/10.18429/JACoW-,https://proceedings.jacow.org/linac2016/talks/tuplr045_talk.pdf,False,https://proceedings.jacow.org/linac2016/papers/tuplr045.pdf,True,https://proceedings.jacow.org/linac2016/posters/tuplr045_poster.pdf,False,https://doi.org/10.18429/JACoW-LINAC2016-TUPLR045,561
linac2016,,TUPLR046,"Design, Fabrication, Installation and Operation of New 201 MHz RF Systems at LANSCE",J.T.M. Lyles; W.C. Barkley; R.E. Bratton; M.S. Prokop; D. Rees; LANL; Los Alamos; New Mexico; USA; The LANSCE RM project has restored the proton linac to high power capability after the RF power tube manufacturer could no longer provide devices that consistently met the high average power requirement. Diacrodes® now supply RF power to three of the four DTL tanks. These tetrodes reuse the existing infrastructure including water-cooling systems; coaxial transmission lines; high voltage power supplies and capacitor banks. Each final power amplifier system uses a combined pair of LANL-designed cavity amplifiers using the TH628L Diacrode® to produce up to 3.5 MW peak and 420 kW of mean power. A new intermediate power amplifier was developed using a TH781 tetrode. These amplifiers are the first production of new high power 200 MHz RF sources at accelerators in three decades. Design and prototype testing of the high power stages was completed in 2012; with commercialization following in 2013. Each installation was accomplished during a 4 to 5 month beam outage each year staring in 2014. Simultaneously; a new digital low-level RF control system was designed and tested; and placed into operation this year; meeting the stringent field control requirements for the linac. The rapid-paced installation project changed over from old to new RF systems while minimizing beam downtime to the user facility schedule.,"Funding: Work supported by the United States Department of Energy, National Nuclear Security Agency, under contract DE-AC52-06NA25396.",reference for this paper ※ https://doi.org/10.18429/JACoW-,https://proceedings.jacow.org/linac2016/talks/tuplr046_talk.pdf,False,https://proceedings.jacow.org/linac2016/papers/tuplr046.pdf,True,https://proceedings.jacow.org/linac2016/posters/tuplr046_poster.pdf,False,https://doi.org/10.18429/JACoW-LINAC2016-TUPLR046,564
linac2016,,TUPLR047,Commissioning of XBox-3: A Very High Capacity X-band Test Stand,N. Catalán Lasheras; C.F. Eymin; J. Giner Navarro; G. McMonagle; S.F. Rey; A. Solodko; I. Syratchev; B.J. Woolley; W. Wuensch; CERN; Geneva; Switzerland; T. Argyropoulos; D. Esperante Pereira; IFIC; Valencia; Spain; The University of Melbourne; Melbourne; Victoria; Australia; The Compact Linear Collider (CLIC) beam-based acceleration baseline uses high-gradient travelling wave accelerating structures at a frequency of 12 GHz. In order to prove the performance of these structures at high peak power and short pulse width RF; two klystron-based test facilities have been put in operation in the last years. The third X-band testing facility at CERN (Xbox3) has recently been commissioned and has tripled the number of testing slots available. Xbox3 uses a novel way of combining relatively low peak power (6 MW) but high average power klystron units whose power is steered to feed four testing slots with RF to the required power with a repetition rate of up to 400 Hz. Besides the repetition rate; peak power; pulse length and pulse shape can be customized to fit the test requirements. This novel way of combining pulsed RF high power can eventually be used for many other applications where multiple test slots are required.,,reference for this paper ※ https://doi.org/10.18429/JACoW-,https://proceedings.jacow.org/linac2016/talks/tuplr047_talk.pdf,False,https://proceedings.jacow.org/linac2016/papers/tuplr047.pdf,True,https://proceedings.jacow.org/linac2016/posters/tuplr047_poster.pdf,False,https://doi.org/10.18429/JACoW-LINAC2016-TUPLR047,568
linac2016,,TUPLR048,Status and Lesson Learned from Manufacturing of FPC Couplers for the XFEL Program,S. Sierra; G. Garcin; Ch.L. Lievin; G. Vignette; TED; Velizy-Villacoublay; France; A. Gallas; W. Kaabi; LAL; Orsay; France; M. Knaak; M. Pekeler; L. Zweibaeumer; RI Research Instruments GmbH; Bergisch Gladbach; Germany; For the XFEL accelerator; Thales; RI research Instrument and LAL are working on the manufacturing; assembly and conditioning of Fundamental power couplers. 670 couplers has been manufactured. The main characteristics of these couplers are remained at 1.3 GHz. The paper describes the full production activity from the starting of the program We describe the lesson learned from a mass production of FPC coupler and different steps necessaries for obtaining a rate up to 10 couplers a week. we propose also some other way to be optimized for a future possible mass production of such components. With comparison of processes and adaptation which could benefit to an increase rate; if needed; including some of them which could be studies from the coupler definition to the manufacturing process in order to obtain a stable and possible increased rate or lower cost of production by decreasing the risks on programs. The status of the production curve during the program is also given,,reference for this paper ※ https://doi.org/10.18429/JACoW-,https://proceedings.jacow.org/linac2016/talks/tuplr048_talk.pdf,False,https://proceedings.jacow.org/linac2016/papers/tuplr048.pdf,True,https://proceedings.jacow.org/linac2016/posters/tuplr048_poster.pdf,False,https://doi.org/10.18429/JACoW-LINAC2016-TUPLR048,572
linac2016,,TUPLR049,Latest Cryogenic Testing of the 2.1 GHz Five-Cell Superconducting RF Cavity with a Photonic Band Gap Coupler Cell,,,,https://proceedings.jacow.org/linac2016/talks/tuplr049_talk.pdf,False,https://proceedings.jacow.org/linac2016/papers/tuplr049.pdf,False,https://proceedings.jacow.org/linac2016/posters/tuplr049_poster.pdf,False,https://doi.org/10.18429/JACoW-LINAC2016-TUPLR049,
linac2016,,TUPLR050,Design of 4-vane RFQ with Magnetic Coupling Windows for Nuclotron Injector Lu-20,V.A. Koshelev; G. Kropachev; T. Kulevoy; D.A. Liakin; A.S. Plastunpresenter; ITEP; Moscow; Russia; JINR; Dubna; Moscow Region; Russia; T. Kulevoy; S.M. Polozov; MEPhI; Moscow; Russia; MIPT; Dolgoprudniy; Moscow Region; Russia; Alvarez-type linac LU-20 is used as Nuclotron injector. In the framework of NICA project the high voltage electrostatic pre-injector for LU-20 has been replaced by RFQ linac. The RFQ was designed by the team of ITEP and MEPhI (Moscow; Russia) and was manufactured in VNIITF (Sneginsk; Russia). The engineering design of the 4-vane RFQ linac with magnetic coupling windows and details of its manufacturing are presented and discussed.,,reference for this paper ※ https://doi.org/10.18429/JACoW-,https://proceedings.jacow.org/linac2016/talks/tuplr050_talk.pdf,False,https://proceedings.jacow.org/linac2016/papers/tuplr050.pdf,True,https://proceedings.jacow.org/linac2016/posters/tuplr050_poster.pdf,False,https://doi.org/10.18429/JACoW-LINAC2016-TUPLR050,575
linac2016,,TUPLR053,Development and Measurements of a 325 MHz RFQ,,,,https://proceedings.jacow.org/linac2016/talks/tuplr053_talk.pdf,False,https://proceedings.jacow.org/linac2016/papers/tuplr053.pdf,True,https://proceedings.jacow.org/linac2016/posters/tuplr053_poster.pdf,True,https://doi.org/10.18429/JACoW-LINAC2016-TUPLR053,578
