conference_code,session_name,paper_id,title,authors,institutions,abstract,presentation_url,presentation_available,paper_url,paper_available,poster_url,poster_available,doi,page_number
linac2016,,TH3A02,The Los Alamos Multi-Probe Facility for Matter-Radiation Interactions in Extremes,LANL; Los Alamos; New Mexico; USA; A next-generation signature facility based on multi-probe capabilities is being planned at Los Alamos. This new facility will enable the first in a new generation of game-changing scientific facilities for the materials community. The new Matter-Radiation Interactions in Extremes (MaRIE) facility will be used to discover and design the advanced materials needed to meet 21st-century national security and energy-security challenges to develop next-generation materials that will perform predictably in extreme environments. The MaRIE facility will include a new 12-GeV electron linac using a state-of-the-art electron photoinjector and superconducting accelerator technology to drive a 42-keV XFEL to generate x rays of unprecedented flux and quality; coupled with the existing proton-beam capabilities of the LANSCE proton linac; new experimental halls; and new materials fabrication/characterization facilities. A description of this new facility; its requirements; and planned uses and capabilities will be presented. Status of the project will also be presented.,"Funding: This work is supported by the United States Department of Energy, National Nuclear Security Agency, under contract DE-AC52-06NA25396.",Slides TH3A02 [5.060 MB] reference for this paper ※ https://doi.org/10.18429/JACoW-,https://proceedings.jacow.org/linac2016/talks/th3a02_talk.pdf,True,https://proceedings.jacow.org/linac2016/papers/th3a02.pdf,True,https://proceedings.jacow.org/linac2016/posters/th3a02_poster.pdf,False,https://doi.org/10.18429/JACoW-LINAC2016-TH3A02,729
linac2016,,TH3A03,The VELA and CLARA Test Facilities at Daresbury Laboratory,P.A. McIntosh; D. Angal-Kalinin; J.A. Clarke; L.S. Cowie; B.D. Fell; S.P. Jamison; B.L. Militsyn; Y.M. Saveliev; D.J. Scott; N. Thompson; P.H. Williams; STFC/DL/ASTeC; Daresbury; Warrington; Cheshire; United Kingdom; A. Gleeson; T.J. Jones; STFC/DL; Daresbury; Warrington; Cheshire; United Kingdom; The Versatile Electron Linear Accelerator (VELA) provides enabling infrastructures targeted at the development and testing of novel and compact accelerator technologies; specifically through partnership with academia and industry; aimed at addressing applications in medicine; health; security; energy and industrial processing. The facility is now fully commissioned and is taking advantage of the variable electron beam parameters to demonstrate new techniques/processes or otherwise develop new technologies for future commercial realization. Examples of which include; electron diffraction and new cargo scanning processes. The Compact Linear Accelerator for Research and Applications (CLARA) will be a novel FEL test facility; focused on the generation of ultra-short photon pulses with extreme levels of stability and synchronization. The principal aim is to experimentally demonstrate that sub-cooperation length pulse generation with FELs is viable; and to compare the various schemes being championed. The results will translate directly to existing and future X-ray FELs; enabling attosecond pulse generation. Both the VELA and CLARA facilities are co-located at Daresbury Laboratory and provide the UK with a unique platform for scientific and commercial R&D using ultra-short pulse; high precision electron and photon beams.,,Slides TH3A03 [11.795 MB] reference for this paper ※ https://doi.org/10.18429/JACoW-,https://proceedings.jacow.org/linac2016/talks/th3a03_talk.pdf,True,https://proceedings.jacow.org/linac2016/papers/th3a03.pdf,True,https://proceedings.jacow.org/linac2016/posters/th3a03_poster.pdf,False,https://doi.org/10.18429/JACoW-LINAC2016-TH3A03,734
linac2016,,THOP01,Experimental Study of Nucleation for Nb3Sn Diffusion Coatings on Niobium SRF Cavities,,,,https://proceedings.jacow.org/linac2016/talks/thop01_talk.pdf,True,https://proceedings.jacow.org/linac2016/papers/thop01.pdf,True,https://proceedings.jacow.org/linac2016/posters/thop01_poster.pdf,False,https://doi.org/10.18429/JACoW-LINAC2016-THOP01,740
linac2016,,THOP02,Investigation of Nitrogen Absorption Rate and Nitride Growth on SRF Cavity Grade RRR Niobium as a Function of Furnace Temperature,,,,https://proceedings.jacow.org/linac2016/talks/thop02_talk.pdf,False,https://proceedings.jacow.org/linac2016/papers/thop02.pdf,True,https://proceedings.jacow.org/linac2016/posters/thop02_poster.pdf,True,https://doi.org/10.18429/JACoW-LINAC2016-THOP02,744
linac2016,,THOP03,Cold Bead-Pull Test Stand for SRF Cavities,,,,https://proceedings.jacow.org/linac2016/talks/thop03_talk.pdf,True,https://proceedings.jacow.org/linac2016/papers/thop03.pdf,True,https://proceedings.jacow.org/linac2016/posters/thop03_poster.pdf,False,https://doi.org/10.18429/JACoW-LINAC2016-THOP03,748
linac2016,,THOP04,Measurements of the Beam Break-Up Threshold Current at the Recirculating Electron Accelerator S-DALINAC,,,,https://proceedings.jacow.org/linac2016/talks/thop04_talk.pdf,True,https://proceedings.jacow.org/linac2016/papers/thop04.pdf,True,https://proceedings.jacow.org/linac2016/posters/thop04_poster.pdf,False,https://doi.org/10.18429/JACoW-LINAC2016-THOP04,751
linac2016,,THOP05,Status and Operation of the ALBA Linac,,,,https://proceedings.jacow.org/linac2016/talks/thop05_talk.pdf,True,https://proceedings.jacow.org/linac2016/papers/thop05.pdf,True,https://proceedings.jacow.org/linac2016/posters/thop05_poster.pdf,True,https://doi.org/10.18429/JACoW-LINAC2016-THOP05,754
linac2016,,THOP06,Novel Scheme to Tune RF Cavities Using Reflected Power,,,,https://proceedings.jacow.org/linac2016/talks/thop06_talk.pdf,False,https://proceedings.jacow.org/linac2016/papers/thop06.pdf,True,https://proceedings.jacow.org/linac2016/posters/thop06_poster.pdf,True,https://doi.org/10.18429/JACoW-LINAC2016-THOP06,757
linac2016,,THOP08,Beam Commissioning of the i-BNCT Linac,,,,https://proceedings.jacow.org/linac2016/talks/thop08_talk.pdf,False,https://proceedings.jacow.org/linac2016/papers/thop08.pdf,True,https://proceedings.jacow.org/linac2016/posters/thop08_poster.pdf,False,https://doi.org/10.18429/JACoW-LINAC2016-THOP08,760
linac2016,,THOP09,Tuning of the CERN 750 MHz RFQ for Medical Applications,,,,https://proceedings.jacow.org/linac2016/talks/thop09_talk.pdf,True,https://proceedings.jacow.org/linac2016/papers/thop09.pdf,True,https://proceedings.jacow.org/linac2016/posters/thop09_poster.pdf,True,https://doi.org/10.18429/JACoW-LINAC2016-THOP09,763
linac2016,,THOP10,Design and Commissioning of FRIB Multipacting-Free Fundamental Power Coupler,,,,https://proceedings.jacow.org/linac2016/talks/thop10_talk.pdf,True,https://proceedings.jacow.org/linac2016/papers/thop10.pdf,True,https://proceedings.jacow.org/linac2016/posters/thop10_poster.pdf,False,https://doi.org/10.18429/JACoW-LINAC2016-THOP10,767
linac2016,,THOP11,Ultra-Short Bunch Electron Injector for Awake,,,,https://proceedings.jacow.org/linac2016/talks/thop11_talk.pdf,True,https://proceedings.jacow.org/linac2016/papers/thop11.pdf,True,https://proceedings.jacow.org/linac2016/posters/thop11_poster.pdf,False,https://doi.org/10.18429/JACoW-LINAC2016-THOP11,770
linac2016,,THOP12,Electron Linac Upgrade for Thomx Project,,,,https://proceedings.jacow.org/linac2016/talks/thop12_talk.pdf,True,https://proceedings.jacow.org/linac2016/papers/thop12.pdf,True,https://proceedings.jacow.org/linac2016/posters/thop12_poster.pdf,True,https://doi.org/10.18429/JACoW-LINAC2016-THOP12,773
linac2016,,THPRC002,Experimental Study of Nucleation for Nb3Sn Diffusion Coatings on Niobium SRF Cavities,,,,https://proceedings.jacow.org/linac2016/talks/thprc002_talk.pdf,False,https://proceedings.jacow.org/linac2016/papers/thprc002.pdf,False,https://proceedings.jacow.org/linac2016/posters/thprc002_poster.pdf,False,https://doi.org/10.18429/JACoW-LINAC2016-THPRC002,
linac2016,,THPRC003,Investigation of Nitrogen Absorption Rate and Nitride Growth on SRF Cavity Grade RRR Niobium as a Function of Furnace Temperature,,,,https://proceedings.jacow.org/linac2016/talks/thprc003_talk.pdf,False,https://proceedings.jacow.org/linac2016/papers/thprc003.pdf,False,https://proceedings.jacow.org/linac2016/posters/thprc003_poster.pdf,False,https://doi.org/10.18429/JACoW-LINAC2016-THPRC003,
linac2016,,THPRC004,Cold Bead-Pull Test Stand for SRF Cavities,,,,https://proceedings.jacow.org/linac2016/talks/thprc004_talk.pdf,False,https://proceedings.jacow.org/linac2016/papers/thprc004.pdf,False,https://proceedings.jacow.org/linac2016/posters/thprc004_poster.pdf,False,https://doi.org/10.18429/JACoW-LINAC2016-THPRC004,
linac2016,,THPRC006,Development of 704.4 MHz Power Coupler Window for Myrrha Project,F. Geslin; P. Blache; M. Chabot; J. Lesrel; IPN; Orsay; France; Ch.L. Lievin; S. Sierra; TED; Velizy; France; Myrrha is an accelerator driven system (ADS) hybrid research reactor designed for spent nuclear fuel burning. The linac controlling the reactor has to be highly reliable (low failure rate). In order to fulfill requirements of ADS projects like Myrrha; IPNO and Thales are involved in a power couplers research and development program. We develop a power coupler window; with MAX RF design; for 80 kW CW input power. During the study; we take account of fabrication and cost issues. We present in this paper the result of simulations needed to design this coupler window. The electromagnetic; thermal and thermo-mechanical simulations were performed with Ansys. The multipacting simulations were performed with Musicc3D; software developed by IPNO. The conditioning and test bench is also described as two prototypes have to be tested this autumn.,,reference for this paper ※ https://doi.org/10.18429/JACoW-,https://proceedings.jacow.org/linac2016/talks/thprc006_talk.pdf,False,https://proceedings.jacow.org/linac2016/papers/thprc006.pdf,True,https://proceedings.jacow.org/linac2016/posters/thprc006_poster.pdf,False,https://doi.org/10.18429/JACoW-LINAC2016-THPRC006,776
linac2016,,THPRC007,Development of 352.2 Mhz Power Coupler Window for R&D Purposes,F. Geslin; M. Chabot; J. Lesrel; D. Reynet; IPN; Orsay; France; Ch.L. Lievin; S. Sierra; TED; Velizy; France; IPNO and Thales are conducting power couplers research and development. This paper present a new window design that fulfills European Spallation Source (ESS) requirements (400 kW RF peak power). The results of electromagnetic; thermal; thermo-mechanical; multipacting simulations and the consequences of the new ceramic window of power coupler will be reported. The multipacting simulations were performed with Musicc3D; software developed by IPNO. The new design overcome ceramic's weakness in tension and allows stronger constraints in the power coupler window.,,reference for this paper ※ https://doi.org/10.18429/JACoW-,https://proceedings.jacow.org/linac2016/talks/thprc007_talk.pdf,False,https://proceedings.jacow.org/linac2016/papers/thprc007.pdf,True,https://proceedings.jacow.org/linac2016/posters/thprc007_poster.pdf,False,https://doi.org/10.18429/JACoW-LINAC2016-THPRC007,779
linac2016,,THPRC008,Status of the Development and Manufacturing of LCLS-II Fundamental Power Couplers,S. Sierra; G. Garcin; Ch.L. Lievin; C. Ribaud; G. Vignette; TED; Velizy-Villacoublay; France; M. Knaak; A. Navitski; M. Pekeler; L. Zweibaeumer; RI Research Instruments GmbH; Bergisch Gladbach; Germany; For the LCLS-II project; Thales and RI research Instrument are working on the manufacturing and assembly of the Fundamental Power Couplers. The paper describes the production of the Fundamental Power Couplers for the LCLS-II project. The main characteristics of these couplers are remained at 1.3 GHz. It describes the main challenges to be overcome principally on the Warm Internal conductor; with a thickness of copper of 150μm. The results obtained on this coating We describe the results obtained on the prototype phase and the status of the serial production on the date of the paper.,,reference for this paper ※ https://doi.org/10.18429/JACoW-,https://proceedings.jacow.org/linac2016/talks/thprc008_talk.pdf,False,https://proceedings.jacow.org/linac2016/papers/thprc008.pdf,True,https://proceedings.jacow.org/linac2016/posters/thprc008_poster.pdf,False,https://doi.org/10.18429/JACoW-LINAC2016-THPRC008,782
linac2016,,THPRC009,IF-Mixture Performance During Cavity Conditioning at STF-KEK,,,,https://proceedings.jacow.org/linac2016/talks/thprc009_talk.pdf,False,https://proceedings.jacow.org/linac2016/papers/thprc009.pdf,True,https://proceedings.jacow.org/linac2016/posters/thprc009_poster.pdf,True,https://doi.org/10.18429/JACoW-LINAC2016-THPRC009,785
linac2016,,THPRC011,Single LLRF for Multi-Harmonic Buncher,N.R. Usher; D.M. Alt; J.F. Brandon; D.G. Morris; S. Zhao; FRIB; East Lansing; Michigan; USA; NSCL; East Lansing; Michigan; USA; In this paper; a unique low level radio frequency (LLRF) controller designed for a multi-harmonic buncher (MHB) is presented. Different than conventional designs; the single LLRF output contains three RF frequencies (f1; f2 = 2*f1; f3 = 3*f1) and is fed to a wide band amplifier driving the MHB. The challenge is while driving f1; due to the non-linearity of the amplifier; the f2 and f3 terms will also be generated and will couple into the control of these two modes. Hence an active cancellation algorithm is used to suppress the nonlinear effect of the amplifier. It is demonstrated in a test that the designed LLRF is able to control the amplitude and phase of the three modes in-dependently.,"Funding: Work supported by Michigan State University, National Science Foundation: NSF Award Number PHY-1102511.",,https://proceedings.jacow.org/linac2016/talks/thprc011_talk.pdf,False,https://proceedings.jacow.org/linac2016/papers/thprc011.pdf,True,https://proceedings.jacow.org/linac2016/posters/thprc011_poster.pdf,True,https://doi.org/10.18429/JACoW-LINAC2016-THPRC011,789
linac2016,,THPRC012,Resonance Control System for the CEBAF Separator Upgrade,T. E. Plawski; R. Bachimanchi; B. Bevins; L. Farrish; C. Hovater; G.E. Lahti; M.J. Wissmann; JLab; Newport News; Virgina; USA,The Continuous Electron Beam Accelerator Facility (CEBAF) energy upgrade from 6 GeV to 12 GeV includes the installation of four new 748.5 MHz normal conducting deflecting cavities in the 5th pass extraction region. The RF system employs two digital LLRF systems controlling four normal conducting cavities in a vector sum setting. Cavity tune information of the individual cavities is obtained using a multiplexing scheme of the forward and reflected RF signals. Water skids equipped with heaters and valves are used to control resonance. A new FPGA-based hardware and EPICS-based predictive control algorithm has been developed to support reliable operation of the beam extraction process. This paper presents the architecture design of the existing hardware and software as well as a plan to develop a model predictive control system.,reference for this paper ※ https://doi.org/10.18429/JACoW-,https://proceedings.jacow.org/linac2016/talks/thprc012_talk.pdf,False,https://proceedings.jacow.org/linac2016/papers/thprc012.pdf,True,https://proceedings.jacow.org/linac2016/posters/thprc012_poster.pdf,False,https://doi.org/10.18429/JACoW-LINAC2016-THPRC012,792
linac2016,,THPRC013,Design of a FRIB Half-Wave Pre-Production Cryomodule,S.J. Miller; H. Ao; B. Bird; G.D. Bryant; B. Bullock; N.K. Bultman; F. Casagrande; C. Compton; A. Facco; W. Hartung; J.D. Hulbert; D.G. Morris; P.N. Ostroumov; J.T. Popielarski; L. Popielarski; M.A. Reaume; K. Saito; M. Shuptar; J. Simon; S. Stark; B.P. Tousignant; J. Wei; J.D. Wenstrom; K. Witgen; T. Xu; Z. Zheng; FRIB; East Lansing; USA; INFN/LNL; Legnaro (PD); Italy; ANL; Argonne; Illinois; USA; The driver linac for the Facility for Rare Isotope Beams (FRIB) will require the production of 48 cryomodules (CMs). In addition to the β=0.085 quarter-wave CM; FRIB has completed the design of a β=0.53 half-wave CM as a pre-production prototype. This CM will qualify the performance of the resonators; fundamental power couplers; tuners; and cryogenic systems of the β=0.53 half-wave design. In addition to the successful systems qualification; the β=0.53 CM build will also verify the FRIB bottom up assembly and alignment method on a half-wave CM type. The lessons learned from the β=0.085 pre-production CM build including valuable fabrication; sourcing; and assembly experience have been applied to the design of β=0.53 half-wave CM. This paper will report the design of the β=0.53 half-wave CM as well as the CM interfaces within the linac tunnel.,,,https://proceedings.jacow.org/linac2016/talks/thprc013_talk.pdf,False,https://proceedings.jacow.org/linac2016/papers/thprc013.pdf,True,https://proceedings.jacow.org/linac2016/posters/thprc013_poster.pdf,True,https://doi.org/10.18429/JACoW-LINAC2016-THPRC013,795
linac2016,,THPRC014,RF Losses in 1.3 GHz Cryomodule of The LCLS-II Superconducting CW Linac,A. Saini; A. Lunin; N. Solyak; A.I. Sukhanov; V.P. Yakovlev; Fermilab; Batavia; Illinois; USA; The Linac Coherent Light Source (LCLS) is an x-ray free electron laser facility. The proposed upgrade of the LCLS facility is based on construction of a new 4 GeV superconducting (SC) linac that will operate in continuous wave (CW) mode. The major infrastructure investments and the operating cost of a SC CW linac are outlined by its cryogenic requirements. Thus; a detail understanding of RF losses in the cryogenic environment is critical for the entire project. In this paper we review RF losses in a 1.3 GHz accelerating cryomodule of the LCLS-II linac. RF losses due to various sources such untrapped higher order modes (HOMs); resonant losses etc. are addressed and presented here.,,reference for this paper ※ https://doi.org/10.18429/JACoW-,https://proceedings.jacow.org/linac2016/talks/thprc014_talk.pdf,False,https://proceedings.jacow.org/linac2016/papers/thprc014.pdf,True,https://proceedings.jacow.org/linac2016/posters/thprc014_poster.pdf,False,https://doi.org/10.18429/JACoW-LINAC2016-THPRC014,798
linac2016,,THPRC015,Cool-Down Performance of the Cornell ERL Cryomodules,R.G. Eichhorn; F. Furuta; M. Ge; G.H. Hoffstaetter; M. Liepe; S.R. Markham; T.I. O'Connell; P. Quigley; D.M. Sabol; J. Sears; E.N. Smith; V. Veshcherevich; D. Widger; Cornell University (CLASSE); Cornell Laboratory for Accelerator-Based Sciences and Education; Ithaca; New York; USA; In the framework of the ERL prototyping; Cornell University has built two cryomodules; one injector module and one prototype Main Linac Cryomodule (MLC). In 2015; the MLC was successfully cooled down for the first time. We will report details on the cool-down as well as cycle tests we did in order to achieve slow and fast cool-down of the cavities. We will also report on the improvement we made on the injector cryomodule which also included a modification of the heat exchanger can that allows now a more controlled cool-down; too.,,reference for this paper ※ https://doi.org/10.18429/JACoW-,https://proceedings.jacow.org/linac2016/talks/thprc015_talk.pdf,False,https://proceedings.jacow.org/linac2016/papers/thprc015.pdf,True,https://proceedings.jacow.org/linac2016/posters/thprc015_poster.pdf,False,https://doi.org/10.18429/JACoW-LINAC2016-THPRC015,802
linac2016,,THPRC016,Assembling Experience of the First Two HIE-ISOLDE Cryomodules,M. Therasse; G. Barlow; S. Bizzaglia; O. Capatina; A. Chrul; P. Demarest; J-B. Deschamps; J. Gayde; M. Gourragne; A. Harrison; G. Kautzmann; Y. Leclercq; D. Mergelkuhl; T. Mikkola; A. Miyazaki; V. Parma; J.A.F. Somoza; M. Struik; S. Teixeira L'pez; W. Venturini Delsolaro; L.R. Williams; P. Zhang; CERN; Geneva; Switzerland; Intitek; Lyon; France; The assembly of the first two cryomodules (CM1 and CM2) of the new superconducting linear accelerator HIE-ISOLDE (High Intensity and Energy ISOLDE); located downstream of the REX-ISOLDE normal conducting accelerator; started one year and half ago. After a delicate assembly phase in the cleanroom which lasted nine months; the first cryomodule was transported to the ISOLDE hall on 2 May 2015 and coupled to the existing REX-ISOLDE accelerator; increasing the energy of the radioactive ion beams from 2.8 to 4.3 MeV per nucleon. The superconducting linac supplied the CERN-ISOLDE Facility; with radioactive zinc ions until the end of the proton run in November 2015. At the beginning of 2016; the second cryomodule was installed in the machine; increasing the energy to 5.5 MeV per nucleon. During commissioning of the first cryomodule in summer 2015; it was found that the performance of the RF superconductive cavities was limited by the over-heating of their RF couplers. The decision was taken to refurbish CM1 and reinstall it at the end of April. In this paper; we present the challenges faced and the experience gained with the cleanroom assembly of the first two cryomodules; especially the construction of the SC RF cavities and their RF ancillaries.,,reference for this paper ※ https://doi.org/10.18429/JACoW-,https://proceedings.jacow.org/linac2016/talks/thprc016_talk.pdf,False,https://proceedings.jacow.org/linac2016/papers/thprc016.pdf,True,https://proceedings.jacow.org/linac2016/posters/thprc016_poster.pdf,False,https://doi.org/10.18429/JACoW-LINAC2016-THPRC016,805
linac2016,,THPRC017,Performance of SRF Cavity Tuners at LCLS II Prototype Cryomodule at FNAL,J.P. Holzbauer; Y.M. Pischalnikov; W. Schappert; J.C. Yun; Fermilab; Batavia; Illinois; USA,,Performances of the fast/slow tuners mounted on the 8 SRF cavities of first LCLS-II prototype cryomodule assembled at FNAL will be presented. reference for this paper ※ https://doi.org/10.18429/JACoW-,https://proceedings.jacow.org/linac2016/talks/thprc017_talk.pdf,False,https://proceedings.jacow.org/linac2016/papers/thprc017.pdf,True,https://proceedings.jacow.org/linac2016/posters/thprc017_poster.pdf,False,https://doi.org/10.18429/JACoW-LINAC2016-THPRC017,808
linac2016,,THPRC021,Status of β=0.53 Pre-Production Cryomodule,H. Ao; B. Bird; G.D. Bryant; B. Bullock; N.K. Bultman; C. Compton; A. Facco; J.D. Hulbert; S.J. Miller; J.T. Popielarski; L. Popielarski; M.A. Reaume; K. Saito; M. Shuptar; J. Simon; S. Stark; B.P. Tousignant; J.D. Wenstrom; K. Witgen; T. Xu; Z. Zheng; FRIB; East Lansing; USA; The driver linac for the Facility for Rare Isotope Beams (FRIB) comprises four kinds of cavities (=0.041; 0.085; 0.29; and 0.53) and six types of cryomodules including matching modules. FRIB has started the fabrication of a β=0.53 preproduction cryomodule; which is the first prototype for a half-wave (=0.29 and 0.53) cavity. This paper describes the fabrication progress and the lessons learned from the β=0.53 preproduction cryomodule.,,reference for this paper ※ https://doi.org/10.18429/JACoW-,https://proceedings.jacow.org/linac2016/talks/thprc021_talk.pdf,False,https://proceedings.jacow.org/linac2016/papers/thprc021.pdf,True,https://proceedings.jacow.org/linac2016/posters/thprc021_poster.pdf,False,https://doi.org/10.18429/JACoW-LINAC2016-THPRC021,811
linac2016,,THPRC022,The Cryogenic Performance of the ARIEL E-Linac Cryomodules,Y. Ma; K. Fong; P.R. Harmer; T. Junginger; D. Kishi; A.N. Koveshnikov; R.E. Laxdal; N. Muller; Z.Y. Yao; V. Zvyagintsev; TRIUMF; Vancouver; Canada; UBC & TRIUMF; Vancouver; British Columbia; Canada; The Advanced Rare Isotope Laboratory (ARIEL) project at TRIUMF requires a 50 MeV superconducting electron Linac consisting of five nine cell 1.3 GHz cavities divided into three cryomodules with one; two and two cavities in each module respectively. The cryomodule design utilizes a unique box cryomodule with a top-loading cold mass. LHe is distributed in parallel to each cryomodule at 4 K and at ~1.2 bar. Each cryomodule has a cryogenic insert on board that receives the 4 K liquid and produces 2 K liquid into a cavity phase separator. In the cryomodules the natural two-phase convection loops; i.e. siphon loop; are installed which supply 4 K liquid to thermal intercepts and return the vaporized liquid to the 4 K reservoir as a refrigerator load. The design of the cryomodule; the simulation results with Ansys Fluent and the results of the cold tests will be presented.,,reference for this paper ※ https://doi.org/10.18429/JACoW-,https://proceedings.jacow.org/linac2016/talks/thprc022_talk.pdf,False,https://proceedings.jacow.org/linac2016/papers/thprc022.pdf,True,https://proceedings.jacow.org/linac2016/posters/thprc022_poster.pdf,False,https://doi.org/10.18429/JACoW-LINAC2016-THPRC022,815
linac2016,,THPRC023,Cost Reduction for FRIB Magnetic Shielding,Z. Zheng; J.T. Popielarski; K. Saito; T. Xu; FRIB; East Lansing; USA; Cryogenic magnetic shielding (A4K) is generally used in SRF cryomodules which is much more expensive than mu-metal used in room temperature. In order to reduce the cost; FRIB QWR and HWR magnetic shieldings were redesign to improve the shielding performance so that mu-metal can be implemented as an alternative shielding material. The magnetic shielding of first FRIB β=0.085 cryomodule was made up of 50% by A4K and 50% by mu-metal. Cavities were tested in 4K and 2K; the results showed that the Q0 of cavities were similar for both shielding materials; which is a success as a validation test for mu-metal magnetic shielding.,,reference for this paper ※ https://doi.org/10.18429/JACoW-,https://proceedings.jacow.org/linac2016/talks/thprc023_talk.pdf,False,https://proceedings.jacow.org/linac2016/papers/thprc023.pdf,True,https://proceedings.jacow.org/linac2016/posters/thprc023_poster.pdf,False,https://doi.org/10.18429/JACoW-LINAC2016-THPRC023,818
