conference_code,session_name,paper_id,title,authors,institutions,abstract,presentation_url,presentation_available,paper_url,paper_available,poster_url,poster_available,doi,page_number
erl2017,,TUIDCC003,CBETA Multipass Lattice Design,Cornell University (CLASSE); Cornell Laboratory for Accelerator-Based Sciences and Education; Ithaca; New York; USA; Cornell University and Brookhaven National Laboratory are currently designing the Cornell-BNL ERL-FFAG Test Accelerator (CBETA); to be built at Cornell that utilizes the existing energy recovery linac (ERL) injector and main linac cryomodule (MLC). The bulk of the recirculation arcs will consist of fixed-field alternating-gradient (FFAG) magnets made from permanent magnet material. Four acceleration passes through the MLC will bring the beam to 150 MeV. We will review the overall lattice design for this machine.,,,https://proceedings.jacow.org/erl2017/talks/tuidcc003_talk.pdf,True,https://proceedings.jacow.org/erl2017/papers/tuidcc003.pdf,False,https://proceedings.jacow.org/erl2017/posters/tuidcc003_poster.pdf,False,https://doi.org/10.18429/JACoW-ERL2017-TUIDCC003,
erl2017,,TUIDCC004,CBETA FFAG Beam Optics Design,J.S. Berg; S.J. Brooks; F. Méot; D. Trbojevic; N. Tsoupas; BNL; Upton; Long Island; New York; USA; J.A. Crittenden; Y. Li; C.E. Mayes; Cornell University (CLASSE); Cornell Laboratory for Accelerator-Based Sciences and Education; Ithaca; New York; USA; CBETA is an Energy Recovery Linac (ERL) accelerating an electron beam to 150 MeV in four linac passes. Instead of having four separate return loops to the linac; it instead has a single fixed field alternating gradient (FFAG) beamline with nearly a factor of 4 energy acceptance. While ideally the FFAG would be circular with identical cells all around; space and cost considerations dictate that small radius of curvature FFAGs should be used near the linac; connected by a straight beamline. To ensure good orbit matching over the entire energy range; adiabatic transitions are inserted between the arcs and the straight. After briefly introducing basic principles of FFAG optics; we describe how we choose the parameters of the arc cell; the basic building block of the lattice. We then describe how the straight cell is chosen to work well with the arc. Finally we describe the design process for the transition that ensures orbits over the entire energy range end up very close to the axis of the straight. We discuss how the realization of this lattice design with physical magnets impacts the design process.,,,https://proceedings.jacow.org/erl2017/talks/tuidcc004_talk.pdf,True,https://proceedings.jacow.org/erl2017/papers/tuidcc004.pdf,True,https://proceedings.jacow.org/erl2017/posters/tuidcc004_poster.pdf,False,https://doi.org/10.18429/JACoW-ERL2017-TUIDCC004,52
erl2017,,TUIDCC005,ERL Recirculation Optics for MESA,IKP; Mainz; Germany,,MESA is a recirculating superconducting accelerator under construction at Johannes Gutenberg-Universität Mainz. It will be used for high precision particle physics experiments in two different operation modes: external beam (EB) mode and energy recovery (ERL) mode. The operating beam current and energy in EB mode is 0.15 mA with polarized electrons at 155 MeV. In ERL mode a beam of 1 mA at 105 MeV will be available. In a later construction stage of MESA the beam current in ERL-mode shall be upgraded to 10 mA. The recirculating main linac follows the concept of a double sided accelerator design with vertical stacking of return arcs. Acceleration is done by in total four TESLA/XFEL 9-cell SRF-cavities mounted in two modified ELBE cryomodules. Within this contribution the recirculation optics for MESA will be presented focussing on achieving best energy spread at the experimental setups in recirculation ERL and non-ERL operation.,https://proceedings.jacow.org/erl2017/talks/tuidcc005_talk.pdf,True,https://proceedings.jacow.org/erl2017/papers/tuidcc005.pdf,False,https://proceedings.jacow.org/erl2017/posters/tuidcc005_poster.pdf,False,https://doi.org/10.18429/JACoW-ERL2017-TUIDCC005,
erl2017,,WEIACC001,PERLE a Proposed Test ERL at LAL,LAL; Orsay; France,,Abstract not submitted at print time.,https://proceedings.jacow.org/erl2017/talks/weiacc001_talk.pdf,True,https://proceedings.jacow.org/erl2017/papers/weiacc001.pdf,False,https://proceedings.jacow.org/erl2017/posters/weiacc001_poster.pdf,False,https://doi.org/10.18429/JACoW-ERL2017-WEIACC001,
erl2017,,WEIACC002,Status of the Berlin Energy Recovery Linac Project BERLinPro,A. Jankowiak; M. Abo-Bakr; W. Anders; K.B. Bürkmann-Gehrlein; A.B. Büchel; P. Echevarria; A. Frahm; H.-W. Glock; F. Glöckner; F. Göbel; B.D.S. Hall; S. Heling; H.-G. Hoberg; C. Kalus; T. Kamps; G. Klemz; J. Knedel; J. Knobloch; J. Kolbe; G. Kourkafas; J. Kühn; B.C. Kuske; P. Kuske; J. Kuszynski; D. Malyutin; A.N. Matveenko; M. McAteer; A. Meseck; C.J. Metzger-Kraus; R. Müller; A. Neumann; N. Ohm; K. Ott; E. Panofski; F. Pflocksch; J. Rahn; M. Schmeißer; O. Schüler; M. Schuster; J. Ullrich; A. Ushakov; J. Völker; HZB; Berlin; Germany; The Helmholtz-Zentrum Berlin is constructing the Energy Recovery Linac Prototype BERLinPro; a demonstration facility for the science and technology of ERLs for future light source applications. BERLinPro is designed to acceleration a high current (100 mA; 50 MeV); high brilliance (norm. emittance below 1 mm mrad); short pulse (below 2 ps) cw electron beam. Here the project status will be reported. This includes the completion of the building and the installation of the first accelerator components; as well as the assembly of the srf gun and GunLab beam diagnostics; which are now under commissioning.,,,https://proceedings.jacow.org/erl2017/talks/weiacc002_talk.pdf,True,https://proceedings.jacow.org/erl2017/papers/weiacc002.pdf,False,https://proceedings.jacow.org/erl2017/posters/weiacc002_poster.pdf,False,https://doi.org/10.18429/JACoW-ERL2017-WEIACC002,
erl2017,,WEIACC003,"ER@CEBAF, a 7 GeV, 5-Pass, Energy Recovery Experiment",F. Méot; I. Ben-Zvi; Y. Hao; C. Liu; M.G. Minty; V. Ptitsyn; G. Robert-Demolaize; T. Roser; P. Thieberger; N. Tsoupas; C. Xu; W. Xu; BNL; Upton; Long Island; New York; USA; M.E. Bevins; S.A. Bogacz; D. Douglas; C.J. Dubbé; T.J. Michalski; Y. Roblin; T. Satogata; M. F. Spata; C. Tennant; M.G. Tiefenback; JLab; Newport News; Virginia; USA,"A multiple-pass, high energy Energy Recovery Linac experiment at the JLab CEBAF will be instrumental in providing necessary information and technology testing for a number of possible future applications and facilities such as Linac-Ring based colliders, which have been designed at BNL (eRHIC) and CERN (LHeC), and also drivers for high-energy FELs and 4th GLS. The project has been submitted to, and has received approval from, JLab Program Advisory Committee (PAC 44) in July 2016. Since it was launched 2+ years ago, it has progressed in defining the experimental goals, including for instance multiple-beam instrumentation, ER efficiency, BBU, and the necessary modifications to CEBAF lattice, including for instance a 4-dipole phase chicane in recirculation Arc A, a dump line, and new linac optics. End-to-end simulations have been undertaken and software tools are under development. A next major objective in demonstrating readiness is a technical review as mandated by PAC 44. This paper gives a status of the project and its context, and presents plans for the near future.",,https://proceedings.jacow.org/erl2017/talks/weiacc003_talk.pdf,True,https://proceedings.jacow.org/erl2017/papers/weiacc003.pdf,True,https://proceedings.jacow.org/erl2017/posters/weiacc003_poster.pdf,False,https://doi.org/10.18429/JACoW-ERL2017-WEIACC003,58
erl2017,,WEIACC004,A Beam Test Facility for High Current Photoinjector and its Key Technologies Development at IHEP,X.P. Li; Y.L. Chi; S. Pei; J.Q. Wang; J.Y. Zhai; IHEP; Beijing; People's Republic of China; Insititute of High Energy Physics (IHEP); People's Republic of China,,A beam test facility for high current photoinjector has been supported for future advanced light source at the Platform of Advanced Photon Source Technology R&D (PAPS) which is going to be completed before July of 2020. This test facility is based on a photocathode DC-Gun followed by two 2-cell 650MHz superconducting RF cavities. The detailed design of the photoinjector and its related key technologies R&D progress such as DC-Gun and superconducting cavities are presented.,https://proceedings.jacow.org/erl2017/talks/weiacc004_talk.pdf,True,https://proceedings.jacow.org/erl2017/papers/weiacc004.pdf,False,https://proceedings.jacow.org/erl2017/posters/weiacc004_poster.pdf,False,https://doi.org/10.18429/JACoW-ERL2017-WEIACC004,
erl2017,,WEIBCC001,Beam Dynamics Issues for Multi-Pass ERLs,Cornell University (CLASSE); Cornell Laboratory for Accelerator-Based Sciences and Education; Ithaca; New York; USA; Several labs have proposed multi-turn ERLs as electron-drivers for major experiments. The beam dynamics of the 4-turn ERL CBETA will be studied in detail to understand the beam-dynamic issues for these electron drivers. These issues include: (a) current limits by the recirculative beam-breakup instability(BBU) and its control by HOM damping; optics adjustments; and optical coupling; (b) ions attracted to the electron beam and their control by clearing electrodes; current modulations; and beam shaking; (c) loss mechanism including Touschek scattering; gas scattering; field emission; ghost pules; and spurious emotions from the cathode; (d) high-chromaticity operation; orbit and optics controls of superimposed beams; coherent synchrotron radiation; micro-bunching; and longitudinal space charge; and (e) low energies space charge and emittance control,,,https://proceedings.jacow.org/erl2017/talks/weibcc001_talk.pdf,True,https://proceedings.jacow.org/erl2017/papers/weibcc001.pdf,False,https://proceedings.jacow.org/erl2017/posters/weibcc001_poster.pdf,False,https://doi.org/10.18429/JACoW-ERL2017-WEIBCC001,
erl2017,,WEIBCC002,LHeC ERL - Beam Dynamics Challenges,CERN; Geneva; Switzerland,,The LHeC is envisioned as a natural upgrade of the LHC that aims at delivering an electron beam for collisions with the existing hadronic beams. The current baseline design for the electron facility consists of a multipass superconducting energy-recovery linac (ERL) operating in a continuous wave mode and delivering a beam current up to 25 mA at the energy of 60 GeV. This contribution aims at briefly reviewing the beam dynamics aspects motivating the existing design choices. Emphasis will be put in the open issues with their potential synergies with other projects.,https://proceedings.jacow.org/erl2017/talks/weibcc002_talk.pdf,True,https://proceedings.jacow.org/erl2017/papers/weibcc002.pdf,False,https://proceedings.jacow.org/erl2017/posters/weibcc002_poster.pdf,False,https://doi.org/10.18429/JACoW-ERL2017-WEIBCC002,
erl2017,,WEIBCC003,Beam Dynamics and Optics Challenges of BERLinPro,HZB; Berlin; Germany; The Helmholtz-Zentrum Berlin is constructing the Energy Recovery Linac Prototype BERLinPro; a demonstration facility for the science and technology of ERLs for future light source applications. BERLinPro is designed to accelerate a high current (100 mA; 50 MeV); high brilliance (norm. emittance below 1 mm mrad) cw electron beam. Various aspects and challenges of beam dynamics and optics in an ERL will be introduced and their relevance and influence on the beam optics layout of BERLinPro discussed. Beside storage ring known requirements emphasis is put to ERL specific problems. Especially collective effects due to space charge and high current are considered.,,,https://proceedings.jacow.org/erl2017/talks/weibcc003_talk.pdf,True,https://proceedings.jacow.org/erl2017/papers/weibcc003.pdf,False,https://proceedings.jacow.org/erl2017/posters/weibcc003_poster.pdf,False,https://doi.org/10.18429/JACoW-ERL2017-WEIBCC003,
erl2017,,WEIBCC004,Studies of CSR and Microbunching at the Jefferson Laboratory ERLs,C. Tennant; S.V. Benson; D. Douglas; R. Li; JLab; Newport News; Virginia; USA; SLAC; Menlo Park; California; USA,One attractive feature of energy recovery linacs (ERLs) is they are source limited. However as beam brightness increases so too do the effects of coherent synchrotron radiation (CSR) and the microbunching instability. The Low Energy Recirculator Facility at Jefferson Laboratory provides a test bed to characterize aspects of CSR's effect on the beam by measuring the energy extraction via CSR as a function of bunch compression. Data was recorded with acceleration occuring on the rising part of the RF waveform while the full compression point was moved along the backleg of the machine and the response of the beam measured. Acceleration was moved to the falling part of the RF waveform and the experiment repeated. Initial start-to-end simulations using a 1D CSR model show good agreement with measurements. The experiment motivated the design of a modified Continuous Electron Beam Accelerator Facility style arc with control of CSR and the microbunching gain. Insights gained from that study informed designs for recirculation arcs in an ERL-driven electron cooler for Jefferson Laboratory's Electron Ion Collider. Progress on the design and outstanding challenges of the cooler are discussed.,,https://proceedings.jacow.org/erl2017/talks/weibcc004_talk.pdf,True,https://proceedings.jacow.org/erl2017/papers/weibcc004.pdf,True,https://proceedings.jacow.org/erl2017/posters/weibcc004_poster.pdf,False,https://doi.org/10.18429/JACoW-ERL2017-WEIBCC004,59
erl2017,,WEICCC001,Commission Results of the Compact ERL High Voltage DC Gun,Tohoku University; Research Center for Electron Photon Science; Sendai; Japan; R. Hajima; R. Nagai; QST; Tokai; Japan; Y. Honda; X.J. Jin; T. Miyajima; T. Obina; T. Uchiyama; M. Yamamoto; KEK; Ibaraki; Japan; HU/AdSM; Higashi-Hiroshima; Japan; Beam commissioning of the compact ERL (cERL) has been performed for the next generation ERL light sources such as a laser Compton gamma-ray source and a high power FEL for EUV lithography. The operational high voltage of the cERL DC gun has been limited to 390 kV due to failure of the ten segmented insulators. In November 2015; we installed an additional two segmented insulators on the top of the existing ten segmented insulators. In December 2015; we successfully performed high voltage conditioning up to 500 kV. We also found high voltage threshold for stable operation in a dc electron gun [1]. The cERL operational voltage has been 450 kV in maximum since then. We will present details of the high voltage upgrade and operational status at 450 kV of the cERL gun.; [1] Masahiro Yamamoto and Nobuyuki Nishimori; APL 109; 014103 (2016).,,,https://proceedings.jacow.org/erl2017/talks/weiccc001_talk.pdf,True,https://proceedings.jacow.org/erl2017/papers/weiccc001.pdf,False,https://proceedings.jacow.org/erl2017/posters/weiccc001_poster.pdf,False,https://doi.org/10.18429/JACoW-ERL2017-WEICCC001,
erl2017,,WEICCC002,The ALICE ERL - DC Photocathode Gun Commissioning,STFC/DL/ASTeC; Daresbury; Warrington; Cheshire; United Kingdom; The ALICE (Accelerators and Lasers In Combined Experiments) accelerator was the first ERL to be operated in Europe. ALICE was used to drive the UK's first Free-Electron Laser; generating infra-red light in the 4 - 20 micron range which was used in the development of pioneering cancer diagnostics. This talk will present an overview of the ALICE DC GaAs photocathode gun; and review the measured performance of the gun when it was operated in to a dedicated diagnostics beamline.,,,https://proceedings.jacow.org/erl2017/talks/weiccc002_talk.pdf,True,https://proceedings.jacow.org/erl2017/papers/weiccc002.pdf,False,https://proceedings.jacow.org/erl2017/posters/weiccc002_poster.pdf,False,https://doi.org/10.18429/JACoW-ERL2017-WEICCC002,
erl2017,,WEICCC003,Injector Challenges for CBETA Demonstration Experiment,Cornell University (CLASSE); Cornell Laboratory for Accelerator-Based Sciences and Education; Ithaca; New York; USA; CBETA; currently under construction; is a 4-pass; 40mA 150MeV ERL based on the proven Cornell ERL injector chain mated with an FFAG loop. The Cornell ERL injector program; originally intended for a large scale X-Ray light source; has been under development and operated for over 10 years. The status of the Cornell ERL injector is reviewed and its parameters compared with the challenges presented by the requirements for CBETA operation. The injector consists of a high voltage DC photocathode gun; a normal conducting buncher cavity; the superconducting injector cryomodule; followed by a splitter magnet that can transport the beam into either a diagnostics beamline or merge the beam into the CBETA ERL loop. The current status of the Cornell DC gun development program and its history will be reviewed. The performance of the injector cryomodule; capable of accelerating beams to 15MeV; will be discussed with a focus on the lessons learned from its operation. Finally the diagnostics beamline and the merger will be detailed along with the latest results from our low emittance beam studies.,Funding: This work was performed with the support of NYSERDA (New York State Energy Research and Development Agency) and of the National Science Foundation (Award No. NSF-DMR 0807731).,,https://proceedings.jacow.org/erl2017/talks/weiccc003_talk.pdf,True,https://proceedings.jacow.org/erl2017/papers/weiccc003.pdf,False,https://proceedings.jacow.org/erl2017/posters/weiccc003_poster.pdf,False,https://doi.org/10.18429/JACoW-ERL2017-WEICCC003,
erl2017,,WEICCC004,First Results of Commissioning DC Photo-Gun for RHIC Low Energy Electron Cooler (LEReC),D. Kayran; Z. Altinbas; D. Bruno; M.R. Costanzo; A.V. Fedotov; D.M. Gassner; X. Gu; L.R. Hammons; P. Inacker; J.P. Jamilkowski; J. Kewisch; C.J. Liaw; C. Liu; K. Mernick; T.A. Miller; M.G. Minty; V. Ptitsyn; T. Rao; J. Sandberg; S. Seletskiy; P. Thieberger; J.E. Tuozzolo; E. Wang; Z. Zhao; BNL; Upton; Long Island; New York; USA; Non-magnetized bunched electron cooling of ion beams during low energy RHIC operation requires electron beam energy in the range of 1.6-2.6 MeV; with an average current up to 45 mA; very small energy spread; and low emittance. A 400 kV DC gun equipped with a photocathode and laser system will provide a source of high-quality electron beams. During DC gun test critical elements of LEReC such as laser beam system; cathode exchange system; cathode QE lifetime; DC gun stability; beam instrumentation; the high-power beam dump system; machine protection system and controls has been tested under near- operational conditions [1]. We present the status; experimental results and experience learned during the LEReC DC gun beam testing.; [1] D. Kayran et al.; DC Photogun Gun Test for RHIC Low Energy Electron Cooler (LEReC),,,https://proceedings.jacow.org/erl2017/talks/weiccc004_talk.pdf,True,https://proceedings.jacow.org/erl2017/papers/weiccc004.pdf,True,https://proceedings.jacow.org/erl2017/posters/weiccc004_poster.pdf,False,https://doi.org/10.18429/JACoW-ERL2017-WEICCC004,65
erl2017,,WEIDCC001,The Development of the DC-SRF Photoinjector at Peking University,H.M. Xie; W. Cheng; L.W. Feng; J.K. Hao; S. Huang; L. Lin; K.X. Liu; W. Qin; S.W. Quan; F. Wang; F. Zhu; PKU; Beijing; People's Republic of China,,Stable operation of the DC-SRF photoinjector has been realized and the electron beam has been delivered to a 2 × 9-cell SRF linac for further acceleration and terahertz superrandiant undulator radiation experiments. In this talk we will present our latest experiment progress and recent work for decreasing the immitance of the DC-SRF photoinjector. The purpose is to build an upgraded DC-SRF photoinjector capable of driving CW X-ray free-electron lasers.,https://proceedings.jacow.org/erl2017/talks/weidcc001_talk.pdf,True,https://proceedings.jacow.org/erl2017/papers/weidcc001.pdf,False,https://proceedings.jacow.org/erl2017/posters/weidcc001_poster.pdf,False,https://doi.org/10.18429/JACoW-ERL2017-WEIDCC001,
erl2017,,WEIDCC002,High Charge High Current Beam From BNL 113 MHz SRF Gun,I. Pinayev; Z. Altinbas; S.A. Belomestnykh; I. Ben-Zvi; K.A. Brown; J.C.B. Brutus; A.J. Curcio; L. DeSanto; A. Di Lieto; C. Folz; D.M. Gassner; M. Harvey; T. Hayes; R.L. Hulsart; P. Inacker; J.P. Jamilkowski; Y.C. Jing; D. Kayran; R. Kellermann; R.F. Lambiase; D. Lehn; V. Litvinenko; C. Liu; G.J. Mahler; M. Mapes; K. Mernick; R.J. Michnoff; T.A. Miller; M.G. Minty; G. Narayan; P. Orfin; M.C. Paniccia; D. Phillips; T. Rao; T. Roser; S.K. Seberg; B. Sheehy; J. Skaritka; L. Smart; K.S. Smith; V. Soria; Z. Sorrell; R. Than; C. Theisen; P. Thieberger; J.E. Tuozzolo; J. Walsh; E. Wang; G. Wang; D. Weiss; B. P. Xiao; T. Xin; W. Xu; A. Zaltsman; Z. Zhao; BNL; Upton; Long Island; New York; USA; Stony Brook University; Stony Brook; USA; SUNY SB; Stony Brook; New York; USA; SBU; Stony Brook; New York; USA; We are commissioning the accelerator for the Coherent Electron Cooling Proof-of-principle (CeC PoP) Experiment. The 113 MHz superconducting RF gun with Cs2KSb photocathode serves as a source of the electrons. The gun is designed to operate up to 5 nC beam with repetition rate of 78 kHz. In the paper we present status of the gun as well as achieved beam parameters. The photocathode performance (quantum efficieny; lifetime) is also discussed.,,,https://proceedings.jacow.org/erl2017/talks/weidcc002_talk.pdf,True,https://proceedings.jacow.org/erl2017/papers/weidcc002.pdf,False,https://proceedings.jacow.org/erl2017/posters/weidcc002_poster.pdf,False,https://doi.org/10.18429/JACoW-ERL2017-WEIDCC002,
erl2017,,WEIDCC003,Metal and Semiconductor Photocathodes in the HZDR SRF Gun,J. Teichert; A. Arnold; P.N. Lu; P. Murcek; H. Vennekate; R. Xiang; HZDR; Dresden; Germany; The superconducting RF photoelectron gun at the ELBE accelerator facility is a high-repetition rate electron injector for CW operation and can provide high average current and high brightness electron beams. During commissioning and operating time different types of photocathodes; metallic (Cu; Mg) and semiconductors (Cs2Te); have been used. We present the preparation processes; properties as well as performance and operational experience of the cathodes in the SRF gun. Furthermore; specific issues like cathode cooling; multipacting; and dark current will be discussed.,,,https://proceedings.jacow.org/erl2017/talks/weidcc003_talk.pdf,True,https://proceedings.jacow.org/erl2017/papers/weidcc003.pdf,False,https://proceedings.jacow.org/erl2017/posters/weidcc003_poster.pdf,False,https://doi.org/10.18429/JACoW-ERL2017-WEIDCC003,
erl2017,,WEIDCC004,The BERLinPro SRF Photoinjector System - From Design to First RF Commissioning Results,HZB; Berlin; Germany; Helmholtz-Zentrum Berlin (HZB) is currently constructing an high average current superconducting (SC) ERL as a prototype to demonstrate low normalized beam emittance of 1 mm·mrad at 100mA and short pulses of about 2 ps. To reach the required beam properties; an SRF based photo-injector system was developed and recently underwent RF commissioning. The medium power prototype- a first stage towards the final high power 100 mA design- presented here features a 1.4 x λ/2 cell SRF cavity with a normal-conducting; high quantum efficiency Cs2KSb cathode; implementing a modified HZDR-style cathode insert. This injector potentially allows for 6 mA beam current and up to 3.5 MeV kinetic energy; limited by the modified twin TTF-III fundamental power couplers. In this contribution an overview of the design approach; cavity production and module assembly up to the first RF commissioning results of the photo-injector module will be presented.,,,https://proceedings.jacow.org/erl2017/talks/weidcc004_talk.pdf,True,https://proceedings.jacow.org/erl2017/papers/weidcc004.pdf,False,https://proceedings.jacow.org/erl2017/posters/weidcc004_poster.pdf,False,https://doi.org/10.18429/JACoW-ERL2017-WEIDCC004,
erl2017,,THIACC001,Higher Bunch Charge Operation in Compact ERL at KEK,KEK; Ibaraki; Japan,,Abstract not submitted at print time.,https://proceedings.jacow.org/erl2017/talks/thiacc001_talk.pdf,True,https://proceedings.jacow.org/erl2017/papers/thiacc001.pdf,False,https://proceedings.jacow.org/erl2017/posters/thiacc001_poster.pdf,False,https://doi.org/10.18429/JACoW-ERL2017-THIACC001,
erl2017,,THIACC002,Dark Current and Halo Tracking in ERLs,HZB; Berlin; Germany; Particles that are far from the core of a bunch are often lost in an uncontrolled way within an accelerator; and in high-current machines beam loss can quickly damage accelerator components or cause significant residual activation. We give a brief overview of the common sources of unwanted beam; including halo generated by nonlinear dynamics; dark current from field emission in the cavities; out-of-time scattered laser light on the cathode; and incompletely blocked laser pulses. The results of tracking simulations to model these effects in BERLinPro are discussed.,,,https://proceedings.jacow.org/erl2017/talks/thiacc002_talk.pdf,True,https://proceedings.jacow.org/erl2017/papers/thiacc002.pdf,False,https://proceedings.jacow.org/erl2017/posters/thiacc002_poster.pdf,False,https://doi.org/10.18429/JACoW-ERL2017-THIACC002,
erl2017,,THIACC003,Low Emittance Optimization and Operation,STFC/DL/ASTeC; Daresbury; Warrington; Cheshire; United Kingdom,,Abstract not submitted at print time.,https://proceedings.jacow.org/erl2017/talks/thiacc003_talk.pdf,True,https://proceedings.jacow.org/erl2017/papers/thiacc003.pdf,False,https://proceedings.jacow.org/erl2017/posters/thiacc003_poster.pdf,False,https://doi.org/10.18429/JACoW-ERL2017-THIACC003,
