conference_code,session_name,paper_id,title,authors,institutions,abstract,presentation_url,presentation_available,paper_url,paper_available,poster_url,poster_available,doi,page_number
erl2017,,MOPSPP017,Energy Distribution and Work Function Measurements for Metal Photocathodes With Measured Levels of Surface Roughness,T.S. Beaver; L.B. Jones; B.L. Militsyn; T.C.Q. Noakes; R. Valizadeh; STFC/DL/ASTeC; Daresbury; Warrington; Cheshire; United Kingdom; STFC/DL; Daresbury; Warrington; Cheshire; United Kingdom,,,https://proceedings.jacow.org/erl2017/talks/mopspp017_talk.pdf,False,https://proceedings.jacow.org/erl2017/papers/mopspp017.pdf,False,https://proceedings.jacow.org/erl2017/posters/mopspp017_poster.pdf,False,https://doi.org/10.18429/JACoW-ERL2017-MOPSPP017,
erl2017,,MOIDCC001,Update on the KEK ERL Test Facility (cERL),KEK; Ibaraki; Japan; The test facility of Compact ERL (cERL) was constructed to develop critical accelerator components for future light sources. The target of cERL is to realize the ERL operation under the conditions of low emittance (lower than 1 mm mrad) with high current (averaged current of 10 mA). Our group presented the construction and initial commissioning result at the previous ERL15 workshop. After that; we have made an effort to update the performance; so that we have succeeded the ERL operation under the conditions of beam current of 1mA with lower emittance of 1mm mrad. At the bunch charges of 0.5 pC and 7.7 pC; the beam emittance was demonstrated at the March of 2016 as 0.3 mm mrad and 1-1.8 mm mrad; respectively. We also achieved the stable beam operation at the conditions of 1mA with 162.5 MHz with a small beam loss; so that it is expected to be possible to operate 10 mA at cERL with a present radiation shielding geometry. Furthermore; recently; we have made an effort to realize the beam development under high bunch charge (40 pC/bunch) operation. I will present these updated developments from the previous ERL15 workshop.,,,https://proceedings.jacow.org/erl2017/talks/moidcc001_talk.pdf,True,https://proceedings.jacow.org/erl2017/papers/moidcc001.pdf,False,https://proceedings.jacow.org/erl2017/posters/moidcc001_poster.pdf,False,https://doi.org/10.18429/JACoW-ERL2017-MOIDCC001,
erl2017,,MOIDCC002,Novosibirsk ERL Facility,N.A. Vinokurov; V.M. Borin; I.V. Davidyuk; O.I. Deichuli; E.N. Dementyev; B.A. Dovzhenko; Ya.V. Getmanov; Ya.I. Gorbachev; B.A. Knyazev; E.I. Kolobanov; A.A. Kondakov; V.R. Kozak; E.V. Kozyrev; S.A. Krutikhin; V.V. Kubarev; G.N. Kulipanovpresenter; E.A. Kuper; I.V. Kuptsov; G.Y. Kurkin; L.E. Medvedev; O.I. Meshkov; S.V. Motygin; A.A. Murasev; V.N. Osipov; V.K. Ovchar; V.M. Petrov; A.M. Pilan; V.M. Popik; V.V. Repkov; T.V. Salikova; M.A. Scheglov; I.K. Sedlyarov; S.S. Serednyakov; O.A. Shevchenko; A.N. Skrinsky; S.V. Tararyshkin; V.G. Tcheskidov; A.G. Tribendis; P. Vobly; V. Volkov; BINP SB RAS; Novosibirsk; Russia; I.V. Davidyuk; Ya.V. Getmanov; B.A. Knyazev; E.V. Kozyrev; S.S. Serednyakov; N.A. Vinokurov; NSU; Novosibirsk; Russia; BINP; Novosibirsk; Russia; NSTU; Novosibirsk; Russia; The first project of the four turn ERL for Novosibirsk FELs (NovoFEL) was proposed at FEL'90 Conference. Later the project was modified; but the base lines kept: a four turn normal conductance linac with energy recovery; low RF cavities (180 MHz); grid controlled DC gun (Q~1 nC; tau=1 nsec; f rep = 10 kHz-50 MHz). The ERL can operate in the three modes; providing an electron beam for the three different FELs (from 300 µm up to 5 µm). Construction and commissioning four track ERL was divided on three stage: the first stage NovoFEL working in spectral range (90-240) µm; based on one track energy recovery linac (ERL) with energy 12 MeV and current 30 mA; was commissioned in 2003. The second stage of NovoFEL working in spectral range (35-80) µm; based on two track energy recovery linac with energy 22 MeV and current 7 mA; was commissioned in 2009. The third stage of NovoFEL working in spectral range (8-15) µm; based on four track energy recovery linac with energy 42 MeV and current 5 mA was commissioned in 2015.,,,https://proceedings.jacow.org/erl2017/talks/moidcc002_talk.pdf,True,https://proceedings.jacow.org/erl2017/papers/moidcc002.pdf,True,https://proceedings.jacow.org/erl2017/posters/moidcc002_poster.pdf,False,https://doi.org/10.18429/JACoW-ERL2017-MOIDCC002,33
erl2017,,MOIDCC004,"CBETA, a 4-Turn ERL With FFAG Arc",Cornell University (CLASSE); Cornell Laboratory for Accelerator-Based Sciences and Education; Ithaca; New York; USA; Cornell University has been pioneering Energy Recovery Linacs (ERLs) technology that is essential for any high brightness electron ERL. This includes a DC electron source and an SRF injector Linac with world-record current and normalized brightness in a bunch train; a high-current linac cryomodule; and a high-power beam stop; and several diagnostics tools for high-current and high-brightness beams. All these are now being used to construct a novel one-cryomodule ERL in Cornell's Wilson Lab. BNL has designed a multi-turn ERL for eRHIC; where beam is transported more than 20 times around the 4km long RHIC tunnel. The number of transport lines is minimized by using two arcs with strongly-focusing permanent magnets that can control many beams of different energies. A collaboration between BNL and Cornell has been formed to investigate this multi-turn eRHIC ERL design by building a 4-turn; one-cryomodule ERL at Cornell. It also has a return loop built with strongly focusing permanent magnets and is meant to accelerate 40 mA beam to 150 MeV. This high-brightness beam will have applications beyond accelerator research; in industry; in nuclear physics; and in X-ray science.,,,https://proceedings.jacow.org/erl2017/talks/moidcc004_talk.pdf,True,https://proceedings.jacow.org/erl2017/papers/moidcc004.pdf,False,https://proceedings.jacow.org/erl2017/posters/moidcc004_poster.pdf,False,https://doi.org/10.18429/JACoW-ERL2017-MOIDCC004,
erl2017,,MOIDCC005,Lessons Learned From BNL ERL Test Facility,BNL; Upton; Long Island; New York; USA; First photocurrent from ERL SRF gun at BNL has been delivered in November 2014. In June 2015 a high charge 0.5nC and 20 uA average current were demonstrated. In July 2015 the gun to dump beam test started. The beam was successfully transported from the SRF gun through the injection system; then through the linac to the beam dump. All ERL loop components have been installed. In October 2015; the SRF gun cavity has been found contaminated during severe cathode stalk RF conditioning. This cavity has been sent for repair and modification for later use in the low-energy RHIC electron cooler (LEReC). LEReC scheduled to start commissioning in early of 2018 [1]. We present our results of BNL ERL beam commissioning; the measured beam properties; the operational status; and future prospects.; [1] D. Kayran et all.; . First Results of Commissioning DC Photogun for RHIC Low Energy Electron Cooler (LEReC). In this procedures.,,,https://proceedings.jacow.org/erl2017/talks/moidcc005_talk.pdf,True,https://proceedings.jacow.org/erl2017/papers/moidcc005.pdf,False,https://proceedings.jacow.org/erl2017/posters/moidcc005_poster.pdf,False,https://doi.org/10.18429/JACoW-ERL2017-MOIDCC005,
erl2017,,MOIDCC006,ERL Mode of S-DALINAC: Design and Status,M. Arnold; C. Burandt; J. Pforr; N. Pietralla; TU Darmstadt; Darmstadt; Germany; C. Eschelbach; M. Lösler; Frankfurt University of Applied Sciences; Frankfurt am Main; Germany; HIM; Mainz; Germany,,,https://proceedings.jacow.org/erl2017/talks/moidcc006_talk.pdf,True,https://proceedings.jacow.org/erl2017/papers/moidcc006.pdf,True,https://proceedings.jacow.org/erl2017/posters/moidcc006_poster.pdf,False,https://doi.org/10.18429/JACoW-ERL2017-MOIDCC006,40
erl2017,,TUIACC001,LERF - New Life for the Jefferson Lab FEL,C. Tennant; S.V. Benson; J.R. Boyce; J.L. Coleman; D. Douglas; S.L. Frierson; J. Gubeli; C. Hernandez-Garcia; K. Jordan; C. Keith; R.A. Legg; M.D. McCaughan; T. Satogata; M. F. Spata; M.G. Tiefenback; S. Zhang; JLab; Newport News; Virginia; USA; R. Alarcon; D. Blyth; R.A. Dipert; L. Ice; G. Randall; B.N. Thorpe; Arizona State University; Tempe; USA; J. Balewski; J.C. Bernauer; J.C. Bessuille; R. Corliss; R.F. Cowan; C. Epstein; P.F. Fisher; I. Friščić; D.K. Hasell; E. Ihloff; J. Kelsey; S. Lee; R. Milner; P. Moran; D. Palumbo; S. Steadman; C. Tschalär; C. Vidal; Y. Wang; MIT; Cambridge; Massachusetts; USA; T. Cao; B. Dongwi; P. Guèye; N. Kalantarians; M. Kohl; A. Liyanage; J. Nazeer; Hampton University; Hampton; Virginia; USA; R. Cervantes; A. Deshpande; N. Feege; Stony Brook University; Stony Brook; USA; SUNY SB; Stony Brook; New York; USA; HZDR; Dresden; Germany; CEA/DRF/IRFU; Gif-sur-Yvette; France; Temple University; Philadelphia; USA; In 2012 Jefferson Laboratory's energy recovery linac (ERL) driven Free Electron Laser successful completed a transmission test in which high current CW beam (4.3 mA at 100 MeV) was transported through a 2 mm aperture for 7 hours with beam losses as low as 3 ppm. The purpose of the run was to mimic an internal gas target for DarkLight* - an experiment designed to search for a dark matter particle. The ERL was not run again until late 2015 for a brief re-commissioning in preparation for the next phase of DarkLight. In the intervening years; the FEL was rebranded as the Low Energy Recirculator Facility (LERF); while organizationally the FEL division was absorbed into the Accelerator division. In 2016 several weeks of operation were allocated to configure the machine for Darklight with the purpose of exercising - for the first time - an internal gas target in an ERL. Despite a number of challenges; including the inability to energy recover; beam was delivered to a target of thickness 1018 cm-2 which represents a 3 order of magnitude increase in thickness from previous internal target experiments. Details of the machine configuration and operational experience will be discussed.; * J. Balewski et al.; A Proposal for the DarkLight Experiment at the Jefferson Laboratory Free Electron Laser; May 2012.,,,https://proceedings.jacow.org/erl2017/talks/tuiacc001_talk.pdf,True,https://proceedings.jacow.org/erl2017/papers/tuiacc001.pdf,True,https://proceedings.jacow.org/erl2017/posters/tuiacc001_poster.pdf,False,https://doi.org/10.18429/JACoW-ERL2017-TUIACC001,45
erl2017,,TUIACC002,Novosibirsk ERL Based FEL as User Facility,BINP SB RAS; Novosibirsk; Russia; The Novosibirsk free electron laser (NovoFEL) is the first multi-turn energy-recovery linear accelerator with three separate laser systems (the terahertz; far-infrared and mid-infrared ones). Radiation of the FELs is transported now from accelerating hall to thirteen user and diagnostics stations by one optical channel filled dry air-nitrogen mixture. In this paper; we describe main radiation parameters of the NovoFEL; workstations of the facility and survey selected recent experiments using substantially intense monochromatic terahertz laser radiation; which can be tuned from 90 µm to 240 µm.,,,https://proceedings.jacow.org/erl2017/talks/tuiacc002_talk.pdf,True,https://proceedings.jacow.org/erl2017/papers/tuiacc002.pdf,False,https://proceedings.jacow.org/erl2017/posters/tuiacc002_poster.pdf,False,https://doi.org/10.18429/JACoW-ERL2017-TUIACC002,
erl2017,,TUIACC003,"Asymmetric, Dual Axis Cavity for Energy Recovery LINAC: Recent Developments and Possible Applications",I.V. Konoplev; A.J. Lancaster; K. Metodiev; A. Seryi; JAI; Oxford; United Kingdom; Fermilab; Batavia; Illinois; USA; Cockcroft Institute; Lancaster University; Lancaster; United Kingdom,,High luminosity THz and X-ray radiation are vital for many branches of science and industry (for example biochemistry and material science) and to achieve it a high electron bunch current is needed. Another requirement to such radiators is high wall plug efficiency. The efficiency is usually very low and the electron beam energy recovery is the most attractive way to improve it. This is normally done using SCRF ERL systems but the bunch current limitations for these systems are more dramatic when compared with a conventional LINACs. Increase of the bunch current in conventional ERLs above some threshold value (normally around 100 mA) leads to beam instabilities development and beam transportation termination. This naturally limits the instruments' luminosity. Here we suggest and discuss the novel concept and specific designs which can enable a SCRF ERL system capable of generating picosecond electron bunches with up to 1A current. The aim of the project is to demonstrate the operation of dual axis asymmetric ERL and its application in research and industry. A preliminary market research of such devices has been recently conducted and results will be also presented.,https://proceedings.jacow.org/erl2017/talks/tuiacc003_talk.pdf,True,https://proceedings.jacow.org/erl2017/papers/tuiacc003.pdf,False,https://proceedings.jacow.org/erl2017/posters/tuiacc003_poster.pdf,False,https://doi.org/10.18429/JACoW-ERL2017-TUIACC003,
erl2017,,TUIBCC001,Photon Science Exploitation of ALICE in Biomedical Science,STFC/DL/SRD; Warrington; Cheshire; United Kingdom; T. Craig; P. Harrison; J. Ingham; M.R.F. Siggel-King; C. Smith; P. Weightman; The University of Liverpool; Liverpool; United Kingdom; ISM-CNR; Rome; Italy; D.J. Dunning; Y.M. Saveliev; N. Thompson; STFC/DL/ASTeC; Daresbury; Warrington; Cheshire; United Kingdom; P. Gardner; M.J. Pilling; MIB; Manchester; United Kingdom; CNR-ISM; Trieste; Italy; University of Liverpool; Liverpool; United Kingdom,"The UK has maintained an ambition to build a national FEL facility and this has been reinforced in a recent strategic review*. The Daresbury Laboratory is engaged in research and development programmes to ensure delivery of a high performance UK XFEL and is operating a number of research accelerators to support all aspects of FEL technology. ALICE is an ERL built to develop skills and experience in superconducting RF. It provides mid infrared and THz light from a cavity FEL and a CSR source respectively. From the very start of the ALICE programme a photon science exploitation activity was pursued. In the last few years all funding for ALICE was for biomedical exploitation by a consortium led by the University of Liverpool, which includes clinicians as well as scientists. In this paper we review the work, including investigating the effect of THz radiation on living cells and sub-diffraction chemical imaging of normal and cancerous human tissue by IR microscopy. The stringent demands of these experiments required substantial improvement on the performance of ALICE. Limitations of the current configuration are discussed and schemes for extending its capability are presented.",* www.stfc.ac.uk/files/fel-report-2016/,https://proceedings.jacow.org/erl2017/talks/tuibcc001_talk.pdf,True,https://proceedings.jacow.org/erl2017/papers/tuibcc001.pdf,False,https://proceedings.jacow.org/erl2017/posters/tuibcc001_poster.pdf,False,https://doi.org/10.18429/JACoW-ERL2017-TUIBCC001,
erl2017,,TUIBCC002,EUV ERLs for Semiconductor Integrated Circuit Lithography,KEK; Ibaraki; Japan; Although the technologies on EUV Lithography are progressing based on laser-produced plasma (LPP) source; which is expected to produce the EUV power of 250 W or more; it is important to develop a new-type EUV source to meet future demand for higher power than 1 kW. Energy recovery linac(ERL) based free electron lasers(FEL) are possible candidates of a high-power EUV source that can distribute 1 kW class power to multiple scanners simultaneously. In order to demonstrate the feasibility of EUV ERLs for lithography; an EUV source based on an 800 MeV ERL operating at the wavelength of 13.5 nm has been designed using available technologies without too much development and resources of the KEK cERL. In addition; the EUV-FEL Light Source Study Group for Industrialization has been established in Japan to realize industrialization of such an ERL-EUV source and the related items. We will present recent progress of the EUV-ERL design work and some activities and considerations for the industrialization.,,,https://proceedings.jacow.org/erl2017/talks/tuibcc002_talk.pdf,True,https://proceedings.jacow.org/erl2017/papers/tuibcc002.pdf,False,https://proceedings.jacow.org/erl2017/posters/tuibcc002_poster.pdf,False,https://doi.org/10.18429/JACoW-ERL2017-TUIBCC002,
erl2017,,TUIBCC003,Applications for CBETA at Cornell,Cornell University (CLASSE); Cornell Laboratory for Accelerator-Based Sciences and Education; Ithaca; New York; USA; At Cornell; a 4-turn ERL with FFAG return loop is being constructed by a collaboration of Cornell and BNL. It is designed to produce a high-current (up to 40mA) CW beam of moderate energy (150MEV). For after successful commissioning; several applications of CBETA have been envisioned and are being analyzed; these include (a) a dark-photon search; (b) a Compton-Backscattering hard-x-ray source; (c) a Terahertz FEL; (d) a facility or ERL accelerator physics studies; and (e) a test facility with CW beam to test; for example; SRF cryomodules for eRHIC or for industrial isotope production,,,https://proceedings.jacow.org/erl2017/talks/tuibcc003_talk.pdf,True,https://proceedings.jacow.org/erl2017/papers/tuibcc003.pdf,False,https://proceedings.jacow.org/erl2017/posters/tuibcc003_poster.pdf,False,https://doi.org/10.18429/JACoW-ERL2017-TUIBCC003,
erl2017,,TUIBCC004,Applications by Means of the Accelerator Technologies Based on cERL,KEK; Ibaraki; Japan; The cERL has been constructed for the test facility so as to demonstrate the ERL operation as the view point of the accelerator technologies. Therefore; the application programs by using cERL are not the main purpose. However; we have demonstrated several test productions such as laser Compton scattering X-ray production and THz radiation. Furthermore; we have tried to draw several industrial applications such as EUV-FEL light source; security systems for nuclear material based on gamma-ray production by means of laser Compton scattering; high resolution medical x-ray imaging systems; and so on. I will present these activities at the workshop.,,,https://proceedings.jacow.org/erl2017/talks/tuibcc004_talk.pdf,True,https://proceedings.jacow.org/erl2017/papers/tuibcc004.pdf,False,https://proceedings.jacow.org/erl2017/posters/tuibcc004_poster.pdf,False,https://doi.org/10.18429/JACoW-ERL2017-TUIBCC004,
erl2017,,TUICCC001,High-Q R&D at FNAL,Fermilab; Batavia; Illinois; USA; Modern projects of accelerators for High Energy Physics and FEL accelerators (PIP II; LCLS II; etc.) demand operation of the SRF cavities in CW regime. In this situation; low cryogenic losses are essential. Decrease of the losses or; thus; increase of the cavity unloaded quality factor Q0 allows great savings in capital and operational cost. The new N-doping technique for the SRF cavity processing in order to achieve high Q0 is described; which is now a ready-to-use technology for SRF accelerators. The current implementation of this technique for the LCLS-II cavity production; allow us to present how ultra-high Q-factors can be maintained from the vertical to the horizontal test. In particular; efficient cooling and optimization of shielding design will be discussed to address potential Q degradation from the remnant magnetic fields in the cryomodule. The talk will go through the physics and fundamental studies performed at FNAL that allowed us a) to define the best nitrogen doping treatment which minimizes the Q sensitivity to trapped magnetic field; b) to maximize magnetic flux expulsion based on cavity treatment.,,,https://proceedings.jacow.org/erl2017/talks/tuiccc001_talk.pdf,True,https://proceedings.jacow.org/erl2017/papers/tuiccc001.pdf,False,https://proceedings.jacow.org/erl2017/posters/tuiccc001_poster.pdf,False,https://doi.org/10.18429/JACoW-ERL2017-TUICCC001,
erl2017,,TUICCC002,Twin-Axis Elliptical Cavity,F. Marhauser; A. Hutton; JLab; Newport News; Virginia; USA; S.U. De Silva; J.R. Delayen; H. Park; L. Sweat; ODU; Norfolk; Virginia; USA,,Energy Recovery Linacs (ERLs) use superconducting RF cavities to accelerate the primary electron beam while the spent electron beam is decelerated in the same cavities to recover the energy. Using separate beam pipes for the accelerated and decelerated beams allows for independent focusing and better merging of the beam from the injector into the ERL. In the frame of a DoE accelerator stewardship program we have designed and built a prototype 1.5 GHz twin-axis single-cell cavity as a proof of principle. Experiences on fabrication techniques and lessons learned will be reported prior to the vertical RF testing.,https://proceedings.jacow.org/erl2017/talks/tuiccc002_talk.pdf,True,https://proceedings.jacow.org/erl2017/papers/tuiccc002.pdf,False,https://proceedings.jacow.org/erl2017/posters/tuiccc002_poster.pdf,False,https://doi.org/10.18429/JACoW-ERL2017-TUICCC002,
erl2017,,TUICCC003,Cornell ERL CM Performance,F. Furuta; J. Dobbins; R.G. Eichhorn; M. Ge; G.H. Hoffstaetter; M. Liepe; T.I. O'Connell; P. Quigley; D.M. Sabol; J. Sears; E.N. Smith; V. Veshcherevich; Cornell University (CLASSE); Cornell Laboratory for Accelerator-Based Sciences and Education; Ithaca; New York; USA; SLAC; Menlo Park; California; USA; The main linac prototype cryomodule (MLC) is a key component for the Cornell-BNL ERL Test Accelerator (CBETA) project; which is a 4-turn FFAG ERL under construction at Cornell University. This novel cryomodule is the first SRF module ever to be fully optimized simultaneously for high efficient SRF cavity operation and for supporting very high CW beam currents. After the success of the initial MLC testing; the MLC had been moved into the final location for the first MLC beam test. Cornell ERL high voltage DC gun and Injector Cryomodule were connected to MLC via the entry beam line; the beam stop assembly was also installed as the exit line. In this paper; we summarize the performance of this novel ERL cryomodule including the results of the first beam test and the additional tests focused on RF field stability and cavity microphonics.,,,https://proceedings.jacow.org/erl2017/talks/tuiccc003_talk.pdf,True,https://proceedings.jacow.org/erl2017/papers/tuiccc003.pdf,False,https://proceedings.jacow.org/erl2017/posters/tuiccc003_poster.pdf,False,https://doi.org/10.18429/JACoW-ERL2017-TUICCC003,
erl2017,,TUICCC004,The Potential of Nb/Cu Technology for High Beam Current Applications,CERN; Geneva; Switzerland,,Particle accelerators with high beam current require not only robust fundamental power couplers that can deliver high power to the accelerating cavities but also thorough handling of losses due to higher order modes induced by the particle beam. Both favour low frequency superconducting RF cavities with big apertures. We present the advantages and limitations of niobium coated copper cavities in comparison to the well-established bulk niobium technology and its potential for high beam current applications such as energy recovery linacs.,https://proceedings.jacow.org/erl2017/talks/tuiccc004_talk.pdf,True,https://proceedings.jacow.org/erl2017/papers/tuiccc004.pdf,False,https://proceedings.jacow.org/erl2017/posters/tuiccc004_poster.pdf,False,https://doi.org/10.18429/JACoW-ERL2017-TUICCC004,
erl2017,,TUIDCC001,PERLE - Beam Optics Design,JLab; Newport News; Virginia; USA; PERLE (Powerful ERL for Experiments) is a novel ERL test facility; initially proposed to validate design choices for a 60 GeV ERL needed for a future extension of the LHC towards a hadron-electron collider; the LHeC. Its main goal is to test the limits of a high current; CW; multi-pass operation with superconducting cavities at 802 MHz (and perhaps exploring other frequencies of interest). PERLE optics features Flexible Momentum Compaction (FMC) lattice architecture for six vertically stacked return arcs and a high current; 5 MeV photo-injector. With only one pair of 4-cavity cryomodules; 400 MeV beam energy can be reached in three re-circulation passes; with beam currents in excess of 15 mA. This unique quality beam is intended to perform a number of experiments in different fields reaching from uncharted tests of accelerator components via elastic ep scattering to laser-Compton backscattering for photon physics. Following the experiment; the CW beam is decelerated in three consecutive passes back to the injection energy; transferring virtually stored energy back to the RF.,,,https://proceedings.jacow.org/erl2017/talks/tuidcc001_talk.pdf,True,https://proceedings.jacow.org/erl2017/papers/tuidcc001.pdf,True,https://proceedings.jacow.org/erl2017/posters/tuidcc001_poster.pdf,False,https://doi.org/10.18429/JACoW-ERL2017-TUIDCC001,49
erl2017,,TUIDCC002,eRHIC Multi-Pass ERL,BNL; Upton; Long Island; New York; USA; The talk concentrates on accelerator physics and accelerator technology issues related with the multi-pass ERL of ERL-Ring design option of future high luminosity electron-hadron collider eRHIC. Possible solutions for recirculating passes are described which include individual loops as well as FFAG-type re-circulations. Major beam dynamics effects dominating the ERL performance are described; which include electron beam disruption; multi-pass beam-break-up; preservation of transverse emittance and energy spread during acceleration and deceleration process. The recent design modifications of ERL-Ring eRHIC aim to balance technological risks and the project cost.,,,https://proceedings.jacow.org/erl2017/talks/tuidcc002_talk.pdf,True,https://proceedings.jacow.org/erl2017/papers/tuidcc002.pdf,False,https://proceedings.jacow.org/erl2017/posters/tuidcc002_poster.pdf,False,https://doi.org/10.18429/JACoW-ERL2017-TUIDCC002,
