conference_code,session_name,paper_id,title,authors,institutions,abstract,presentation_url,presentation_available,paper_url,paper_available,poster_url,poster_available,doi,page_number
hiat2018,,WEOXA01,The Dc130 Project: New Multipurpose Applied Science Facility for FLNR,S.V. Mitrofanov; P.Yu. Apel; V. Bashevoy; V. Bekhterev; S.L. Bogomolov; O.N. Borisov; J. Franko; B. Gikal; G.G. Gulbekyan; I.A. Ivanenko; I.V. Kalagin; N.Yu. Kazarinov; V. Mironov; V.A. Semin; V.A. Skuratov; A. Tikhomirov; JINR; Dubna; Moscow Region; Russia; The main activities of Flerov Laboratory of Nuclear Reactions; following its name - are related to fundamental science; but; in parallel; plenty of efforts are paid for practical applications. Certain amount of beam time every year is spent for applied science experiments on FLNR accelerator complex. For the moment; the main directions are: the production of the heterogeneousμ- and nano-structured materials; testing of electronic components (avionics and space electronics) for radiation hardness; ion-implantation nanotechnology and radiation materials science. Basing on FLNR long term experience in these fields and aiming to improve the instrumentation; the accelerator department start the Design Study for new cyclotron DC130 which will be dedicated machine for applied researches in FLNR. Following the user’s requirements DC130 should accelerate the heavy ions with mass-to-charge ratio A/Z of the range from 5 to 8 up to fixed energies 2 and 4.5 MeV per unit mass. The first outlook of DC130 parameters; its features; layout of its casemate and general overview of the new FLNR facility for applied science will be presented.,,,https://proceedings.jacow.org/hiat2018/talks/weoxa01_talk.pdf,True,https://proceedings.jacow.org/hiat2018/papers/weoxa01.pdf,True,https://proceedings.jacow.org/hiat2018/posters/weoxa01_poster.pdf,False,https://doi.org/10.18429/JACoW-HIAT2018-WEOXA01,122
hiat2018,,WEOYA01,Mechanical Design of Single Spoke Resonator Type-2 (SSR2) Superconducting Cavity for RISP,M.O. Hyun; Y.W. Jo; H.C. Jung; Y. Kim; IBS; Daejeon; Republic of Korea; Superconducting linear accelerator and many beam experimental devices for the future of basic science research in Korea are making and preparing installation in Sindong linac tunnel north side of Daejeon; Korea. The key component of superconducting linac is the superconducting cavity and RISP linac has four types of superconducting cavities - quarter-wave; half-wave; and single spoke resonator type-1 and 2. In this paper; we introduce about the initial RF/EM design of single spoke resonator type-2 (SSR2) superconducting (SC) cavity; and explain about mechanical design. After explanation; we analyze mechanical design parameters of SSR2 SC cavity using ANSYS 18.0 structural solver and RRR 300 pure-niobium and stainless steel material properties.,"Funding: This paper was supported by the Rare Isotope Science Project (RISP), which is funded by the Ministry of Science and ICT (MSIT) and National Research Foundation (NRF) of the Republic of Korea.",,https://proceedings.jacow.org/hiat2018/talks/weoya01_talk.pdf,True,https://proceedings.jacow.org/hiat2018/papers/weoya01.pdf,True,https://proceedings.jacow.org/hiat2018/posters/weoya01_poster.pdf,False,https://doi.org/10.18429/JACoW-HIAT2018-WEOYA01,125
hiat2018,,WEOYA02,First heavy ion beam acceleration with a superconducting multi gap CH-cavity,M. Basten; M. Busch; H. Podlech; M. Schwarz; IAP; Frankfurt am Main; Germany; K. Aulenbacher; F.D. Dziuba; V. Gettmann; T. Kürzeder; M. Miski-Oglu; HIM; Mainz; Germany; W.A. Barth; M. Heilmann; A. Rubin; A. Schnase; S. Yaramyshev; GSI; Darmstadt; Germany; In the future a new superconducting (sc) continuous wave (cw) high intensity heavy ion Linac should provide ion beams with a max. beam energy above the coulomb barrier for the Super Heavy Element (SHE) program at GSI Helmholtzzentrum für Schwerionenforschung. As a first step a newly developed superconducting 15-gap Crossbar H-cavity (CH-cavity) operated at 217 MHz has been successfully tested with heavy ion beam up to the design beam energy of 1.85 MeV/u for the first time. The design energy gain of 3.5 MV within a length of less than 70 cm has been validated with heavy ion beams of up to 1.5 particle mueA. The measured beam parameters showed excellent beam quality; while a dedicated beam dynamics layout provides beam energy variation between 1.2 and 2.2 MeV/u. The beam commissioning is a milestone of the R&D work of Helmholtz Institute Mainz (HIM) and GSI in collaboration with Goethe University Frankfurt (GUF) and the first step towards a sc heavy ion cw-Linac with variable beam energy. The next two CH-cavities have already tested under cryogenic conditions. The results of the first successful heavy ion beam acceleration with a superconducting CH-cavity will be presented.,,,https://proceedings.jacow.org/hiat2018/talks/weoya02_talk.pdf,True,https://proceedings.jacow.org/hiat2018/papers/weoya02.pdf,True,https://proceedings.jacow.org/hiat2018/posters/weoya02_poster.pdf,False,https://doi.org/10.18429/JACoW-HIAT2018-WEOYA02,129
hiat2018,,WEOYA03,Design and Beam Commissioning of the LEAF-RFQ,L. Lu; Y. He; H. Jia; W. Ma; L.B. Shi; L.T. Sun; L.P. Sun; Y. Yang; Y.H. Zhai; H.W. Zhao; IMP/CAS; Lanzhou; People’s Republic of China; An 81.25 MHz continuous wave (CW) radio frequency quadrupole (RFQ) accelerator has been developed and fabricated for the Low Energy Accelerator Facility (LEAF) by the Institute of Modern Physics (IMP) of the Chinese Academy of Science (CAS). The operation frequency is 81.25 MHz and the inter-vane voltage is a constant of 70 kV. It took about 44 hours continuous conditioning to reach RF power of 75 kW which is 1.1 time of the maximum designed operation power; and the CW operation of He+ beam and N2+ beam had successfully accelerated to the designed energy of 0.5 MeV/u. Both the results of the high power test and the beam test will be presented in this paper.,,,https://proceedings.jacow.org/hiat2018/talks/weoya03_talk.pdf,True,https://proceedings.jacow.org/hiat2018/papers/weoya03.pdf,True,https://proceedings.jacow.org/hiat2018/posters/weoya03_poster.pdf,False,https://doi.org/10.18429/JACoW-HIAT2018-WEOYA03,135
hiat2018,,WEPB03,Multi-physics Analysis of a CW Four-rod RFQ,Z.S. Li; Y. Cong; H. Du; Y. He; L. Jing; Q.Y. Kong; X.N. Li; J. Meng; G.D. Shen; H.N. Wang; K.D. Wang; Z.J. Wang; Y. Wei; J.X. Wu; J.W. Xia; H.M. Xie; W.J. Xie; X.W. Xu; Z. Xu; J.C. Yang; Y.Q. Yang; X. Yin; Y.J. Yuan; Y. Zhang; IMP/CAS; Lanzhou; People’s Republic of China; Y.R. Lu; K. Zhu; PKU; Beijing; People’s Republic of China; The new injector SSC-LINAC is under design and con-struction to improve the efficiency and intensity of beams for the Separated-Sector Cyclotron (SSC). This will be accomplished with a normal conducting radio-frequency quadrupole (RFQ) accelerator. To match with the SSC; the RFQ must be operated on Continuous Wave (CW) mode with a frequency of 53.667 MHz. A four-rod structure was adopted for small dimensions of the cavity. While; it was a huge challenge on CW mode. A multi-physics theoretical analysis; including RF; thermal; struc-tural and frequency shift coupling analysis; have been completed in response to the security and stable opera-tion of the RFQ. The experimental measurement of fre-quency shift was also completed; which is consistent with the simulation. In this paper; the results of theoretical analysis and experiment are reported in detail.,,reference for this paper ※ https://doi.org/10.18429/JACoW-,https://proceedings.jacow.org/hiat2018/talks/wepb03_talk.pdf,False,https://proceedings.jacow.org/hiat2018/papers/wepb03.pdf,True,https://proceedings.jacow.org/hiat2018/posters/wepb03_poster.pdf,False,https://doi.org/10.18429/JACoW-HIAT2018-WEPB03,138
hiat2018,,WEPB04,New Type of Injector for Cancer Therapy,C.C. Xing; T. He; C.X. Li; L. Lu; X.B. Xu; L. Yang; IMP/CAS; Lanzhou; People’s Republic of China; University of Chinese Academy of Sciences; Beijing; People’s Republic of China; A compact proton linac injector is being studied; HSC (Hybrid single cavity); for cancer therapy. The HSC consists of RFQ section and DTL section. Both sections are interdigital-H (IH) mode linac. The HSC with an operation frequency of 100 MHz accelerate C6+ beams from 20keV/u up to 4 MeV/u. The total length of HSC is less than 4 meters. For this purpose; we use the RFGen to design RFQ section; and PIMLOC is provided for DTL section and whole HSC.,,,https://proceedings.jacow.org/hiat2018/talks/wepb04_talk.pdf,False,https://proceedings.jacow.org/hiat2018/papers/wepb04.pdf,True,https://proceedings.jacow.org/hiat2018/posters/wepb04_poster.pdf,True,https://doi.org/10.18429/JACoW-HIAT2018-WEPB04,142
hiat2018,,WEPB06,Nb Sputtered 325 MHz QWR Cavities for CiADS,F. Pan; H. Guo; Y. He; T.C. Jiang; T. Tan; P.R. Xiong; C. Zhang; IMP/CAS; Lanzhou; People’s Republic of China; Z.X. Li; H.N. Wang; MMRC; Fukui-ken; Japan; CIADS is considering to use quarter wave resonators (QWRs); made by niobium thin film sputtered on copper bases; at its low energy section. Comparing with bulk niobium cavities; the Nb/Cu cavities feature a much better thermal and mechanical stability at 4.5 K. A 325 MHz QWR cavity has been fabricated at IMP; to demostrate the niobium coated copper cavity technique can meet the requirements of CIADS. The cavity is coated with biased DC diode sputtering technique. This paper covers resulting film characters; vertical tests with the evolution of the sputtering process; and improvements to mitigate issues we meet.,,reference for this paper ※ https://doi.org/10.18429/JACoW-,https://proceedings.jacow.org/hiat2018/talks/wepb06_talk.pdf,False,https://proceedings.jacow.org/hiat2018/papers/wepb06.pdf,True,https://proceedings.jacow.org/hiat2018/posters/wepb06_poster.pdf,False,https://doi.org/10.18429/JACoW-HIAT2018-WEPB06,145
hiat2018,,WEPB08,Dynamics Study of a Drift Tube Linac for Both Heavy Ions and Proton,H. Du; Q.Y. Kong; X.N. Li; Z.S. Li; K.D. Wang; J.W. Xia; J.C. Yang; X. Yin; Y.J. Yuan; IMP/CAS; Lanzhou; People’s Republic of China; An accelerator complex for Space Environment Simu-lation and Research Infrastructure (SESRI) has been designed by Institute of Modern Physics (IMP) and will be constructed in Harbin Institute of Technology (HIT). This accelerator consists of an ECR ion source; a linac injector; a synchrotron and 3 research terminals. As an important part of the complex; the linac injector should provide both proton and different kinds of heavy ions; from helium to bismuth; with energy of 5 MeV and 1 MeV/u respectively for the synchrotron. In order to provide beams with the mass to charge ratio (A/Q) range from 1 ’ 6.5(for proton to 209Bi32+) by only one linac injector; a special solution of the main acceleration section DTL is carried out. The relevant dynamics calculations; such as beam matching; stripping process of the hydrogen molecule ion and beam energy spread reducing; are performed by Particle in Cell (PIC) method.,"Funding: Work supported by National Natural Science Foundation of China (11375243, 11405237) and Guangdong Innovative and Entrepreneurial Research Team Program (2016ZT06G373).",,https://proceedings.jacow.org/hiat2018/talks/wepb08_talk.pdf,False,https://proceedings.jacow.org/hiat2018/papers/wepb08.pdf,True,https://proceedings.jacow.org/hiat2018/posters/wepb08_poster.pdf,True,https://doi.org/10.18429/JACoW-HIAT2018-WEPB08,148
hiat2018,,WEPB10,Study on A HOM Type Buncher,L. Lu; T. He; L.B. Shi; L.P. Sun; C.C. Xing; X.W. Xu; L. Yang; IMP/CAS; Lanzhou; People’s Republic of China; Higher order mode (HOM) type drift tube linac is a higher power efficience structure for middle and high energy region acceleration. In this paper; we will present designs and calculations of a prototype HOM buncher.,,reference for this paper ※ https://doi.org/10.18429/JACoW-,https://proceedings.jacow.org/hiat2018/talks/wepb10_talk.pdf,False,https://proceedings.jacow.org/hiat2018/papers/wepb10.pdf,True,https://proceedings.jacow.org/hiat2018/posters/wepb10_poster.pdf,False,https://doi.org/10.18429/JACoW-HIAT2018-WEPB10,152
hiat2018,,WEPB12,Error Analysis and RF Optimization of a Compact RFQ,K.D. Wang; H. Du; Q.Y. Kong; X.N. Li; Z.S. Li; X. Yin; IMP/CAS; Lanzhou; People’s Republic of China; A 162.5 MHz; 7.2 MeV 4-rod radio frequency quadru-ples (RFQ) dynamics design has been finished for injec-tor of a carbon ion cancer therapy facility which is pro-moted by the Institution of Modern Physics (IMP) of the Chinese Academy of Science (CAS). A detailed error analysis was performed after the optimization process. Field flatness error is analysed for determining a RF optimization target. The RF structure is designed based on a new type dynamics design. Electric field of the RF structure is optimized in order to supporting the dynam-ics design. The error analysis and detailed field flatness optimization of this compact RFQ have been presented and discussed in this paper.,,reference for this paper ※ https://doi.org/10.18429/JACoW-,https://proceedings.jacow.org/hiat2018/talks/wepb12_talk.pdf,False,https://proceedings.jacow.org/hiat2018/papers/wepb12.pdf,True,https://proceedings.jacow.org/hiat2018/posters/wepb12_poster.pdf,False,https://doi.org/10.18429/JACoW-HIAT2018-WEPB12,155
hiat2018,,WEPB13,A New RF Structure: Bent-Vane Type RFQ,L. Yang; T. He; Y. He; Y. He; L. Lu; C.C. Xing; IMP/CAS; Lanzhou; People’s Republic of China; A new cavity structure of RFQ accelerator with bent vanes is proposed to meet the miniaturization requirement of low frequency accelerators. The new structure has a downsized cross section by bending vanes while keeping a certain vane lengths. It also possesses the advantages of simple cooling structure in low frequency field. The new structure has obvious advantages in reducing manufacturing difficulty of cavity; cutting down project cost; enhancing facility reliability and stability.,,reference for this paper ※ https://doi.org/10.18429/JACoW-,https://proceedings.jacow.org/hiat2018/talks/wepb13_talk.pdf,False,https://proceedings.jacow.org/hiat2018/papers/wepb13.pdf,True,https://proceedings.jacow.org/hiat2018/posters/wepb13_poster.pdf,False,https://doi.org/10.18429/JACoW-HIAT2018-WEPB13,158
hiat2018,,WEPB15,Beam Commissioning in the First Chinese Demo Cancer Therapy Synchrotron,J. Shi; W.P. Chai; J.W. Xia; J.C. Yang; IMP/CAS; Lanzhou; People’s Republic of China; Heavy Ion Medical Machine in Wuwei (HIMM-ww) is the first Chinese heavy ion accelerator facility de-veloped for cancer therapy. After commissioning; the particle number after acceleration reached 1.5·109 ppp (particles per pulse); while injection exceeded 3·109 ppp. The slow extraction efficiency reached nearly 90% for all energies from 120 to 400 MeV/u. The spill duty factor exceeded 90% at a sample rate of 10 kHz. This paper reports the results of the synchrotron commis-sioning.,,reference for this paper ※ https://doi.org/10.18429/JACoW-,https://proceedings.jacow.org/hiat2018/talks/wepb15_talk.pdf,False,https://proceedings.jacow.org/hiat2018/papers/wepb15.pdf,True,https://proceedings.jacow.org/hiat2018/posters/wepb15_poster.pdf,False,https://doi.org/10.18429/JACoW-HIAT2018-WEPB15,161
hiat2018,,THXAA01,The status of accelerator mass spectrometry at CIAE,CIAE; Beijing; People’s Republic of China; Accelerator mass spectrometry (AMS) is the most sensitive measurement technique for long-lived nuclides; it can be used in many research field. There are three AMS system at CIAE: the HI-13 AMS system; the single stage AMS system and the heavy nuclides AMS system. the HI-13 tandem accelerator is the first AMS beam line in China; based on the system; more than 10 kinds of long lived nuclides have been developed and applications in many research fields have been carried out. The single stage AMS (SSAMS) system is a home-made compact AMS system which working at terminal of 180KV. Based on the SSAMS system; the measurement techniques of 14C and 3H with high performances have been established; the applications have been carried out. The heavy nuclides AMS system is also a home-made system. It is a kind of tandem accelerator with a terminal voltage of 350KV. Air insulated accelerator tubes are used to connect high voltage deck and the ground potential. This system is dedicated for the heavy nuclides measurement. A brief introduction of HI-13 accelerator; applications based on the accelerator and currently upgrading systems and will also be given.,,,https://proceedings.jacow.org/hiat2018/talks/thxaa01_talk.pdf,True,https://proceedings.jacow.org/hiat2018/papers/thxaa01.pdf,False,https://proceedings.jacow.org/hiat2018/posters/thxaa01_poster.pdf,False,https://doi.org/10.18429/JACoW-HIAT2018-THXAA01,
hiat2018,,THOAA01,High Resolution Mass Separator Dipole Design Studies for SPES Project,C. Baltador; L. Bellan; M. Cavenago; M. Comunian; L. Ferrari; A. Galatà; M.F. Moisio; A. Pisent; INFN/LNL; Legnaro (PD); Italy; Consorzio RFX; Padova; Italy; The purposes of the SPES (Selective Production of Exotic Species) project at INFN laboratory in Legnaro (Italy) is to study nuclei close to the drip lines. Therefore; a High Resolution Mass Separator (HRMS) must provide full separation of the ions with a resolution 1/20000; to be sensible to the proton’neutron mass difference. SPES HRMS is consisting of: two 90° magnet dipoles; one electrostatic multipole in between them; six electrostatic quadrupoles; two electrostatic hexapoles and two electrostatic triplets before and after the slits on the object and image point. All these components will be installed on a high voltage platform with a maximum operating voltage of -240 kV. Before entering the HRMS; a 40 keV energy beam go through an RFQ Cooler; designed to have an output energy spread of 1 eV. Mass separation within target resolution is the most critical part: dipoles must provide a magnetic field homogeneity of 4 E-5 throughout beam occupancy (half magnet pole surface); at a field intensity of 0.56 T for the reference ion 132 Sn. Therefore; a very accurate dipole design is mandatory. This contribute will show the key points which lead to the final HRMS layout and dipole design.,,,https://proceedings.jacow.org/hiat2018/talks/thoaa01_talk.pdf,True,https://proceedings.jacow.org/hiat2018/papers/thoaa01.pdf,True,https://proceedings.jacow.org/hiat2018/posters/thoaa01_poster.pdf,False,https://doi.org/10.18429/JACoW-HIAT2018-THOAA01,164
hiat2018,,THOBA01,Multipole Magnets for the HIAF Fragment Separator Using  the Canted-Cosine-Theta (CCT) Geometry,W. Wu; Y. Liang; E.M. Mei; D.S. Ni; X.J. Ou; W.J. Yang; S.J. Zheng; L. Zhou; IMP/CAS; Lanzhou; People’s Republic of China; The fragment separator of the HIAF (High Intensity Heavy Ion Accelerator Facility) project called HFRS re-quires quadrupoles with high gradients (11.4 T/m) and large bores (gap width of 420 mm). The iron dominated magnets with superconducting coils have been widely used in the similar facilities such as A1900; BigRIPS; Super­FRS and RISP with the advantages of low request for coils installation precision; simple fabrication and low cost; but they have large cold mass and helium contain-ment; which result in long time cooling down and high pressure rise during a quench. In addition; due to iron saturation; it is hard to guarantee on the field quality in the operated field range. A new coil dominated design based on the Canted­Cosine­Theta geometry is presented for HFRS; which is expected to overcome these problems. The design superimposes several layers of oppositely wound helical windings to generate high quality quadru-pole. Sextupole; octupole and steering dipole can also be easily integrated to reduce the length of cryostat. This paper reports the detailed design of HFRS multiplets based on the CCT concept and the construction of a sub-scale prototype.,Funding: Work supported by the National Natural Science Foundation of China (Grant No. 11575266),,https://proceedings.jacow.org/hiat2018/talks/thoba01_talk.pdf,True,https://proceedings.jacow.org/hiat2018/papers/thoba01.pdf,True,https://proceedings.jacow.org/hiat2018/posters/thoba01_poster.pdf,False,https://doi.org/10.18429/JACoW-HIAT2018-THOBA01,170
hiat2018,,THOCA01,Gyrotron Based Systems for Electron Cyclotron Resonance Ion Sources,A.I. Tsvetkov; A.A. Bogdashov; Yu.V. Bykov; G.G. Denisov; A.G. Eremeev; M.Yu. Glyavin; V.V. Holoptsev; E.A. Kopelovich; A.G. Luchinin; M.V. Morozkin; I.V. Plotnikov; M.Yu. Shmelev; D.I. Sobolev; M.M. Troitsky; IAP/RAS; Nizhny Novgorod; Russia; M.I. Bakulin; E.V. Sokolov; E.A. Soluyanova; E.M. Tai; GYCOM Ltd; Nizhny Novgorod; Russia; In recent years high power microwave radiation is applied for wide range of applications like ceramic sintering; nano-powder; diamond discs and films production; electron cyclotron resonance ion sources. The gyrotron complexes created at IAP RAS jointly with GYCOM Ltd. allow creating materials with new qualities and do not have any analogues with similar functional capabilities. These complexes are installed at the research centers of Russia; Germany; USA; China; France and Japan. Typical microwave power of these setups obtained several tens kW with efficiency up to 40% (up to 65% with energy recovery) at the frequency range 24 ’ 84 GHz. The output power of gyrotrons can be smoothly regulated from about 0.5% to 100% of the full power in CW or pulsed mode. The next ambitious steps are broadband frequency tuning and fast power modulation. The results in the development of the electron cyclotron resonance ion sources have proven the potential of an increase in the operating frequency for the production of high intensity multicharge ion beams. The report present detail description of the 45 GHz system for FECRAL ECRIS; its key components and obtained experimental results.,,,https://proceedings.jacow.org/hiat2018/talks/thoca01_talk.pdf,True,https://proceedings.jacow.org/hiat2018/papers/thoca01.pdf,False,https://proceedings.jacow.org/hiat2018/posters/thoca01_poster.pdf,False,https://doi.org/10.18429/JACoW-HIAT2018-THOCA01,
hiat2018,,THYAA01,Novel Methods for the Production of Radionuclides of Medical Interest With Accelerators,S. Corradetti; A. Andrighetto; M. Ballan; F. Borgna; INFN/LNL; Legnaro (PD); Italy; UNIFE; Ferrara; Italy; V. Di Marco; G. Marzaro; N. Realdon; Università degli Studi di Padova; Padova; Italy; Radionuclides for radiopharmaceuticals preparation are currently produced in cyclotrons; generators or nuclear reactors. However; none of these modes is free from serious issues; like: high costs of targets; production of undesired radionuclide contaminants; long and expensive separation methods and formation of long-lived radioactive wastes. For this purpose; novel methods are being developed for the production of highly pure radionuclides. The ISOL (Isotope Separation On-Line) method can be applied to produce high purity radionuclides of medium and heavy masses. ISOL is nowadays established as a major method for the production of high intensity and high quality radioactive ion beams for nuclear physics studies. The SPES-ISOLPHARM project at INFN-LNL (Istituto Nazionale di Fisica Nucleare ’ Laboratori Nazionali di Legnaro) aims to provide a feasibility study for an innovative technology for the production of high specific activity radionuclides based on the ISOL method. The ongoing experimental activities on primary and secondary (ion collectors) targets production; construction and testing of the selection and transport apparatus will be presented.,,,https://proceedings.jacow.org/hiat2018/talks/thyaa01_talk.pdf,True,https://proceedings.jacow.org/hiat2018/papers/thyaa01.pdf,True,https://proceedings.jacow.org/hiat2018/posters/thyaa01_poster.pdf,False,https://doi.org/10.18429/JACoW-HIAT2018-THYAA01,175
hiat2018,,THODA01,Preliminary Design and Simulation Results of Ne+ Beam Source,Y.H. Xie; C.D. Hu; J. Li; Y.L. Xie; Y. Xu; ASIPP; Hefei; People’s Republic of China; An ion source of Ne beam was designed for basic physics research in the Institute of Plasma Physics; Chinese Academy of Science (ASIPP). The ion source was designed with hot cathode plasma source with three electrodes accelerator. The designed beam energy is 10-20 keV; the beam power is 50 kW; beam size is 25 cm × 25 cm and beam duration is 2 seconds. The three electrodes accelerator with slit type was designed. The extracted beam current and beam divergence angle was simulated. The maximum beam power of 40 kW can be extracted when the divergence angle less than 5 degree with beam energy of 10 keV and the beam power of 28 kW can be extracted with minimum divergence angle of 2.2 degree. When the beam energy is 20 keV; the maximum beam power of 95 kW can be extracted when divergence angle less than 5 degree. And the beam power is 65 kW with minimum beam divergence angle is 2.2 degree too. The results shown that; the maximum beam power can not got 50 kW with beam energy of 10 kW; but the beam power can achieve 95 kW with beam energy of 20 keV.,Funding: The National Key R&D Program of China(2017YFE300101) The National Natural Science Foundation of China (NNSFC) (Contract No.11505225 & 11675215),,https://proceedings.jacow.org/hiat2018/talks/thoda01_talk.pdf,True,https://proceedings.jacow.org/hiat2018/papers/thoda01.pdf,True,https://proceedings.jacow.org/hiat2018/posters/thoda01_poster.pdf,False,https://doi.org/10.18429/JACoW-HIAT2018-THODA01,179
