conference_code,session_name,paper_id,title,authors,institutions,abstract,presentation_url,presentation_available,paper_url,paper_available,poster_url,poster_available,doi,page_number
hiat2018,,TUXAA02,BRIF Progress and BISOL Proposal,CIAE; Beijing; People’s Republic of China; BRIF progress and BISOL proposal will be presented; BRIF is an ISOL facility based on a 100 MeV proton cyclotron as driver; a mass resolution 20000 ISOL in between; and a current 15 MV tandem as post accelerator. The BRIF project is commissioned by producing 20Na beam for decay study; with plan of post accelerating RI beams in year of 2018. BISOL; or Beijing ISOL (previous called CARIF); is an ISOL facility based on 60 MW research reactor CARR and a 40 MeV deuteron LINA as drivers; an ISOL in between to separate fission beam; and a 150 MeV/u LINAC as post accelerator. By using ISOL+PF approach; BISOL is of advantageous of producing very neutron rich RI beams. The BISOL project is listed by national long-range plan in 2017. With feasibility report expected to be approved in 2019; by the year of 2025; BISOL will becoming a facility that is capable of detecting the location of neutron drip line.,,,https://proceedings.jacow.org/hiat2018/talks/tuxaa02_talk.pdf,True,https://proceedings.jacow.org/hiat2018/papers/tuxaa02.pdf,False,https://proceedings.jacow.org/hiat2018/posters/tuxaa02_poster.pdf,False,https://doi.org/10.18429/JACoW-HIAT2018-TUXAA02,
hiat2018,,TUXAA03,ROSE - a Rotating 4D Emittace Scanner,M.T. Maier; L. Groening; C. Xiao; GSI; Darmstadt; Germany; A. Bechtold; J.M. Maus; NTG Neue Technologien GmbH & Co KG; Gelnhausen; Germany; The detector system ROSE; allowing to perform 4D emittance measurements on heavy ion beams independent of their energy and time structure; has been build and successfully commissioned in 2016 at GSI in Darmstadt; Germany. This method to measure the four dimensional emittance has then been granted a patent in 2017. The inventors together with the technology transfer department of GSI have found and industrial partner to modify ROSE into a standalone; commercially available emittance scanner system. This is a three step process involving the hardware; the electronics and the software working packages. It is planned to have a configurable customer product ready by end of 2020. In this contribution I will present the actual status and introduce the multiple possibilities of this 4D emittance scanner.,,,https://proceedings.jacow.org/hiat2018/talks/tuxaa03_talk.pdf,True,https://proceedings.jacow.org/hiat2018/papers/tuxaa03.pdf,True,https://proceedings.jacow.org/hiat2018/posters/tuxaa03_poster.pdf,False,https://doi.org/10.18429/JACoW-HIAT2018-TUXAA03,65
hiat2018,,TUYAA01,Present Status of and Recent Developments at RIKEN RI Beam Factory,H. Okuno; T. Dantsuka; M. Fujimaki; N. Fukunishi; H. Hasebe; Y. Higurashi; E. Ikezawa; H. Imao; O. Kamigaito; M. Kidera; M. Komiyama; K. Kumagai; T. Maie; M. Nagase; T. Nagatomo; T. Nakagawa; M. Nakamura; J. Ohnishi; K. Ozeki; N. Sakamoto; K. Suda; A. Uchiyama; S. Watanabe; T. Watanabe; Y. Watanabe; K. Yamada; H. Yamasawa; RIKEN Nishina Center; Wako; Japan; RIKEN; Saitama; Japan,,Present status and recent developments of RIKEN RI Beam Factory will be presented.,https://proceedings.jacow.org/hiat2018/talks/tuyaa01_talk.pdf,True,https://proceedings.jacow.org/hiat2018/papers/tuyaa01.pdf,True,https://proceedings.jacow.org/hiat2018/posters/tuyaa01_poster.pdf,False,https://doi.org/10.18429/JACoW-HIAT2018-TUYAA01,71
hiat2018,,TUYBA01,Trends and challenges in RIB processes,GANIL; Caen; France,,,https://proceedings.jacow.org/hiat2018/talks/tuyba01_talk.pdf,True,https://proceedings.jacow.org/hiat2018/papers/tuyba01.pdf,False,https://proceedings.jacow.org/hiat2018/posters/tuyba01_poster.pdf,False,https://doi.org/10.18429/JACoW-HIAT2018-TUYBA01,
hiat2018,,TUZAA01,Development of RIKEN 28 Ghz SC-ECRISs for Synthesizing Super-Heavy Elements,T. Nakagawa; M. Fujimaki; N. Fukunishi; Y. Higurashi; O. Kamigaito; K. Kumagai; T. Nagatomo; J. Ohnishi; N. Sakamoto; A. Uchiyama; RIKEN Nishina Center; Wako; Japan; For synthesizing the new elements heavier than Z=118 at RIKEN; production of the intense metallic ion beams (e.g.; Ti; V and Cr ion beams) were strongly required. To meet the requirements; we systematically studied the optimization of RIKEN 28 GHz SC-ECRIS performance. Using these results; we produced ~400 μA of V13+ ion beam at the RF power of 2 kW (28 GHz) and very low Bext (~1.4 T for 28 GHz). For long term operation; we successfully produced the intense stable beam (100~200 microA). To further push this project forward; new super-conducting RF cavities are now under construction in the downstream of RIKEN heavy-ion linac (RILAC) to increase the beam energy. In this project; we also constructed new 28 GHz SC-ECRIS based on these results in order to increase the beam intensities. In addition; to inject the high quality beam into the upgraded RILAC; three sets of movable slits to control the size of the transverse emittance of the beam are installed in the low energy beam transport (LEBT). In this contribution; we present the status of new 28 GHz ECRIS and LEBT. We also present the results of the systematic study and the production of the intense metallic ion beams.,,reference for this paper ※ https://doi.org/10.18429/JACoW-,https://proceedings.jacow.org/hiat2018/talks/tuzaa01_talk.pdf,False,https://proceedings.jacow.org/hiat2018/papers/tuzaa01.pdf,True,https://proceedings.jacow.org/hiat2018/posters/tuzaa01_poster.pdf,False,https://doi.org/10.18429/JACoW-HIAT2018-TUZAA01,77
hiat2018,,TUZAA02,Highly Charged ECR Ion Source Development at IMP,L.T. Sun; Y. Cao; X. Fang; Y.C. Feng; J.W. Guo; W. Huang; J.Q. Li; L.B. Li; L.X. Li; W. Lu; H.Y. Ma; L.Z. Ma; Y.M. Ma; Z. Shen; B.M. Wu; W. Wu; Y. Yang; W.H. Zhang; X.Z. Zhang; H.W. Zhao; IMP/CAS; Lanzhou; People’s Republic of China; Highly charged ECR ion source development plays an important role in the heavy ion accelerators advancement at IMP; such as HIRFL upgrade; heavy ion treatment complex HIMM; future heavy ion facility HIAF; and so on. As requested by those projects; many high performance highly charged ECR ion sources with different technologies have been built; or under development. The representative ion sources are superconducting ECR ion sources SECRAL and recently built SECRAL-II; room temperature,,,https://proceedings.jacow.org/hiat2018/talks/tuzaa02_talk.pdf,False,https://proceedings.jacow.org/hiat2018/papers/tuzaa02.pdf,True,https://proceedings.jacow.org/hiat2018/posters/tuzaa02_poster.pdf,False,https://doi.org/10.18429/JACoW-HIAT2018-TUZAA02,82
hiat2018,,TUOXA01,All-permanent Magnet ECR Ion Source DECRIS-PM,A.A. Efremov; V. Bekhterev; S.L. Bogomolov; A.E. Bondarchenko; N. Lebedev; V.N. Loginov; V. Mironov; JINR; Dubna; Moscow Region; Russia; ITT-Group; Moscow; Russia; Super-heavy-element factory is under construction at the Flerov Laboratory for Nuclear Reactions; JINR; Dubna. The factory will include DC-280 cyclotron; which will be equipped with two 100 kV high voltage platforms. A high charge state all-permanent magnet 14 GHz ECRIS ’ DECRIS-PM has been designed and fabricated to provide intense multiple charge state ion beams. The request for the source is a production of medium mass ions with A/q=4/7.5 such as 48Ca8+. The conceptual design of DECRIS-PM is presented. During the first tests at the ECR test bench; the source shows a good enough performance for the production of medium charge state ions (such as 900 eµA Ar8+; 550 eµA Ar9+; 200 eµA Ar11+; 160 eµA Kr15+; etc.).,,,https://proceedings.jacow.org/hiat2018/talks/tuoxa01_talk.pdf,True,https://proceedings.jacow.org/hiat2018/papers/tuoxa01.pdf,True,https://proceedings.jacow.org/hiat2018/posters/tuoxa01_poster.pdf,False,https://doi.org/10.18429/JACoW-HIAT2018-TUOXA01,89
hiat2018,,TUOYA01,Stripping and modulating of ion beam in plasma,Xi’an Jiaotong University; People’s Republic of China; Plasma could be used as a stripper as well as a modulator. Here we would mainly report recent activities in the experiments and simulations on ion beam plasma interaction in low-medium energy ranges. The experiments were carried out at HIRFL at IMP-Lanzhou for ~100keV/u ion beams with gas discharge plasma; and at UNILAC at GSI-Darmstadt for ~10MeV/u ion beam with theta pinch plasma. Charge state evolution; energy lossing; and transportation of ion in plasma were observed. It is shown that; plasma could be an perfect stripper for low-medium energy ion beam; as well an excellent modulator to fucus; compress and even pulslize an intense ion beam.; ※ BibTeX; ※ LaTeX; ※ Text/Word; ※ RIS,,reference for this paper using,https://proceedings.jacow.org/hiat2018/talks/tuoya01_talk.pdf,False,https://proceedings.jacow.org/hiat2018/papers/tuoya01.pdf,False,https://proceedings.jacow.org/hiat2018/posters/tuoya01_poster.pdf,False,https://doi.org/10.18429/JACoW-HIAT2018-TUOYA01,
hiat2018,,TUZCA01,Operational Comparison of an ECR and an EBIS Charge Breeder for CARIBU,R.C. Vondrasek; C. Dickerson; M.R. Hendricks; G. Savard; R.H. Scott; ANL; Lemont; Illinois; USA; An Electron Beam Ion Source (EBIS) charge breeder is in operation at Argonne National Laboratory as part of the CAlifornium Rare Ion Breeder Upgrade (CARIBU). The EBIS replaced the ECR charge breeder in 2016; was commissioned on-line in 2017; and delivery of radioactive beams for the ATLAS physics program began in 2018. The source has produced stable and radioactive beams with A/Q <6; breeding times <30 ms; and charge breeding efficiencies >18% into a single charge state. The source has also demonstrated a substantial reduction in beam contamination levels when compared to the ECR charge breeder; with the radioactive species accounting for >80% of the beam incident on target; whereas with the ECR the fraction was <3%. The dynamics of charge bred ion extraction from the trapping region have been investigated as well as methods to lengthen the extracted beam pulse.,"Funding: This work was supported by the U.S. Department of Energy, Office of Nuclear Physics, under Contract No. DE-AC02-06CH11357 and used resources of ANL’s ATLAS facility, an Office of Science User Facility",,https://proceedings.jacow.org/hiat2018/talks/tuzca01_talk.pdf,True,https://proceedings.jacow.org/hiat2018/papers/tuzca01.pdf,False,https://proceedings.jacow.org/hiat2018/posters/tuzca01_poster.pdf,False,https://doi.org/10.18429/JACoW-HIAT2018-TUZCA01,
hiat2018,,TUOZA01,New Method to Design Magnetic Channels with 2D Optimization tools and Using  Permendur Vanadium,L. Neri; L. Calabrettapresenter; D. Rifuggiato; INFN/LNS; Catania; Italy; JINR/DLNP; Dubna; Moscow region; Russia; Magnetic channels are used in many cyclotrons to focus the beam radially through crossing of the coils and yoke region. These magnetic channel are generally iron made and use three iron bars to reduce the radial gradient of the cyclotron magnetic field. The current sheet approximation (CSA) was generally used to evaluate their performance. For the new magnetic channel to be used in the upgrading of the k800 cyclotron of the LNS-INFN; we investigate the use of permendur vanadium in alternative to the usual iron to reduce the volume of the bar and mainly the magnetic force. Moreover; using the computer code COMSOL (and CST) the 2D model of the magnetic channels have been optimized using a genetic algorithm and complex geometric configuration. High magnetic gradients with high uniformity and reduced magnetic force were achieved. The preliminary results of our work are presented and discussed.,,reference for this paper ※ https://doi.org/10.18429/JACoW-,https://proceedings.jacow.org/hiat2018/talks/tuoza01_talk.pdf,False,https://proceedings.jacow.org/hiat2018/papers/tuoza01.pdf,True,https://proceedings.jacow.org/hiat2018/posters/tuoza01_poster.pdf,False,https://doi.org/10.18429/JACoW-HIAT2018-TUOZA01,92
hiat2018,,TUOZA02,Electromagnetic Force Correction and Their Application in High Energy Physics,Dalian University; Liaoning Province; People’s Republic of China; As fields’ interaction; electromagnetic force between a charged particle’s boundary intrinsic electrical field (BIEF) and external EM field occurs in their overlapped volume. Upon EM fields nature’s description of both BIEF and external E or B field; and new measurable data on modern facility; the conventional formulas of electrical and Lorentz force; upon the ’point charge’ model and crudity on very limited observation a century ago; are confront to be corrected for agreeing to the integrity of new evidence on both EM fields’ nature and interactive mechanism. Corrected formulas include an effective contributed factor of the external EM field; manifest themselves being related to BIEF’s center-charge velocity but the center-mass’. We made a table to contrast all aspects of the twoes; particularly on applicable capacity in accelerator with no hypotheses involved for matching data. The demonstration strongly suggests the conventional formulas; as crude approximations ones resulted in a misinterpretation on Kaufmann Experiment and fictitious concepts (EM mass & angular momentum etc.) by accumulating the hypothesis; should be replaced by alternatives.; Ji Luo; School of Physics Science and Technology; Dalian University; Dalian; Liaoning Province; P.R.China; 116622; logicjiluo@sina.com.cn  Phone:13252992560  Topic: Electromagnetic Dynamics; ※ BibTeX; ※ LaTeX; ※ Text/Word; ※ RIS,,reference for this paper using,https://proceedings.jacow.org/hiat2018/talks/tuoza02_talk.pdf,False,https://proceedings.jacow.org/hiat2018/papers/tuoza02.pdf,False,https://proceedings.jacow.org/hiat2018/posters/tuoza02_poster.pdf,False,https://doi.org/10.18429/JACoW-HIAT2018-TUOZA02,
hiat2018,,TUOPA01,Design of the Multi-Ion Injector Linac for the JLAB EIC (JLEIC),B. Mustapha; Z.A. Conway; M.P. Kelly; ANL; Lemont; Illinois; USA; P.N. Ostroumov; A.S. Plastun; FRIB; East Lansing; Michigan; USA; An Electron Ion Collider (EIC) is the highest priority for future U.S. accelerator-based nuclear physics facility following the completion of the Facility for Rare Isotope Beams (FRIB). Two laboratories are competing to host the future EIC: Brookhaven National Lab. (BNL) and Jefferson Lab. (JLab). The baseline design of JLab’s Electron Ion Collider (JLEIC) ion complex comprises a pulsed superconducting (SC) linac injector capable of accelerating all ions from protons to lead; where proton and light ion beams can be polarized. After reviewing the design requirements for the injector linac; important design choices such as the room-temperature (RT) section design; the transition energy between the RT and SC sections and the stripping energy for heavy ions will be discussed. The design of the different linac sections will be presented as well as the results of end-to-end beam dynamics simulations for polarized deuterons and un-polarized lead ions.,,,https://proceedings.jacow.org/hiat2018/talks/tuopa01_talk.pdf,True,https://proceedings.jacow.org/hiat2018/papers/tuopa01.pdf,True,https://proceedings.jacow.org/hiat2018/posters/tuopa01_poster.pdf,False,https://doi.org/10.18429/JACoW-HIAT2018-TUOPA01,97
hiat2018,,WEXAA01,SHE-Factory: new cyclotron facility for super heavy element research,I.V. Kalagin; S.N. Dmitriev; G.G. Gulbekyan; Y.T. Oganessian; JINR; Dubna; Moscow Region; Russia; The synthesis of heavy and the heaviest elements and the study of their nuclear and chemical properties are of highest priority in the basic research programme of the Flerov Laboratory of Nuclear Reactions. The synthesis of super heavy elements (SHE) with atomic numbers 113-118 has been achieved in the 48Ca-induced reactions. The International Unions of pure and applied physics (IUPAP) and chemistry (IUPAC) recognized the priority of Dubna in the discovery of elements 114 ’ 118. The seventh period of the Periodic Table has been completed. In accordance with the development program; the first in the world Super heavy Element Factory is being built at the Laboratory on the basis of the new DC280 cyclotron which has to provide intensities up to 10 pμA for ions with atomic masses over 50. The main task of the Factory is the synthesis of new chemical elements with atomic numbers 119 and higher; as well as a detailed study of the nuclear and chemical properties of previously discovered superheavy elements. The Factory will be equipped with target materials; new separators and detectors for the study of the nuclear; atomic and chemical properties of the new elements.,,,https://proceedings.jacow.org/hiat2018/talks/wexaa01_talk.pdf,True,https://proceedings.jacow.org/hiat2018/papers/wexaa01.pdf,False,https://proceedings.jacow.org/hiat2018/posters/wexaa01_poster.pdf,False,https://doi.org/10.18429/JACoW-HIAT2018-WEXAA01,
hiat2018,,WEOAA01,GFS-2 - The New Gas-filled Separator for Super-Heavy Elements in JINR. A Guided Walk through the Genesis of the Project from First Thoughts to Completion,W. Beeckman; S. Antoine; F. Forest; P.J. Jehanno; P. Jivkov; M.J. Leray; X. Milpied; C. Nignol; Sigmaphi; Vannes; France; A.G. Popeko; V.K. Utyonkov; JINR/FLNR; Moscow region; Russia; SIGMAPHI S.A.; Vannes; France; The brand-new Superheavy Element Factory at the Flerov Laboratory of Nuclear Reactions (FLNR) in JINR; Dubna; is under completion; with the high-current DC-280 cyclotron installed; mapped and tested and first beams will be made available during the last term of 2018. To improve the efficiency of studies on heavy and superheavy nuclei; it will deliver a wide range of species with high intensity; which in turn require effective separators providing high suppression of unwanted reaction products. The first experiment fed by the cyclotron; GFS-2; is a universal gas-filled separator for synthesis and study of the properties of heavy isotopes; based on the QvDhQvQhD scheme. The presentation describes its study and design in close collaboration between FLNR and Sigmaphi; starting from the initial demand in 2015 and going through the different steps; up to its construction in 2017 and installation a few months ago.,,,https://proceedings.jacow.org/hiat2018/talks/weoaa01_talk.pdf,True,https://proceedings.jacow.org/hiat2018/papers/weoaa01.pdf,False,https://proceedings.jacow.org/hiat2018/posters/weoaa01_poster.pdf,False,https://doi.org/10.18429/JACoW-HIAT2018-WEOAA01,
hiat2018,,WEOAA02,Investigations on KONUS beam dynamics using the pre-stripper drift tube LINAC at GSI,C. Xiao; X. Du; L. Groening; GSI; Darmstadt; Germany; Interdigital H-mode (IH) drift tube linacs (DTLs) based on KONUS beam dynamics are very sensitive to the rf-phases and voltages at the gaps between tubes. In order to design these DTLs; a deep understanding of the underlying longitudinal beam dynamics is mandatory. The report presents tracking simulations along an IH-DTL using the PARTRAN and BEAMPATH codes together with MATHCAD and CST. Simulation results illustrate that the beam dynamics design of the pre-stripper IH-DTL at GSI is sensitive to slight deviations of rf-phase and gap voltages with impact to the mean beam energy at the DTL exit. Applying the existing geometrical design; rf-voltages; and rf-phases of the DTL were re-adjusted. In simulations this re-optimized design can provide for more than 90% of transmission of an intense 15 emA beam keeping the reduction of beam brilliance below 25%.,,,https://proceedings.jacow.org/hiat2018/talks/weoaa02_talk.pdf,True,https://proceedings.jacow.org/hiat2018/papers/weoaa02.pdf,True,https://proceedings.jacow.org/hiat2018/posters/weoaa02_poster.pdf,False,https://doi.org/10.18429/JACoW-HIAT2018-WEOAA02,102
hiat2018,,WEOAA03,Stochastic Cooling Simulation of Rare Isotope Beam and its Secondary Beam,X.J. Hu; Z. Du; L. Jing; Y. Wei; J.X. Wu; Y.J. Yuan; G. Zhu; IMP/CAS; Lanzhou; People’s Republic of China; Stochastic cooling is a broadband feedback system; which is very effective for reducing the beam size without beam loss. It has advantage over electron cooling in cooling low intensity beam with large emittance and mo-mentum spread; which is required for precise study of the decay properties of RIB (Radioactive Ion Beam) using SMS method. This paper mainly concerns on cooling of primary beam and its secondary beam; pointing out the range of mass-to-charge spread that could be cooled for secondary particles. Meanwhile; TOF cooling combined with filter cooling was also studied. The simulation results provide theoretical supports for analysing different ions circulating in the ring at the same time in the experiments.,,,https://proceedings.jacow.org/hiat2018/talks/weoaa03_talk.pdf,True,https://proceedings.jacow.org/hiat2018/papers/weoaa03.pdf,True,https://proceedings.jacow.org/hiat2018/posters/weoaa03_poster.pdf,False,https://doi.org/10.18429/JACoW-HIAT2018-WEOAA03,107
hiat2018,,WEYAA01,Commissioning of China ADS Demo Linac and Baseline Design of CiADS Project,S.H. Liu; W.L. Chen; W.P. Dou; Y. He; H. Jia; Y.S. Qin; Z.J. Wangpresenter; H.W. Zhao; IMP/CAS; Lanzhou; People’s Republic of China; China Accelerator Driven Subcritical System (C-ADS) program was launched in China in 2011; which aims to design and build an ADS demonstration facility with the capability of more than 10 MW thermal power in multiple phases lasting about 20 years. In the first phase; a demo linac has been constructed and commissioned successfully to demonstrate the key technologies of the high-power CW mode superconducting linac. Followed the China ADS roadmap; a superconducting driver linac with 500MeV and 5mA proton beam is designed for the second phase of China Initiative Accelerator Driven Subcritical System (CiADS) program. The commissioning results of the China ADS 25 MeV demo linac and the RAMI oriented beam physics design of CiADS linac are presented in this paper.,,,https://proceedings.jacow.org/hiat2018/talks/weyaa01_talk.pdf,True,https://proceedings.jacow.org/hiat2018/papers/weyaa01.pdf,True,https://proceedings.jacow.org/hiat2018/posters/weyaa01_poster.pdf,False,https://doi.org/10.18429/JACoW-HIAT2018-WEYAA01,112
hiat2018,,WEYAA02,Update on the ATLAS Multi-User Upgrade,B. Mustapha; J.A. Nolen; G. Savard; ANL; Lemont; Illinois; USA; The recently approved multi-user upgrade [1] of the superconducting linac; ATLAS; will enable simultaneous acceleration and delivery of two ion beams to different experimental areas. In the initial phase; one stable; nearly continuous wave; beam from the ECR ion source and one pulsed radioactive beam from the EBIS charge breeder ion source of the Californium Rare Isotope Beam Upgrade (CARIBU-EBIS) will be interleaved in time via an electrostatic deflector at injection; and accelerated through the first two sections of the linac. At that point; one of the beams is deflected via a fast switching magnet to a lower energy experimental area while the other is further accelerated through the third linac stage of ATLAS. Details of the proposed implementation and the expected gains from this upgrade will be presented. In addition to enhancing the nuclear physics program; this upgrade will allow some applications such as material irradiation; isotope production; and radiobiology [2].; * ’Simultaneous Acceleration of Radioactive and Stable Beams in the ATLAS Linac’; B. Mustapha et al; HB-2014.  ** ’The ATLAS Multi-User Upgrade and Potential Applications’; JINST 12 (2017) T12002.,"Funding: Work supported by the U.S. Department of Energy, Office of Nuclear Physics, Contract No. DE-AC02-06CH11357. This research used resources of ANL’s ATLAS facility, a DOE Office of Science User Facility.",,https://proceedings.jacow.org/hiat2018/talks/weyaa02_talk.pdf,True,https://proceedings.jacow.org/hiat2018/papers/weyaa02.pdf,False,https://proceedings.jacow.org/hiat2018/posters/weyaa02_poster.pdf,False,https://doi.org/10.18429/JACoW-HIAT2018-WEYAA02,
hiat2018,,WEZAA01,High-Brilliance Neutron Source Project,FZJ; Jülich; Germany; J. Baggemann; Th. Brückel; T. Cronert; P.-E. Doege; T. Gutberlet; E. Mauerhofer; M. Rimmler; U. Rücker; J. Voigt; JCNS; Jülich; Germany; NET; Aachen; Germany; IEK; Jülich; Germany; O. Meusel; H. Podlech; M. Schwarz; IAP; Frankfurt am Main; Germany; The High-Brilliance Neutron Source (HBS) project aims to design a scalable compact accelerator driven neutron source (CANS) which is competitive and cost-efficient. The concept allows one to optimize the whole facility including accelerator; target; moderators and neutron optics to the demands of individual neutron instruments. Particle type; energy; timing; and pulse structure of the accelerator are fully defined by the requirements of a given neutron instrument. In the following; we present the current status of the HBS project.,,,https://proceedings.jacow.org/hiat2018/talks/wezaa01_talk.pdf,True,https://proceedings.jacow.org/hiat2018/papers/wezaa01.pdf,True,https://proceedings.jacow.org/hiat2018/posters/wezaa01_poster.pdf,False,https://doi.org/10.18429/JACoW-HIAT2018-WEZAA01,117
