conference_code,session_name,paper_id,title,authors,institutions,abstract,presentation_url,presentation_available,paper_url,paper_available,poster_url,poster_available,doi,page_number
ibic2021,,MOPP31,Preliminary Studies for the SOLEIL Upgrade BPM,M. El Ajjouri; F. Alves; A. Gamelin; N. Hubert; SOLEIL; Gif-sur-Yvette; France; Synchrotron SOLEIL is preparing a machine upgrade based on multibend achromat lattice with a drastically reduced horizontal electron beam emittance (<100 pmrad). Foreseen quadrupole and sextupole strengths will impose a small vacuum chamber diameter and the future Beam Position Monitors (BPM) will have a 16 mm inner diameter (circular shape). To minimize the BPM contribution to the longitudinal impedance; and induced heating on their mechanics; the feedthrough and button shapes must be optimized. This paper summarizes the systematic electromagnetic simulations that have been carried on in order to distinguish the effect of single dimension changes (such as button thickness and shape; ceramic thickness and diameter) on the amplitudes and frequency position of the resonances. It also introduces the preliminary BPM design for the SOLEIL upgrade project.,,,https://proceedings.jacow.org/ibic2021/talks/mopp31_talk.pdf,False,https://proceedings.jacow.org/ibic2021/papers/mopp31.pdf,True,https://proceedings.jacow.org/ibic2021/posters/mopp31_poster.pdf,True,https://doi.org/10.18429/JACoW-IBIC2021-MOPP31,128
ibic2021,,MOPP33,BPM System for the PIP-II Injector Test Facility,N. Eddy; J.S. Diamond; B.J. Fellenz; R.R. Santucci; A. Semenov; D. Slimmer; D.C. Voy; Fermilab; Batavia; Illinois; USA; A new BPM system was used for commissioning and operation of the PIP2 Injector Test Facility. The system of 13 warm and 12 cold BPMs was based upon custom 250 MS/s digitizers controlled and readout over gigabit ethernet by a single multi-core rackmount server running linux. The system provided positions; intensity; and phase for each bpm as a pulse average or pulse waveform from 10 us to 4 ms at a 20 Hz pulse repetition rate.,"Funding: Work supported by the Fermi National Accelerator Laboratory, managed and operated by Fermi Research Alliance, LLC under Contract No. DE-AC02-07CH11359 with the U.S. Department of Energy.",,https://proceedings.jacow.org/ibic2021/talks/mopp33_talk.pdf,False,https://proceedings.jacow.org/ibic2021/papers/mopp33.pdf,True,https://proceedings.jacow.org/ibic2021/posters/mopp33_poster.pdf,True,https://doi.org/10.18429/JACoW-IBIC2021-MOPP33,133
ibic2021,,MOPP34,Performance of the SLAC-PAL-Vitzrotech X-band Cavity BPMs in the LCLS-II Undulator Beam Lines,C.D. Nantista; S.L. Hoobler; P. Krejcik; D.S. Martinez-Galarce; B.D. McKee; M. Rowen; A. Young; SLAC; Menlo Park; California; USA; PAL; Pohang; Republic of Korea; The hard X-ray and soft X-Ray undulator beamlines of the LCLS-II X-ray FEL incorporate 65 X-band RF beam position monitors for accurate tracking of the electron beam trajectories and Beam-Based Alignment. For this crucial function; a design was jointly developed between PAL and SLAC; consisting of a monopole reference cavity and a dipole position cavity; with signals coupled out through coaxial vacuum feed-throughs. For the relatively large quantity needed; the production of completed units was contracted to the Korean company; Vitzrotech; who developed the manufacturing processes to successfully fabricate the needed quantity. Herein; an overview is given of the production experience; tuning; installation; and performance of these devices.,,,https://proceedings.jacow.org/ibic2021/talks/mopp34_talk.pdf,False,https://proceedings.jacow.org/ibic2021/papers/mopp34.pdf,True,https://proceedings.jacow.org/ibic2021/posters/mopp34_poster.pdf,True,https://doi.org/10.18429/JACoW-IBIC2021-MOPP34,136
ibic2021,,MOPP35,Commissioning and Results of,,,,https://proceedings.jacow.org/ibic2021/talks/mopp35_talk.pdf,False,https://proceedings.jacow.org/ibic2021/papers/mopp35.pdf,True,https://proceedings.jacow.org/ibic2021/posters/mopp35_poster.pdf,True,https://doi.org/10.18429/JACoW-IBIC2021-MOPP35,
ibic2021,,MOPP36,Comparison of Two Long Term Drift Stabilization Schemes for BPM Systems,F. Schmidt-Föhre; G. Kube; K. Wittenburg; DESY; Hamburg; Germany; For the planned upgrade of synchrotron radiation sources PETRA (called PETRA IV) at DESY a much higher beam brilliance is requested. In order to measure according beam positions and to control orbit stability to the corresponding level of accuracy; a future high-resolution BPM system has to deliver the necessary requirements on machine stability. This needs to enable long-term drift requirements of even less than 1 micron beam position deviation per week. Such a specification goal requires an additional long-term drift stabilization of the beam position monitor (BPM) readout scheme for PETRA IV; which will include a compensation of BPM cable parameter drifts. This paper discusses a comparison of two common compensation schemes using different signal conditioning features; typically needed at machine topologies with long BPM cable paths. Certain critical aspects of the different schemes are discussed in this report; while existing successful measurements are referred in some references.,,,https://proceedings.jacow.org/ibic2021/talks/mopp36_talk.pdf,False,https://proceedings.jacow.org/ibic2021/papers/mopp36.pdf,True,https://proceedings.jacow.org/ibic2021/posters/mopp36_poster.pdf,True,https://doi.org/10.18429/JACoW-IBIC2021-MOPP36,145
ibic2021,,MOPP37,KEK LUCX Facility Laser Transport Line Alignment Automatization,Sokendai; Ibaraki; Japan; A. Aryshev; N. Terunuma; J. Urakawa; KEK; Ibaraki; Japan; KEK LUCX facility* is a linear accelerator devoted to the beam instrumentation R&Ds for present and future accelerator systems and colliders. Parameters of electron beam generated by laser-driven photocathode-equipped gun are sensitive to laser wavelength; laser pulse intensity; duration (RMS); spot size (RMS) and spot position on the photocathode. Typically; tuning of such generation schema requires stable laser pulse generation and shaping; alignment of the laser transport line (LTL) and final focus optical system. Conventional diagnostics along LTL may include CCD cameras for position and profile tuning and monitoring including that at the virtual cathode position. An approach to achieve laser spot size and position with the high level of stability and reproducibility on the photocathode is associated with the implementation of geometric optics based software protocol which allows for automatic- or semi-automatic alignment of entire LTL. This approach was developed and applied for KEK LUCX RF gun LTL alignment. It employs two CCD cameras**; motorized mirrors and optical telescope designed for laser pulse delivery to the photocathode. The report shows the system stability and repeatability results; as well as commissioning technical notes.; *A. Aryshev et al.; Appl. Phys. Lett. 111; 033508 (2017). **https://www.jai.com/products/cm-040-ge,,,https://proceedings.jacow.org/ibic2021/talks/mopp37_talk.pdf,False,https://proceedings.jacow.org/ibic2021/papers/mopp37.pdf,False,https://proceedings.jacow.org/ibic2021/posters/mopp37_poster.pdf,True,https://doi.org/10.18429/JACoW-IBIC2021-MOPP37,
ibic2021,,MOPP38,An Automatic Focalization System for Enhanced Radioisotope Production with Solid Targets,P. Casolaro; S. Braccini; G. Dellepiane; P. Häffner; I. Mateu; P. Scampoli; N. Voeten; E. Zyaee; AEC; Bern; Switzerland; Naples University Federico II; Napoli; Italy,Funding: This research was partially funded by the Swiss National Science Foundation (SNSF). Grants: 200021175749 and,,https://proceedings.jacow.org/ibic2021/talks/mopp38_talk.pdf,False,https://proceedings.jacow.org/ibic2021/papers/mopp38.pdf,True,https://proceedings.jacow.org/ibic2021/posters/mopp38_poster.pdf,True,https://doi.org/10.18429/JACoW-IBIC2021-MOPP38,150
ibic2021,,MOPP39,The Design of a Fast Orbit Feedback System for Hefei Advanced Light Facility,Y.L. Li; B.G. Sun; USTC/NSRL; Hefei; Anhui; People’s Republic of China; In order to improve the stability of the beam orbit; the fast orbit feedback system (FOFB) is employed to eliminate the undesirable interference from various sources. The paper will present the design of the design of the global Fast Orbit Feedback for Hefei Advanced Light Facility (HALF). The FOFB system aims to stabilize the electron beam position towards an ideal electron beam orbit. The FOFB system employs high-speed board series PXIe-7902 board of National Instruments (NI) to realize the design of the communication controller (CC) and the algorithm calculation. The PXIe-7902 called cell has a built-in Xilinx Virtex-7 586T and 24 two-way digital channels. Which allows connecting 12 Liberal BPMs at most to receive the beam position values. A two-tier communication architecture is applied in the CC design. The beam position monitors are directly connected to cell and do not communicate each other. Which liberates the tasks of BPMs and make the task concentrated on the cell. The correction output is connected to the power supply to adjust the correctors to reach beam stability.; ※ BibTeX; ※ LaTeX; ※ Text/Word; ※ RIS,,reference for this paper using,https://proceedings.jacow.org/ibic2021/talks/mopp39_talk.pdf,False,https://proceedings.jacow.org/ibic2021/papers/mopp39.pdf,False,https://proceedings.jacow.org/ibic2021/posters/mopp39_poster.pdf,False,https://doi.org/10.18429/JACoW-IBIC2021-MOPP39,
ibic2021,,MOPP40,Design of Transverse Feedback Kickers for the HEPS Storage Ring,IHEP; People’s Republic of China; The High Energy Photon Source (HEPS) is a 6 GeV synchrotron radiation light source being built in Beijing; China. The electron beam inside the storage ring is designed to run with ultra-low emittance. To ensure high beam quality; the coupled bunch instabilities need to be carefully investigated and controlled; therefore an effective feedback system is essential. Stripline electrodes will be used in HEPS storage ring as transverse feedback kickers. Besides; a tune kicker is designed to measure tune and clean undesired buckets. This paper will introduce the design of these kickers; which mainly includes the optimization of the shunt impedance and reflection parameters within the working bandwidth. The shunt impedance simulated by numerical code HFSS is well coincident with the theoretical results.; ※ BibTeX; ※ LaTeX; ※ Text/Word; ※ RIS,,reference for this paper using,https://proceedings.jacow.org/ibic2021/talks/mopp40_talk.pdf,False,https://proceedings.jacow.org/ibic2021/papers/mopp40.pdf,False,https://proceedings.jacow.org/ibic2021/posters/mopp40_poster.pdf,False,https://doi.org/10.18429/JACoW-IBIC2021-MOPP40,
ibic2021,,MOPP41,A New Digital SSB Longitudinal Feedback System for the Fermilab Booster,N. Eddy; A. Semenov; Fermilab; Batavia; Illinois; USA,"Funding: Work supported by the Fermi National Accelerator Laboratory, managed and operated by Fermi Research Alliance, LLC under Contract No. DE-AC02-07CH11359 with the U.S. Department of Energy.",The Booster Longitudinal Mode Feedback System has been upgraded to single sideband system with improved ability to measure Beam Transfer Function for each mode. The new system provide feedback via either dedicated mode cavites or via the Booster RF system. It also provides diagnostic capabilities for tracking the sidebands of any Booster mode after transition crossing.,https://proceedings.jacow.org/ibic2021/talks/mopp41_talk.pdf,False,https://proceedings.jacow.org/ibic2021/papers/mopp41.pdf,False,https://proceedings.jacow.org/ibic2021/posters/mopp41_poster.pdf,True,https://doi.org/10.18429/JACoW-IBIC2021-MOPP41,
ibic2021,,MOPP42,Several Key Circuit Designs in HEPS-FOFB,Z.X. Xie; M.T. Kang; Z.C. Mu; IHEP CSNS; Guangdong Province; People’s Republic of China; D.P. Jin; L. Zeng; Y.L. Zhang; P. Zhu; IHEP; Beijing; People’s Republic of China; DNSC; Dongguan; People’s Republic of China; The bunch size of HEPS is up to micrometer level; so it is very vulnerable to external interference. FOFB(Fast Orbit Feedback) is used to counteract external interference and improve beam quality. HEPS Fofb independently developed hardware equipment; used to collect 576 BPM data; and then distributed to 192 fast corrector power supply after matrix operation and PI operation. Fofb is divided into 16 sub-sites; each sub-site uses a single circuit main board; each site processes 36 BPM data; 24 (X & Y axis) corrector power supply. Two Xilinx FPGA chips are mounted on the circuit board; one is for high-speed data processing; the other is network transmission and low-speed data processing. Because the single board processing business is very large; there are more than 15 channels of high current and low noise power supply; more than 60 channels of low jitter clock; and tens of centimeters of 10Gbps high-speed transmission path. This paper will introduce the simulation and design of power supply; clock and high-speed transmission in detail.; ※ BibTeX; ※ LaTeX; ※ Text/Word; ※ RIS,,reference for this paper using,https://proceedings.jacow.org/ibic2021/talks/mopp42_talk.pdf,False,https://proceedings.jacow.org/ibic2021/papers/mopp42.pdf,False,https://proceedings.jacow.org/ibic2021/posters/mopp42_poster.pdf,False,https://doi.org/10.18429/JACoW-IBIC2021-MOPP42,
ibic2021,,MOPP44,Analysis of Multi-Bunch Instabilities at Alba Using a Transverse Feedback System,U. Iriso; T.F. Günzel; ALBA-CELLS Synchrotron; Cerdanyola del Vallès; Spain; Since 2015 Alba is equipped with a transverse bunch by bunch feedback system; which not only damps the transverse coupled bunch instabilities in the machine; but also allows the impedance characterization of the storage ring. This characterization is produced by an internal sequence; which is programmed to excite and measure the growth and damping rates of each of the multi-bunch modes. This paper describes the measurement technique; presents the studies carried out to characterize the machine and different movable systems like the scrapers or in-vacuum undulators. Results are compared with the transverse impedance spectra obtained from computer simulations.,,,https://proceedings.jacow.org/ibic2021/talks/mopp44_talk.pdf,False,https://proceedings.jacow.org/ibic2021/papers/mopp44.pdf,True,https://proceedings.jacow.org/ibic2021/posters/mopp44_poster.pdf,True,https://doi.org/10.18429/JACoW-IBIC2021-MOPP44,154
ibic2021,,TUOA01,Single-Crystal Diamond Pixelated Radiation Detector with Buried Graphitic Electrodes,C. Bloomer; L. Bobb; DLS; Oxfordshire; United Kingdom; University of Warwick; Coventry; United Kingdom; A new type of transmissive pixel detector has been developed for synchrotron radiation diagnostics at Diamond Light Source. A thin single-crystal CVD diamond plate is used as the detector material; and a pulsed-laser technique has been used to write conductive graphitic electrodes inside the diamond plate. Instead of using traditional electrodes formed from a layer of surface metallisation; the graphitic electrodes are buried under the surface of the diamond and result in an all-carbon imaging detector. Within the instrument’s transmissive aperture there are no surface structures that could be damaged by exposure to radiation beams; and no surface metallization that could introduce unwanted absorption edges. The instrument has successfully been used to image the X-ray beam profile and measure the beam position to sub-micron accuracy at 100 Hz at Diamond Light Source. A novel modulation lock-in technique is used to read out all pixels simultaneously. Presented in this work are measurements of the detector’s beam position resolution and intensity resolution. Initial measurements of the instrument’s spread-function are also presented. Numerical simulations are used to identify potential improvements to the electrode geometry to improve the spatial resolution of similar future detectors. The instrument has applications in both synchrotron radiation instrumentation; where real-time monitoring of the beam profile is useful for beam diagnostics and fault-finding; and particle tracking at colliders; where the electrode geometries that buried graphitic tracks can provide increased the charge collection efficiency of the detector.,,Your browser cannot play the video. Consider download from Link Address. Right click on video forPicture-in-Picture modeor Full screen display.At start the sound is muted!,https://proceedings.jacow.org/ibic2021/talks/tuoa01_talk.pdf,True,https://proceedings.jacow.org/ibic2021/papers/tuoa01.pdf,True,https://proceedings.jacow.org/ibic2021/posters/tuoa01_poster.pdf,False,https://doi.org/10.18429/JACoW-IBIC2021-TUOA01,158
ibic2021,,TUOA02,Characterizing Ultralow Emittance Electron Beams using Structured Light Fields,IOQ; Jena; Germany; DESY; Hamburg; Germany; Novel schemes for generating ultralow emittance electron beams have been developed in past years and promise compact particle sources with excellent beam quality suitable for future high-energy physics experiments and free-electron lasers. Current methods for the characterization of low emittance electron beams such as pepperpot measurements or beam focus scanning are limited in their capability to resolve emittances in the sub 0.1 mm mrad regime. Here we propose a novel; highly sensitive method for the single shot characterization of the beam waist and emittance using interfering laser beams. In this scheme; two laser pulses are focused under an angle creating a gratinglike interference pattern. When the electron beam interacts with the structured laser field; the phase space of the electron beam becomes modulated by the laser ponderomotive force and results in a modulated beam profile after further electron beam phase advance; which allows for the characterization of ultralow emittance beams. 2D PIC simulations show the effectiveness of the technique for normalized emittances in the range of 0.01 to 1 mm mrad.; Characterizing ultralow emittance electron beams using structured light fields  Andreas Seidel; Jens Osterhoff; and Matt Zepf  Phys. Rev. Accel. Beams 24; 012803 (2021),,Your browser cannot play the video. Consider download from Link Address. Right click on video forPicture-in-Picture modeor Full screen display.At start the sound is muted!,https://proceedings.jacow.org/ibic2021/talks/tuoa02_talk.pdf,True,https://proceedings.jacow.org/ibic2021/papers/tuoa02.pdf,False,https://proceedings.jacow.org/ibic2021/posters/tuoa02_poster.pdf,False,https://doi.org/10.18429/JACoW-IBIC2021-TUOA02,
ibic2021,,TUOA03,Transverse Beam Emittance Measurement by Undulator Radiation Power Noise,University of Chicago; Chicago; Illinois; USA; A. Halavanau; Z. Huang; SLAC; Menlo Park; California; USA; ANL; Lemont; Illinois; USA; V.A. Lebedev; S. Nagaitsev; A.L. Romanov; G. Stancari; A. Valishev; Fermilab; Batavia; Illinois; USA; Generally; turn-to-turn power fluctuations of incoherent spontaneous synchrotron radiation in a storage ring depend on the 6D phase-space distribution of the electron bunch. In some cases; if only one parameter of the distribution is unknown; this parameter can be determined from the measured magnitude of these power fluctuations. In this contribution; we report the results of our experiment at the Integrable Optics Test Accelerator (IOTA) storage ring; where we carried out an absolute measurement (no free parameters or calibration) of a small vertical emittance (5–15 nm rms) of a flat beam by this new method; under conditions; when the small vertical emittance is unresolvable by a conventional synchrotron light beam size monitor. This technique may be particularly beneficial for existing state-of-the-art and next generation low-emittance high-brightness ultraviolet and x-ray synchrotron light sources.,,https://doi.org/10.1103/PhysRevLett.126.134802 Your browser cannot play the video. Consider download from Link Address. Right click on video forPicture-in-Picture modeor Full screen display.At start the sound is muted!,https://proceedings.jacow.org/ibic2021/talks/tuoa03_talk.pdf,True,https://proceedings.jacow.org/ibic2021/papers/tuoa03.pdf,True,https://proceedings.jacow.org/ibic2021/posters/tuoa03_poster.pdf,False,https://doi.org/10.18429/JACoW-IBIC2021-TUOA03,167
ibic2021,,TUOA04,Measurement and Reconstruction of a Beam Profile Using a Gas Sheet Monitor by Beam-Induced Fluorescence Detection in J-PARC,I. Yamada; M. Wada; Doshisha University; Graduate School of Engineering; Kyoto; Japan; J. Kamiya; M. Kinsho; K. Moriya; JAEA/J-PARC; Tokai-mura; Japan; A high-intensity beam accelerator requires a non-destructive beam profile monitor since a destructive monitor; such as a wire-scanning-type profile monitor; may be broken by deposited energy. We have been developing a non-destructive transverse beam profile monitor using a gas sheet. The sheet-shaped gas flow is formed by a technique of rarefied gas dynamics and enables two-dimensional profile measurement. One of the issues on development of the profile monitor based on beam-gas interaction is reconstruction of the beam profile from the obtained signal by the monitor. Our gas sheet monitor captures the beam-induced fluorescence using an image intensifier and a CCD camera. Photons produced by beam-gas interaction are integrated along the normal direction of the detector; the luminous intensity distribution of the obtained image can be written as an integral of the product of the sheet-gas density distribution and the beam profile. To solve the equation and reconstruct the profile; the sheet-gas density distribution needs to be measured. The gas density distribution was quantified using an electron beam narrow enough as compared with the beam whose profile needs to be measured. The narrow electron beam induces local photon emission from the gas sheet; and the gas density distribution can be measured by scanning the electron beam position on the gas sheet while monitoring the photon signal intensities. An advantage of this measurement method of the gas density distribution is the obtained distribution includes the sensitivity distribution of the detector; such as a CCD camera and an image intensifier. The measured gas density distribution including the sensitivity distribution was applied to the profile reconstruction of 3 MeV; 60 mA negative hydrogen ion beam in J-PARC Linac; and the beam profile was successfully obtained.,,Your browser cannot play the video. Consider download from Link Address. Right click on video forPicture-in-Picture modeor Full screen display.At start the sound is muted!,https://proceedings.jacow.org/ibic2021/talks/tuoa04_talk.pdf,True,https://proceedings.jacow.org/ibic2021/papers/tuoa04.pdf,True,https://proceedings.jacow.org/ibic2021/posters/tuoa04_poster.pdf,False,https://doi.org/10.18429/JACoW-IBIC2021-TUOA04,168
ibic2021,,TUOA05,Commissioning of Timepix3 Based Beam Gas Ionisation Profile Monitors for the CERN Proton Synchrotron,H.S. Sandberg; D. Bodart; S. Jensen; S. Levasseurpresenter; G. Schneider; J.W. Storey; R. Veness; CERN; Geneva 23; Switzerland; UMAN; Manchester; United Kingdom; Royal Holloway; University of London; Surrey; United Kingdom; KEK; Ibaraki; Japan; A pair of operational Beam Gas Ionisation (BGI) profile monitors was installed in the CERN Proton Synchrotron (PS) at the beginning of 2021. These instruments use Timepix3 hybrid pixel detectors to continuously measure the beam profile throughout the cycle in the horizontal and vertical planes. In the weeks following their installation; both BGI’s were commissioned in situ by equalizing and tuning the thresholds of the Timepix3 detectors. First measurements were taken during the beam commissioning period; demonstrating the operational readiness of the instruments. Sextupolar components originating from the magnetic shield in the vertical BGI magnet were later discovered and required compensation to reduce their effect on the PS beams. With the compensation in place; operational measurements could be started and provided new insights into the dynamics of the PS beam cycles.,,Your browser cannot play the video. Consider download from Link Address. Right click on video forPicture-in-Picture modeor Full screen display.At start the sound is muted!,https://proceedings.jacow.org/ibic2021/talks/tuoa05_talk.pdf,True,https://proceedings.jacow.org/ibic2021/papers/tuoa05.pdf,True,https://proceedings.jacow.org/ibic2021/posters/tuoa05_poster.pdf,False,https://doi.org/10.18429/JACoW-IBIC2021-TUOA05,172
