conference_code,session_name,paper_id,title,authors,institutions,abstract,presentation_url,presentation_available,paper_url,paper_available,poster_url,poster_available,doi,page_number
ibic2021,,WEPP06,Observation and Analysis of Island Phenomenon in the Storage Ring Light Source,Y.K. Zhao; S.S. Jin; P. Lu; B.G. Sun; L.L. Tang; J.G. Wang; F.F. Wu; T.Y. Zhou; USTC/NSRL; Hefei; Anhui; People’s Republic of China; In the previous experimental investigations and measurements using the radio-frequency (RF) phase modulation method to study the longitudinal beam characteristics of the Hefei Light Source-II (HLS-II); we found that the longitudinal bunch distributions under different modulation frequencies and amplitudes have great difference. In order to further explore island phenomenon and better understand beam motion associated with external RF phase modulation; the streak camera is exploited to effectively observe the longitudinal bunch profile and distribution in single-bunch filling mode. In addition; the dependence between island size; bunch dilution effect and modulation frequency are also discussed in detail. This is meaningful for researching the impact of RF noise on longitudinal beam dynamics; beam manipulation; and machine maintenance and debugging.,,,https://proceedings.jacow.org/ibic2021/talks/wepp06_talk.pdf,False,https://proceedings.jacow.org/ibic2021/papers/wepp06.pdf,True,https://proceedings.jacow.org/ibic2021/posters/wepp06_poster.pdf,True,https://doi.org/10.18429/JACoW-IBIC2021-WEPP06,373
ibic2021,,WEPP07,Design and Simulation of the Coupling Structure for Single Resonant Cavity Bunch Length Monitor,H.X. Tuo; P. Lu; Q. Luo; B.G. Sun; F.F. Wu; T.Y. Zhou; USTC/NSRL; Hefei; Anhui; People’s Republic of China; The measurement of the bunch length can better realize the monitoring of the beam; because the bunch length is one of the important longitudinal parameters of the beam. In this paper; a new single-cavity bunch length monitor is proposed; whose coupling structures consist of two kinds of filters. One is a low pass filter; the other is a band pass filter. The coaxial low-pass filter is used to couple out lowfrequency signals; and the band-pass filter is used to couple higher-frequency signals. According to the beam characteristics of the National Synchrotron Radiation Laboratory (NSRL)based on the tunable infrared laser energy chemistry research large-scale experimental device (FELiChEM); we perform simulation in CST. The simulation results show that the monitor can measure the bunch length of the FELiChEM device very well; and the simulation measurement error is less than 2%.,,,https://proceedings.jacow.org/ibic2021/talks/wepp07_talk.pdf,False,https://proceedings.jacow.org/ibic2021/papers/wepp07.pdf,True,https://proceedings.jacow.org/ibic2021/posters/wepp07_poster.pdf,True,https://doi.org/10.18429/JACoW-IBIC2021-WEPP07,377
ibic2021,,WEPP08,Femtosecond Fiber Link Stabilization to Timing Synchronization System for SHINE Project,L. Feng; C.L. Li; B. Liu; J.G. Wang; X.T. Wang; W.Y. Zhang; SARI-CAS; Pudong; Shanghai; People’s Republic of China; The upcoming Shanghai high repetition rate XFEL and Extreme light facility (SHINE) project has a high precision requirement for the timing synchronization system on femtosecond timescale over more than 3-km long optical fiber links. For this purpose; we setup the fiber link stabilization units to stable a long-distance polarization maintaining (PM) fiber link using balanced optical cross-correlators. In this paper; the current development progress and measurement results of the fiber link stabilization will be reported.,,,https://proceedings.jacow.org/ibic2021/talks/wepp08_talk.pdf,False,https://proceedings.jacow.org/ibic2021/papers/wepp08.pdf,True,https://proceedings.jacow.org/ibic2021/posters/wepp08_poster.pdf,True,https://doi.org/10.18429/JACoW-IBIC2021-WEPP08,381
ibic2021,,WEPP09,The Development of Bunch Length Monitor Based on CSR for SXFEL,SSRF; Shanghai; People’s Republic of China; The Shanghai soft X-ray Free-Electron Laser facility (SXFEL) will be opened to user at the end of this year. In order to ensure the stable FEL generation; on-line single-shot and nondestructive bunch length monitors utilizing coherent synchrotron radiation (CSR) were installed after each of two bunch compressors (BC1; BC2). We have tested CSR monitor after BC1 when bunch length range from 1ps to 2 ps and calibrated with TDS stalled downstream. The results show that the monitor is capable of measuring picosecond bunch length with a precision of less than 10%.; ※ BibTeX; ※ LaTeX; ※ Text/Word; ※ RIS,,reference for this paper using,https://proceedings.jacow.org/ibic2021/talks/wepp09_talk.pdf,False,https://proceedings.jacow.org/ibic2021/papers/wepp09.pdf,False,https://proceedings.jacow.org/ibic2021/posters/wepp09_poster.pdf,False,https://doi.org/10.18429/JACoW-IBIC2021-WEPP09,
ibic2021,,WEPP10,Development of an On-Line Bunch Length Monitoring System at PLS-II Using an Ultrafast Photodiode,POSTECH; Pohang; Republic of Korea; T. Ha; G. Hahn; Y.D. Joo; D. Kim; Y.S. Lee; PAL; Pohang; Republic of Korea; HZB; Berlin; Germany; Users of time-resolving experiments at 3rd generation synchrotron light sources deem online bunch length and filling pattern monitoring as an important real-time diagnostic. We developed an on-line monitoring system that can measure bunch lengths and filling pattern using a photodiode; a wideband pre-amplifier; and a sampling digitizer. Two different methods were evaluated to reconstruct the bunch lengths: Gaussian deconvolution method as an approximation scheme and Fourier analysis as a method to restore the original signal by using the power transmission characteristics of the electronic devices in the system; including a bias-tee; a wideband amplifier; cables; and the photodiode. A bunch lengthening experiment has been conducted to compare and verify the results of those two methods of the photodiode and the result of the streak camera images by changing the overall gap voltage of the superconducting RF cavities. In this paper; we elaborate upon the said photodiode-based measurement techniques; and present the experimental results.,,,https://proceedings.jacow.org/ibic2021/talks/wepp10_talk.pdf,False,https://proceedings.jacow.org/ibic2021/papers/wepp10.pdf,True,https://proceedings.jacow.org/ibic2021/posters/wepp10_poster.pdf,True,https://doi.org/10.18429/JACoW-IBIC2021-WEPP10,384
ibic2021,,WEPP11,Broadband Characterization of a Compact Zero-Bias Schottky Diode Detector with a Continuous Wave THz System,R. Yadav; S. Preu; IMP; TU Darmstadt; Darmstadt; Germany; THM; Friedberg; Germany; Over the last few decades several types of Terahertz (THz) detectors have been developed to maturity; paving the way for various potential applications such as diagnostics of THz generation at particle accelerators. An important class are zero-biased Schottky diode THz detectors that are frequently applied at accelerator facilities [*] for operation at room temperature. Zero-biased Schottky diode THz detectors [**; ***] are having lower noise compared to biased ones due to the absence of shot noise. Here we demonstrate the sensitivity of Schottky detectors using a commercial continuous wave photomixing THz system as source. Both; a commercially available as well as a research-grade compact quasi-optical detector with improved video bandwidth are compared from 0.05 to 1.2 THz in terms of sensitivity. At 1 THz; the research grade quasi optical detector shows 7 dB higher dynamic range than the commercial one.,,"[*] Preu, S.,et al.,DOI: 10.1109/TTHZ.2015.2482943  [**] Penirschke, A.,et al.,DOI: 10.1109/IRMMW-THz.2014.6956027  [***] Hoefle, M.,et al.,DOI: 10.1109/IRMMW-THz.2013.6665893",https://proceedings.jacow.org/ibic2021/talks/wepp11_talk.pdf,False,https://proceedings.jacow.org/ibic2021/papers/wepp11.pdf,True,https://proceedings.jacow.org/ibic2021/posters/wepp11_poster.pdf,True,https://doi.org/10.18429/JACoW-IBIC2021-WEPP11,388
ibic2021,,WEPP12,Modal Analysis of Electromagnetic Coupling Between SMA-Feedthrough Electrode and Beam for Wideband Beam Monitor,KEK; Ibaraki; Japan; The direct simultaneous detection of electron (e-) and positron (e+) bunch signals was successfully performed for the first time by a wideband beam monitor at the positron capture section of the SuperKEKB factory. This monitor can measure a time interval between the e- and e+ bunches; their bunch lengths; bunch intensities; and transverse beam positions; depending on the phase of accelerating structures. For this purpose; a new beam monitor with wideband pickups simply using SMA feedthroughs and a wideband detection system based on a fast and real-time oscilloscope was developed to investigate their capture process at the capture section and to maximally optimize the e+ intensity. The required specification for the new monitor is to simultaneously detect the e+ and e- bunches generated in the capture section within the resolution of pico-second level with a sufficient dynamic range in the time-interval and bunch-length measurements. Thus; the wideband detection system is required for this purpose. In this report; the basic design and results based on a modal analysis of electromagnetic couplings between the SMA-feedthrough electrode and a beam are in detail given along with some obtained performance.,,,https://proceedings.jacow.org/ibic2021/talks/wepp12_talk.pdf,False,https://proceedings.jacow.org/ibic2021/papers/wepp12.pdf,True,https://proceedings.jacow.org/ibic2021/posters/wepp12_poster.pdf,True,https://doi.org/10.18429/JACoW-IBIC2021-WEPP12,392
ibic2021,,WEPP13,Bunch Arrival Time Measurement System Test for SHINE,Y.M. Zhou; J. Chen; Y.B. Leng; SSRF; Shanghai; People’s Republic of China; SARI-CAS; Pudong; Shanghai; People’s Republic of China; To achieve high-precision synchronization between electron bunches and seeded lasers; a femto-second resolution bunch arrival time measurement system (BAM) is required at SHINE (Shanghai High repetition rate XFEL aNd Extreme light facility). The bunch signal from a GHz-bandwidth cavity monitor is mixed with a reference signal from the device synchronization clock in the RF front-end. Then; the generated IF signal is collected by the digital acquisition system. In the pre-research stage; four sets of cavity monitors with different frequencies and load quality factors and three sets of analog front-ends with different schemes were performed; but now only one monitor with the attenuation time constant of 200 ns was installed for beam experiment testing. The system can measure the bunch charge; bunch arrival time; and bunch flight time. The first results will be presented in this paper.,,,https://proceedings.jacow.org/ibic2021/talks/wepp13_talk.pdf,False,https://proceedings.jacow.org/ibic2021/papers/wepp13.pdf,True,https://proceedings.jacow.org/ibic2021/posters/wepp13_poster.pdf,True,https://doi.org/10.18429/JACoW-IBIC2021-WEPP13,396
ibic2021,,WEPP14,Bunch Compression Monitor Based on Coherent Diffraction Radiation at European XFEL and FLASH,C. Gerth; N.M. Lockmann; DESY; Hamburg; Germany; Bunch compression monitors (BCMs) based on the detection of coherent diffraction radiation have been installed at the European XFEL for a beam-based stabilisation of the accelerating phases as well as monitoring of bunch lengths. The monitor systems comprise zero-bias Schottky and pyro-electric detectors in combination with low and high pass filters. The detector responses and filters are matched to the spectral ranges of the coherent part of the emitted diffraction radiation which is given by the particular beam energy and bunch lengths after each bunch compression stage. In this paper; we describe in detail the experimental setup of the BCMs. The last BCM has been calibrated with the help of a transverse deflecting structure to establish a (rms) bunch length monitor in the range of a few tens of femtoseconds; and results from compression scans are presented. To enable operation at megahertz repetition rates of the superconducting accelerator; a correction method for the signal pileup of the pyro-electric detectors has been applied. Installation of the same BCMs is foreseen at FLASH within the,,,https://proceedings.jacow.org/ibic2021/talks/wepp14_talk.pdf,False,https://proceedings.jacow.org/ibic2021/papers/wepp14.pdf,True,https://proceedings.jacow.org/ibic2021/posters/wepp14_poster.pdf,True,https://doi.org/10.18429/JACoW-IBIC2021-WEPP14,400
ibic2021,,WEPP15,Proposed Longitudinal Profile Diagnostics for Optical Stochastic Cooling of Stored Electrons in the IOTA Ring,Fermilab; Batavia; Illinois; USA; One of the predicted signatures of successful optical stochastic cooling (OSC) in the Fermilab Integrable Optics Test Accelerator (IOTA) ring is reduction of the bunch length. The IOTA OSC experiment is designed for a low nominal beam current (~0.1 microAmps of 100-MeV electrons) to reduce intrabeam scattering (IBS); and during cooling; OSC is expected to reduce the bunch length from ~200 ps to ~130 ps*. These equilibrium bunch lengths can be measured using a streak camera and the optical synchrotron radiation (OSR) generated in a ring dipole by the circulating beam. A similar measurement was previously performed at the Advanced Photon Source with a Hamamatsu C5680 synchroscan streak camera operating at 117.3 MHz**. In this case; synchronous summing of OSR resulted in a bunch length measurement of 276 ± 30 ps using only 57 electrons circulating at 425 MeV. At IOTA; an existing streak camera has been modified to operate at the 11th harmonic of the ring’s revolution frequency of 7.50 MHz and has been installed on an OSR port in support of the OSC experiments. The integrated system will have sufficient sensitivity and resolution for measuring the evolution and equilibrium values of the bunch length during OSC experiments.; *V. Lebedev; J. Jarvis; H. Piekarz; A. Romanov; J. Ruan; M. Andorf; https://arxiv.org/abs/2012.09967 ** A.H. Lumpkin and K. P. Wootton,,,https://proceedings.jacow.org/ibic2021/talks/wepp15_talk.pdf,False,https://proceedings.jacow.org/ibic2021/papers/wepp15.pdf,True,https://proceedings.jacow.org/ibic2021/posters/wepp15_poster.pdf,True,https://doi.org/10.18429/JACoW-IBIC2021-WEPP15,404
ibic2021,,WEPP16,Comparison of Feschenko BSM and Fast Faraday Cup with Low Energy Ion Beams,R. Singh; W.A. Barth; P. Forck; S. Lauber; M. Miski-Oglu; T. Reichert; T. Sieber; GSI; Darmstadt; Germany; V.E. Scarpine; D. Sun; Fermilab; Batavia; Illinois; USA; A comparison between Fast Faraday Cup and Feschenko longitudinal bunch shape detectors was recently performed at HELIAC Advanced Demonstrator beamline at GSI. Feschenko bunch shape monitor (BSM) uses the time to space conversion by means of secondary electrons emitted from a wire correlated to a rf deflector; while the fast Faraday cup (FFC) measures the deposited charge in a cup geometry matched to 50 Ohm. The FFC design aims to minimize the bunch shape dilution due to field polarization and secondary electrons produced on irradiation. An He1+ with 100 µA average current and 1.4 MeV/u kinetic energy is utilized for this comparison. A buncher upstream of the detectors was operated to focus the beam longitudinally. The results are discussed in this contribution.,,,https://proceedings.jacow.org/ibic2021/talks/wepp16_talk.pdf,False,https://proceedings.jacow.org/ibic2021/papers/wepp16.pdf,True,https://proceedings.jacow.org/ibic2021/posters/wepp16_poster.pdf,True,https://doi.org/10.18429/JACoW-IBIC2021-WEPP16,407
ibic2021,,WEPP17,Uncertainty Quantification and Robustness of Particle Accelerator Machine-Learning Based Models,O.R. Convery; A. Hanuka; SLAC; Menlo Park; California; USA; Y. Gal; L. Smith; Oxford University Press (Oxford Electronic Publishing); Oxford; United Kingdom; Virtual Diagnostic (VD) is a computational tool built using deep learning that can be used to predict diagnostic outputs*. VDs are especially useful in systems where measuring outputs is invasive; limited; costly or runs the risk of modifying the output. In experiments with large ramifications; it is important to quantify the uncertainty of each prediction. Given out-of-distribution inputs (e.g. using the same machine in a different operation mode); it is also necessary to understand how robust the VD model is and how well it generalizes on unfamiliar data. In this work**; we use various compositions of neural networks to explore and enhance prediction uncertainty and robustness on data sets gathered from SLAC National Laboratory. We aim to accurately and confidently predict the longitudinal phase space images of electron beams. The ability to make informed decisions under uncertainty and limited computational power is crucial for reliable deployment of scalable deep learning tools on safety-critical systems such as particle accelerators.; * Hanuka; A.; Emma; C.; Maxwell; T. et al. Sci Rep 11; 2945 (2021). ** Convery; O.; Smith; L.; Gal; Y.; & Hanuka; A. Arxiv 2105.04654 (2021).; ※ BibTeX; ※ LaTeX; ※ Text/Word; ※ RIS,"Funding: This work was supported by the Department of Energy, Laboratory Directed Research and Development program at SLAC National Accelerator Laboratory, under contract DE-AC02-76SF00515.",reference for this paper using,https://proceedings.jacow.org/ibic2021/talks/wepp17_talk.pdf,False,https://proceedings.jacow.org/ibic2021/papers/wepp17.pdf,False,https://proceedings.jacow.org/ibic2021/posters/wepp17_poster.pdf,False,https://doi.org/10.18429/JACoW-IBIC2021-WEPP17,
ibic2021,,WEPP18,New X-Band RF Deflector for Femtosecond Diagnostics of LCLS-II Beams,V.A. Dolgashev; H. Bassan; S. Condamoor; A.A. Haase; P. Krejcik; T.J. Maxwell; J.W. Wang; SLAC; Menlo Park; California; USA; An X-band transverse deflector has been successfully developed for femtosecond electron and x-ray pulse temporal diagnostic at the LCLS [1]. The working frequency for the deflector is 11.424 GHz. New free electron laser LCLS-II has two undulator beamlines; one Soft-X-Ray and another Hard-X-Ray. The Hard-X-Ray line uses two one-meter long X-band deflectors for beam diagnostics. We have designed; build; installed and commissioned another; 1.5 meter long X-band deflector in the Soft-X-Ray beam line. Both Hard-X-Ray and Soft-X-Ray deflectors share one klystron. RF power is transmitted from a 50 MW klystron to a tunnel in an overmoded circular waveguide and then directed to either of the deflectors using a remotely controlled RF switch. The power split ratio could be changed arbitrarily; and both deflectors could work simultaneously. In this article; we provide details on the development and commissioning of the new deflector.,,"[1] C. Behrens et al., ’Few-femtosecond time-resolved measurements of X-ray free-electron lasers’ Nat. Commun., vol. 5, no. 1, pp. 17, Apr. 2014, doi: 10.1038/ncomms4762.",https://proceedings.jacow.org/ibic2021/talks/wepp18_talk.pdf,False,https://proceedings.jacow.org/ibic2021/papers/wepp18.pdf,True,https://proceedings.jacow.org/ibic2021/posters/wepp18_poster.pdf,True,https://doi.org/10.18429/JACoW-IBIC2021-WEPP18,412
ibic2021,,WEPP19,Bunch Arrival-Time Measurement with Rod-Shaped Pickups on a Printed Circuit Board for X-Ray Free-Electron Lasers,B.E.J. Scheible; S. Mattiello; A. Penirschke; THM; Friedberg; Germany; W. Ackermann; H. De Gersem; TEMF; TU Darmstadt; Darmstadt; Germany; M.K. Czwalinna; H. Schlarb; DESY; Hamburg; Germany; The all-optical synchronization system implemented in the European X-ray free-electron laser (EuXFEL) is to receive an upgrade. The modifications are intended to allow operation with consistently high accuracy in a 1 pC mode; which is required for various user experiments. The lower charges; e.g. a factor of 20; lead to a reduced signal strength at the pickups and thus to a decreased resolution. A significant potential for improvement has been identified in a modified pickup structure and transmission network; which provide the transient voltage signal to subsequent parts of the synchronization system. One solution for a broadband pickup structure with short signal paths; large active surfaces and minimum aperture diameter could be achieved by connecting rod-shaped pickups to a combination network on a printed circuit board; which will be mounted in the beamline. In this contribution the proposed design is introduced and analyzed by electromagnetic field simulations.,,,https://proceedings.jacow.org/ibic2021/talks/wepp19_talk.pdf,False,https://proceedings.jacow.org/ibic2021/papers/wepp19.pdf,True,https://proceedings.jacow.org/ibic2021/posters/wepp19_poster.pdf,True,https://doi.org/10.18429/JACoW-IBIC2021-WEPP19,417
ibic2021,,WEPP20,Design of the Bunch-Length Monitors for the New Superconducting LCLS Linac,E.C. Aneke; A.S. Fisher; B.T. Jacobson; T.J. Maxwell; L. Sapozhnikov; SLAC; Menlo Park; California; USA; The LCLS x-ray free-electron laser at SLAC uses the third km of the original 3-km copper linac. We are now installing LCLS-II; a superconducting linac that replaces the first km. Two undulators; for hard and soft x rays; will be driven by bunches from either linac. One of the solutions developed at SLAC involves a pyroelectric detector; which converts the infrared emitted by the electron bunch into voltage by measuring fast changes in the temperature of the detecting crystal. Not only are the pyrodetectors used at SLAC but also a method with gap diodes. The radial electric field produced by the bunches leaks through a ceramic gap in the beampipe and is collected by a horn antenna and conveyed through a one millimeter waveguide. The waveguides act as a filter; only passing shorter wavelengths and a zero-bias Schottky diode measures the power. In both methods; a portion of the spectral energy emitted by the bunch is intercepted. After normalizing to differentiate between bunches of the same length with different charge; the detected signal is sensitive to only changes in bunch length. This poster discusses the mechanics and optics behind the LCLS-II bunch length monitors operations and plans for collaboration.,,,https://proceedings.jacow.org/ibic2021/talks/wepp20_talk.pdf,False,https://proceedings.jacow.org/ibic2021/papers/wepp20.pdf,True,https://proceedings.jacow.org/ibic2021/posters/wepp20_poster.pdf,True,https://doi.org/10.18429/JACoW-IBIC2021-WEPP20,422
ibic2021,,WEPP21,High Resolution Bunch Arrival Time Monitor Based on Sagnac Interferometer,SARI-CAS; Pudong; Shanghai; People’s Republic of China; Based on an sagnac interferometer detection scheme; a Bunch Arrival-time Monitor (BAM) is under study at Shanghai soft X-ray Free Electron Laser (SXFEL) to meet the high-resolution requirements of the measurement of bunch arrival time. In this paper; we present the basic working principle and the design of the BAM system.; ※ BibTeX; ※ LaTeX; ※ Text/Word; ※ RIS,,reference for this paper using,https://proceedings.jacow.org/ibic2021/talks/wepp21_talk.pdf,False,https://proceedings.jacow.org/ibic2021/papers/wepp21.pdf,False,https://proceedings.jacow.org/ibic2021/posters/wepp21_poster.pdf,False,https://doi.org/10.18429/JACoW-IBIC2021-WEPP21,
ibic2021,,WEPP23,Design of Wall Current Monitor in BRing at HIAF*,P.L. He; X.C. Kang; X.T. Liu; R.S. Mao; Z.G. Xu; Y.L. Yang; IMP/CAS; Lanzhou; People’s Republic of China; The Wall Current Monitor (WCM) can monitor the lon-gitudinal beam shape; beam stability; beam longi-tudinal emittance and intensity; which has been ap-plied widely in the laboratories of high-current proton accelerators. Many accelerators such as CERN-PS; CERN-CLIC; J-PARC and CSNS-RCS have designed different WCMs according to their respective accelera-tor beam parameters. In order to provide the high-intensity heavy-ion accelerator facility (HIAF)-BRing high-frequency system of with the intensity of each harmonic beam to compensate for wake field; and to observe the changes of the bundle length during the injection; acceleration; and extraction of the bundle; it is planned to place a WCM in HIAF-BRing. According to physical requirements; the lower limit of the WCM work-ing bandwidth is expected to reach 10kHz; and the upper limit can reach 100MHz. According to this bandwidth re-quirement; a WCM structure is designed; and its theoretical bandwidth is 2kHz~400MHz; which fully meets the de-mand. This article gives a detailed and comprehensive in-troduction to the overall design of this WCM; the selection of various components; design calculations and related simulation calcula-tions. At present; the WCM has com-pleted the pro-curement and processing of various compo-nents; while offline and online testing has not been carried out owing to time constraints. It is expected to be in-stalled on the Heavy Ion Research Facility in Lanzhou-Cooling Storage Ring (HIRFL-CSR) for online testing in August.,,,https://proceedings.jacow.org/ibic2021/talks/wepp23_talk.pdf,False,https://proceedings.jacow.org/ibic2021/papers/wepp23.pdf,True,https://proceedings.jacow.org/ibic2021/posters/wepp23_poster.pdf,True,https://doi.org/10.18429/JACoW-IBIC2021-WEPP23,425
ibic2021,,WEPP24,PSB H0-H⁻ Monitor Calibration and Commissioning,A. Navarro Fernandez; D. Belohrad; C. Bracco; E. Renner; F. Roncarolo; J. Tassan-Viol; CERN; Geneva; Switzerland; During the LHC Long Shutdown 2 (LS2); the H−,,,https://proceedings.jacow.org/ibic2021/talks/wepp24_talk.pdf,False,https://proceedings.jacow.org/ibic2021/papers/wepp24.pdf,True,https://proceedings.jacow.org/ibic2021/posters/wepp24_poster.pdf,True,https://doi.org/10.18429/JACoW-IBIC2021-WEPP24,429
