conference_code,session_name,paper_id,title,authors,institutions,abstract,presentation_url,presentation_available,paper_url,paper_available,poster_url,poster_available,doi,page_number
ibic2021,,TUPP17,Fast Measurements of the Electron Beam Transverse Size and Position on SOLEIL Storage Ring,M. Labat; A. Bence; N. Hubert; D. Pédeau; SOLEIL; Gif-sur-Yvette; France; E. Bründermann; M. Caselle; A. Ebersoldt; M.M. Patil; KIT; Karlsruhe; Germany; On SOLEIL storage ring; three beamlines are dedicated to electron beam diagnostics: two in the X-ray range and one in the visible range. The visible range beamline uses the synchrotron radiation which is emitted in one of the ring dipoles and further extracted by a slotted mirror operated in surf-mode (surfing on the upper part of the synchrotron layer). The radiation in the visible range is then transported towards a diagnostic hutch in the experimental hall; allowing electron beam imaging at the source point onto a standard CCD camera. In the perspective of prototyping works for the eventually forthcoming upgrade of SOLEIL; and for the on-going commissioning of a new Multipole Injection Kicker (MIK); we recently installed in this hutch two new branches ended by two new cameras (a KALYPSO system and a standard CMOS camera). We report in this paper the optimization we performed on the mirror mode of operation; as well as on spectral filtering; polarization selection; image plane location; fast acquisition tools; to improve the resolution and increase the speed of our initial transverse beam size measurement at source point.,,,https://proceedings.jacow.org/ibic2021/talks/tupp17_talk.pdf,False,https://proceedings.jacow.org/ibic2021/papers/tupp17.pdf,True,https://proceedings.jacow.org/ibic2021/posters/tupp17_poster.pdf,True,https://doi.org/10.18429/JACoW-IBIC2021-TUPP17,235
ibic2021,,TUPP18,Commissioning of the LHC Injectors BWS Upgrade,J. Emery; W. Andreazza; D. Belohrad; S. Di Carlo; J.C. Esteban Felipe; A. Goldblatt; D. Gudkov; A. Guerrero; S. Jackson; G.O. Lacarrere; M. Martin Nieto; A.T. Rinaldi; F. Roncarolo; C. Schillinger; R. Veness; CERN; Meyrin; Switzerland; A novel generation of fast Beam Wire Scanners (BWS); developed in the framework of the LHC Injectors Upgrade (LIU); has been recently deployed in the 3 LHC injector synchrotrons; accelerating protons from 160 MeV to 450 GeV; during the 2019-2020 LHC long shutdown. The monitors feature high precision motor controller; high resolution wire position monitoring and wide dynamic range secondary particles detectors. This contribution will document the commissioning of the 17 new systems during the accelerator complex restart in 2021; which is an exciting and challenging phase in the life cycle of an instrument. A summary of the so far achieved levels of reliability; reproducibility; detectors/DAQ bandwidth and overall accuracy; will be used to revisit the options for further improving the systems’ performance in the future.,,,https://proceedings.jacow.org/ibic2021/talks/tupp18_talk.pdf,False,https://proceedings.jacow.org/ibic2021/papers/tupp18.pdf,True,https://proceedings.jacow.org/ibic2021/posters/tupp18_poster.pdf,True,https://doi.org/10.18429/JACoW-IBIC2021-TUPP18,239
ibic2021,,TUPP19,Proposed Research with Microbunched Beams at LEA,A.H. Lumpkin; W. Berg; J.C. Dooling; Y. Sun; K.P. Wootton; ANL; Lemont; Illinois; USA; RadiaBeam; Santa Monica; California; USA; UCLA; Los Angeles; California; USA; Private Address; Silver Spring; USA; One of the advantages of relativistic electron beams with microbunching at UV to visible wavelengths is the potential to generate coherent optical transition radiation (COTR) at a metal foil for diagnostics purposes. A significant microbunching fraction of at least 10% is expected for the case of a seed laser at 257.5 nm copropagating with a 343-MeV electron beam through a modulator undulator (3.2 cm period) at the Linac Extension Area (LEA) at Argonne National Laboratory. Diagnostic plans have been made for the COTR based-characterization of the microbunched beam size (~100 microns); divergence (sub-mrad); microbunching fraction; spectrum; and bunch length (sub-ps); as well as coalignment of the laser pulse and electron beam as previously described**. For that case; COTR enhancements over OTR of more than seven million were calculated; and we expect a similar enhancement of coherent optical diffraction radiation (CODR). Thus; we propose the modification of the microbunching diagnostics station to support initial (CODR) experiments with beam transit through an aperture in a metal screen or near a metal edge at the second screen position of the interferometer. We would explore whether the coherence function for CODR provides a complementary beam size monitor and whether COTR and CODR interferences from the two interferometer screens provide divergence and pointing information.; **A.H. Lumpkin and D.W. Rule; Proceedings of FEL19; WEP041; Hamburg; Germany; Aug. 2019; https://JaCoW.org.,,,https://proceedings.jacow.org/ibic2021/talks/tupp19_talk.pdf,False,https://proceedings.jacow.org/ibic2021/papers/tupp19.pdf,True,https://proceedings.jacow.org/ibic2021/posters/tupp19_poster.pdf,True,https://doi.org/10.18429/JACoW-IBIC2021-TUPP19,244
ibic2021,,TUPP20,Electromagnetic Field Simulation and Optimization for the RCS IPM in CSNS,IHEP; Beijing; People’s Republic of China; W.L. Huang; J.L. Sun; IHEP CSNS; Guangdong Province; People’s Republic of China; Ionization profile monitors (IPMs) are widely used in high energy hadron accelerators for nondestructive beam profile measurement. The secondary particles generated by the ionization of the residual gas are collected and amplified by MCP; the output signal of which is sensitive to the influence of external disturbances dominated by the effect of space-charge. Thus the beam profile distortion should be studied primarily. Current profile correction method is mainly the commissioning of the electric field and magnetic field inside the RCS IPM to suppress the distortion. Here we verify the distortion process of the detected result through theoretical analysis and simulation; then optimize the configuration of electric field and magnetic field setting for the measurement of the CSNS-RCS IPM.; ※ BibTeX; ※ LaTeX; ※ Text/Word; ※ RIS,,liumy@ihep.ac.cn Corresponding author: huangwei@ihep.ac.cn reference for this paper using,https://proceedings.jacow.org/ibic2021/talks/tupp20_talk.pdf,False,https://proceedings.jacow.org/ibic2021/papers/tupp20.pdf,False,https://proceedings.jacow.org/ibic2021/posters/tupp20_poster.pdf,False,https://doi.org/10.18429/JACoW-IBIC2021-TUPP20,
ibic2021,,TUPP21,The HL-LHC Beam Gas Vertex Monitor - Performance and Design Optimisation Using Simulations,B. Kolbinger; H. Guerin; O.R. Jones; R. Kieffer; T. Lefèvre; A. Salzburger; J.W. Storey; R. Veness; C. Zamantzas; CERN; Meyrin; Switzerland; S.M. Gibson; H. Guerin; Royal Holloway; University of London; Surrey; United Kingdom; The Beam Gas Vertex (BGV) instrument is a novel non-invasive beam profile monitor and part of the High Luminosity Upgrade of the Large Hadron Collider (LHC) at CERN. Its aim is to continuously measure emittance and transverse beam profile throughout the whole LHC cycle; which has not yet been achieved by any other single device in the machine. The BGV consists of a gas target and a forward tracking detector to reconstruct tracks and vertices resulting from beam-gas interactions. The beam profile is inferred from the spatial distribution of the vertices; making it essential to achieve a very good vertex resolution. Extensive simulation studies are being performed to provide a basis for the design of the future BGV. The goal of the study is to ascertain the requirements for the tracking detector and the gas target within the boundary conditions provided by the feasibility of integrating it into the LHC; budget and timescale. This contribution will focus on the simulations of the forward tracking detector. Based on cutting-edge track and vertex reconstruction methods; key parameter scans and their influence on the vertex resolution will be discussed.,,,https://proceedings.jacow.org/ibic2021/talks/tupp21_talk.pdf,False,https://proceedings.jacow.org/ibic2021/papers/tupp21.pdf,True,https://proceedings.jacow.org/ibic2021/posters/tupp21_poster.pdf,True,https://doi.org/10.18429/JACoW-IBIC2021-TUPP21,249
ibic2021,,TUPP22,New CERN SPS Beam Dump Imaging System,S. Burger; E. Bravin; F. Roncarolo; A. Topaloudis; F.M. Velotti; E. Veyrunes; CERN; Geneva; Switzerland; As part of the LHC injector Upgrade (LIU); the CERN SPS is now equipped with a new Beam Dumping System (SBDS) designed to cope with the high power beams foreseen for the High Luminosity LHC (HL-LHC) era. Before reaching the dump; the proton beam (from 26 to 450 GeV) is vertically kicked and then diluted passing through a series of horizontal and vertical bumps. This prevents the dump damage; by reducing the power density per surface unit. The quality of each dump event must be recorded and verified and all parameters of the SBDS are logged and analysed from the so-called Post-Mortem dataset. An essential part of the verification is performed by a beam imaging system based on a Chromox screen imaged on a digital camera. The desired availability level (100%; to protect the dump) and the harsh radiation environment made the design extremely challenging. For example; it implied the need for a 17 m long optical line made of high-quality optical elements; a special camera shielding (to minimise single event upsets) and a generally careful design accounting for maintenance aspects; mainly related to expected high activation levels. After giving an overview of the whole imaging system design with details on the chosen layout and hardware; this paper will discuss the DAQ and SW architecture; including the automatic; on-line; image selection for validating every dump event. This will be complemented with experimental results demonstrating the performance and reliability achieved so far.,,,https://proceedings.jacow.org/ibic2021/talks/tupp22_talk.pdf,False,https://proceedings.jacow.org/ibic2021/papers/tupp22.pdf,True,https://proceedings.jacow.org/ibic2021/posters/tupp22_poster.pdf,True,https://doi.org/10.18429/JACoW-IBIC2021-TUPP22,254
ibic2021,,TUPP23,A Beam Diagnostics System of Electron Beam Melting for Additive Manufacturing,R. Kavak; E. Durna; M.G. Sanal; M.M. Sezerpresenter; ASELSAN A.S.; Ankara; Turkey; Electron beam melting has been used recently in additive manufacturing by various researchers. In those electron beam melting applications; the electron energy can be 60 to 100 keV; the beam current can be around 10 mA to 100 mA; and the beam spot size can be as small as 200 µm according to electron energy and beam current. Those parameters can result in very high beam power densities. The diagnostics of this powerful beam can be quite a problematic issue. As the electron beam current required for the application is quite similar to DC current; fast undestructive current measurement techniques for current beam profile and beam position are very limited in performance. Therefore; some destructive techniques to measure current and other beam properties are essential. As part of the beam diagnostics for electron beam melting application for additive manufacturing; the authors proposed a complete beam diagnostics system to measure the electron gun’s capabilities and associate electromagnetic lens systems. The following properties have been diagnosed as part of this research work: i) Beam Current; ii) Beam Spot size for enlarged and focused beams; iii) Scanning velocity of the deflected beam; iv) Profile of the beam. The authors proposed methods to measure focused beam spot size and deflected beam scanning velocity using Secondary Emission Grid Sensors. Moreover; the authors proposed a new technique to measure beam profile using consecutively placed several copper plates with beam guiding holes of various diameters. The proposed beam profile measurement method effectively determines the useful beam radius for metal powder melting properties specifically to additive manufacturing applications.,,,https://proceedings.jacow.org/ibic2021/talks/tupp23_talk.pdf,False,https://proceedings.jacow.org/ibic2021/papers/tupp23.pdf,True,https://proceedings.jacow.org/ibic2021/posters/tupp23_poster.pdf,True,https://doi.org/10.18429/JACoW-IBIC2021-TUPP23,259
ibic2021,,TUPP24,Development of a Profile Monitor Using OTR and Fluorescence for Injected Beams in J-PARC Main Ring,Y. Hashimoto; T.M. Mitsuhashi; T. Nakamura; T. Toyama; M. Uota; KEK; Tokai; Ibaraki; Japan; Mitsubishi Electric System & Service Co.; Ltd; Tsukuba; Japan; Y. Sato; M. Tejima; J-PARC; KEK & JAEA; Ibaraki-ken; Japan; A two-dimensional beam profile monitor having a high dynamic range approximately six orders of magnitude by using of Optical Transition Radiation (OTR) and fluorescence screens has been operated in the injection-beam transport (3-50BT) line of the J-PARC main ring (MR) [1]. This device contributes to the diagnosis of beam core and halo of intense proton beams before injection to MR; particularly measurement of beam cut effects by beam collimators located in upstream of the device is useful for beam shaping. We have been developing the second device to be installed into MR for diagnosing on injected beams. By using the both of first and second devices; beam core and halo can be diagnosed in different phases. Moreover; by using the second device; beam profiles including halo can be measured with circulating beams in almost twenty turns after injection. This measurement allows us to diagnose beam cut effect by the MR beam collimators by observing beam halo phase space distribution. Property tests of the device have been conducted at a test bench to install it in the ring. In the structure of the device; its longitudinal coupling impedance close to 10 Ω (by Z/n value) is an issue; especially due to high-frequency resonance in the in-vacuum optical system and the target section by beam wake fields. As a countermeasure; we have been studying the absorption of the power of such high frequency resonances up to about 1 GHz using SiC. We have been studying to keep the coupling impedance as low as possible. In a current simulation; we obtained the result that the impedance can be reduced to about 0.5 Ω or less. At the end of this fiscal year; we plan to conduct a characteristic test with SiC mounted device. In this presentation; we will discuss the characteristics of the developing device to be put in the ring and the simulation result of suppressing the coupling impedance.; [1] Y. Hashimoto; et al.; Proc. HB2014; East-Lansing; p.187-191.,,,https://proceedings.jacow.org/ibic2021/talks/tupp24_talk.pdf,False,https://proceedings.jacow.org/ibic2021/papers/tupp24.pdf,True,https://proceedings.jacow.org/ibic2021/posters/tupp24_poster.pdf,True,https://doi.org/10.18429/JACoW-IBIC2021-TUPP24,263
ibic2021,,TUPP25,Beam Profile Measurements Utilizing an Amplitude Modulated Pulsed Fiber Laser at PIP2IT,V.E. Scarpine; R. Campos; N. Eddy; B.J. Fellenz; T.W. Hamerla; J. Ruan; R.M. Thurman-Keup; Fermilab; Batavia; Illinois; USA; Université Paris-Saclay; CNRS/IN2P3; IJCLab; Orsay; France; Fermilab is undertaking the development of a new 800 MeV superconducting RF linac to replace its present normal conducting 400 MeV linac. The PIP-II linac consists of a warm front-end generating 2 mA of 2.1 MeV H− followed immediately by a series of superconducting RF cryomodules to 800 MeV. To limit the potential damage to the superconducting RF cavities; PIP-II will utilize laser-based monitors to obtain beam profiles via photoionization. This paper will present the results of transverse and longitudinal beam profile measurements using a prototype profile monitor that was tested with 2.1 MeV H− beam at the PIP-II Injector Test (PIP2IT) accelerator. This prototype profile monitor utilizes a high repetition rate fiber laser and fiber optic transport into the PIP2IT enclosure. In addition; results will be shown of narrow-band electron detection from amplitude modulated laser pulses.,,,https://proceedings.jacow.org/ibic2021/talks/tupp25_talk.pdf,False,https://proceedings.jacow.org/ibic2021/papers/tupp25.pdf,True,https://proceedings.jacow.org/ibic2021/posters/tupp25_poster.pdf,True,https://doi.org/10.18429/JACoW-IBIC2021-TUPP25,268
ibic2021,,TUPP28,Real-Time Beam Detection and Tracking From Pinhole Imaging System Based on Machine Learning,A.A. Nosych; U. Iriso; ALBA-CELLS Synchrotron; Cerdanyola del Vallès; Spain; At ALBA Synchrotron each of the two in-air pinhole imaging systems is able to see several beam spots at once due to specific pinhole grid with 3x3 holes placed in the path of the X-ray fan. Each beam image has its own properties; such as source pinhole aperture size; its Point Spread Function (PSF) and copper filter thickness; all of which impact the electron beam size calculation. Until now; these parameters were applied manually to the pinhole device servers for numerical image analysis; so this semi-manual beam size calculator is subject to frequent adjustments and human monitoring. This study looks at feasibility of training and pointing an Artificial Neural Network (ANN) at image stream coming from pinhole cameras in real time; track all detected beam spots and analyze them; with the end goal to automate the whole pinhole beam image processing.,,,https://proceedings.jacow.org/ibic2021/talks/tupp28_talk.pdf,False,https://proceedings.jacow.org/ibic2021/papers/tupp28.pdf,True,https://proceedings.jacow.org/ibic2021/posters/tupp28_poster.pdf,True,https://doi.org/10.18429/JACoW-IBIC2021-TUPP28,272
ibic2021,,TUPP30,Fast Scanning Diamond Detector for Electron Beam Profile Monitoring,Applied Diamond; Inc.; Wilmington; Delaware; USA; S. Bellavia; J.C. Brutus; R.J. Michnoff; T.A. Miller; P. Thieberger; BNL; Upton; New York; USA; Recently new high energy electron cooling beam projects; CeC and LEReC; were proposed at Brookhaven National Laboratory as part of a future electron-ion collider. Efficient electron cooling requires a high quality; high power electron beam with tight parameters (energy and space trajectory). In order to achieve and maintain the required parameters and stability of the electron beam; its parameters have to be continuously monitored and feedback control has to be developed. However; existing detectors are not suitable for invasive profile measurements of powerful continuous wave (CW) electron beams. As a result; the beam profile of powerful CW electron beams is currently monitored in low repetition pulsed mode and assumed to remain the same in CW mode. The first prototype of a fast scanning diamond beam profile detector (DBPD) suitable for invasive high power CW electron beam core profile measurements in transmittance mode was developed. It consists of a multi-strip solid state diamond detector to scan with high speed (up to 1 m/s) and precision (about 5 um) through the core of an electron beam. The diamond sensor was made from a thin pc-CVD diamond plate with highly B-doped CVD diamond conductive strips. Transient currents from the multi-strip detector were measured with fast digitizing electrometers. Successful operation of the DBPD was demonstrated for pulsed (5 Hz) and CW (78 kHz) CeC beams; including the detector’s ability to withstand a 20 sec insertion into the CW CeC beam core. The X-Y beam spatial profile was measured in one scan. Thermal modeling demonstrated a manageable thermal impact even from a relatively long (up to 2 min) insertion of the diamond sensor into the CW CeC core. Electrical impedance modeling of the detector and vacuum chamber assembly demonstrated minimal impact on beam line impedance with diamond sensor insertion.,,,https://proceedings.jacow.org/ibic2021/talks/tupp30_talk.pdf,False,https://proceedings.jacow.org/ibic2021/papers/tupp30.pdf,True,https://proceedings.jacow.org/ibic2021/posters/tupp30_poster.pdf,True,https://doi.org/10.18429/JACoW-IBIC2021-TUPP30,276
ibic2021,,TUPP31,Design and Numerical Investigations of Scintillation Beam Loss Monitor for PolFEL,R. Kwiatkowski; M. Krakówiak; S. Mianowski; R. Nietubyc; J. Szewiński; NCBJ; Świerk/Otwock; Poland; NSRC SOLARIS; Kraków; Poland; The Beam Loss Monitor (BLM) system is used mainly for machine protection and is particularly important in the case of high energy density of accelerated beam; when such a beam could lead to serious damages in the case of uncontrolled loss. The Polish Free Electron Laser; PolFEL; will be equipped with linear superconducting accelerator operating in continuous wave regime. The maximum energies of electrons will be equal to about 180 MeV; or 270 MeV for 2nd phase of operation. The beam charge; pulse width and repetition rate will be in the range of 100-250 pC; 0.1-10 ps and 50 kHz respectfully. Operational parameters of PolFEL linear accelerator induced needs to install and operate the BLM system. One of the type of BLMs is based on the scintillation detectors. Such a system is characterized by; e.g.: high sensitivity; fast response; broad gain range and relatively low cost. Another important feature of such setup is the option of checking the operation of detector by using the integrated LED. The BLM concept for PolFEL is based on several scintillation probes placed along the linear accelerator. The paper reports on numerical investigation of electron and X-ray radiation induced during fast electron losses. We also present design of BLM detectors and results of first tests of a prototype on the linear electron accelerator at Solaris research centre.,,,https://proceedings.jacow.org/ibic2021/talks/tupp31_talk.pdf,False,https://proceedings.jacow.org/ibic2021/papers/tupp31.pdf,True,https://proceedings.jacow.org/ibic2021/posters/tupp31_poster.pdf,True,https://doi.org/10.18429/JACoW-IBIC2021-TUPP31,281
ibic2021,,TUPP32,The Beam Loss Monitoring System after LHC Injectors Upgrade at CERN,M. Saccani; E. Calvo Giraldo; W. Viganò; C. Zamantzas; CERN; Geneva; Switzerland; The LHC Injector Upgrade project aims to increase the brightness of the beams available and improve the efficiency of the whole accelerator chain. The Beam Loss Monitoring (BLM) system is a key element of CERN’s accelerator instrumentation for beam optimisation and machine protection by producing continuous and reliable beam loss measurements while ensuring safe operation. The new BLM system for the LHC Injectors aimed to provide faster measures with a higher dynamic range; to install more detectors along the beamlines and to give the operator more flexible use. A review will be given on the versatility provided by the system to cover requirements from various accelerators and their transfer lines; focusing on the measurements and the operational scenarios.,,,https://proceedings.jacow.org/ibic2021/talks/tupp32_talk.pdf,False,https://proceedings.jacow.org/ibic2021/papers/tupp32.pdf,True,https://proceedings.jacow.org/ibic2021/posters/tupp32_poster.pdf,True,https://doi.org/10.18429/JACoW-IBIC2021-TUPP32,285
ibic2021,,TUPP33,Beam Loss Signal Calibration for the LHC Diamond Detectors During Run 2,S. Morales Vigo; E. Calvo Giraldo; E. Effinger; B. Salvachuapresenter; C. Zamantzas; CERN; Geneva; Switzerland; C.P. Welsch; J. Wolfenden; The University of Liverpool; Liverpool; United Kingdom; Chemical Vapour Deposition (CVD) diamond detectors can be used as fast beam loss monitors in particle accelerators. In the Large Hadron Collider (LHC) at CERN; they are installed in the betatron collimation region; a high-radiation environment. In addition to their high-radiation tolerance; their main advantage is a time resolution of 1 ns which makes possible not only turn-by-turn; but also bunch-by-bunch loss measurements. An analysis of the LHC diamond beam loss monitor signals recorded during the last months of Run 2 (September 2018-November 2018) is presented with the aim of obtaining a signal-to-beam loss calibration.,,,https://proceedings.jacow.org/ibic2021/talks/tupp33_talk.pdf,False,https://proceedings.jacow.org/ibic2021/papers/tupp33.pdf,True,https://proceedings.jacow.org/ibic2021/posters/tupp33_poster.pdf,True,https://doi.org/10.18429/JACoW-IBIC2021-TUPP33,290
ibic2021,,TUPP34,"Methodology, Characterisation and Results from the Prototype Beam Loss Monitoring ASIC at CERN",F. Martina; L. Giangrande; J. Kaplon; P.V. Leitao; C. Zamantzas; CERN; Geneva 23; Switzerland; J.W. Bradley; F. Martina; C.P. Welsch; The University of Liverpool; Liverpool; United Kingdom; F. Martina; C.P. Welsch; Cockcroft Institute; Warrington; Cheshire; United Kingdom; The characterisation of novel beam loss monitoring front-end converters; based on radiation-hardened application-specific integrated circuits (ASIC); is undergoing at CERN. An effective performance analysis of the newly developed ASICs plays a key role in their candidacy for the future installation in the HL-LHC complex. This work introduces the latest test-bed architecture; used to characterise such a device; together with the variety of audits involved. Special focus is given on the verification methodology of data acquisition and measurements; in order to allow a detailed study of the conversion capabilities; the evaluation of the device resolution and the linearity response. Finally; the first results of post-irradiation measurements are also reported.,,,https://proceedings.jacow.org/ibic2021/talks/tupp34_talk.pdf,False,https://proceedings.jacow.org/ibic2021/papers/tupp34.pdf,True,https://proceedings.jacow.org/ibic2021/posters/tupp34_poster.pdf,True,https://doi.org/10.18429/JACoW-IBIC2021-TUPP34,294
