conference_code,session_name,paper_id,title,authors,institutions,abstract,presentation_url,presentation_available,paper_url,paper_available,poster_url,poster_available,doi,page_number
pcapac2012,,THIA01,Trombay Programmable Logic Controller TPLC-32,BARC; Mumbai; India; Until recently Computer Based Safety and Safety-related Control and Instrumentation systems in Indian NPPs and other nuclear utilities were custom built embedded systems. This approach needs enormous development and verification & validation efforts. Further requirement change management during plant operation becomes intricate due to dependence on custom System Designer. Current scenario worldwide is development of such systems using Qualified Configurable; Programmable Platforms (PLCs) offering several advantages over custom built approach. Trombay Programmable Logic Controller TPLC-32 is one such qualified platform designed and developed in-house by Reactor Control Division; BARC. It facilitates configurable and programmable environment to build safety and safety related Control and Instrumentation Systems. TPLC-32 hardware is designed around 32 bit processor based in-house developed Single Board Computer on VME bus and intelligent Input/Output modules on proprietary I/O bus. The hardware design is carried out as per IEC60987 standard. The Platform software development is carried out following well documented; well controlled; fully reviewable software engineering process based on AERB SG-D25 guide and IEC 80880 standard including verification and validation by an independent team. The Application Development Environment (ADE) software package of TPLC-32 facilitates defining complete system configuration and application development in the form of function block diagrams based on IEC 61131-3 standards. Platform architecture; development process; platform salient features and C&I system developed using TPLC-32 platform will be discussed in the talk.,,,https://proceedings.jacow.org/pcapac2012/talks/thia01_talk.pdf,True,https://proceedings.jacow.org/pcapac2012/papers/thia01.pdf,False,https://proceedings.jacow.org/pcapac2012/posters/thia01_poster.pdf,False,https://doi.org/10.18429/JACoW-PCAPAC2012-THIA01,
pcapac2012,,THIA02,Current Status and Upgrade Plan of the Data-Acquisition System at SACLA,"T. Sugimoto; A. Amselem; Y. Furukawa; T. Hirono; Y. Joti; T.K. Kameshima; A. Kiyomichi; T. Ohata; M. Yamaga; JASRI/SPring-8; Hyogo-ken; Japan; T. Abe; R. Tanaka; RIKEN SPring-8 Center; Innovative Light Sources Division; Hyogo; Japan; T. Hatsui; A. Tokuhisa; RIKEN SPring-8 Center; Sayo-cho; Sayo-gun; Hyogo; Japan; This paper presents current status and upgrade plan of a data-acquisition (DAQ) system for SACLA user experiments. The X-ray Free-Electron Laser facility in SPring-8; SACLA; has achieved first SASE lasing in June 2011; and has delivered X-ray laser beams to users from March 2012 [1]. For the user experiments at SACLA; a dedicated DAQ system has been developed. The DAQ system is currently capable to operate with maximum 10 sensors of multiport Charge-Coupled Device (MPCCD) for X-ray detection. With this configuration; the MPCCD generates 10 MBytes data per accelerator beam shot; which is equivalent to 5 Gbps data rate at 60 Hz beam repetition. During the first experimental period from March to July 2012; the DAQ system carried out 25 experimental proposals that covered atom; molecular and optical physics; ultrafast science; material science; and structure biology. In this paper; we present an overview of the DAQ system with special emphasis on the high-speed data cache; and data visualization by on-site PC clusters. An upgrade plan of the DAQ storage more than 3 PBytes and the on-line data-analysis with the off-site 10 PFlops supercomputer (""K computer"") are also discussed.; [1] T. Ishikawa et al.; ""A compact X-ray free-electron laser emitting in the sub-angstrom region""; Nature Photonics 6; 540-544 (2012).",,,https://proceedings.jacow.org/pcapac2012/talks/thia02_talk.pdf,True,https://proceedings.jacow.org/pcapac2012/papers/thia02.pdf,True,https://proceedings.jacow.org/pcapac2012/posters/thia02_poster.pdf,False,https://doi.org/10.18429/JACoW-PCAPAC2012-THIA02,90
pcapac2012,,THIA03,The IUAC Tandem-LINAC Control System,A. Kumar; B.K. Sahu; K. Singh; IUAC; New Delhi; India; The 16MV Tandem Van de Graff accelerator at IUAC is one of the earliest machines to go for a PC based control system. The PDP11; supplied with it; was replaced by an IBM PC running DOS before the accelerator was commissioned in 1989. The present system; commissioned in 1997 to include the LINAC; runs on a network of PCs under the GNU/Linux operating system. We have followed a distributed approach by grouping the signals; around 1000 in total; based on the location. Each group is connected to a server computer; by hardware interfaces like CAMAC; VME and custom hardware. The signals connected to each server PC are handled by a server program and they are accessible to the outside world; over a TCP/IP network; using a unique identifier consisting of a Label; Function and Unit. The features like a user interface; monitoring for alarm conditions; data logging and partial automation are handled by several client programs; communicating to multiple servers to access the hardware. The communication is done by passing a message packet and waiting for the reply. The message consists of the unique signal identifier and commands for setting/reading analog and digital parameter values. The development of the control system also resulted in low cost equipment for science education[1]. It also helped further development of the control system by additions like client programs in Python language. This feature enabled accelerator users to write simple scripts for tasks like setting the LINAC resonator parameters based on calculations; writing routines for partial automation etc. The system is cost effective; scalable and simple. It has shown very high reliability and ease of use during the past two decades of operation.,,[1] http://expeyes.inhttp://expeyes.in,https://proceedings.jacow.org/pcapac2012/talks/thia03_talk.pdf,True,https://proceedings.jacow.org/pcapac2012/papers/thia03.pdf,True,https://proceedings.jacow.org/pcapac2012/posters/thia03_poster.pdf,False,https://doi.org/10.18429/JACoW-PCAPAC2012-THIA03,94
pcapac2012,,THCA04,An Update on ConSys Including a New LabVIEW FPGA Based LLRF System,T. Worm; J.S. Nielsen; ISA; Aarhus; Denmark; ConSys; the Windows based control system for ASTRID and,,,https://proceedings.jacow.org/pcapac2012/talks/thca04_talk.pdf,True,https://proceedings.jacow.org/pcapac2012/papers/thca04.pdf,True,https://proceedings.jacow.org/pcapac2012/posters/thca04_poster.pdf,False,https://doi.org/10.18429/JACoW-PCAPAC2012-THCA04,97
pcapac2012,,THCA05,"PLC-based Control System for 10 MeV Linear Accelerator at EBC Kharghar, BARC",A.S. Chachondia; B.B. Biswas; D.P. Chakravarthy; G. Ganesh; L.M. Gantayet; K.C. Mittal; M.K. Mukesh Kumar; M.B. Patil; R.K. Patil; BARC; Mumbai; India; Currently the 10MeV Linac is being used for different research applications and industrial use. The control system in operation was developed using CAMAC based DAS; backed by Hard-wired Interlock System. It is proposed to replace the CAMAC system with a state-of-the-art indigenously developed PLC that is verified to the level of a Class IB computer-based system used in nuclear power plants. A PLC node comprises of two VME bus based CPU boards (PowerPC MPC7447; 600MHz) working in redundant mode. The Inputs and Outputs are common to both CPUs. The intelligent I/O boards are hot swappable. The PLC hardware and software has undergone rigorous verification and validation. A user-friendly development environment is provided to the process engineer for building the application using pre-defined function blocks. The LCS developed using PLC is to be used for operating the Linac irradiation facility; remotely as well as locally in a fail-safe mode; with sequential start-up and sequential shut-down. Apart from system status monitoring; data archiving; alarm generation and setpoint adjustments; it shall monitor the important parameters and trip the GM HV; KM HV and EG PS on fault conditions.,,,https://proceedings.jacow.org/pcapac2012/talks/thca05_talk.pdf,True,https://proceedings.jacow.org/pcapac2012/papers/thca05.pdf,True,https://proceedings.jacow.org/pcapac2012/posters/thca05_poster.pdf,False,https://doi.org/10.18429/JACoW-PCAPAC2012-THCA05,100
pcapac2012,,THCA06,Status of the Ultra Fast Tomography Experiments Control at ANKA,D. Haas; A. Cecilia; A. Kopmann; W. Mexner; H. Pasic; T. Spangenberg; P. Vagovic; M. Vogelgesang; KIT; Eggenstein-Leopoldshafen; Germany; B.M. Balzer; S. Cilingaryan; Karlsruhe Institute of Technology; Eggenstein-Leopoldshafen; Germany; X-ray imaging permits spatially resolved visualization of the 2D and 3D structure in materials and organisms which is crucial for the understanding of their properties. Additional resolution in the time domain gives insight in the temporal structure evolution and thus access to dynamics of processes allowing to understand functionality of devices and organisms and to optimize technological processes. Such time resolved dynamic analyses ofμsize structures became now possible by the new ultrafast tomography at the TopoTomo beamline of the synchrotron light source ANKA. At TopoTomo the whole experimental workflow has been significant improved in order to decrease the total duration time of a tomography experiment in a range of minutes. To aim the goal of a Tango based control system for ultra fast tomography with a data throughput of several 100 MB/s; detectors and computing infrastructure have been optimized. Multi GPU based computing allows a high speed data processing by using a special reconstruction scheme. Furthermore data management infrastructure will allow a life cycle management of data sets accumulating to several TByte/day.,,,https://proceedings.jacow.org/pcapac2012/talks/thca06_talk.pdf,True,https://proceedings.jacow.org/pcapac2012/papers/thca06.pdf,True,https://proceedings.jacow.org/pcapac2012/posters/thca06_poster.pdf,False,https://doi.org/10.18429/JACoW-PCAPAC2012-THCA06,103
pcapac2012,,THCB01,HyperArchiver: an Evolution of EPICS Channel Archiver,M. del Campo; I. Arredondo; ESS Bilbao; Zamudio; Spain; M.G. Giacchini; L.G. Giovannini; INFN/LNL; Legnaro (PD); Italy; University of the Basque Country; Faculty of Science and Technology; Bilbao; Spain; Data storage is a primary issue in any research facility. In the EPICS middleware based accelerator community; Channel Archiver has been always considered the main reference. It works with Oracle and MySQL; probably the best well known relational databases. However; demanding requirements at minimum costs have fostered the development of a wide range of alternatives; like protocol buffers (SLAC); MSDPlus (Consorzio RFX); SciDB (BNL) or Hypertable (IFNF). This document launches a tool called HyperArchiver; which was firstly developed at IFNF (Italy) and eventually customised by ESS Bilbao (Spain). Based on a NoSQL database named Hypertable; it focuses on large data sets management with maximum scalability; reliability and performance. Besides the update and further customization made at ESS Bilbao; HyperArchiver is presented with a set of GUIs; in order to provide an easy use and integration with any general control system. A LabVIEW VI and two cross-platform PyQt GUIs for both Hypertable data retrieval and HyperArchiver control have been developed and successfully tested at ESS Bilbao.,,,https://proceedings.jacow.org/pcapac2012/talks/thcb01_talk.pdf,False,https://proceedings.jacow.org/pcapac2012/papers/thcb01.pdf,True,https://proceedings.jacow.org/pcapac2012/posters/thcb01_poster.pdf,False,https://doi.org/10.18429/JACoW-PCAPAC2012-THCB01,106
pcapac2012,,THCB02,EPICS MySQLArchiver - Integration Between EPICS and MySQL,A. Roy; R.B. Bhole; S. Pal; D. Sarkar; VECC; Kolkata; India; The performance evaluation and analysis of inter-system dependency of the various subsystems of the Superconducting Cyclotron demand a well configured data logging; archiving and historic analysis facility for massive number of control parameters along with on-line failure analysis facility of every system. EPICS is used as development architecture of the control system of these systems with MySQL used as database for large amount of relational data management. This combination requires integration between EPICS and MySQL server. For this purpose; MySQLArchiver as an EPICS Extension is developed for data logging and archiving of control parameters into MySQL database. This extension also provides a web based tool for online monitoring of control parameters and historic analysis of archived data. This paper describes the software architecture; implementations; as well as method of configuration for any other EPICS based control system as a utility. This facility is also elaborated with examples; web page views and experiences of deploying it in SCC.,,,https://proceedings.jacow.org/pcapac2012/talks/thcb02_talk.pdf,True,https://proceedings.jacow.org/pcapac2012/papers/thcb02.pdf,True,https://proceedings.jacow.org/pcapac2012/posters/thcb02_poster.pdf,False,https://doi.org/10.18429/JACoW-PCAPAC2012-THCB02,109
pcapac2012,,THCB03,Using Memcached as Real-time Database in the SPARC Control System,E. Pace; G. Di Pirro; INFN/LNF; Frascati (Roma); Italy; The first implementation of the SPARC control system was based on a distributed TCP/IP data server: each front-end CPU had its own server to distribute data to the console. We decided to move the system to a NoSQL key value database. We decided to use an open source database Memcached. This is a database that is high performance key-value cache optimized for speed only. For this reason we could use Memcached not for storing data; but as a channel of communication between front-end processors and consoles. The first object that we have installed is the camera system. We chose this class of elements because the amount of data is high; cameras are at least 640x480 with 8 bit. In this first installation we made some speed test: we increased the speed transfer and the data transfer is now independent from the number of high level CPUs that are using the same image. The success of this installation convinced us to bring the entire data transfer of SPARC control system to use Memcached as data server.,,,https://proceedings.jacow.org/pcapac2012/talks/thcb03_talk.pdf,True,https://proceedings.jacow.org/pcapac2012/papers/thcb03.pdf,True,https://proceedings.jacow.org/pcapac2012/posters/thcb03_poster.pdf,False,https://doi.org/10.18429/JACoW-PCAPAC2012-THCB03,112
pcapac2012,,THIB04,"Control System Interoperability, an Extreme Case: Merging DOOCS and TINE",P. Duval; A. Aghababyan; O. Hensler; K. Rehlich; DESY; Hamburg; Germany; In controlling large facilities one is rarely able to manage all controllable elements via a common control system framework. When the standard framework must deal with numerous 'foreign' elements it is often worthwhile to adopt a new framework; rather than 'disguising' such components with a wrapper. The DOOCS[1] and TINE[2] control system frameworks fall into this scenario. Both systems have a device server oriented view; which made early mapping attempts (~2001) immediately successful. Transparent communication; however; is but a small (albeit important) part of the control system merger currently taking place. Both systems have well-established central services (e.g. archiving and alarms); and possess a general 'culture' which might dictate to a large extent how something is actually 'done'. The long term goal of the DOOCS/TINE merger is to be able to make use of any tool; from either the DOOCS or TINE toolbox; on any control system element. We report here on our progress to date; concentrating on the REGAE accelerator; and plans for the XFEL accelerator (to begin commissioning in 2015).,,[1] http://doocs.desy.de  [2] http://tine.desy.de,https://proceedings.jacow.org/pcapac2012/talks/thib04_talk.pdf,True,https://proceedings.jacow.org/pcapac2012/papers/thib04.pdf,True,https://proceedings.jacow.org/pcapac2012/posters/thib04_poster.pdf,False,https://doi.org/10.18429/JACoW-PCAPAC2012-THIB04,115
pcapac2012,,THIC01,Tango for Experiment Control,J.M. Meyer; L. Claustre; A. Götz; S. Petitdemange; O. Svensson; ESRF; Grenoble; France; A. Buteau; M. Ounsy; SOLEIL; Gif-sur-Yvette; France; CELLS-ALBA Synchrotron; Cerdanyola del Vallès; Spain; The Tango[1] control system framework contains the communication bus with the standard communication modes as well as the basic hardware access modules; GUI tools and development kits; services and bindings to commercial products to set up a control system. Tango was developed by several synchrotron light sources that have to support not only the accelerator complex but also a lot of experimental end stations. For synchrotron experiments we have to control the whole process from basic hardware access over data taking to data analysis. This paper describes in the first part the special features of Tango allowing flexible experiment control. The dynamic configuration; the rapid hardware interface development and the sequencing and scanning framework are some examples. The second part gives an overview of some packages developed in the Tango community for experiment control: A HKL library for diffraction computation and diffractometer control; a library to control 2D detectors and a data analysis workbench with workflow engine for on-line and off-line data analysis. These packages are not part of Tango and can be used with other control systems.,,[1] http://www.tango-controls.org/,https://proceedings.jacow.org/pcapac2012/talks/thic01_talk.pdf,True,https://proceedings.jacow.org/pcapac2012/papers/thic01.pdf,True,https://proceedings.jacow.org/pcapac2012/posters/thic01_poster.pdf,False,https://doi.org/10.18429/JACoW-PCAPAC2012-THIC01,118
pcapac2012,,THCC02,Controls Architecture for the Diagnostic Devices at the European XFEL,DESY; Hamburg; Germany; The X-ray laser is an 3.4-km-long facility which runs essentially underground and comprises three sites above ground. For controlling all diagnostic devices like toroids; BPMs or BLMs; it is planned to use the new MTCA.4 crate standard instead of VME. ATCA is an emerging standard from the Telecom Industry and adapted with the PICMG MTCA.4 branch for physics usage. The communication on the backplane utilizes the high speed serial PCIe communication plus precise clock lines and SATA interface. The MTCA.4 hardware supports hot-plug mechanism and remote monitoring and control via IPMI over Ethernet. Some of the diagnostics will be connected to 16Bit ADCs with up to 125Mhz sampling rate from Struck company or to an internal DESY development call,,,https://proceedings.jacow.org/pcapac2012/talks/thcc02_talk.pdf,True,https://proceedings.jacow.org/pcapac2012/papers/thcc02.pdf,True,https://proceedings.jacow.org/pcapac2012/posters/thcc02_poster.pdf,False,https://doi.org/10.18429/JACoW-PCAPAC2012-THCC02,121
pcapac2012,,THCC03,PC Based Real Time Data Exchange on 10GbE Optical Network Using RTOS,R.P. Gupta; H.D. Dave; IPR; Bhat; Gandhinagar; India; The traditional embedded systems are expensive to adapt to the new requirements. The Personal Computer based systems offer alternatives for industrial controls. It reduces the capital cost and provides a solution for multiple applications. However; limitations of PC based controls should be resolved. PC operates on a non-real time OS with non-deterministic response to real time events and data. The real-time pre-emptive kernel for Linux uses Xenomai for better solution. A real-time 10GbE data exchange optical network using Xenomai extension for Linux is demonstrated. The hardware based on Intel_82599 10GbE Ethernet PCIe network card supports,"Funding: This work is supported by research grant No. BRFST/NFP/2012/Feb/N/05; dated 5th April, 2012, under the National Fusion Programme of the Board for research in Fusion Science & Technology at IPR",,https://proceedings.jacow.org/pcapac2012/talks/thcc03_talk.pdf,True,https://proceedings.jacow.org/pcapac2012/papers/thcc03.pdf,True,https://proceedings.jacow.org/pcapac2012/posters/thcc03_poster.pdf,False,https://doi.org/10.18429/JACoW-PCAPAC2012-THCC03,124
pcapac2012,,THCD04,"Master Slave Topology Based, Remotely Operated, Precision X-ray Beam Profiler and Placement System for High Pressure Physics Experiment at Indus-2 Beam Line",H.S. Vora; S.K. Deb; V.K. Dubey; T. Ganguli; C.P. Navathe; P. Saxena; I. Singh; M.N. Singh; A.K. Sinha; A. Upadhyay; RRCAT; Indore (M.P.); India; JNCASR; Bangalore; India; RRCAT has commissioned a beam-line on Indus-2 synchrotron facility for carrying out Angle Dispersive X-ray Diffraction Measurement. A typical high pressure measurement is carried out by placing the sample in the Diamond Anvil Cell (DAC) with the sample located in a region of beam diameter within 50-100 μm. The X-Ray beam has to pass through the DAC to ensure maximum illumination of the sample with the X-Rays. An X-Y beam scanner/locater cum placement system is developed; which scans an area of 10 x 10 mm2 with resolution of 10 to 100 μm in rough scan mode and fine scans selected area with programmable resolution of 2.5 to 25 μm. The scanner acts as slave to the PC in which master GUI grabs the data on serial port and plots the image of X-ray beam. It also analyzes and detects the coordinate with maximum intensity. Thus the DAC can be placed at the desired location with an accuracy of 2.5μm anywhere within 10 x 10 mm2; for performing experiment. Developed system takes only ~5 minutes to search the beam and a few seconds to place DAC at any the desired location within the scanned area.,,,https://proceedings.jacow.org/pcapac2012/talks/thcd04_talk.pdf,True,https://proceedings.jacow.org/pcapac2012/papers/thcd04.pdf,True,https://proceedings.jacow.org/pcapac2012/posters/thcd04_poster.pdf,False,https://doi.org/10.18429/JACoW-PCAPAC2012-THCD04,128
pcapac2012,,THCD05,A  Flexible  and Testable Software Architecture: Applying Presenter First to a Device Server for the DOOCS Accelerator Control System of the European XFEL,A. Beckmann; S. Karabekyan; J. Pflüger; XFEL. EU; Hamburg; Germany; Presenter First (PF) uses a variant of Model View Presenter design pattern to add implementation flexibility and to improve testability of complex event-driven applications. It has been introduced in the context of GUI applications; but can easily be adapted to server applications. This paper describes how Presenter First methodology is used to develop a device server for the Programmable Logic Controls (PLC) of the European XFEL undulator systems; which are Windows PCs running PLC software from Beckhoff. The server implements a ZeroMQ message interface to the PLC allowing the DOOCS accelerator control system of the European XFEL to exchange data with the PLC by sending messages over the network. Our challenge is to develop a well-tested device server with a flexible architecture that allows integrating the server into other accelerator control systems like EPICS.,,,https://proceedings.jacow.org/pcapac2012/talks/thcd05_talk.pdf,True,https://proceedings.jacow.org/pcapac2012/papers/thcd05.pdf,True,https://proceedings.jacow.org/pcapac2012/posters/thcd05_poster.pdf,False,https://doi.org/10.18429/JACoW-PCAPAC2012-THCD05,131
pcapac2012,,THCD06,Design  Development and Analysis of a Comprehensive Open Source System for Proactive Management of Security Aspects of a Control Network,S.S. Tomar; S.N. Chaudhari; H.S. Chouhan; V.K. Maurya; A. Rawat; RRCAT; Indore (M.P.); India; Control networks can only be assumed to be secure; when they work in complete isolation and all communication ports of the constituent control devices are disabled and are closely monitored for security breaches on 24X7 basis. With more and more control systems being developed using Common Out of The Shelf (COTS) computers; using windows OS; the chances of virus attacks on such control networks is extremely large. Handling zero day virus attacks or virus attacks with unknown cure; is a serious challenge for control network administrators. Another important aspect; somehow related to the security of the control network; is the rising temperatures of the control devices; because of 24X7 operation. All this is difficult to handle manually or using disconnected systems and hence there is a requirement of a comprehensive system which can do all this automatically. In this paper we will discuss the various security related parameters of the control networks and then present a simplified design followed by development details of a comprehensive open source system for proactive management of the security aspects of the control network.,,,https://proceedings.jacow.org/pcapac2012/talks/thcd06_talk.pdf,True,https://proceedings.jacow.org/pcapac2012/papers/thcd06.pdf,True,https://proceedings.jacow.org/pcapac2012/posters/thcd06_poster.pdf,False,https://doi.org/10.18429/JACoW-PCAPAC2012-THCD06,134
