conference_code,session_name,paper_id,title,authors,institutions,abstract,presentation_url,presentation_available,paper_url,paper_available,poster_url,poster_available,doi,page_number
pcapac2012,,WEKA01,The CSS Story,M.R. Clausen; J. Hatje; J. Penning; DESY; Hamburg; Germany; Control System Studio (CSS) is designed to serve as an integration platform for engineering and operation of todays process controls as well as machine controls systems. Therefore CSS is not yet another replacement of existing operator interfaces (OPI) but a complete environment for the control room covering alarm management; archived data displays diagnostic tools and last not least operator interfaces. In addition we decided to use CSS as the platform for the whole engineering chain configuring EPICS based process control databases; configuring and managing the I/O; editing state notation programs; configuring role based access rights and many more. Due to the ease of use of CSS as an Eclipse based product; we decided to use the CSS core also for all our stand alone processes. This helped us to reduce the diversity of running products/ processes and simplified the management. In this presentation we will describe our experience with CSS over the last two years. How we managed the transition from old displays to new ones; how we changed our alarm/ message philosophy and last not least which lessons we learned.,,,https://proceedings.jacow.org/pcapac2012/talks/weka01_talk.pdf,True,https://proceedings.jacow.org/pcapac2012/papers/weka01.pdf,True,https://proceedings.jacow.org/pcapac2012/posters/weka01_poster.pdf,False,https://doi.org/10.18429/JACoW-PCAPAC2012-WEKA01,1
pcapac2012,,WEKA02,Evolution of Control Systems for Large Telescopes and Accelerators : A retrospective,BARC; Mumbai; India; Particle accelerators and telescopes are big instruments of experimental physics. Even though markedly different in design & construction; particle accelerators and telescopes complement each other in answering man's most profound questions on the nature and origin of universe. Today's particle accelerators are mammoth microscopes peering in to the structure and properties of building blocks of matter with ever larger energies or particle intensities. On the other hand; telescopes look outside in to the cosmos to ever greater distances and time. As they become bigger and more powerful; both accelerators and telescopes have been continuously pushing the frontiers of technology in all spheres- detectors & front-end electronics; control; communication and computing. This has resulted in electronics which is smaller; consume less power; faster; more accurate; more reliable and support higher capacities. In this keynote address; the speaker traces over two decades of association in building control and information systems for world's big telescopes such as GMRT (Giant Metre-wave Radio Telescope; 90's) and MACE (Multiple Atmospheric Cerenkov Emission; today) in India and large particle accelerators such as LHC (90's) and FAIR (today). While tracking the evolution of related technology over the years; the talk analyses the choices made; lessons learnt; failures and successes; performance and life cycle management issues.,,,https://proceedings.jacow.org/pcapac2012/talks/weka02_talk.pdf,True,https://proceedings.jacow.org/pcapac2012/papers/weka02.pdf,False,https://proceedings.jacow.org/pcapac2012/posters/weka02_poster.pdf,False,https://doi.org/10.18429/JACoW-PCAPAC2012-WEKA02,
pcapac2012,,WEIB01,Implementation of Control Systems for Cyclotrons at VECC: A Status Report,VECC; Kolkata; India; The modernisations of the control of various subsystems of the Room Temperature Cyclotron (K130) and implementation of the subsystems control for Superconducting Cyclotron (K500) have been done at Variable Energy Cyclotron Centre (VECC); Kolkata. The architecture; realization and present status of the development of the control systems are elaborated in this presentation.,,,https://proceedings.jacow.org/pcapac2012/talks/weib01_talk.pdf,True,https://proceedings.jacow.org/pcapac2012/papers/weib01.pdf,False,https://proceedings.jacow.org/pcapac2012/posters/weib01_poster.pdf,False,https://doi.org/10.18429/JACoW-PCAPAC2012-WEIB01,
pcapac2012,,WEIB02,Review of Control Resources for J-PARC Accelerators,KEK; Ibaraki; Japan; J-PARC consists of three big accelerators : 181-MeV LINAC (now upgrading to 400-MeV); 3-GeV RCS (Rapid Cycle Synchrotron); and 30-GeV MR (Main Ring). Beam operation of LINAC started in November; 2006; followed by RCS in 2007; and by MR in 2008. Since 2009; J-PARC accelerators have been providing high-intensity proton beams to experimental facilities. In this report; we focused on three components; sever CPU for MR; control network; and disk system. Improvement; upgrade; and troublesduring 6-year operation will be reviewed.,,,https://proceedings.jacow.org/pcapac2012/talks/weib02_talk.pdf,True,https://proceedings.jacow.org/pcapac2012/papers/weib02.pdf,False,https://proceedings.jacow.org/pcapac2012/posters/weib02_poster.pdf,False,https://doi.org/10.18429/JACoW-PCAPAC2012-WEIB02,
pcapac2012,,WEIB03,Indus-2 Control System: A Closer Perspective,RRCAT; Indore; India; Indus-2; the 2.5 GeV Synchrotron Radiation Source (SRS) facility at RRCAT Indore is a national facility and being operated on round the clock basis to provide synchrotron radiation to users as well as carrying out machine studies. The accelerator as a whole is a widely distributed system and employs a distributed control system for its monitoring; control and operation. The control system has continuously evolved since the start-up and continues to do so. The talk will throw light upon various sub-systems; components of the control system; viz. hardware; software; databases; communication protocols; their evolution; various issues and approaches; current status and future possibilities. It will cover different aspects concerning Control system architecture; VME control hardware; SCADA software; Realtime software; Profibus protocol; Web based software tools; Machine parameter database and System diagnostics tools and techniques.,,,https://proceedings.jacow.org/pcapac2012/talks/weib03_talk.pdf,True,https://proceedings.jacow.org/pcapac2012/papers/weib03.pdf,False,https://proceedings.jacow.org/pcapac2012/posters/weib03_poster.pdf,False,https://doi.org/10.18429/JACoW-PCAPAC2012-WEIB03,
pcapac2012,,WEIC01,Web2cToGo: Bringing the Web2cToolkit to Mobile Devices,DESY; Hamburg; Germany; The Web2cToolkit is a collection of Web services. It enables scientists; operators and service technicians to supervise and operate accelerators and beam lines through the World Wide Web. The toolkit includes a synoptic display viewer and editor; an archive viewer; a messenger service; a logbook facility; an administration manager and an HTTP gateway to control systems. Recently; a novel view (Web2cToGo) has been added which is especially designed for mobile devices such as tablet computers or smartphones running iOS; Android or other mobile operation systems. Web2cToGo is a frame which embeds instances of all kinds of Web2c tools. It provides a single-sign-on user authentication and authorization procedure. Web2cToGo supports single- or multi-touch user gestures and is available as a platform-independent browser-based Web application or as a platform-dependent native app. This paper describes the conceptual design of Web2cToGo and the technologies used behind the scenes as well as the experiences gathered so far. It presents an outlook of ongoing developments including user-device interaction based on voice recognition.,,,https://proceedings.jacow.org/pcapac2012/talks/weic01_talk.pdf,True,https://proceedings.jacow.org/pcapac2012/papers/weic01.pdf,True,https://proceedings.jacow.org/pcapac2012/posters/weic01_poster.pdf,False,https://doi.org/10.18429/JACoW-PCAPAC2012-WEIC01,4
pcapac2012,,WECC02,EPICS Channel Access Using WebSocket,Sokendai; Ibaraki; Japan; KEK; Ibaraki; Japan; RIKEN Nishina Center; Wako; Japan; Web technology is useful as a means to widely inform of accelerators and beam status.　For this purpose; WebOPI[1] as to web-based system using Ajax (Asynchronous JavaScript and XML) with EPICS was implemented by SNS. On the other hand; it is often necessary to perform the accelerator control from various locations as well as central control room during the beam operation and the maintenance.　However; it is not realistic to replace GUI-based operator interface (OPI) with Web-based system using Ajax technology because of interactive performance.　Therefore; as a next-generation OPI over the web using EPICS Channel Access (CA); we developed a client system based on WebSocket; which is a new protocol provided by Internet Engineering Task Force for Web-based system.　WebSocket is a web technology providing bi-directional; full-duplex communication channels over a single TCP connection.　By utlizing Node.js and WebSocket access library named Socket. IO; a WebSocket server was implemented. As a result; Web-based client systems became available not only in the central control room but also with various types of equipment for accelerator operation.,,[1] http://sourceforge.net/apps/trac/cs-studio/wiki/webopi,https://proceedings.jacow.org/pcapac2012/talks/wecc02_talk.pdf,False,https://proceedings.jacow.org/pcapac2012/papers/wecc02.pdf,True,https://proceedings.jacow.org/pcapac2012/posters/wecc02_poster.pdf,False,https://doi.org/10.18429/JACoW-PCAPAC2012-WECC02,7
pcapac2012,,WECC03,Qt Based GUI System for EPICS Control Systems,A. Rhyder; R.N. Fernandes; A. C. Starritt; ASCo; Clayton; Victoria; Australia; The Qt based GUI system developed at the Australian Synchrotron for use on EPICS control systems has recently been enhanced to including support for imaging; plotting; user login; logging and configuration recipes. Plans are also being made to broaden its appeal within the wider EPICS community by expanding the range of development options and adding support for EPICS V4. Current development options include graphical and non graphical application development; 'code-rich' C++ development and simple 'code-free' GUI design. Additional development options will allow developers to manage the GUI framework's data needs themselves when required; as an alternative to letting the GUI objects manage their own data using the framework's Qt based EPICS data classes. Developers will be able to choose to manage the GUI data needs using the framework's Qt based EPICS data classes; or alternative data systems such as PSI's CAFE.,Funding: Australian Synchrotron,,https://proceedings.jacow.org/pcapac2012/talks/wecc03_talk.pdf,True,https://proceedings.jacow.org/pcapac2012/papers/wecc03.pdf,True,https://proceedings.jacow.org/pcapac2012/posters/wecc03_poster.pdf,False,https://doi.org/10.18429/JACoW-PCAPAC2012-WECC03,10
pcapac2012,,WEPD01,Data Logging System Upgrade for Indus Accelerator,R. Mishra; R.K. Agrawal; P. Fatnani; B.N. Merh; C.P. Navathe; RRCAT; Indore (M.P.); India; VECC; Kolkata; India; An accelerator has various subsystems like Magnet Power Supply; Beam Diagnostics and Vacuum etc. that are required to work in a stable manner to ensure required machine performance. Logging of system parameters at a faster rate plays a crucial role in analysing and understanding machine behaviour. Logging all the machine parameters consistently at the rate of typically more than 1 Hz has been the aim of a recent data logging system upgrade. Nearly ten thousand parameters are being logged at varying intervals of one second to one minute in Indus accelerator complex. The present logging scheme is augmented to log all these parameters at a rate equal to or more than 1 Hz. The database schema is designed according to data type of the parameter. The data is distributed into historical table and intermediate table comprising of recent data. Machine control applications read the parameter values from the control system and store them into the text-files of finite time duration for each sub-system. The logging application of each subsystem passes these text files to database for bulk insertion. The detail design of database; logging scheme and its architecture is presented in the paper.,,,https://proceedings.jacow.org/pcapac2012/talks/wepd01_talk.pdf,False,https://proceedings.jacow.org/pcapac2012/papers/wepd01.pdf,True,https://proceedings.jacow.org/pcapac2012/posters/wepd01_poster.pdf,True,https://doi.org/10.18429/JACoW-PCAPAC2012-WEPD01,12
pcapac2012,,WEPD03,Control System Studio Archiver with PostgreSQL Backend: Optimizing Performance and Reliability for a Production Environment,M. Konrad; C. Burandt; J. Enders; N. Pietralla; TU Darmstadt; Darmstadt; Germany; Archiving systems based on relational databases (RDB) provide a higher flexibility with regard to data retrieval and analysis than the traditional EPICS Channel Archiver. On the other hand they can suffer from poor performance compared to the Channel Archiver for simple linear data retrieval operations. However; careful tuning of the database management system's configuration can lead to major performance improvements. Special care must be taken to ensure data integrity following power outages or hardware failures. This contribution describes the hardware and software configuration of an archiving system used in the production environment at the S-DALINAC. It covers performance and reliability aspects of the hardware as well as tuning of the Linux operating system and PostgreSQL server optimizations.,,,https://proceedings.jacow.org/pcapac2012/talks/wepd03_talk.pdf,False,https://proceedings.jacow.org/pcapac2012/papers/wepd03.pdf,True,https://proceedings.jacow.org/pcapac2012/posters/wepd03_poster.pdf,True,https://doi.org/10.18429/JACoW-PCAPAC2012-WEPD03,15
pcapac2012,,WEPD09,Fast Data Acquisition System for Booster Supplies Readback,K. Saifee; A. Chauhan; P. Fatnani; P. Gothwal; C.P. Navathe; RRCAT; Indore (M.P.); India; The booster synchrotron at RRCAT is used to inject electron beam in Synchrotron Radiation Sources Indus-1 & Indus-2. The booster gets 20 MeV beam from Microtron; ramps up its energy to 450/550 MeV which is then extracted for injection in Indus-1/Indus-2. The ramping cycle repeats every second. For this; various magnet power supplies are fed with synchronous reference voltage & current waveforms and accordingly they feed the magnets with current waveforms of ~800 msec. A system was required to synchronously capture data of all power supplies to analyze changes on cycle to cycle basis. Global data acquisition system polling data at 1 Hz can't acquire sufficient points to do this. So a VME and PC based system has been developed for parallel and fast capture of data from 13 such power supplies. VME station has a CPU; 13 ADC cards and one control card. User can select- permit to capture; start delay; samples and time interval between samples. Advantages are' Isolated; simultaneous capturing on 13-channels; capturing synchronized with an event and selectable capturing-rate and samples. It involved reconfiguring ADC boards; developing RTOS OS-9 Device Driver & programs for CPU Board and GUI for PC using LabVIEW.,,,https://proceedings.jacow.org/pcapac2012/talks/wepd09_talk.pdf,False,https://proceedings.jacow.org/pcapac2012/papers/wepd09.pdf,True,https://proceedings.jacow.org/pcapac2012/posters/wepd09_poster.pdf,False,https://doi.org/10.18429/JACoW-PCAPAC2012-WEPD09,18
pcapac2012,,WEPD10,Embedded CAMAC Controller: Hardware/Software Co-optimization for High Throughput,P.M. Nair; A. Behere; M.P. Diwakar; K. Jha; C.K. Pithawa; P. Sridharan; BARC; Trombay; Mumbai; India; Advances in technology have resulted in availability of low-power; low form-factor embedded PC based modules. The Embedded CAMAC Controller (ECC) is designed with ETX standard Single Board Computer having PC architecture with Ethernet connectivity. The paper highlights the software and hardware design optimizations to meet high throughput requirements of multi-parameter experiments and scan mode accelerator control applications. The QNX based software is designed for high throughput by adopting design strategies like multi-threaded architecture; interrupt-driven data transfer; buffer pool for burst data; zero memory copy; lockless primitives and batched event data transfer to host. The data buffer and all control logic for CAMAC cycle sequencing for LIST mode is implemented entirely in hardware in Field Programmable Gate Array (FPGA). Through this design; sustained throughput of 1.5MBps has been achieved. Also; the host connectivity through Ethernet link enables support for multi-crate configuration; thus providing scalability. The ECC has been installed for accelerator control at FOTIA BARC; Pelletron and LINAC Pelletron TIFR and for multi-parameter experiments at NPD.,,,https://proceedings.jacow.org/pcapac2012/talks/wepd10_talk.pdf,False,https://proceedings.jacow.org/pcapac2012/papers/wepd10.pdf,True,https://proceedings.jacow.org/pcapac2012/posters/wepd10_poster.pdf,False,https://doi.org/10.18429/JACoW-PCAPAC2012-WEPD10,20
pcapac2012,,WEPD11,Client Server Architecture Based Embedded Data Acquisition System on PC104,J.J. Patel; P.K. Chattopadhyay; R. Jha; P. Kumari; R. Rajpal; IPR; Bhat; Gandhinagar; India; The data acquisition system is designed on embedded PC104 platform Single Board Computer (SBC) with running Windows XP Embedded operating system. This is a multi channel system which consists of 12 Bit; 10 MSPS Analog to Digital Converters with on board FIFO memory for each channel. The digital control and PC104 bus interface logic are implemented using Very High Speed Hardware Description Language (VHDL) on Complex Programmable Logic Device (CPLD). The system has provision of software; manual as well as isolated remote trigger option. The Client Server based application is developed using National Instrument CVI for remote continuous and single shot data acquisition for basic plasma physics experiments. The software application has features of remote settings of sampling rate; selection of operation mode; data analysis using plot and zoom features. The embedded hardware platform can be configured to be used in different way according to the physics experiment requirement by different top level software architecture. The system is tested for different physics experiments. The detailed hardware and software design; development and testing results will be discussed in the paper.,,,https://proceedings.jacow.org/pcapac2012/talks/wepd11_talk.pdf,False,https://proceedings.jacow.org/pcapac2012/papers/wepd11.pdf,True,https://proceedings.jacow.org/pcapac2012/posters/wepd11_poster.pdf,True,https://doi.org/10.18429/JACoW-PCAPAC2012-WEPD11,23
pcapac2012,,WEPD12,A Large Channel Count Multi Client Data Acquisition System for Superconducting Magnet System of SST-1,K.J. Doshi; J.A. Dhongde; Y.S. Khristi; H.A. Masand; B.A. Parghi; D.A. Patel; S. Pradhan; U.A. Prasad; A.N. Sharma; P.A. Varmora; IPR; Bhat; Gandhinagar; India; The magnet system of the steady-state superconducting tokamak-1 at the Institute for Plasma Research; Gandhinagar; India; consists of sixteen Toroidal field and nine poloidal field Superconducting coils together with a pair of resistive PF coils; an air core ohmic transformer and a pair of vertical field coils. These coils are instrumented with various cryogenic grade sensors and voltage taps to monitor it's operating status and health during different operational scenarios. A VME based data acquisition system with remote system architecture is implemented for data acquisition and control of the complete magnet operation. Client-Server based architecture is implemented with remote hardware configuration and continuous online/ offline monitoring. A JAVA based platform independent client application is developed for data analysis and data plotting. The server has multiple data pipeline architecture to send data to storage database; online plotting application; Numerical display screen; and run time calculation. This paper describes software architecture; design and implementation of the data acquisition system.,,,https://proceedings.jacow.org/pcapac2012/talks/wepd12_talk.pdf,False,https://proceedings.jacow.org/pcapac2012/papers/wepd12.pdf,True,https://proceedings.jacow.org/pcapac2012/posters/wepd12_poster.pdf,True,https://doi.org/10.18429/JACoW-PCAPAC2012-WEPD12,26
pcapac2012,,WEPD13,Serial Multiplexed Based Data Acquisition and Control System,N.C. Patel; C.K. Chavda; K.G. Patel; IPR; Bhat; Gandhinagar; India; Data acquisition and control system consist of analog to digital converter; digital to analog converter; timer; counter; pulse generation; digital input / output etc depending upon requirement. All the components of the system must communicate with personal computer (PC) for data and control signal transmission using any one of the communication protocol like Serial; Parallel; USB; and GPIB etc. Serial communication is advantageous over other protocol like long distance data transmission; less number of physical connection; ease of implementation etc. The developed serial multiplexed system can control different module like ADC (for a small analog channel density; moderate sampling rate and local on-board memory) module; DAC (for controlling pressure valve; biasing voltage etc) module; DIO ( for system status monitoring and status control) module; Timer card ( for generating delayed pulse for triggering and synchronizing with other system) using single serial port. A LabVIEW based GUI program is developed for the individual communication of each module.,,,https://proceedings.jacow.org/pcapac2012/talks/wepd13_talk.pdf,False,https://proceedings.jacow.org/pcapac2012/papers/wepd13.pdf,True,https://proceedings.jacow.org/pcapac2012/posters/wepd13_poster.pdf,True,https://doi.org/10.18429/JACoW-PCAPAC2012-WEPD13,29
pcapac2012,,WEPD14,VEPP-2000 Logging System,A.I. Senchenko; D.E. Berkaev; BINP SB RAS; Novosibirsk; Russia; The electron-positron collider VEPP-2000 has been constructed in the Budker INP at the beginning of 2007 year. The first experiments on high-energy physics has been started at the end of 2009. The collider state is characterized by many parameters which have to be tracked. These parameters called channels could be divided into continuous (like beam current or beam energy) and pulsed. The main difference is that the first one related to the moment of time while the second one to the beam transport event. There are approximately 3000 continuous channels and about 500 pulsed channels at the VEPP-2000 facility. The Logging system consists of server layer and client layer. Server side are a specialized server with an intermediate embedded database aimed at saving data in case of external database fault. Client layer provide data access via API; CLI and WUI. The system has been deployed and is used as primary logging system on,,,https://proceedings.jacow.org/pcapac2012/talks/wepd14_talk.pdf,False,https://proceedings.jacow.org/pcapac2012/papers/wepd14.pdf,True,https://proceedings.jacow.org/pcapac2012/posters/wepd14_poster.pdf,True,https://doi.org/10.18429/JACoW-PCAPAC2012-WEPD14,32
pcapac2012,,WEPD16,Development of Data Acquisition Software for VME Based System,A. Kumar; A. Chatterjee; K. Mahata; K. Ramachandran; BARC; Mumbai; India; A Data Acquisition system for VME has been developed for use in accelerator based experiments. It is in use at BARC-TIFR laboratory. The development was motivated by the growing demand for higher throughput in view of the increasing size of experiments. The VME based data acquisition system provides a powerful alternative to CAMAC standards on account of higher readout speeds (100 ns/word) resulting in reduced dead time. Further; high density VME modules are capable of providing up to 640 channels in a single VME crate with 21 slots. The software system LAMPS[1]; earlier developed for CAMAC based system and used extensively in our laboratory and elsewhere has been modified for the present VME based system. The system makes use of the VME library to implement Chain Block Transfer Readout (CBLT) and gives the option of both Polling and Interrupt mode to acquire data. Practical throughput of ~250 ns/word in zero-suppressed mode have been achieved. The developed software currently supports CAEN[2] V785 ADC; V775 TDC and V862 QDC and V830 Scalar Modules. The design; development and architecture of this DAQ system will be discussed.,,[1] http://www.tifr.res.in/~pell/lamps.html [2] http://caen.it/,https://proceedings.jacow.org/pcapac2012/talks/wepd16_talk.pdf,False,https://proceedings.jacow.org/pcapac2012/papers/wepd16.pdf,True,https://proceedings.jacow.org/pcapac2012/posters/wepd16_poster.pdf,False,https://doi.org/10.18429/JACoW-PCAPAC2012-WEPD16,35
