conference_code,session_name,paper_id,title,authors,institutions,abstract,presentation_url,presentation_available,paper_url,paper_available,poster_url,poster_available,doi,page_number
pcapac2012,,THPD21,Testing of Inductive Output Tube based RF Amplifier for 650 MHz SRF Cavities,S. Ghosh; A. Mandal; U. Panda; S. Seth; S.S. Som; VECC; Kolkata; India; A 650 MHz IOT based RF amplifier has been developed in VECC. It can be used to power several cavity modules in high energy high current proton linear accelerator to be built for ADSS programme in India and in Project-X at Fermilab; USA. The IOT based amplifier requires different powers supplies; water cooling and forced air cooling for its operation. A Programmable Logic Controller (PLC) based interlocks has been incorporated to take care of systematic on/off of the power supplies and driver amplifier; water flow; air flow and other interlocks for the safe operation of the RF System. In addition to that EPICS based RF operating console and data logging/monitoring system has been added.,,,https://proceedings.jacow.org/pcapac2012/talks/thpd21_talk.pdf,False,https://proceedings.jacow.org/pcapac2012/papers/thpd21.pdf,True,https://proceedings.jacow.org/pcapac2012/posters/thpd21_poster.pdf,True,https://doi.org/10.18429/JACoW-PCAPAC2012-THPD21,187
pcapac2012,,THPD22,Controls for a 10 Petawatt Class Laser Facility,STFC/RAL; Chilton; Didcot; Oxon; United Kingdom; Computerised controls are vital to the operability and flexibility of large-scale physics facilities (such as accelerators; synchrotrons and high-power lasers) in providing fundamental services; for example; automatic configuring of specialist hardware; motion control; firing of shot sequences; enabling precision trigger distribution; vacuum monitoring and control; data acquisition and analysis. The proposed 10PW Laser facility; in line with other major physics facilities around the world; will require a complex computer control system. This is expected to be modeled on the existing Vulcan Laser[1] control system and consist of a dozen or so Windows based PCs each of which will be running a separate and dedicated application to control a particular area or function of the facility. This paper will present an overview of the existing Vulcan laser and provide a status report on the development towards the 10PW which will require the control system to be designed to allow autonomous operation of the 10PW facility as well as to be fully integrated with the existing Vulcan laser controls for combined and synchronized 10PW plus 1PW operations.,,[1] www.clf.stfc.ac.uk/Facilities/Vulcan/12248.aspx,https://proceedings.jacow.org/pcapac2012/talks/thpd22_talk.pdf,False,https://proceedings.jacow.org/pcapac2012/papers/thpd22.pdf,True,https://proceedings.jacow.org/pcapac2012/posters/thpd22_poster.pdf,True,https://doi.org/10.18429/JACoW-PCAPAC2012-THPD22,190
pcapac2012,,THPD26,Integrated Control System for LEHIPA,S.K. Bharade; T. Ananthkrishnan; A. Basu; G. Joshi; P.D. Motiwala; C.K. Pithawa; P. Singh; S. Singh; BARC; Trombay; Mumbai; India; The Low Energy High Intensity Proton Accelerator (LEHIPA) is a 20 MeV 30 mA proton accelerator which will be achieved in multiple stages. LEHIPA consists of several sub systems/devices located at different positions of the beam path which includes ION source; RF Power; RF Protection Interlock System; Low Conductivity Water plant; Low Level RF control Systems; Vacuum System; Beam Diagnostics & Beam Line Devices. All these subsystems have their own local control systems (LCS) which will coordinate the operation of the corresponding subsystem. The control system for LEHIPA is thus being designed as a Distributed Control System with different teams developing each LCS. The control system will assist the operator to achieve a beam of desired characteristics by interacting with various sub systems of the accelerator in a seamless manner; protect the various parts machine by generating the necessary interlocks; keep track of various parameters monitored periodically by suitably archiving them; alarms annunciation and trouble shoot from the control room. This paper describes approach to system design of ICS.,,,https://proceedings.jacow.org/pcapac2012/talks/thpd26_talk.pdf,False,https://proceedings.jacow.org/pcapac2012/papers/thpd26.pdf,True,https://proceedings.jacow.org/pcapac2012/posters/thpd26_poster.pdf,False,https://doi.org/10.18429/JACoW-PCAPAC2012-THPD26,192
pcapac2012,,THPD27,Control Scheme for Remote Operation of Magnet Power Supplies for Infrared Free Electron Laser,L. Jain; M.A. Ansari; V.P. Bhanage; C.P. Navathe; RRCAT; Indore (M.P.); India; Infrared Free Electron Laser (IRFEL) is under development at MAASD; RRCAT Indore. The IRFEL machine consists of 90keV thermionic gun as electron source; beam transport line; 25MeV Linear Accelerator (LINAC) and an undulator magnet. There are fifty magnets on beam transport line. These magnets are energized by precision power supplies. These power supplies have local as well as remote control and will be located at equipment hall. The control room and equipment hall are at approximate distance of 300 m. We have planned a three layer structure for centralized operation of Beam Transport line Magnet Power Supplies (BTMPS). These layers are device interface layer; the equipment control layer and the presentation layer. Presentation layer is linked with equipment control layer on Ethernet. Whereas equipment control layer will be linked to device interface layer by RS-485. Device interface layer consist Magnet Power Supply Controllers (MPSC). Each MPSC has one master and five slave controllers linked on isolated SPI bus; which will control five BTMPS. We have developed slave controllers and a master as prototype of MPSC. This paper describes MPSC prototype and proposed control scheme.,,,https://proceedings.jacow.org/pcapac2012/talks/thpd27_talk.pdf,False,https://proceedings.jacow.org/pcapac2012/papers/thpd27.pdf,True,https://proceedings.jacow.org/pcapac2012/posters/thpd27_poster.pdf,True,https://doi.org/10.18429/JACoW-PCAPAC2012-THPD27,195
pcapac2012,,THPD28,A Distributed CAN Bus Based Embedded Control System for 750 keV DC Accelerator,"A. Kasliwal; T.G. Pandit; RRCAT; Indore (M.P.); India; This paper describes a distributed embedded system that uses a high performance mixed signal controller C8051F040 for its DAQ nodes and is based on CAN bus protocol for remote monitoring and controlling of various subsystems of 750 keV DC accelerator based irradiation facility at RRCAT; Indore. A PC with integrated PCI CAN card communicates with intelligent DAQ nodes over CAN bus and each node is interfaced with a subsystem. An opto- isolated SN65HVD230 CAN driver is interfaced between each node and physical bus. Remote frames and message prioritizing are used for efficient control. The PC application is developed using LabVIEW 8.6. The proposed system is more reliable and noise immune as compared to previously [1] used systems that initially used a centralized system based on C8051 controller. This was then upgraded [2] to a distributed system that used micro-controller AduC812 and communicated over RS485 link. The new system has been integrated and tested satisfactorily for its designed performance with test jigs that simulated the actual subsystems with a bus length of 75 meters. First the complete scheme of the system is presented; then the hardware and software designs are discussed.; [1] A. Kasliwal; ""PC based control system for 750 KV DC accelerator""; InPAC-2003; CAT; Indore; India [2] A. Kasliwal; ""Upgradation of PC based control system for 750 keV DC accelerator""; InPAC-2005; VECC; Kolkata; India",,,https://proceedings.jacow.org/pcapac2012/talks/thpd28_talk.pdf,False,https://proceedings.jacow.org/pcapac2012/papers/thpd28.pdf,True,https://proceedings.jacow.org/pcapac2012/posters/thpd28_poster.pdf,False,https://doi.org/10.18429/JACoW-PCAPAC2012-THPD28,197
pcapac2012,,THPD30,High Voltage Controller System for Spectroscopy Diagnostics of SST-1,H.D. Mandaliya; P.V. Edappala; R. Jha; R. Rajpal; M. Shah; IPR; Bhat; Gandhinagar; India; We have developed special instrumentation for spectroscopy diagnostics of the SST-1 Tokamak. Light output in the visible spectrum is guided through fiber optics from the Tokamak ports to the diagnostics Hall; where photo multipliers tubes and other instrumentation electronics are kept. High Voltage(0 - 1500 V) bias generation electronics is required to bias these PMTs. Total 14 PMTs to be biased for overall requirements of the diagnostics. We have developed modular electronics for HV bias generation; which consist of one controller and seven HV modules. We have designed and developed FPGA based controller card which controls seven HV modules. The Slot-0 card is having Spartan 3E FPGA and Standalone Controller Area Networking (CAN) controller. 32-bit RISC processor Microblaze has been deployed into the FPGA. We have used Hitek make HV supply modules which is programmable. In the HV modules; Analog Device Inc. make iCoupler; digital isolators are used to break the ground loops and to avoid ground-lifting problem. Various features like Manual mode/Remote mode operation; HV ON/OFF; HV Value setting through remote GUI have been developed on LabVIEW software.,,,https://proceedings.jacow.org/pcapac2012/talks/thpd30_talk.pdf,False,https://proceedings.jacow.org/pcapac2012/papers/thpd30.pdf,True,https://proceedings.jacow.org/pcapac2012/posters/thpd30_poster.pdf,False,https://doi.org/10.18429/JACoW-PCAPAC2012-THPD30,200
pcapac2012,,THPD32,Progress of the JINR e-Linac Accelerator Test-Bench Control Systems,M.A. Nozdrin; N. Balalykin; V. Minashkin; V.Y. Schegolev; G. Shirkov; G.V. Trubnikov; JINR; Dubna; Moscow Region; Russia; Due to Joint Institute for Nuclear Research participation in ILC collaboration; e-linac accelerator test-bench is being created in Laboratory of high energy physics of JINR. The bench is designed for several goals: accelerating structures and diagnostics testing; photoinjector prototype creation and investigation; radiation resistance studies of different materials etc. In addition; several proposals of FEL creation on the basis of the e-linac exist. Current setup; results of the test-bench control systems evolution since 2009 and future plans are presented. The most important updates include radiation control system calibration; verification and installation and an upgrade of the video control system.,,,https://proceedings.jacow.org/pcapac2012/talks/thpd32_talk.pdf,False,https://proceedings.jacow.org/pcapac2012/papers/thpd32.pdf,True,https://proceedings.jacow.org/pcapac2012/posters/thpd32_poster.pdf,True,https://doi.org/10.18429/JACoW-PCAPAC2012-THPD32,203
pcapac2012,,THPD33,Qt Based Control System Software  for Low Energy Accelerator Facility,A. Basu; S.K. Gupta; S.B.V. Nagraju; P. Singh; S. Singh; BARC; Mumbai; India; Qt based control system software for low energy accelerating facility is operational in Trombay; BARC. LEAF is 50 keV negative ion electrostatic accelerator based on SNICS ion source. Control system uses Nokia Trolltech's QT 4.x API for control system software. Ni 6008 USB based multifunction cards has been used for control and read back field equipments such as power supplies; pumps; valves etc. Control system architecture is designed to be client server. Qt is chosen for its excellent GUI capability and platform independent nature. Control system follows client server architecture. This paper will describe the control system.,,,https://proceedings.jacow.org/pcapac2012/talks/thpd33_talk.pdf,False,https://proceedings.jacow.org/pcapac2012/papers/thpd33.pdf,True,https://proceedings.jacow.org/pcapac2012/posters/thpd33_poster.pdf,True,https://doi.org/10.18429/JACoW-PCAPAC2012-THPD33,206
pcapac2012,,THPD35,Modeling and Simulation of Indus-2 RF Feedback Control System,D. Sharma; P.S. Bagduwal; P.R. Hannurkar; M. Lad; N. Tiwari; RRCAT; Indore (M.P.); India; The Indus-2 synchrotron radiation source has four RF stations along with their feedback control systems. For higher beam energy and current operation; amplitude and phase feedback control systems of Indus-2 are being upgraded. To understand the behavior of amplitude and phase control loop under different operating conditions; modeling and simulation of RF feedback control system is done. RF cavity base band quadrature domain model has been created due to its close correspondence with actual implementation and better computational efficiency which make the simulation faster. Correspondence between base band and actual RF cavity model is confirmed by comparing their simulation results. Base band Cavity model was studied under different operating conditions. LLRF feed back control system simulation is done using the same cavity model. Error signals are intentionally generated and response of the closed loops system is observed. With implementation of feedback control loop; broadening in the RF cavity bandwidth was also observed in terms of reduction in cavity fill time. Simulation will help us in optimizing parameters of upgraded LLRF system for higher beam energy and current operation.,,,https://proceedings.jacow.org/pcapac2012/talks/thpd35_talk.pdf,False,https://proceedings.jacow.org/pcapac2012/papers/thpd35.pdf,True,https://proceedings.jacow.org/pcapac2012/posters/thpd35_poster.pdf,True,https://doi.org/10.18429/JACoW-PCAPAC2012-THPD35,208
pcapac2012,,THPD36,"An Embedded System Based Computer Controlled Process Automation for Recovery and Purification of 99mTc from (n, γ)99Mo",A. De; P. Bhaskar; A. Dutta Roy; M. Garai; V.K. Khare; S. Kumari; S.S. Pal; S. Saha; S.K. Thakur; VECC; Kolkata; India; L. Barua; S. Chattopadhyay; M.K. Das; U. Kumar; S. Saha Das; BRIT; Bidhan Nagar; India; 99Mo produced 99mTc (t1/2=6hr; 140keV γ-ray) is the most useful radioisotope for nuclear diagnostics. High specific activity 99Mo is supplied globally mainly by five old reactors whose routine or unscheduled maintenance shutdown causes supply irregularities that adversely affects patient management in nuclear medicine centres. 99mTc may also be produced via 98Mo(n; γ) in a natural MoO3 target in reactor or by 100Mo(n; 2n)99Mo or 100Mo(p; 2n)99mTc reaction in cyclotron. To meet the crisis proposals are there to produce 99Mo by 100Mo(n; 2n)99Mo or 99mTc directly by 100Mo(p; 2n)99mTc in a cyclotron. Of the several separation methods of 99mTc from molybdenum; the most common are adsorption column chromatography; sublimation and liquid-liquid solvent extraction. The conventional methods besides being cumbersome are often hazardous; polluting; require skilled manpower and facilities like fume hood and so are not always practically feasible for hospitals. To address these; VECC and BRIT; Kolkata have collaborated to develop an embedded system based automated 99Mo/99mTc generator from low specific activity 99Mo using solvent extraction technique; supervised by a PC based GUI.,,,https://proceedings.jacow.org/pcapac2012/talks/thpd36_talk.pdf,False,https://proceedings.jacow.org/pcapac2012/papers/thpd36.pdf,True,https://proceedings.jacow.org/pcapac2012/posters/thpd36_poster.pdf,True,https://doi.org/10.18429/JACoW-PCAPAC2012-THPD36,211
pcapac2012,,THPD40,Instrumentation Architecture for ITER Diagnostic Neutral Beam Power Supply System,"A.M. Thakar; U.K. Baruah; R. Dave; H.A. Dhola; S. Gajjar; V. Gupta; D.C. Parmar; A.M. Patel; B.M. Raval; N.P. Singh; IPR; Bhat; Gandhinagar; India; J.Y. Journeaux; D. Lathi; B. Schunke; S. Svensson; ITER Organization; St. Paul lez Durance; France; A Neutral Beam Injection system is used for either heating or diagnostics of the plasma in a tokamak. The Diagnostics Neutral Beam system [1] for ITER based on acceleration of negative ions; injects a neutral (Ho) beam at 100KeV with specified modulation into the plasma for charge exchange recombination spectroscopy. DNBPS system consists of HVPS; HCPS and RF Sources. The system operates in a given operating sequence; very high electromagnetic transients are intrinsically generated during operation. Instrumentation is to be provided to operate the DNBPS system remotely with required control and protection. The operation is to be synchronized with ITER operation as directed by CODAC. Instrumentation functionality includes  Acquisition of injector performance parameters; Operation and control of necessary auxiliaries; Protection of DNB components and power supplies using interlock system; To ensure safe operation of high voltage hazardous systems and  To facilitate test and maintenance of individual subsystem.  This paper discusses about proposed DNB instrumentation architecture. The design generally follows the protocols from the ITER- Plant Control Design Handbook.; [1] Lennart Svensson et.al; ""Instrumentation and diagnostics for the ITER Neutral Beam System""; Fusion Engineering and Design 86 (2011)",,,https://proceedings.jacow.org/pcapac2012/talks/thpd40_talk.pdf,False,https://proceedings.jacow.org/pcapac2012/papers/thpd40.pdf,True,https://proceedings.jacow.org/pcapac2012/posters/thpd40_poster.pdf,True,https://doi.org/10.18429/JACoW-PCAPAC2012-THPD40,214
pcapac2012,,THPD43,Electron Cyclotron Resonance Ion Source Control System,H.M. Kewlani; D.P. Chakravarthy; S. Gharat; L. Mishra; K.C. Mittal; P. Roychowdhury; BARC; Mumbai; India; The control system of Electron Cyclotron Resonance (ECR) ion source is computer based control system. Main components of ECR ion source are microwave generator; plasma chamber; solenoid magnets; high current power supplies; extraction electrodes; high voltage power supplies; beam measuring devices and vacuum system. All the electronics devices have their built in microprocessor base electronic interface; which can be remotely accessed by serial or Ethernet link. Two numbers of Ethernet to four port serial converter modules are used to extend the serial interface capabilities of computer. Serial interface of all the devices are connected to the extended serial ports of the computer. Serial link of high voltage power supplies are optically isolated using optical isolators to overcome EMI and EMC problems. Software has been developed in house for remote operation of the ECR ion source electronic devices like magnetron power supply; high voltage power supplies; high current power supplies; microwave power measurement and vacuum gauges.,,,https://proceedings.jacow.org/pcapac2012/talks/thpd43_talk.pdf,False,https://proceedings.jacow.org/pcapac2012/papers/thpd43.pdf,True,https://proceedings.jacow.org/pcapac2012/posters/thpd43_poster.pdf,True,https://doi.org/10.18429/JACoW-PCAPAC2012-THPD43,217
pcapac2012,,THPD44,The CS framework as a Control System for the HITRAP Facility at GSI,D. Neidherr; D.H. Beck; H. Brand; F. Herfurth; GSI; Darmstadt; Germany; At the GSI accelerator complex in Darmstadt Germany the linear decelerator HITRAP is currently under commissioning. The aim is to provide highly charged ions up to bare uranium at cryogenic temperatures for various experiments as for instance tests of the theory of quantum electrodynamics. The ions are delivered with kinetic energies of about 4 MeV/u from GSIs experimental storage ring (ESR) and are slowed down in several steps until they are trapped and cooled down in a Penning trap. Whereas for the ESR as well as for the first sections of the linear decelerator the GSI accelerator control system is used the cooler trap as well as the subsequent transfer section to the experimental area are controlled with the LabVIEW based CS-framework developed at GSI. This framework is an object-oriented; event driven and multi-threaded framework with SCADA functionality; which is currently in use at many different experiments world-wide. For the HITRAP facility additional features like an online beam monitoring; realized with the integration of a LVOOP class capable of reading out IMAQ cameras; as well as a new GUI were implemented; which allows automatic scans of beam elements.,,,https://proceedings.jacow.org/pcapac2012/talks/thpd44_talk.pdf,False,https://proceedings.jacow.org/pcapac2012/papers/thpd44.pdf,True,https://proceedings.jacow.org/pcapac2012/posters/thpd44_poster.pdf,True,https://doi.org/10.18429/JACoW-PCAPAC2012-THPD44,219
pcapac2012,,THPD45,Overview of Control System for 30MeV RF Source,R.B. Chavan; S. Chandan; K. Dixit; K.C. Mittal; A.R. Tillu; V. Yadav; BARC; Mumbai; India; Control system for RF source of 30 MeV; 3 kW RF Linac for neutron generation is being developed. The system consists of two 15 MeV linac structures; each powered independently with klystron rated for 7.5 MW(pk)/7.5 kW(avg). Two klystron modulators of 160kV; 110A; 7usec and 250Hz feed pulsed power into the klystron; which produces RF power at 2856 MHz. The klystrons will be driven by low power RF driver amplifiers programmed for matching phase; frequency and power into the linac. Both the driver amplifiers are controlled through RS-232 Protocol. The HV pulsing and RF drive for the klystron has been interlocked with water flow; arc detector; SF6 gas pressure etc. The control system is designed using Real time embedded controller; where pulses for synchronization are being generated in FPGA. Most of the power supplies like electromagnet; HVDC; etc. are on RS-232 protocol. These power supplies are controlled via suitable RS-232 to Ethernet converter. State machine topology is being used to design the logic. The database for logging data is developed in SQL. This paper describes the details of the software implementation and hardware used to realize the control of the RF power source.,,,https://proceedings.jacow.org/pcapac2012/talks/thpd45_talk.pdf,False,https://proceedings.jacow.org/pcapac2012/papers/thpd45.pdf,True,https://proceedings.jacow.org/pcapac2012/posters/thpd45_poster.pdf,True,https://doi.org/10.18429/JACoW-PCAPAC2012-THPD45,222
pcapac2012,,THPD46,Simulation Analysis of Analog IQ based LLRF Control of RF Cavity,S. Basak; A. Chakrabarti; H.K. Pandey; VECC; Kolkata; India; This paper presents the simulation analysis and results in Matlab Simulink of the analog Inphase-Quadrature (IQ) based LLRF control of RF cavity voltage. The RF cavity parameters were selected to be one of the RF cavities in our RIB project. All the subsystems in the IQ based RF control were modeled using the Simulink blocks/components. The envelope simulation was carried out using the IQ model of RF cavity. The PI controller was properly tuned to achieve good control performance in time. The simulation graphs showing the time evolution of the RF cavity voltage with a step changes of the input reference signal is presented. The simulation graphs showing the control response time needed to correct a disturbance is presented. Further the effects of beam currents (if not ignored) on the cavity voltage can been studied through the simulation graphs. The simulation results showing the amplitude and phase Bode/Nichols plots of the control loop and the gain and phase margin values obtained from them are presented; which are good enough for stability. Thus the control simulation RF cavity voltage is done in Simulink and the results obtained are presented.,,,https://proceedings.jacow.org/pcapac2012/talks/thpd46_talk.pdf,False,https://proceedings.jacow.org/pcapac2012/papers/thpd46.pdf,True,https://proceedings.jacow.org/pcapac2012/posters/thpd46_poster.pdf,True,https://doi.org/10.18429/JACoW-PCAPAC2012-THPD46,225
pcapac2012,,THPD47,Introduction of Non-Standard EPICS Controllers,I. Badillo; I. Arredondo; M. Eguiraun; D. Piso; M. del Campo; ESS Bilbao; Zamudio; Spain; University of the Basque Country; Faculty of Science and Technology; Bilbao; Spain; Although EPICS is a mature software framework; the study and validation of new configurations of EPICS systems is very valuable; since new ideas open its evolution and improvement. So; the goal of the present work is to introduce new technologies under EPICS control structures and test different configurations with innovative hardware in this kind of applications. More specifically; it is intended to validate the use of non-stardard EPICS controllers. This paper presents a test bench using LabVIEW together with EPICS. LabVIEW eases and speeds up the development of control structures; avoids the hardware dependent developing costs and offers almost absolute compatibility with all kind of hardware used in control and data acquisition. To validate its use; it is mandatory to make a study facing this solution and EPICS standard methodology; specifically CODAC system used in ITER. To do so; a test bench is defined running both methods and its results compared. Following this scheme; the next step is to make a similar experiment introducing wireless links and replacing as many wires as possible.,,,https://proceedings.jacow.org/pcapac2012/talks/thpd47_talk.pdf,False,https://proceedings.jacow.org/pcapac2012/papers/thpd47.pdf,True,https://proceedings.jacow.org/pcapac2012/posters/thpd47_poster.pdf,True,https://doi.org/10.18429/JACoW-PCAPAC2012-THPD47,227
