conference_code,session_name,paper_id,title,authors,institutions,abstract,presentation_url,presentation_available,paper_url,paper_available,poster_url,poster_available,doi,page_number
pcapac2012,,WEPD18,Microcontroller Based DAQ System for IR Thermography by Hot and Cold Water Flow,M.S. Khan; S.M. Belsare; K.D. Galodiya; S.S. Khirwadkar; T.H. Patel; IPR; Bhat; Gandhinagar; India; There are many Non Destructive Technique used in science and industry to evaluate the properties of a material; component or system without causing damage Infrared Thermography is one of them. Different types of IR thermo-graphy are used for different purpose. We are using hot and cold-water flow IR Thermography method to evaluate the Performance of Plasma Facing Components (PFC) for Divertor Mock-up. The Set-up is designed in such a way that hot and Called Water can flow in both direction inside mockup; like left to right and right to Left using electric motor. Eight numbers of Solenoid Valves have been used for selection of Water Flow Direction; thermo-couples for temperature measurement of water; IR camera to take the images and many others devices. Which needs a very good and versatile DAC system. We have developed a DAC system usingμcontroller and LabView for the acquisition of various parameters and controlling & synchronization of other system. Development of DAC is described in this paper,,,https://proceedings.jacow.org/pcapac2012/talks/wepd18_talk.pdf,False,https://proceedings.jacow.org/pcapac2012/papers/wepd18.pdf,True,https://proceedings.jacow.org/pcapac2012/posters/wepd18_poster.pdf,True,https://doi.org/10.18429/JACoW-PCAPAC2012-WEPD18,37
pcapac2012,,WEPD19,Smart Structured Measurement Process for Versatile Synchrotron Beamline Data at ANKA,T. Spangenberg; D. Haas; W. Mexner; KIT; Karlsruhe; Germany,,"An unstructured measurement process might deliver the needed quantity of primary data for an experiment. But the achievement of the scientific results depends more and more from the offered opportunities of embedding these measurement data into its specific context with a meta data description and a complete life cycle management. Obviously the design of a measurement process influences the potential applicability of an experimental setup for its scientific purpose and of course its options to fulfill a contemporary data management. ANKA's Tango based environment offers in principal varying approaches with different implementation efforts and coverage of scientific or information technology requirements. At ANKA we have set up a smart structured measurement process which stand out due to its seamless integration into the overall data management, the support of recent control concepts for fast data generation as well as its support of well time-tested SPEC based scan systems. The presented measurement process focuses to the minimal implementation for all involved components without a break of well accepted habits.",https://proceedings.jacow.org/pcapac2012/talks/wepd19_talk.pdf,False,https://proceedings.jacow.org/pcapac2012/papers/wepd19.pdf,True,https://proceedings.jacow.org/pcapac2012/posters/wepd19_poster.pdf,True,https://doi.org/10.18429/JACoW-PCAPAC2012-WEPD19,40
pcapac2012,,WEPD22,Post-Mortem Analysis of BPM-Interlock Triggered Beam Dumps at PETRA-III,G.K. Sahoo; K. Balewski; A. Kling; DESY; Hamburg; Germany; PETRA-III is a 3rd generation synchrotron light source dedicated to users at 14 beam lines with 30 instruments. This operates with several filling modes such as 60; 240 and 320 bunches with 100mA or 40 bunches with 80mA at a positron beam energy of 6 GeV. The horizontal beam emittance is 1nmrad while a coupling of 1% amounts to a vertical emittance of 10pmrad. During a user run unscheduled beam dumps triggered by Machine Protection System may occur. In many cases the reason can be identified but in some it remains undetected. Though the beam is lost some signature is left in the ring buffers of the 226 BPM electronics where last 16384 turns just before the dump are available for post-mortem analysis. Scrutinizing turn by turn orbits and the frequency spectrum measured at a BPM can improve understanding of such a beam loss and may help to increase the efficiency of operation by eliminating the sources. Here we discuss in detail the functionality of a Java GUI used to investigate the reasons for unwanted dumps. In particular; the most effective corrector method is applied to identify correctors that might have perturbed the golden orbit leading to violations of the interlock limits.,,,https://proceedings.jacow.org/pcapac2012/talks/wepd22_talk.pdf,False,https://proceedings.jacow.org/pcapac2012/papers/wepd22.pdf,True,https://proceedings.jacow.org/pcapac2012/posters/wepd22_poster.pdf,False,https://doi.org/10.18429/JACoW-PCAPAC2012-WEPD22,43
pcapac2012,,WEPD23,Design & Implementation Of LabVIEWTM Based GUI for Remote Operation and Control of Excimer Laser for Plasma Wakefield Accelerator Experiment,K.K. Kizhupadath; R.A.V. Kumar; K. Mahavar; IPR; Bhat; Gandhinagar; India; S. Joshi; A. Sharma; Nirma University; Ahmedabad; India; The paper describes the development of GUI based control software for control/operation; maintenance and data logging of a Coherent CompexPro 102 Excimer Laser (ArF; 193 nm) using LabVIEWTM instrument control software. Excimer laser will be used to generate the lithium plasma for the Plasma Wake Field Acceleration (PWFA) experiment which is currently being pursued at the Institute for Plasma research; Gandhinagar. The LabViewTM drivers for the system were developed and various control modules for laser control & operation; maintenance (gas refill); energy calibration as well as logging were developed and integrated into a single screen GUI. Automated calibration of the internal energy meter with an external one has also been implemented. The modules can be used independently or as an integrated system. The laser is interfaced to the control PC through a RS-232-to-USB interface.,,,https://proceedings.jacow.org/pcapac2012/talks/wepd23_talk.pdf,False,https://proceedings.jacow.org/pcapac2012/papers/wepd23.pdf,True,https://proceedings.jacow.org/pcapac2012/posters/wepd23_poster.pdf,True,https://doi.org/10.18429/JACoW-PCAPAC2012-WEPD23,46
pcapac2012,,WEPD24,STARS on Android,"KEK; Ibaraki; Japan; STARS (Simple Transmission and Retrieval System) is a message transferring software for small scale control systems with TCP/IP socket; which works on various types of operating systems. STARS is used as beamline control system and it controls optical devices (mirror; monochrometer etc.) of beamline at the Photon Factory. We have succeeded to run STARS GUI Client on Android with STARS Java interface library this time. This success brings capability of handy GUI terminal development with smartphones and tablet devices. The handy GUI terminal helps beamline users when checking movement near optical devices. We will describe detail of ""STARS on Android"".",,,https://proceedings.jacow.org/pcapac2012/talks/wepd24_talk.pdf,False,https://proceedings.jacow.org/pcapac2012/papers/wepd24.pdf,True,https://proceedings.jacow.org/pcapac2012/posters/wepd24_poster.pdf,True,https://doi.org/10.18429/JACoW-PCAPAC2012-WEPD24,51
pcapac2012,,WEPD25,Development of EPICS Channel Access Embedded ActiveX Components for GUI Development,A. Roy; R.B. Bhole; S. Pal; VECC; Kolkata; India; The paper describes the integration of EPICS Channel Access protocol and Microsoft ActiveX technology towards developing a generalize operator interface (OPI) building facility for Windows platform. EPICS is used as the development architecture of the control system in Superconducting Cyclotron (SCC). Considering the operators' familiarity and compatibility with third party software; it was decided to use MS-Windows platform at operator interface level in SCC during commission. Microsoft Visual Basic (VB) is used on trial basis as OPI building platform to incorporate user specific features e.g. file system access for data storage and analysis; user authentication at OPI level etc. A set of EPICS Channel Access embedded ActiveX components is developed to ease the programming complexity and reduce developmental time of the OPI for Windows platform. OPIs; developed using these components and containing hundreds of process parameters; are being used reliably over a considerable period of time.,,,https://proceedings.jacow.org/pcapac2012/talks/wepd25_talk.pdf,False,https://proceedings.jacow.org/pcapac2012/papers/wepd25.pdf,True,https://proceedings.jacow.org/pcapac2012/posters/wepd25_poster.pdf,True,https://doi.org/10.18429/JACoW-PCAPAC2012-WEPD25,54
pcapac2012,,WEPD26,Development of Fast Controls for Beam Wire Scanner for SuperKEKB,VECC; Kolkata; India; K. Furukawa; N. Iida; KEK; Ibaraki; Japan; EJIT; Hitachi; Ibaraki; Japan; Recent development towards the data acquisition system of the wire scanner (WS) systems of the SuperKEKB injector linac (LINAC) and beam transport lines (BT's) is described. A VME based system; comprised of charge sensitive ADC (CSADC) board; scaler board; DAC board and Event receiver board; has been installed. The primary aim of the system is to utilise global linac event timing system for synchronized and mode-dependent data acquisition. A set of EPICS device driver has been developed for new hardware e.g. CSADC; scaler and DAC boards. The combination of latest versions of firmware and EPICS device driver forμResearch Finland (MRF) Event receiver board is also evaluated and further incorporated in this system. The application software is developed for simultaneous acquisition of multiple beam mode data during multimode injection of the LINAC. The developed system is tested successfully after integrating with the existing wire scanner driving mechanism. The system enables the beam size measurements at four consecutive locations; that derive Twiss parameters and ensure the reliable beam transport to four downstream storage rings.,,,https://proceedings.jacow.org/pcapac2012/talks/wepd26_talk.pdf,False,https://proceedings.jacow.org/pcapac2012/papers/wepd26.pdf,True,https://proceedings.jacow.org/pcapac2012/posters/wepd26_poster.pdf,True,https://doi.org/10.18429/JACoW-PCAPAC2012-WEPD26,57
pcapac2012,,WEPD27,Graphical User Interface (GUI) for Testing CAMAC modules,S. Kulkarni; P. V. Bhagwat; J.A. Gore; A.K. Gupta; S. Kailas; BARC; Mumbai; India; A new program (GUI) for testing CAMAC modules (CAMAC ADC; DAC; Input Gate; Output Register) is developed using Labview and dynamic link libraries (DLLs). On start-up; the program initializes the CAMAC Controller via PCI bus interface; thus enabling communication with CAMAC modules. It can test CAMAC modules through different controls like slider bars; buttons etc. and display status of individual channels with soft panel meters and LEDs. The GUI is extremely useful in troubleshooting hardware problems of CAMAC modules and also in developing new modules.,,,https://proceedings.jacow.org/pcapac2012/talks/wepd27_talk.pdf,False,https://proceedings.jacow.org/pcapac2012/papers/wepd27.pdf,True,https://proceedings.jacow.org/pcapac2012/posters/wepd27_poster.pdf,True,https://doi.org/10.18429/JACoW-PCAPAC2012-WEPD27,60
pcapac2012,,WEPD28,Re-envisioning the Operator Consoles for Dhruva Control Room,S. Gaur; M.P. Diwakar; P.M. Nair; C.K. Pithawa; P. Sridharan; BARC; Trombay; Mumbai; India; Bhabha Atomic Research Centre; Mumbai; India; Control Room design is undergoing rapid changes with the progressive adoption of computerization and automation. Advances in man-machine interfaces have further accelerated this trend. This paper presents the design and main features of Operator consoles (OC) using new technologies for Dhruva control room. The OCs have been designed so as not to burden the operator with information overload but to help him quickly assess the situation and timely take appropriate steps. The consoles provide minimalistic yet intuitive interfaces; context sensitive navigation; display of important information and progressive disclosure of situation based information. The use of animations; 3D graphics; and real time trends with the benefit of hardware acceleration to provide a resolution-independent rich user experience. The use of XAML; an XML based Mark-up Language for User Interface definition and C# for application logic resulted in complete separation of visual design; content; and logic. This also resulted in a workflow where separate teams could work on the UI and the logic of an application. The introduction of Model View View-Model has led to more testable and maintainable software.,,,https://proceedings.jacow.org/pcapac2012/talks/wepd28_talk.pdf,False,https://proceedings.jacow.org/pcapac2012/papers/wepd28.pdf,True,https://proceedings.jacow.org/pcapac2012/posters/wepd28_poster.pdf,True,https://doi.org/10.18429/JACoW-PCAPAC2012-WEPD28,62
pcapac2012,,WEPD33,Embedded PC Based Controller for Use in VME Bus Based Data Acquisition System,G. Verma; B.B. Biswas; S.K. Jain; M. Kalra; D.A. Roy; BARC; Mumbai; India; An embedded PC based Controller module; named System Controller Module (SCM); has been developed at Reactor Control Division(RCnD); BARC. This module uses standard PC-104 bus based CPU module integrated with a protocol translator card to provide an interface between the CPU module and VME bus. The signal interface between PC-104 bus of CPU module and translator card is achieved through stackable connectors. SCM can be interfaced with 16-bit slave I/O modules on VME bus for Data Acquisition and Control. This development provides low cost PC based platform for developing I/O intensive embedded system requiring high processing power. SCM module is fully compatible with PC architecture and is available in Double Euro modular form factor. Module has self diagnostics features to test software integrity using onboard watchdog timer. The module provides dual Ethernet link for communication. The SCM has been assembled; integrated and successfully tested along with VME based high speed data acquisition system (Machinery Protection System); which has been developed in RCnD for condition monitoring of rotating machines. SCM acts as a configuration controller and data manager for this system.,,,https://proceedings.jacow.org/pcapac2012/talks/wepd33_talk.pdf,False,https://proceedings.jacow.org/pcapac2012/papers/wepd33.pdf,True,https://proceedings.jacow.org/pcapac2012/posters/wepd33_poster.pdf,True,https://doi.org/10.18429/JACoW-PCAPAC2012-WEPD33,65
pcapac2012,,WEPD34,A Low-Cost High-Performance Embedded Platform for Accelerator Controls,S. Cleva; A.I. Bogani; L. Pivetta; ELETTRA; Basovizza; Italy; Over the last years the mobile and hand-held device market has seen a dramatic performance improvement of the microprocessors employed for these systems. As an interesting side effect; this brings the opportunity of adopting these microprocessors to build small low-cost embedded boards; featuring lots of processing power and input/output capabilities. Moreover; being capable of running a full featured operating system such as GNU/Linux; and even a control system toolkit such as Tango; these boards can also be used in control systems as front-end or embedded computers. In order to evaluate the feasibility of this idea; an activity has started at ELETTRA to select; evaluate and validate a commercial embedded device able to guarantee production grade reliability; competitive costs and an open source platform. The preliminary results of this work are presented.,,,https://proceedings.jacow.org/pcapac2012/talks/wepd34_talk.pdf,False,https://proceedings.jacow.org/pcapac2012/papers/wepd34.pdf,True,https://proceedings.jacow.org/pcapac2012/posters/wepd34_poster.pdf,True,https://doi.org/10.18429/JACoW-PCAPAC2012-WEPD34,68
pcapac2012,,WEPD38,"A wireless control system for the HTS-ECRIS, PKDELIS and low energy beam transport",R.N. Dutt; D. Kanjilal; P.S. Lakshmy; Y. Mathur; U.K. Rao; G.O. Rodrigues; IUAC; New Delhi; India; A wireless control system based on MODBUS protocol has been developed for operation of the High Temperature Superconducting ECR ion source; PKDELIS [1]; LEBT and associated systems on a 200 kV high voltage platform. The isolation channels for the two high voltage platforms are implemented using ISM band wireless channel. A server for organization wide connectivity over Ethernet for access from the main IUAC control room has been implemented. History features and an intuitive GUI interface is provided. The system has been in regular use and has proven to be rugged and reliable.; [1] D. Kanjilal et al.; Rev. Sci. Instrum. 77; (2006) 03A317  [2] R.N. Dutt et al. Proceedings of Indian Particle Accelerator Conference; INPAC; New Delhi; 2011,,,https://proceedings.jacow.org/pcapac2012/talks/wepd38_talk.pdf,False,https://proceedings.jacow.org/pcapac2012/papers/wepd38.pdf,True,https://proceedings.jacow.org/pcapac2012/posters/wepd38_poster.pdf,True,https://doi.org/10.18429/JACoW-PCAPAC2012-WEPD38,71
pcapac2012,,WEPD39,Development of an Ethernet Enabled Microcontroller Based Module for Superconducting Cyclotron ECR Beamline Control,M. Chatterjee; D. Koley; P.Y. Nabhiraj; VECC; Kolkata; India; A General purpose Ethernet enabled control and data acquisition module based on PIC microcontroller has been developed. This module supports multiple general purpose analog and digital inputs and outputs for interfacing with various equipments. The remote control; configuration and monitoring of the equipment are achieved through an embedded web server. A strict authentication process is built in the web server to access for control and configuration parameters that ensures the operational safety of the equipment under control. At present; this is being used for remote control of the ECR beam line vacuum systems and monitoring of various parameters like dual vacuum Gauge readings; pumping speed etc. These modules form a distributed control architecture enhancing the reliability of the controlled system; enables fast fault diagnostics and thereby reducing the downtime of the system significantly. In this article; the development of the hardware and software for the Ethernet enabled microcontroller based module is presented.,,,https://proceedings.jacow.org/pcapac2012/talks/wepd39_talk.pdf,False,https://proceedings.jacow.org/pcapac2012/papers/wepd39.pdf,True,https://proceedings.jacow.org/pcapac2012/posters/wepd39_poster.pdf,True,https://doi.org/10.18429/JACoW-PCAPAC2012-WEPD39,73
pcapac2012,,WEPD43,A New Scheme for Direct Estimation of PID Controller Parameters,S. Srivastava; V.S. Pandit; VECC; Kolkata; India; This paper presents a novel scheme for the direct estimation of a PID controller parameters(Kp; TI; Td).The proposal discussed here is only applicable to first and second order stable systems. The formulation begins with system parameter identification (Transfer function of the process); which was calculated by applying weighted-recursive least square method. The pole zero cancellation technique was applied to estimate PID controller parameters ;which in-turn results into the matched coefficients of the system parameters to the Controller parameters. An additional tuning parameters 'α' is proposed in our method; which provides an additional flexibility of tuning the response time of the controller without disturbing the controller parameters. The proposed scheme was bench marked using real time cases of DC Motor speed control and Cruise Control. The effectiveness and robustness of the proposed auto tuning algorithm is verified by the simulation results.,,,https://proceedings.jacow.org/pcapac2012/talks/wepd43_talk.pdf,False,https://proceedings.jacow.org/pcapac2012/papers/wepd43.pdf,True,https://proceedings.jacow.org/pcapac2012/posters/wepd43_poster.pdf,True,https://doi.org/10.18429/JACoW-PCAPAC2012-WEPD43,76
pcapac2012,,WEPD44,FPGA Data Block FIFO for the APS ID Measurement System,J.Z. Xu; R.I. Farnsworth; I. Vasserman; ANL; Argonne; USA,,A Hall probe insertion device (ID) measurement system has been developed to characterize the IDs at the Advanced Photon Source (APS). The system uses the latest state-of-the-art field programmable gate array (FPGA) technology to synchronize the position and Hall voltage measurements. Data block first-in-first-out (FIFO) has been implemented to transfer the data from the FPGA to the host computer during measurement. The system is capable of continuous scanning measurements on a full 6 meter bench at 1 ms per data point with the position resolution of 1 micron and Hall voltage precision of 5-1/2 digits.,https://proceedings.jacow.org/pcapac2012/talks/wepd44_talk.pdf,False,https://proceedings.jacow.org/pcapac2012/papers/wepd44.pdf,True,https://proceedings.jacow.org/pcapac2012/posters/wepd44_poster.pdf,False,https://doi.org/10.18429/JACoW-PCAPAC2012-WEPD44,79
pcapac2012,,WEPD47,Low-cost EPICS Control Using Serial-LAN Module XPort,KEK; Ibaraki; Japan; J-PARC; KEK & JAEA; Ibaraki-ken; Japan; Kanto Information Service (KIS); Accelerator Group; Ibaraki; Japan; In J-PARC MR (Main Ring); we are interested in a commercial product; XPort; a low-cost serial-LAN converter [1]. We have introduced it in two different cases. (1) Two RF-amplifiers with GPIB were introduced. We asked a company to add a XPort for remote control rather than GPIB. Serial messages of GPIB are transported to an EPICS IOC (I/O controller) over our control network. (2) We developed an electric circuit board with manual switches. An on-board FPGA chip has connections both to switches and to XPort pins. Status of switches can be read remotely as UDP messages through XPort. In both cases; messages are converted into EPICS-style records using AsyncDriver of EPICS. Implementation details and operational reports are given.,,[1] http://www.lantronix.com/device-networking/embedded-device-servers/xport.html,https://proceedings.jacow.org/pcapac2012/talks/wepd47_talk.pdf,False,https://proceedings.jacow.org/pcapac2012/papers/wepd47.pdf,True,https://proceedings.jacow.org/pcapac2012/posters/wepd47_poster.pdf,False,https://doi.org/10.18429/JACoW-PCAPAC2012-WEPD47,81
pcapac2012,,WEPD48,Facility-Wide Synchronization of Standard FAIR Equipment Controllers,S. Rauch; R. Bär; D.H. Beck; M. Kreider; W. Panschow; C. Prados; W.W. Terpstra; M. Thieme; M. Zweig; GSI; Darmstadt; Germany; The standard equipment controller for the new FAIR accelerator facility is the Scalable Control Unit (SCU). It synchronizes and controls the actions of up to 12 purpose-built slave cards; connected in a crate. Facility-wide synchronization is a core FAIR requirement and thus precise timing of SCU slave actions is of vital importance. The SCU consists primarily of two components; a daughter board with CPU and a carrier board with FPGA; interconnected by PCI Express. The CPU receives configuration and set values with which it programs the real-time event-condition-action (ECA) unit in the FPGA. The ECA unit receives event messages via the timing network; which also synchronizes clocks using White Rabbit. Matching events trigger actions on the SCU slave cards such as ramping magnets; triggering kickers; etc. Timing requirements differ depending on the action taken. For softer real-time actions; an interrupt can be generated for complex processing on the CPU. Alternatively; the FPGA can directly fire a pulse or bus operation. The delay and jitter achievable in each case differs and this paper examines their timing performance to determine which is appropriate for the required actions.,,,https://proceedings.jacow.org/pcapac2012/talks/wepd48_talk.pdf,False,https://proceedings.jacow.org/pcapac2012/papers/wepd48.pdf,True,https://proceedings.jacow.org/pcapac2012/posters/wepd48_poster.pdf,True,https://doi.org/10.18429/JACoW-PCAPAC2012-WEPD48,84
pcapac2012,,WEPD52,Diamond Light Source Control Systems Relational RDB,K. Vijayan; M.T. Heron; S.J. Singleton; Diamond; Oxfordshire; United Kingdom; The functionality of the Diamond Light Source Relational Database (RDB) will be described in this article. An Oracle-based RDB and web-based GUIs allow recording of system configuration information and configuration change management. Information about the hardware components that make up each beam line crate is stored in the RDB; for each item of control equipment; the status; location and name of the person responsible for the item are held. The Diamond Control System is based on EPICS and has of the order of 500; 000 process variables (PVs); the RDB maintains a record of the names of these PVs and validates new names against the Diamond Naming Convention; allowing consistency of naming style to be maintained and avoiding name duplication. Machine operational details such as alarm logs are stored in the RDB and viewed using a web browser. All process data recorded by the control software are archived using the EPICS Channel Archiver; the Archiver configuration for each technical area is maintained in the RDB. A further application using the RDB is the electronic logbook (ELOG) which is used to record activities by Diamond Operations and Beamline groups.,,,https://proceedings.jacow.org/pcapac2012/talks/wepd52_talk.pdf,False,https://proceedings.jacow.org/pcapac2012/papers/wepd52.pdf,True,https://proceedings.jacow.org/pcapac2012/posters/wepd52_poster.pdf,True,https://doi.org/10.18429/JACoW-PCAPAC2012-WEPD52,87
