conference_code,session_name,paper_id,title,authors,institutions,abstract,presentation_url,presentation_available,paper_url,paper_available,poster_url,poster_available,doi,page_number
pcapac2018,,WEKT1,Abstraction or Instantiation: On Building the Internet for Smarter Places,"Skywatch; Taipei; Taiwan; Inventec; Taipei; Taiwan; There are two ends of the spectrum when it comes to Internet-of-Things. On the one end; the focus is on lower level communication technology; platforms; and standards that aim to enable machine-to-machine communications. On the other end; people have been searching for the killer devices that would transform our lives. Clearly; one is the ""Internet"" perspective; while the other is the ""Things"" perspective. In this talk; instead of taking the words ""Internet of Things"" literally; we focus on the combined effects of devices on environments. Specifically; we discuss the conversations between devices; and how these interactions can open new frontiers of digitized spaces in the era of machine learning.",,,https://proceedings.jacow.org/pcapac2018/talks/wekt1_talk.pdf,True,https://proceedings.jacow.org/pcapac2018/papers/wekt1.pdf,False,https://proceedings.jacow.org/pcapac2018/posters/wekt1_poster.pdf,False,https://doi.org/10.18429/JACoW-PCAPAC2018-WEKT1,
pcapac2018,,WEPI1,EtherCAT Driver and Tools for EPICS and Linux at PSI,PSI; Villigen PSI; Switzerland; EtherCAT bus and interface are widely used for external module and device control in accelerator environments at PSI; ranging from modulator and undulator communication and control; over motion control; basic I/O control; all the way to Machine Protection System for the new SwissFEL accelerator. A combined EPICS/Linux driver package has been developed at PSI; to allow for simple and mostly automatic setup of various EtherCAT configurations. The driver is capable of automatic scan of the existing devices and modules; followed by self-configuration and finally autonomous operation of the EtherCAT bus real-time loop. Additionally; the driver package supports the user PLC to manipulate EtherCAT data in real time; implements fast real-time (single cycle) slave-to-slave communication (skipping EPICS layer or PLC completely); features guaranteed one-shot trigger signals otherwise not supported by EPICS and much more. All the standard EtherCAT functions are supported; including the complete reprogramming of slave configurations and configuration generation for programmable slaves; such as EL6692 and EL6695 network bridges.; ※ BibTeX; ※ LaTeX; ※ Text/Word; ※ RIS,,use link to access more material from this paper's primary paper code reference for this paper ※ https://doi.org/10.18429/JACoW-PCaPAC2018-WEP01 paper received ※ 08 October 2018       paper accepted ※ 16 October 2018        issue date ※ 21 January 2019 reference for this paper using,https://proceedings.jacow.org/pcapac2018/talks/wepi1_talk.pdf,False,https://proceedings.jacow.org/pcapac2018/papers/wepi1.pdf,False,https://proceedings.jacow.org/pcapac2018/posters/wepi1_poster.pdf,False,https://doi.org/10.18429/JACoW-PCAPAC2018-WEPI1,
pcapac2018,,WEPI2,BLISS - Experiments Control for ESRF Beamline,V. Michel; A. Beteva; T.M. Coutinho; M.C. Dominguez; M. Guijarro; C. Guilloud; A. Homs; J.M. Meyer; E. Papillon; M. Perez; S. Petitdemange; ESRF; Grenoble; France; BLISS is the new ESRF control system for running experiments; with full deployment aimed for the end of the EBS upgrade program in 2020. BLISS provides a global approach to run synchrotron experiments; thanks to hardware integration; Python sequences and an advanced scanning engine. As a Python package; BLISS can be easily embedded into any Python application and data management features enable online data analysis. In addition; BLISS ships with tools to enhance scientists user experience and can easily be integrated into TANGO based environments; with generic TANGO servers on top of BLISS controllers. BLISS configuration facility can be used as an alternative TANGO database. Delineating all aspects of the BLISS project from beamline device configuration up to the integrated user interface; this poster will present the technical choices that drove BLISS design and will describe the BLISS software architecture and technology stack in depth.,,use link to access more material from this paper's primary paper code,https://proceedings.jacow.org/pcapac2018/talks/wepi2_talk.pdf,False,https://proceedings.jacow.org/pcapac2018/papers/wepi2.pdf,False,https://proceedings.jacow.org/pcapac2018/posters/wepi2_poster.pdf,False,https://doi.org/10.18429/JACoW-PCAPAC2018-WEPI2,
pcapac2018,,WEPI3,A General Solution for Complex Vacuum System Controls,"G. Bischof; A. M. Barbour; B. A. Sobhani; A. Walter; BNL; Upton; Long Island; New York; USA; At the National Synchrotron Light Source II (NSLS-II) there are many different ultra-high vacuum system configurations on the unique beamline end-stations. The proposed controls solution attempts to capture the requirements of all of these configurations with a single standard logic and graphical user interface. Additional design considerations include: resource management for multiple users; providing a high level of abstraction to simplify operation for users; providing a high level of flexibility to do non-standard operations; minimizing shock from pressure differentials when opening valves; supporting a variety of pumps; and maximizing pump lifetime. At NSLS-II it was determined that all vacuum configurations can be captured by the composition of three standard objects: a ""rough vacuum group""; and ""high vacuum group""; and a ""smart vacuum manifold"" which implements a blocking queue. These objects can be flexibly linked together to meet the needs of the beamline experiments. This solution is platform independent; but implemented and tested here using Pfeiffer vacuum pumps; Allen Bradley PLC; EPICS; and Control System Studio (CSS).; ※ BibTeX; ※ LaTeX; ※ Text/Word; ※ RIS",,use link to access more material from this paper's primary paper code reference for this paper ※ https://doi.org/10.18429/JACoW-PCaPAC2018-WEP03 paper received ※ 10 October 2018       paper accepted ※ 16 October 2018        issue date ※ 21 January 2019 reference for this paper using,https://proceedings.jacow.org/pcapac2018/talks/wepi3_talk.pdf,False,https://proceedings.jacow.org/pcapac2018/papers/wepi3.pdf,False,https://proceedings.jacow.org/pcapac2018/posters/wepi3_poster.pdf,False,https://doi.org/10.18429/JACoW-PCAPAC2018-WEPI3,
pcapac2018,,WEPI4,Developing and Validating OPC-UA Based Industrial Controls for Power Supplies at CERN,M. Ludwig; J.A.R. Arroyo Garcia; M. Bengulescu; B. Farnham; P.G.J. Gonzalez Jimenez; F. Varela; CERN; Meyrin; Switzerland; The industrial control systems of CERN’s experiments are undergoing major renovation since 2017 and well into CERN’s second Long Shutdown (LS2) until the end of 2019. Each detector power-supply control system runs several hundred software instances consisting of many different components in parallel on a large scale; broadly distinguishable as servers and clients. Our accumulated experience during LHC runs proves that some complex control issues are impossible to detect using stand-alone components on a small scale only. Furthermore; new components must be developed well before the electron-ics becomes available; without impact on operations. Moreover; during LS2; the improved and now widely established Open Protocol Communication Unified Ar-chitecture (OPC-UA) replaces OPC-DA as middleware protocol. For these reasons; we developed a simulation environment to emulate the real; and valuable; CAEN power-supply electronics underneath the OPC-UA serv-ers. This distributed simulation is configurable to mimic and exceed the nominal conditions during production and provides a repeatable setup for validation. This paper discusses the functionality and use of this simulation service.; ※ BibTeX; ※ LaTeX; ※ Text/Word; ※ RIS,,use link to access more material from this paper's primary paper code reference for this paper ※ https://doi.org/10.18429/JACoW-PCaPAC2018-WEP04 paper received ※ 05 October 2018       paper accepted ※ 15 October 2018        issue date ※ 21 January 2019 reference for this paper using,https://proceedings.jacow.org/pcapac2018/talks/wepi4_talk.pdf,False,https://proceedings.jacow.org/pcapac2018/papers/wepi4.pdf,False,https://proceedings.jacow.org/pcapac2018/posters/wepi4_poster.pdf,False,https://doi.org/10.18429/JACoW-PCAPAC2018-WEPI4,
pcapac2018,,WEPI5,Wireless Internet of Thing Application in the TLS,C.H. Kuo; K.H. Hu; C.-J. Wang; NSRRC; Hsinchu; Taiwan; The internet of thing is applied in the accelerator more frequently than before. There are many advantages in data acquisition and control oriented applications; for example; easy to distribute remotely and less cables needed; low noise generated; many commercial interfaces for choosing. The stable wireless communication is also applied in the measurement system. The high reliability and security of wireless communication with server and client structure is introduced. The structure design and implementation of IoT are summarized in this report.; ※ BibTeX; ※ LaTeX; ※ Text/Word; ※ RIS,,use link to access more material from this paper's primary paper code reference for this paper ※ https://doi.org/10.18429/JACoW-PCaPAC2018-WEP05 paper received ※ 16 October 2018       paper accepted ※ 30 January 2019        issue date ※ 21 January 2019 reference for this paper using,https://proceedings.jacow.org/pcapac2018/talks/wepi5_talk.pdf,False,https://proceedings.jacow.org/pcapac2018/papers/wepi5.pdf,False,https://proceedings.jacow.org/pcapac2018/posters/wepi5_poster.pdf,False,https://doi.org/10.18429/JACoW-PCAPAC2018-WEPI5,
pcapac2018,,WEPI6,Data Archiving and Visualization of IRFEL,Y. Song; X. Chen; C. Li; G. Liu; J.G. Wang; K. Xuan; USTC/NSRL; Hefei; Anhui; People’s Republic of China; An Infrared Free Electron Laser Light (IRFEL) is being constructed at National Synchrotron Radiation Laboratory. The EPICS Archiver Appliance provides the functions of historical data acquisition; archiving; migration; retrieval and management in the IRFEL facility. A Single-Page Web Application is developed for the data visualization based on Vue.js framework and Highcharts JavaScirpt library. A unified interface is developed for the visualization to integrate multiple data sources and provide the same retrieval entry of the historical data from EPICS Archiver Appliance; the real-time data from EPICS IOC; the statistical data from database and the alarm information from the Phoebus. This paper will describe the implementation details of data archiving and visualization of IRFEL.; ※ BibTeX; ※ LaTeX; ※ Text/Word; ※ RIS,Funding: Work supported by National Natural Science Foundation of China (No.11375186),use link to access more material from this paper's primary paper code reference for this paper ※ https://doi.org/10.18429/JACoW-PCaPAC2018-WEP06 paper received ※ 09 October 2018       paper accepted ※ 16 October 2018        issue date ※ 21 January 2019 reference for this paper using,https://proceedings.jacow.org/pcapac2018/talks/wepi6_talk.pdf,False,https://proceedings.jacow.org/pcapac2018/papers/wepi6.pdf,False,https://proceedings.jacow.org/pcapac2018/posters/wepi6_poster.pdf,False,https://doi.org/10.18429/JACoW-PCAPAC2018-WEPI6,
pcapac2018,,WEPI7,Innovative Graphical User Interfaces Development: Give the Power Back to Users,G. Segura; A. Ledeul; A. Savulescu; B. Styczen; D. Vazquez Rivera; CERN; Meyrin; Switzerland; GUI for supervision; control and data acquisition systems are usually oriented to specialist users. In big organizations like CERN; where different teams play the roles of operators; scientists and instrumentation specialists; providing a unique or static user interface usually results in a situation of dissatisfaction of everyone. On the other hand; providing distinct user interfaces for each type of user increases the development and maintenance effort and makes software evolution heavier. The approach taken for the design and development of GUIs for radiation and environment protection at CERN addressed this issue by integrating user interface changes as an embedded software functionality. Key users were provided with a tool to build; deploy and maintain their own tailor-made user interfaces; in a graphical way and without the necessity of learning any kind of programming or scripting languages. Other benefits observed from this solution include reduction of the resources spent on the support and maintenance and increase of the frequency of GUIs updates; executed without compromising the underlying control system. This paper describe the innovative design that was implemented.; ※ BibTeX; ※ LaTeX; ※ Text/Word; ※ RIS,,use link to access more material from this paper's primary paper code reference for this paper ※ https://doi.org/10.18429/JACoW-PCaPAC2018-WEP07 paper received ※ 09 October 2018       paper accepted ※ 17 October 2018        issue date ※ 21 January 2019 reference for this paper using,https://proceedings.jacow.org/pcapac2018/talks/wepi7_talk.pdf,False,https://proceedings.jacow.org/pcapac2018/papers/wepi7.pdf,False,https://proceedings.jacow.org/pcapac2018/posters/wepi7_poster.pdf,False,https://doi.org/10.18429/JACoW-PCAPAC2018-WEPI7,
pcapac2018,,WEPI8,A Universal System Based on WebSocket and JSON for the Employment of LabVIEW External Drivers,A. Stecchi; C. Bisegni; P. Ciuffetti; A. D’Uffizi; G. Di Pirro; F. Galletti; A. Michelotti; INFN/LNF; Frascati; Italy; One of the heaviest workloads when installing a Control System on a plant is the development of a large number of device drivers. This is even more true in the case of scientific facilities for which you typically deal with many custom devices and legacy code. In these cases; it is useful to consider the Rapid Application Development (RAD) approach that consists in lessen the planning phase and give more emphasis on an adaptive process; so that software prototypes can be successfully used in addition to or in place of design specifications. LabVIEW* is a typical RAD-oriented development tool and is widely used in technical laboratories where many stand-alone programs are developed to manage devices under construction or evaluation. An original system that allows software clients to use external LabVIEW drivers is presented. This system; originally created for the !CHAOS Control System**; is entirely written in LabVIEW and is based on JSON messages -transmitted on a WebSocket communication- driving LabVIEW VIs through dynamic calls. This system is completely decoupled from the client and is therefore suitable for any Control System.; *LabVIEW: http://www.ni.com ** L. Catani et al; Phys. Rev. ST Accel. Beams 15; 112804 (2012). Introducing a New Paradigm for Accelerators and Large Experimental Apparatus Control Systems.; ※ BibTeX; ※ LaTeX; ※ Text/Word; ※ RIS,,use link to access more material from this paper's primary paper code reference for this paper ※ https://doi.org/10.18429/JACoW-PCaPAC2018-WEP08 paper received ※ 10 October 2018       paper accepted ※ 15 October 2018        issue date ※ 21 January 2019 reference for this paper using,https://proceedings.jacow.org/pcapac2018/talks/wepi8_talk.pdf,False,https://proceedings.jacow.org/pcapac2018/papers/wepi8.pdf,False,https://proceedings.jacow.org/pcapac2018/posters/wepi8_poster.pdf,False,https://doi.org/10.18429/JACoW-PCAPAC2018-WEPI8,
pcapac2018,,THKT1,Delivering Machine Learning Engineering in Scientific Research,LargitData; Taipei; Taiwan; As the use of machine learning to train a predictive model has become more and more popular; knowing how to build a model with a fixed dataset may not be news to most researchers nowadays. With a little programming training; any researcher can now easily create a model with just a few lines of coding with some state of the art programming languages and analysis tool. However; knowing how to build the model is not enough; if you wish your research can reach to a wider audience; it would be important to know the correct approach to deliver the learned model into a production environment. In this keynote speech; I will address how to bring machine learning model into the production environment from the perspective of a data scientist and engineer. I will cover the issues includes data preparation; model versioning; model deployment; continuous integration/delivery; model validation; how to choose evaluation metrics; some challenges when facing big data.,,,https://proceedings.jacow.org/pcapac2018/talks/thkt1_talk.pdf,True,https://proceedings.jacow.org/pcapac2018/papers/thkt1.pdf,False,https://proceedings.jacow.org/pcapac2018/posters/thkt1_poster.pdf,False,https://doi.org/10.18429/JACoW-PCAPAC2018-THKT1,
pcapac2018,,THCA1,Quest for the New Standard PSI IOC Platform,"PSI; Villigen PSI; Switzerland; With its four accelerator facilities the Paul Scherrer Institut (PSI) has already several decades of control system Input Output Computer (IOC) experience. The technology is moving forward fast. The older hardware is becoming obsolete: it is slow; consumes too much power; does not match new computing; networking and bus technologies; and replacements can no longer be purchased as models have been discontinued. All this forces us to opt for a new ""standard"" IOC platform with increasing regularity. What used to be twenty years; became ten; and is now tending towards five years. Here we present past and possible future IOC platforms which we are investigating. Feedback from the conference would be highly appreciated.",,,https://proceedings.jacow.org/pcapac2018/talks/thca1_talk.pdf,True,https://proceedings.jacow.org/pcapac2018/papers/thca1.pdf,True,https://proceedings.jacow.org/pcapac2018/posters/thca1_poster.pdf,False,https://doi.org/10.18429/JACoW-PCAPAC2018-THCA1,119
pcapac2018,,THCA2,Development of MicroTCA-based Low-level Radio Frequency Control Systems for cERL and STF,F. Qiu; T. Matsumoto; S. Michizono; T. Miura; KEK; Ibaraki; Japan; Low-level radio frequency (LLRF) control systems based on µTCA standard have been developed for facilities such as compact energy recovery linac (cERL) and superconducting test facility (STF) at the High Energy Accelerator Research Organization (KEK); Japan. Three different types of boards were developed according to their different applications. Experimental physics and industrial control system (EPICS) was selected as the data communication system for all of these µTCA boards. The LLRF systems showed good performance during the beam commissioning. This paper presents the current status of the µTCA-based LLRF systems in the cERL and STF.,,,https://proceedings.jacow.org/pcapac2018/talks/thca2_talk.pdf,True,https://proceedings.jacow.org/pcapac2018/papers/thca2.pdf,True,https://proceedings.jacow.org/pcapac2018/posters/thca2_poster.pdf,False,https://doi.org/10.18429/JACoW-PCAPAC2018-THCA2,124
pcapac2018,,THCA3,A Feedback/Feedforward System at the TPS and its Component Performance,C.H. Huang; Y.-S. Cheng; P.C. Chiu; K.T. Hsu; K.H. Hu; C.Y. Wu; NSRRC; Hsinchu; Taiwan; For a low-emittance photon light source like the Taiwan Photon Source (TPS); beam stability is a very important property for high-quality photon beams. It is; however; hard to completely remove beam disturbing effects. Therefore; a feedback/feedforward system becomes an effective tool to suppress beam motion. In this report; we discuss the performance of such a system implemented at the TPS. The component performance of the feedback system has been tested to understand its bandwidth limitations.,,,https://proceedings.jacow.org/pcapac2018/talks/thca3_talk.pdf,True,https://proceedings.jacow.org/pcapac2018/papers/thca3.pdf,True,https://proceedings.jacow.org/pcapac2018/posters/thca3_poster.pdf,False,https://doi.org/10.18429/JACoW-PCAPAC2018-THCA3,127
pcapac2018,,THCA4,Development of a Network-based Timing and Tag Information Distribution System for Synchrotron Radiation Experiments at SPring-8,JASRI/SPring-8; Hyogo; Japan; Time-resolved measurements in synchrotron radiation experiments require an RF clock of a storage ring accelerator and a fundamental revolution frequency (zero address) signal. For the usage of these signals around the experimental station; long RF cables from the accelerator timing station; divider modules and delay modules must be deployed. These installations need a lot of cost and require a lot of efforts to adjust the timing by experts. To lower these costs and efforts; the revolution frequency; which is ~209 kHz at the SPring-8 storage ring; and tag information distribution system has been studied based on a high precision time synchronization technology over a network. In this study; the White Rabbit* (WR) technology is adopted. The proof of concept system has been built; which consists of a master PC; a slave PC and two WR switches. The master PC detects the zero-address signal and distributes the time stamps with tag information to the slave PC. Then the slave PC generates the ~209 kHz signals synchronized with the target bunch by adding the offset time by software. The measured one-σ jitter of the output signals from the slave PC has been achieved less than 100 ps.,,* https://www.ohwr.org/projects/white-rabbit,https://proceedings.jacow.org/pcapac2018/talks/thca4_talk.pdf,True,https://proceedings.jacow.org/pcapac2018/papers/thca4.pdf,True,https://proceedings.jacow.org/pcapac2018/posters/thca4_poster.pdf,False,https://doi.org/10.18429/JACoW-PCAPAC2018-THCA4,131
pcapac2018,,THCA5,Rethinking PLCs: Industrial Ethernet for Large-Scale Real-Time Distributed Control Applications,B. Plötzeneder; O. Janda; A. Kru’enko; J. Trdlicka; ELI-BEAMS; Prague; Czech Republic; Institute of Physics of the ASCR; Prague; Czech Republic; Many research facilities rely on PLCs to automate large slow systems like vacuum or HVAC; where price; availability and reliability matter. The dominant architecture consists of local units of controllers/ modules (programmed in IEC61131-3 languages); which operate mostly autonomously from a SCADA layer. While some vendors provide low-level stacks to encourage growth of their ecosystems; PLC programming remains largely within a closed; proprietary world. In this paper; we introduce a different way of thinking about PLC hardware. Working with the open stacks intended for the design of new EtherCAT (Beckhoff) / Powerlink (B&R) modules; we built an abstract C+± API to control the existing ones. These industrial ethernet busses can be propagated using standard network hardware; so any RT-Linux system can now control any PLC module from anywhere in our facility using high-level languages (C++; LabVIEW). This way; PLC modules are seamlessly integrated into our distributed TANGO-based control system. PC-PLC interfaces are no longer needed; or in the case of traditionally implemented subsystems (machine safety); trivial.,,,https://proceedings.jacow.org/pcapac2018/talks/thca5_talk.pdf,True,https://proceedings.jacow.org/pcapac2018/papers/thca5.pdf,True,https://proceedings.jacow.org/pcapac2018/posters/thca5_poster.pdf,False,https://doi.org/10.18429/JACoW-PCAPAC2018-THCA5,136
pcapac2018,,THCB1,ACOP. NET : Not Just Another GUI Builder,"J. Szczesny; P. Duval; M. Lomperski; H. Wu; DESY; Hamburg; Germany; Cosylab; Ljubljana; Slovenia; KEK; Ibaraki; Japan; ACOP (Advanced Component Oriented Programming) tools have been useful in control system GUI application development for some time; originally as an ActiveX component offering a transport layer and a multi-faceted chart * and then later as a suite of components in the Java world **. We now present a set of ACOP components for development in .NET. And where the emphasis in the past has been primarily on rapid application development of rich clients; this new palette of components is designed both for fully featured rich-client development in any of the .NET supported languages (C#; C++; VB; F#) as well as for fully configurable clients (with design-time browsing); where no programming on the part of the developer is necessary; and of course for any combination between these extremes. This is an important point; which will become clear when we contrast application development with ACOP. NET with other control system GUI builders such as Control System Studio and jddd. Although Visual Studio is the GUI builder of choice; we will present other available options; for example on Linux. Examples using transport plugs for TINE and STARS will be given.; * I. Deloose; et al.; ""The Use of ACOP Tools in Writing Control System Software""; ICALEPCS 1997.  ** J.Bobnar; et al.; ""The ACOP Family of Beans: A Framework Independent Approach""; ICALEPCS 2007.",,,https://proceedings.jacow.org/pcapac2018/talks/thcb1_talk.pdf,True,https://proceedings.jacow.org/pcapac2018/papers/thcb1.pdf,True,https://proceedings.jacow.org/pcapac2018/posters/thcb1_poster.pdf,False,https://doi.org/10.18429/JACoW-PCAPAC2018-THCB1,139
