conference_code,session_name,paper_id,title,authors,institutions,abstract,presentation_url,presentation_available,paper_url,paper_available,poster_url,poster_available,doi,page_number
pcapac2018,,THCB2,Development of ACOP .NET STARS Transport Layer,T. Kosuge; H. Ishii; Y. Nagatani; H. Nitani; KEK; Ibaraki; Japan; P. Duval; J. Szczesny; DESY; Hamburg; Germany; STARS is an extremely simple and very flexible control software for small scale control systems with TCP/IP sockets; which is used as the beamline control system and so on at the KEK Photon Factory (KEK-PF). STARS works on various operating system and the STARS client developer can choose his or her favorite programing language. Choosing .NET is very common to develop GUI applications of beamline control at the KEK-PF. ACOP (Advanced Component Oriented Programming) is very useful for GUI development; which is developed by DESY and a .NET version of ACOP was recently developed. ACOP has a transport layer and communicate with various system through this layer. Now; we have started development of STARS transport layer of ACOP .NET and succeeded in adding very primitive functionality. The development of ACOP .NET STARS transport layer is still ongoing.,,,https://proceedings.jacow.org/pcapac2018/talks/thcb2_talk.pdf,True,https://proceedings.jacow.org/pcapac2018/papers/thcb2.pdf,True,https://proceedings.jacow.org/pcapac2018/posters/thcb2_poster.pdf,False,https://doi.org/10.18429/JACoW-PCAPAC2018-THCB2,144
pcapac2018,,THCB3,Improving Web2cHMI Gesture Recognition Using Machine Learning,DESY; Hamburg; Germany; Web2cHMI is multi-modal human-machine interface which seamlessly incorporates actions based on various interface modalities in a single API; including finger; hand and head gestures as well as spoken commands. The set of native gestures provided by off-the-shelf 2D- or 3D-interface devices such as the Myo gesture control armband can be enriched or extended by additional custom gestures. This paper discusses a particular method and its implementation in recognizing different finger; hand and head movements using supervised machine learning algorithms including a non-linear regression for feature extraction of the movement and a k-nearest neighbor method for movement classification using memorized training data. The method is capable of distinguishing between fast and slow; short and long; up and down; or right and left linear as well as clockwise and counterclockwise circular movements; which can then be associated with specific user interactions.,,,https://proceedings.jacow.org/pcapac2018/talks/thcb3_talk.pdf,True,https://proceedings.jacow.org/pcapac2018/papers/thcb3.pdf,True,https://proceedings.jacow.org/pcapac2018/posters/thcb3_poster.pdf,False,https://doi.org/10.18429/JACoW-PCAPAC2018-THCB3,148
pcapac2018,,THCB4,Leveraging Internet of Things Developments for Rapid Prototyping of Synoptic Displays,L.T. Stant; T.M. Cobb; DLS; Oxfordshire; United Kingdom; Recently the technology industry has been laying foundations for the eponymous Internet of Things (IoT): efficient publish-subscribe protocols; process control schemas for household items; and improved low-power radio communications. Accelerator controls and IoT have several aspects in common - small payloads; low latency; dashboard/synoptic data presentation format are some examples. The IoT now provides several open-source projects which can provide a partial implementation of one or more accelerator controls software features. Because development is typically a lower priority for accelerator controls groups; there is a valid case to try and utilise the free efforts of others for the benefit of accelerator controls. In this paper; the authors present examples of the use of IoT frameworks for synoptic display/GUI development. The work in this paper enables other developers to access this resource and experiment with their own systems.,,reference for this paper ※ https://doi.org/10.18429/JACoW-PCaPAC2018-,https://proceedings.jacow.org/pcapac2018/talks/thcb4_talk.pdf,False,https://proceedings.jacow.org/pcapac2018/papers/thcb4.pdf,True,https://proceedings.jacow.org/pcapac2018/posters/thcb4_poster.pdf,False,https://doi.org/10.18429/JACoW-PCAPAC2018-THCB4,151
pcapac2018,,THCB5,Intelligent Controls and Modeling for Particle Accelerators and Other Research and Industrial Infrastructures,S. Biedron; S.V. Milton; Element Aero; Chicago; USA; CSU; Fort Collins; Colorado; USA,,"We give some perspective on the present state of intelligent control for particle accelerators. This is based on our experience over the past 14 years in developing artificial-intelligence-based tools specifically to address modeling and control challenges found in particle accelerator systems. [1] E. Meier et al., NIM A: 632. 1 (2011): 1-6; [2] S. G. Biedron et al., ""Advanced Controls for RF and Directed Energy Systems,"" 18th Annual Directed Energy Symposium, 2016. [3] A. L. Edelen et al., IEEE Trans. on Nuclear Science 63(2), 878-897., [4] A. Edelen et al., in Proc. IPAC’18, Vancouver, Canada, 2018. doi:10.18429/JACoW-",https://proceedings.jacow.org/pcapac2018/talks/thcb5_talk.pdf,False,https://proceedings.jacow.org/pcapac2018/papers/thcb5.pdf,True,https://proceedings.jacow.org/pcapac2018/posters/thcb5_poster.pdf,False,https://doi.org/10.18429/JACoW-PCAPAC2018-THCB5,156
pcapac2018,,THPI1,Upgrading the Synchronisation and Trigger Systems on the Vulcan High-Power Nd:glass Laser,D.A. Pepler; I. O. Musgrave; P.B.M. Oliveira; STFC/RAL; Chilton; Didcot; Oxon; United Kingdom; The Vulcan Neodymium-Glass High-Power Laser Facility at the Central Laser Facility in the UK has been operational for over 40 years providing a world-leading and high-profile service to International researchers in the field of Plasma Physics. Over that time the Facility has had many modifications and enhancements to the buildings; the laser hardware and to the computerised control; synchronisation and timing systems. As the laser systems have developed and the user experiments have continued to become much more complex and demanding; many new operational conditions have been required. The use of four independent laser oscillators with different properties - including temporal; spectral and operating frequencies - have meant that the optical and electrical multiplexing and the timing and synchronisation systems have all had to be adapted and extended to cope with these additional needs. However; these changes have resulted in the build-up of the overall system jitter to ± 250 ps between long (ns) and short (ps) optical pulses and this is a limiting factor for time-critical experiments. This paper will present some of the key changes and improvements that have recently been made.; ※ BibTeX; ※ LaTeX; ※ Text/Word; ※ RIS,,use link to access more material from this paper's primary paper code reference for this paper ※ https://doi.org/10.18429/JACoW-PCaPAC2018-THP12 paper received ※ 27 September 2018       paper accepted ※ 15 October 2018        issue date ※ 21 January 2019 reference for this paper using,https://proceedings.jacow.org/pcapac2018/talks/thpi1_talk.pdf,False,https://proceedings.jacow.org/pcapac2018/papers/thpi1.pdf,False,https://proceedings.jacow.org/pcapac2018/posters/thpi1_poster.pdf,False,https://doi.org/10.18429/JACoW-PCAPAC2018-THPI1,
pcapac2018,,THPI2,Current Status of the RAON Machine Protection System Development,H. Jin; Y. Choi; S. Lee; IBS; Daejeon; Republic of Korea; For the RAON accelerator that transport beams with high energy and power; a machine protection system (MPS) that protects each device from sudden beam loss is necessary. For this reason; we have been preparing for the development of the MPS with the start of the RAON accelerator construction. For effective MPS operation and stable accelerator operation; we divided the MPS into four subsystems: fast protection system; slow interlock system; run permit system; and post-mortem system. Among them; the FPGA-based fast protection system and the PLC-based slow interlock system have been tested by prototypes and are currently working on the mass production. The run permit system and the post-mortem system are also undergoing basic design and software development. In this paper; we will describe the progress of the MPS development through detailed hardware and software development in the RAON accelerator and explain the future plans.; ※ BibTeX; ※ LaTeX; ※ Text/Word; ※ RIS,,use link to access more material from this paper's primary paper code reference for this paper ※ https://doi.org/10.18429/JACoW-PCaPAC2018-THP02 paper received ※ 04 October 2018       paper accepted ※ 15 October 2018        issue date ※ 21 January 2019 reference for this paper using,https://proceedings.jacow.org/pcapac2018/talks/thpi2_talk.pdf,False,https://proceedings.jacow.org/pcapac2018/papers/thpi2.pdf,False,https://proceedings.jacow.org/pcapac2018/posters/thpi2_poster.pdf,False,https://doi.org/10.18429/JACoW-PCAPAC2018-THPI2,
pcapac2018,,THPI3,Marvin Update ’ the Robotic Sample Mounting System at the Embl-Hamburg,U. Ristau; M. Bueno; S. Fiedler; T. Gehrmann; D. Jahn; V. Palnati; EMBL; Hamburg; Germany,In this article we give an overview about the controls of the robotic sample mounting system Marvin in user operation at the DESY Petra III synchrotron Beamlines of the EMBL. Two protein crystallography Beamlines each equipped with the in house build robotic sample mounting system are in user operation. The controls of the sample mounting system ‘Marvin’ and especially new developments to decrease down times as well as system recovery routines will be described in detail.,use link to access more material from this paper's primary paper code,https://proceedings.jacow.org/pcapac2018/talks/thpi3_talk.pdf,False,https://proceedings.jacow.org/pcapac2018/papers/thpi3.pdf,False,https://proceedings.jacow.org/pcapac2018/posters/thpi3_poster.pdf,False,https://doi.org/10.18429/JACoW-PCAPAC2018-THPI3,
pcapac2018,,THPI4,Real-time and Detailed Provision of J-PARC Accelerator Operation Information from the Accelerator Control LAN to the Office LAN,J-PARC; KEK & JAEA; Ibaraki-ken; Japan; J-PARC Main Ring (MR) is a high-intensity proton synchrotron whose control system is developed based on EPICS.　It started its beam operation in 2008; and since 2009 has been delivering beam to the T2K neutrino experiment and hadron experiments.　Over the past decade; MR have become more sophisticated and more stable driving is required.　Along with this; demands arose from users and experts of equipment such that acquiring detailed and real-time information on the apparatus from the office LAN.　On the other hand; the accelerator control system is quarantined from the office LAN with firewall for security reasons.　Therefore; despite being intentional or not; manipulating any equipment in the accelerator control LAN shall be prohibited from the office LAN.　This article describes construction and prospects of such an one-way gateway system such that information is relayed via EPICS from accelerator control LAN to the office LAN while minimizing influence in the opposite direction.; ※ BibTeX; ※ LaTeX; ※ Text/Word; ※ RIS,,use link to access more material from this paper's primary paper code reference for this paper ※ https://doi.org/10.18429/JACoW-PCaPAC2018-THP04 paper received ※ 14 October 2018       paper accepted ※ 25 April 2019        issue date ※ 21 January 2019 reference for this paper using,https://proceedings.jacow.org/pcapac2018/talks/thpi4_talk.pdf,False,https://proceedings.jacow.org/pcapac2018/papers/thpi4.pdf,False,https://proceedings.jacow.org/pcapac2018/posters/thpi4_poster.pdf,False,https://doi.org/10.18429/JACoW-PCAPAC2018-THPI4,
pcapac2018,,THPI5,Development and Current Status of KURAMA-II,Kyoto University; Research Reactor Institute; Osaka; Japan; KURAMA-II; a successor of a carborne gamma-ray survey system named KURAMA (Kyoto University RAdiation MApping system); has been developed and applied to various activities related to the nuclear accident at TEPCO Fukushima Daiichi Nuclear Power Plant in 2011. KURMA-II has established its position as an effective method for the radiation monitoring method in environment on a long-term basis. The development of KURAMA-II is still on the way to extend its application areas such as the trial to port the system to a single-board computer or the development of cloud services of data management for the users who don’t have capabilities to manage the data processing system. In this paper; the current status of KURAMA-II on its developments and applications along with some results from its applications are introduced.,,use link to access more material from this paper's primary paper code,https://proceedings.jacow.org/pcapac2018/talks/thpi5_talk.pdf,False,https://proceedings.jacow.org/pcapac2018/papers/thpi5.pdf,False,https://proceedings.jacow.org/pcapac2018/posters/thpi5_poster.pdf,False,https://doi.org/10.18429/JACoW-PCAPAC2018-THPI5,
pcapac2018,,THPI6,Reliability Improvement for the Insertion Device Control in the TPS,C.Y. Wu; J. Chen; Y.-S. Cheng; K.T. Hsu; K.H. Hu; C.Y. Liao; NSRRC; Hsinchu; Taiwan; Insertion devices (ID) are essential components in third-generation synchrotron light sources; which can produce highly-brilliant; collimated and quasi-monochromatic radiation over a broad energy range for experiments. Reliable operation of the insertion devices is important to users of beamlines. The most unpredictable fault is due to a soft error in optical absolute encoders due to radiation. There are several solutions to avoid such faults; e.g. by increasing the distance of the encoder from the beam; by a lead shield cover and finally by adopting an auxiliary position sensing devices to help recovery from a fault. Efforts to improve operational reliability of the TPS ID controls will be discussed.; ※ BibTeX; ※ LaTeX; ※ Text/Word; ※ RIS,,use link to access more material from this paper's primary paper code reference for this paper ※ https://doi.org/10.18429/JACoW-PCaPAC2018-THP06 paper received ※ 10 October 2018       paper accepted ※ 15 October 2018        issue date ※ 21 January 2019 reference for this paper using,https://proceedings.jacow.org/pcapac2018/talks/thpi6_talk.pdf,False,https://proceedings.jacow.org/pcapac2018/papers/thpi6.pdf,False,https://proceedings.jacow.org/pcapac2018/posters/thpi6_poster.pdf,False,https://doi.org/10.18429/JACoW-PCAPAC2018-THPI6,
pcapac2018,,THPI7,Long-term Stability Observed by Electron BPM and Photon BPM for Taiwan Photon Source,P.C. Chiu; K.T. Hsu; K.H. Hu; C.H. Huang; NSRRC; Hsinchu; Taiwan; TPS is 3-GeV synchrotron light source which have opened for public users since September 2016 and now offers 400 mA top-up mode operation. The requirements of the long term orbit stability and orbit reproducibility after beam trip have been gradually more and more stringent and become a challenge from users’ request. Furthermore; the thermal effect would be expected to be worsen after 500 mA top-up operation which should deteriorate the orbit drift. The report investigates the long-term orbit stability observed from eBPM and XBPM and also evaluates the possibility of the local XBPM feedback.; ※ BibTeX; ※ LaTeX; ※ Text/Word; ※ RIS,,use link to access more material from this paper's primary paper code reference for this paper ※ https://doi.org/10.18429/JACoW-PCaPAC2018-THP07 paper received ※ 09 October 2018       paper accepted ※ 15 October 2018        issue date ※ 21 January 2019 reference for this paper using,https://proceedings.jacow.org/pcapac2018/talks/thpi7_talk.pdf,False,https://proceedings.jacow.org/pcapac2018/papers/thpi7.pdf,False,https://proceedings.jacow.org/pcapac2018/posters/thpi7_poster.pdf,False,https://doi.org/10.18429/JACoW-PCAPAC2018-THPI7,
pcapac2018,,THPI8,Design and Implementation of Stepper Motor Control of the LINAC High Power RF System Based on FPGA,R. Rujanakraikarn; Ch. Dhammatong; W. Phacheerak; SLRI; Nakhon Ratchasima; Thailand; In this paper; the new motion control system that governs the position of high power attenuators and phase shifters in the linac’s RF system at SLRI is described. The drive system; which was originally driven by a set of AC reversible motors; is replaced by a new set of stepper motors. The hardware selection and installation is presented in detail. The digital control circuits are designed in VHDL and implemented on a commercial Field Programmable Gate Array (FPGA) board. The main software part; implemented in MicroBlaze Microcontroller System (MCS); is coded in C to control the position of stepper motors relative to the DC voltage reference points of the hardware system. A LabVIEW GUI is designed to interface with the control system to provide reference points and display position values via RS-232 and PLC interfaces. This stepper motor control system can be used to effectively implement the phase and amplitude control system of the linac’s RF signals in the future.,,use link to access more material from this paper's primary paper code,https://proceedings.jacow.org/pcapac2018/talks/thpi8_talk.pdf,False,https://proceedings.jacow.org/pcapac2018/papers/thpi8.pdf,False,https://proceedings.jacow.org/pcapac2018/posters/thpi8_poster.pdf,False,https://doi.org/10.18429/JACoW-PCAPAC2018-THPI8,
pcapac2018,,FRKT1,Bootstrapping AI Adoption for Smart Manufacturing,Inventec; Taipei; Taiwan; Skywatch; Taipei; Taiwan; When it comes to applying AI to smart manufacturing; the first problems that come to mind are usually the automatic inspection of products. The reality is we often need to carefully re-define the problems to yield a satisfactory solution and return on investment. In this talk; we share our experiences working with first-tier electronics manufacturing facilities to apply machine learning techniques to their product design process and production pipeline. We will also talk in more detail about several applications in the domains of circuit defect and product appearance inspections; quality control; and the associated edge AI algorithms and machinery we have created to solve these problems.,,,https://proceedings.jacow.org/pcapac2018/talks/frkt1_talk.pdf,True,https://proceedings.jacow.org/pcapac2018/papers/frkt1.pdf,False,https://proceedings.jacow.org/pcapac2018/posters/frkt1_poster.pdf,False,https://doi.org/10.18429/JACoW-PCAPAC2018-FRKT1,
pcapac2018,,FRCA1,New Collaborative Approach to Scientific Data Management with NOVA,W. Mexner; E. Bründermann; M. Caselle; S. Funkner; A. Kopmann; G. Niehues; N. Tan Jerome; M. Vogelgesang; KIT; Eggenstein-Leopoldshafen; Germany; Accelerator physics studies at the storage ring KARA at KIT produce terabytes of diagnostics data per day; which is recorded once and then reused on a long-term basis to answer different research questions at KIT. Finally; raw data and intermediate analysis results should be published along with scientific results. Thus storing from the very beginning the data of all analysis steps and its metadata in a central portal would be very beneficial. Similar requirements exist for synchrotron X-rayμtomography at the KIT imaging cluster and there is an interest to share the large data analysis effort. By using a new collaborative approach; the NOVA project aims to create tools; to enable an efficient use of valuable beam time. Forμtomography beamlines the project will build up a comprehensive database of various demonstrator organisms up for the morphological analysis of animals. The NOVA portal is integrated in the local data handling procedures and the datasets automatically appear in the NOVA portal as they are recorded. For both applications; accelerator diagnostics and X-ray tomography; the NOVA portal will offer new collaborative tools to enable synergetic data analysis.,,,https://proceedings.jacow.org/pcapac2018/talks/frca1_talk.pdf,True,https://proceedings.jacow.org/pcapac2018/papers/frca1.pdf,True,https://proceedings.jacow.org/pcapac2018/posters/frca1_poster.pdf,False,https://doi.org/10.18429/JACoW-PCAPAC2018-FRCA1,224
pcapac2018,,FRCA2,Development of a Task-Oriented Chatbot Application for Monitoring Taiwan Photon Source Front-End System,Y.Z. Lin; C.-C. Chang; Y.T. Cheng; J.-Y. Chuang; H.P. Hsueh; C.H. Huang; I.C. Sheng; Y.C. Yang; NSRRC; Hsinchu; Taiwan; In this study; we propose a task-oriented chatbot application as an interactive user interface for monitoring Taiwan Photon Source front-end system. This application can get specific information faster and improve the efficiency of the maintenance engineer’s definition of fault information when a fault occurs. The chatbot uses LINE’s Message API to provide services; and obtains information and status of the front-end system over EPICS protocol; responding to users’ needs; like a virtual assistant. At present; the application can obtain the front-end system information already in operation of Taiwan Photon Source; including x-ray beam position monitor; safety interlock system; front-end valve status; vacuum status…etc. However; in addition to the passive provision of information; this program has a fault warning function; and will actively transmit fault information to relevant personnel when a problem occurs in the safety interlock system.,,,https://proceedings.jacow.org/pcapac2018/talks/frca2_talk.pdf,True,https://proceedings.jacow.org/pcapac2018/papers/frca2.pdf,True,https://proceedings.jacow.org/pcapac2018/posters/frca2_poster.pdf,False,https://doi.org/10.18429/JACoW-PCAPAC2018-FRCA2,228
pcapac2018,,FRCB1,Ultra Fast Data Acquisition in ELI Beamlines,Institute of Physics of the ASCR; Prague; Czech Republic; V. Gaman; O. Janda; P. Pivonka; B. Plötzeneder; J. Sys; J. Trdlicka; ELI-BEAMS; Prague; Czech Republic; The ELI Beamlines facility is a Petawatt laser facility in the final construction and commissioning phase in Czech Republic. In fully operation phase; four lasers will be used to control beamlines in six experimental halls. In this paper we describe Ultra fast and distributed data acquisition system as was defined in ELI Beamlines. The data acquisition system is divided into two levels: central and local level. The central level data acquisition system defines a special Tier 0 RAM buffer. This buffer is based on special multi node data acquisition server which shares memory of all its nodes into one continuous space over low latency network technologies (Mellanox Infinband/Intel OmniPath). The main role of the Tier 0 buffer is to acquire first bunch and provide load balancing of incoming data. These data comes from many sources distributed along the experimental technologies. The local data acquisition system is then responsible for connection of local detectors to central data acquisition server through ROCE interface. The connection is done directly when supported or indirectly using local data acquisition computers (for PCIe etc.).,,,https://proceedings.jacow.org/pcapac2018/talks/frcb1_talk.pdf,True,https://proceedings.jacow.org/pcapac2018/papers/frcb1.pdf,True,https://proceedings.jacow.org/pcapac2018/posters/frcb1_poster.pdf,False,https://doi.org/10.18429/JACoW-PCAPAC2018-FRCB1,230
pcapac2018,,FRCB2,Design and Construction of the Data Warehouse Based on Hadoop Ecosystem at HLS-II,Y. Song; X. Chen; C. Li; G. Liu; J.G. Wang; K. Xuan; USTC/NSRL; Hefei; Anhui; People’s Republic of China; A data warehouse based on Hadoop ecosystem is designed and constructed for Hefei Light Source II (HLS-II). The ETL program based on Spark migrates data to HDFS from RDB Channel Archiver and the EPICS Archiver Appliance continuously and store them in Parquet format. The distributed data analysis engine based on Impala greatly improves the performance of data retrieval and reduces the response time of queries. In this paper; we will describe our efforts and experience to use various open sources software and tools to effectively manage the big data. We will also report the plans on this data warehouse in the future.,Funding: Work supported by National Natural Science Foundation of China (No.11375186),,https://proceedings.jacow.org/pcapac2018/talks/frcb2_talk.pdf,True,https://proceedings.jacow.org/pcapac2018/papers/frcb2.pdf,True,https://proceedings.jacow.org/pcapac2018/posters/frcb2_poster.pdf,False,https://doi.org/10.18429/JACoW-PCAPAC2018-FRCB2,233
