conference_code,session_name,paper_id,title,authors,institutions,abstract,presentation_url,presentation_available,paper_url,paper_available,poster_url,poster_available,doi,page_number
pcapac2018,,FRCB3,Novel Concept of Off-detector Electronics Based on Machine Learning for High Energy Physics,"W. Wang; B.M. Balzer; M. Brunet; M. Caselle; L. Rota; M. Weber; KIT; Karlsruhe; Germany; Due to increase of complexity of HEP detectors operating in rush radiation environment; detector calibration operations becomes a challenge. Moreover; growing volumes of available data; traditional calibration approach risk being weak. Therefore; new methods that can automatically analyses large complex data and deliver quick accurate results; without human intervention; are necessary in modern detectors. Embedded machine learning algorithms on FPGAs enables new methods for performing high-granularity Data Quality Monitoring (DQM) and real-time detector calibration; ensuring optimal data quality for further offline analysis. Combining FPGA with multiprocessor system-on-chip (MPSoC) opens ""new ideas"" in integration of DQM and slow-control for off-detector electronics. In this context; a novel readout electronics based on ZYNQ Ultrascale+ MPSoC has been designed. To handle the huge data volume; the ZYNQ board is equipped with FireFly optical data links. In this contribution; a novel high-granularity Data Quality Monitoring (DQM) architecture with real-time detector calibration based on embedded machine learning is presented.; ※ BibTeX; ※ LaTeX; ※ Text/Word; ※ RIS",,reference for this paper using,https://proceedings.jacow.org/pcapac2018/talks/frcb3_talk.pdf,False,https://proceedings.jacow.org/pcapac2018/papers/frcb3.pdf,False,https://proceedings.jacow.org/pcapac2018/posters/frcb3_poster.pdf,False,https://doi.org/10.18429/JACoW-PCAPAC2018-FRCB3,
pcapac2018,,FRCB4,The Application for Fault Diagnosis and Prediction of Power Supply Control Device on BEPCII,J. Liu; D. Wang; J.C. Wang; X.L. Wang; IHEP; Beijing; People’s Republic of China; With the widely adoption of complex electronic devices and microcircuits in accelerator system; the probability of system failure and functional failure will be enlarged. For example; the fault of the magnet power supply front-end electronics devices may cause accelerator energy instability and even lead to beam loss. Therefore; it is very necessary to diagnose and locate the device fault accurately and rapidly; that will induce the high cost of the accelerator operation. Faults diagnosis and prediction can not only improve the safety and reliability of the equipment; but also effectively reduce the equipment’s cycle costing. We applied the FMECA and testability modeling method for the PSI device; which using in BEPCII power supply control system; and evaluated the remaining life of the PSI under certain temperature and humidity condition based on the reliability model and accelerated life test.,,reference for this paper ※ https://doi.org/10.18429/JACoW-PCaPAC2018-,https://proceedings.jacow.org/pcapac2018/talks/frcb4_talk.pdf,False,https://proceedings.jacow.org/pcapac2018/papers/frcb4.pdf,True,https://proceedings.jacow.org/pcapac2018/posters/frcb4_poster.pdf,False,https://doi.org/10.18429/JACoW-PCAPAC2018-FRCB4,236
pcapac2018,,FRCC1,FPGA-based Image Processing System for Electron Beam Welding Facility,M. M. Sizov; K.A. Blokhina; A.M. Medvedev; A.A. Starostenko; BINP SB RAS; Novosibirsk; Russia; NSU; Novosibirsk; Russia,,In this paper image processing system for secondary emission of electrons in electron beam welding facility is described. System runs on Intel Field Programmable Gate Array (FPGA) for digital processing. Time-sensitive algorithms are designed in VHDL and dataflow DSL Caph. Seam finder algorithm and data filters are written in Caph. The system is designed to filter high-frequency noise and estimate seam location for its automatic correction within 2 us. General algorithms for hardware control and data visualization are described with the interface to the FPGA-based part.,https://proceedings.jacow.org/pcapac2018/talks/frcc1_talk.pdf,True,https://proceedings.jacow.org/pcapac2018/papers/frcc1.pdf,True,https://proceedings.jacow.org/pcapac2018/posters/frcc1_poster.pdf,False,https://doi.org/10.18429/JACoW-PCAPAC2018-FRCC1,239
pcapac2018,,FRCC2,Continuous Beam Scanning Intensity Control of a Medical Proton Accelerator Using a Simulink Generated FPGA Gain Scheduled Controller,P. Fernandez Carmona; C. Bula; M. Eichin; G. Klimpki; D. Meer; V. Minnig; S. Psoroulas; D.C. Weber; PSI; Villigen PSI; Switzerland; At the Centre for Proton Therapy at the Paul Scherrer Institut we treat cancer patients using a fixed beam line and two gantries. The latter use a step-and-shoot technique to deliver dose covering the treatment volume with a grid of weighted proton bunches. Dose delivery for tumours moving under respiration (e.g. lung) is however challenging and not routinely performed because of the interplay between target and beam motions. At the Gantry 2 unit; we are implementing a novel continuous beam modulation concept called line scanning; aiming at realizing a faster dose delivery to allow for effective organ motion mitigation techniques such as rescanning and gating. The current should stabilise within 100 us; which is tough due to the non-linearity of the system and latency of the monitors. In this work we implemented a gain scheduled controller and a predictor by modelling the accelerator in Simulink and developing a controller using the frequency domain robust method. We used Mathwork’s HDL Coder functionality to generate VHDL code that was implemented in an FPGA in the gantry control system. Latency; overshoot and dosimetric performance improved considerably compared to a classic PID.,,,https://proceedings.jacow.org/pcapac2018/talks/frcc2_talk.pdf,True,https://proceedings.jacow.org/pcapac2018/papers/frcc2.pdf,True,https://proceedings.jacow.org/pcapac2018/posters/frcc2_poster.pdf,False,https://doi.org/10.18429/JACoW-PCAPAC2018-FRCC2,242
pcapac2018,,FRCC3,"CERN Supervision, Control and Data Acquisition System for Radiation and Environmental Protection",A. Ledeul; A. Savulescu; G. Segurapresenter; B. Styczen; D. Vazquez Rivera; CERN; Meyrin; Switzerland; The CERN Health; Safety and Environment Unit is mandated to provide a Radiation and Environment Supervision; Control and Data Acquisition system for all CERN accelerators; experiments as well as the environment. The operation and maintenance of the previous CERN radiation and environment supervisory systems showed some limitations in terms of flexibility and scalability. In order to face the increasing demand for radiation protection and continuously assess both conventional and radiological impacts on the environment; CERN developed and deployed a new supervisory system; called REMUS - Radiation and Environment Monitoring Unified Supervision. REMUS design and development focused on these desired features. REMUS interfaces with 75 device types; providing about 3; 000 measurement channels (approximately 600; 000 tags) at the time of writing. This paper describes the architecture of the system; as well as the innovative design that was adopted in order to face the challenges of heterogeneous equipment interfacing; diversity of end users and continuous operation.,,,https://proceedings.jacow.org/pcapac2018/talks/frcc3_talk.pdf,True,https://proceedings.jacow.org/pcapac2018/papers/frcc3.pdf,True,https://proceedings.jacow.org/pcapac2018/posters/frcc3_poster.pdf,False,https://doi.org/10.18429/JACoW-PCAPAC2018-FRCC3,248
pcapac2018,,FRCC4,Maintenance and Optimization of Insertion Devices at NSLS-II Using Motion Controls,C.A. Guerrero; J. Escallier; R.I. Farnsworth; D.A. Hidas; Y. Tian; BNL; Upton; Long Island; New York; USA; The purpose of this project is to demonstrate the performance improvements on insertion devices by upgrading the motion control software. The insertion devices installed inside the NSLS-II storage ring are currently operating at micron precision with slow speeds; which can limit the scope of preferences for user experimentation. We can manipulate the devices with adaptive tuning algorithms to compensate for varying electromagnetic forces throughout motion scans. By correcting positional feedback with encoder compensation and redefining motion programs; we can safely increase the speed to run the same motion trajectories in less time.,Funding: This project is funded by Brookhaven Science Associates. BSA is a partnership between Battelle and The Research Foundation for the State University of New York on behalf of Stony Brook University.,,https://proceedings.jacow.org/pcapac2018/talks/frcc4_talk.pdf,True,https://proceedings.jacow.org/pcapac2018/papers/frcc4.pdf,True,https://proceedings.jacow.org/pcapac2018/posters/frcc4_poster.pdf,True,https://doi.org/10.18429/JACoW-PCAPAC2018-FRCC4,253
