conference_code,session_name,paper_id,title,authors,institutions,abstract,presentation_url,presentation_available,paper_url,paper_available,poster_url,poster_available,doi,page_number
rupac2014,,THPSC11,NSLS-II Booster Vacuum System,"A.M. Semenov; V.V. Anashin; S.M. Gurov; V.A. Kiselev; A.A. Krasnov; BINP SB RAS; Novosibirsk; Russia; H.-C. Hseuh; T.V. Shaftan; BNL; Upton; Long Island; New York; USA; One of the last SR source third generation (NSLS-II) is constructed in Brookhaven National Laboratory in present time. To raise the operation effectiveness in continued mode with irradiation of maximum brightness injectors of these SR sources is operated continually on the energy up to energy of the main ring (linac or synchrotron booster). The injection on the full energy allows add electrons to early moved electrons in a storage ring rather than to regulate a magnet system. This operating mode is often named ""Top-Up"". NSLS-II consists of a linear accelerator on the electron energy up to 200 MeV; a synchrotron booster on the energy 3 GeV; a main storage ring. The status and review of vacuum system are written in this report.",,,https://proceedings.jacow.org/rupac2014/talks/thpsc11_talk.pdf,False,https://proceedings.jacow.org/rupac2014/papers/thpsc11.pdf,True,https://proceedings.jacow.org/rupac2014/posters/thpsc11_poster.pdf,False,https://doi.org/10.18429/JACoW-RUPAC2014-THPSC11,342
rupac2014,,THPSC12,Effect of the Vertical Velocity Component on Properties of Synchrotron Radiation,MSIU; Moscow; Russia,,This subject determines more precisely characteristics of synchrotron radiation when charge particle moves on the spiral in physical devices and a space. For this purpose first the Bessel functions of a high order are approximated to within the second approach. It is discussed that the vertical component of velocity in alternating magnetic fields of accelerators significantly changes spectral and angular distributions of radiation intensity.,https://proceedings.jacow.org/rupac2014/talks/thpsc12_talk.pdf,False,https://proceedings.jacow.org/rupac2014/papers/thpsc12.pdf,True,https://proceedings.jacow.org/rupac2014/posters/thpsc12_poster.pdf,False,https://doi.org/10.18429/JACoW-RUPAC2014-THPSC12,345
rupac2014,,THPSC13,Horizontal Emittance Regulation at SIBERIA-2,A.G. Valentinov; V. Korchuganov; Y.V. Krylov; Y.L. Yupinov; NRC; Moscow; Russia,Synchrotron radiation (SR) brightness is the most valuable parameter of every SR light source. It depends greatly on horizontal emittance of an electron beam. That's why all modern SR light sources have designed emittance of several nanometers. A horizontal emittance of Siberia-2 now equals to 98 nm. It can be decreased by two ways. First way is to find another working point (betatron tunes) with lower emittance. Maximal possible current values of existing power supplies must be taken into account. Injection efficiency may become worse because of smaller dynamic aperture due to stronger sextupoles. Second way is to rebuild magnetic structure keeping the same betatron tunes. Advantages of this method are good injection efficiency and proved energy ramping process. Modification of the magnetic structure may be done at high energy with more stable electron beam. But the second way is not allowed to reach as lower emittance level as in the first way. Theoretical and practical aspects of these two ways are described in the report. Magnetic structures with dispersion-free straight sections and smooth horizontal dispersion function are presented. Also structure with higher emittance is described in order to reach higher injection efficiency.,,https://proceedings.jacow.org/rupac2014/talks/thpsc13_talk.pdf,False,https://proceedings.jacow.org/rupac2014/papers/thpsc13.pdf,True,https://proceedings.jacow.org/rupac2014/posters/thpsc13_poster.pdf,False,https://doi.org/10.18429/JACoW-RUPAC2014-THPSC13,347
rupac2014,,THPSC14,Electron Emission and Trapping in Non-Uniform Fields of Magnet Structure and Insertion Devices at SR Source Siberia-2,V.I. Moiseev; V. Korchuganov; N.V. Smolyakov; NRC; Moscow; Russia; In vacuum chamber of SR source; scattered photons provide high intensity flows of photo emitted electrons along the magnetic fields lines. The unperturbed electrons reach the opposite walls. The relativistic bunches influence the trajectories of low energy electrons. These electrons can be trapped by non-uniform magnetic field. The low energy electron distributions change the operating settings of the storage ring. For Siberia-2 case; the low energy electron densities are evaluated both in quadrupole lenses and in superconducting wiggler on 7.5 T field. The qualitative description of the trapped electrons behavior was developed. In calculations; the analitical solution was obtained and used for estimations of the single impact of relativistic bunch.,,,https://proceedings.jacow.org/rupac2014/talks/thpsc14_talk.pdf,False,https://proceedings.jacow.org/rupac2014/papers/thpsc14.pdf,True,https://proceedings.jacow.org/rupac2014/posters/thpsc14_poster.pdf,False,https://doi.org/10.18429/JACoW-RUPAC2014-THPSC14,350
rupac2014,,THPSC15,Modernisation of the ILC Cryomodule Using High-tech Tchnology – Explosion Welding,JINR; Dubna; Moscow Region; Russia; The world first samples of Ti and Nb tubes joint with stainless steel ones by an explosion welding by the JINR-VNIIEF-FNAL-INFN cooperation were manufactured in the frame of ILC R&D program. An applying methods of relaxation of residual tensions (after explosion and electron beam welding); macro-and microanalyses of welding seam and cryogenic tests of the samples produced manifest the achievement of high mechanic strength (~250 MPa/share) of welding seam; solidity and leak absence on 10-10 l*atm/sec level at 1.8 K. The explosion welding technology and methods introducing to industrial manufacturing of the 4-th generation of cryomodule of TESLA TYPE DESIGN can exclude the Ti – communications as cover of the vessel. The Agreement between JINR and E.Paton IEW (Kiev; Ukraine) was achieved for manufacturing Nb+SS transition samples using new technology and new design of Nb+Ti+SS junction. We suppose this samples should be more technological; simpler in manufacturing and cheaper.,,,https://proceedings.jacow.org/rupac2014/talks/thpsc15_talk.pdf,False,https://proceedings.jacow.org/rupac2014/papers/thpsc15.pdf,False,https://proceedings.jacow.org/rupac2014/posters/thpsc15_poster.pdf,False,https://doi.org/10.18429/JACoW-RUPAC2014-THPSC15,
rupac2014,,THPSC16,Analysis of High Order Modes Damping Techniques for 800 MHz Single Cell Superconducting Cavities,Ya.V. Shashkov; N.P. Sobenin; MEPhI; Moscow; Russia; INFN/LNF; Frascati (Roma); Italy; The High Luminosity LHC upgrade program foresees a possibility of using the second harmonic cavities working at 800 MHz for the collider bunch length variation. Such harmonic cavities should provide an opportunity to vary the length of colliding bunches. In order to supply the required harmonic voltage several single cell superconducting cavities are to be used. Different cavity designs and several higher order mode (HOM) damping techniques are being studied in order to reduce the cavity HOM impact on the beam stability and to minimize parasitic power losses. In this paper we analyze and compare the HOM electromagnetic characteristics and respective wake potential decay rates for cavities with grooves; fluted and ridged beam pipes. The problem of Lorentz force detuning is also addressed.,,,https://proceedings.jacow.org/rupac2014/talks/thpsc16_talk.pdf,False,https://proceedings.jacow.org/rupac2014/papers/thpsc16.pdf,True,https://proceedings.jacow.org/rupac2014/posters/thpsc16_poster.pdf,False,https://doi.org/10.18429/JACoW-RUPAC2014-THPSC16,353
rupac2014,,THPSC17,Higher Order Modes Damping for 9-cell Structure with Modified Drift Tubes,Ya.V. Shashkov; A.A. Mitrofanov; N.P. Sobenin; MEPhI; Moscow; Russia; TRIUMF; Canada's National Laboratory for Particle and Nuclear Physics; Vancouver; Canada,,This paper is focused on HOM damping in 9-cell superconducting cavities. We are considering HOM propagation outside from the cavity ridged and fluted drift tubes. The analysis of the influence of the parameters of the drift tube on the HOM damping was conducted. The considered methods were analysed and compared.,https://proceedings.jacow.org/rupac2014/talks/thpsc17_talk.pdf,False,https://proceedings.jacow.org/rupac2014/papers/thpsc17.pdf,True,https://proceedings.jacow.org/rupac2014/posters/thpsc17_poster.pdf,False,https://doi.org/10.18429/JACoW-RUPAC2014-THPSC17,356
rupac2014,,THPSC18,Suppression of Mechanical Oscillations in Quarterwave 106 MHz Resonator,M. Gusarova; I.I. Petrushina; I.V. Rybakov; Ya.V. Shashkov; Ya.V. Shashkov; V. Zvyagintsev; MEPhI; Moscow; Russia; TRIUMF; Canada's National Laboratory for Particle and Nuclear Physics; Vancouver; Canada,,Analytical calculations and numerical simulations have been done for mechanical eigenmodes of quarter wave superconducting resonators with operating frequency of 106 MHz and 80 MHz. A possibility of frequency shift of mechanical modes in 106 MHz resonator has been estimated by application of the damper. We have optimized the damper's position for suppression efficiency. We have also compared the numerical and experimental results.,https://proceedings.jacow.org/rupac2014/talks/thpsc18_talk.pdf,False,https://proceedings.jacow.org/rupac2014/papers/thpsc18.pdf,True,https://proceedings.jacow.org/rupac2014/posters/thpsc18_poster.pdf,False,https://doi.org/10.18429/JACoW-RUPAC2014-THPSC18,359
rupac2014,,THPSC19,Influence of the Different Geometric Parameters of Superconducting Elliptical Cavities on the Multipactor,M. Gusarova; I.I. Petrushina; MEPhI; Moscow; Russia; The results of numerical simulations of multipacting in the different superconducting elliptical cavities are presented. Question of influence of the aperture radius; equator shape; iris shape and frequency and electron trajectories for different geometrical parameters of elliptic structures are considered.,,,https://proceedings.jacow.org/rupac2014/talks/thpsc19_talk.pdf,False,https://proceedings.jacow.org/rupac2014/papers/thpsc19.pdf,True,https://proceedings.jacow.org/rupac2014/posters/thpsc19_poster.pdf,False,https://doi.org/10.18429/JACoW-RUPAC2014-THPSC19,362
rupac2014,,THPSC20,Multipactor in Elliptical Cavities 800 MHz,M. Gusarova; I.I. Petrushina; MEPhI; Moscow; Russia; The studies of the multipacting discharge possibility in elliptic single-cell cavities at 800 MHz with three types of hifger order modes couplers were done. The ranges of the field gradients where the conditions for the occurrence of first order multipacting discharge in the equatorial region; as well as the HOM field levels were determined.,,,https://proceedings.jacow.org/rupac2014/talks/thpsc20_talk.pdf,False,https://proceedings.jacow.org/rupac2014/papers/thpsc20.pdf,True,https://proceedings.jacow.org/rupac2014/posters/thpsc20_poster.pdf,False,https://doi.org/10.18429/JACoW-RUPAC2014-THPSC20,365
rupac2014,,THPSC21,Observation of Characteristic X-ray Radiation Induced by 450 MeV/nucleon C+6 Ions and 1 GeV Protons Impact in Solid Targets at Extracted and Circulated Beams of Accelerator U70,R.M. Nazhmudinov; A.S. Kubankin; A.V. Shchagin; BelSU; Belgorod; Russia; A.G. Afonin; G.I. Britvich; Y.A. Chesnokov; A.A. Durum; M.Yu. Kostin; V.A. Maisheev; D.A. Savin; A.A. Yanovich; IHEP; Moscow Region; Russia; A.S. Gogolev; S.R. Uglov; TPU; Tomsk; Russia; A.V. Shchagin; N.F. Shul'ga; NSC/KIPT; Kharkov; Ukraine; KhNU; Kharkov; Ukraine; * S. Ivanov et al.; Proceedings of RUPAC 2012; Saint-Petersburg; Russia p. 120–122.  ** A.G. Afonin et al.; Problems of Atomic Science and Technology; №4 (86) (2013) 315-319.,,Results of experimental research on observation of characteristic X-ray radiation excited in solid thin targets by the extracted beam of C+6 ions* and circulated beam of 1 GeV protons are presented. It was found that the background radiation of secondary particles** is not as an obstacle for observation of characteristic X-ray radiation spectral peaks at energies from a few to tens of keVs. Spectra of X-ray radiation from Ti and W targets are presented. It is shown that characteristic X-ray radiation can be used for monitoring of the number of particles passed through a non-crystalline target. The applicability of the characteristic X-ray radiation for the monitoring of the number of incident particles in experiments on steering of proton and ion beams by crystalline deflectors as well as for study of parametric X-ray radiation from crystalline deflectors is discussed.,https://proceedings.jacow.org/rupac2014/talks/thpsc21_talk.pdf,False,https://proceedings.jacow.org/rupac2014/papers/thpsc21.pdf,False,https://proceedings.jacow.org/rupac2014/posters/thpsc21_poster.pdf,False,https://doi.org/10.18429/JACoW-RUPAC2014-THPSC21,
rupac2014,,THPSC22,Electron Beam Deflection by Pyroelectric Crystals,R.M. Nazhmudinov; A.S. Kubankin; A.N. Oleinik; A.V. Shchagin; K.A. Vokhmyanina; BelSU; Belgorod; Russia; NSC/KIPT; Kharkov; Ukraine,,Turning of non-relativistic electron beam moving in the transverse electric field created by the pair of pyroelectric crystals is shown experimentally for the first time. The transverse electric field arises between the crystals at their heating and cooling. The angle of the electron beam deflection is measured and the value of the transverse electric field is estimated. Prospects for application of pyroelectric crystals for steering of particle beams are discussed.,https://proceedings.jacow.org/rupac2014/talks/thpsc22_talk.pdf,False,https://proceedings.jacow.org/rupac2014/papers/thpsc22.pdf,False,https://proceedings.jacow.org/rupac2014/posters/thpsc22_poster.pdf,False,https://doi.org/10.18429/JACoW-RUPAC2014-THPSC22,
rupac2014,,THPSC23,Upgrade of BPM System at VEPP-4M Collider,NSU; Novosibirsk; Russia; E.A. Bekhtenev; G.V. Karpov; BINP SB RAS; Novosibirsk; Russia,,Developed in BINP wideband beam position monitor (BPM) electronics has been installed at the VEPP-4M electron-positron collider. The VEPP-4M operates with two electron and two positron bunches. Wide bandwidth of new electronics (200 MHz) allows the separate measurements of electron and positron bunches with time interval between bunches up to 18 ns. 18 BPMs located near four meeting points are supplied with new electronics. The electronics can measure the position of each of four bunches. BPM system works at two modes: slow closed orbit measurements and turn-by-turn measurements. We present details of system design and operation.,https://proceedings.jacow.org/rupac2014/talks/thpsc23_talk.pdf,False,https://proceedings.jacow.org/rupac2014/papers/thpsc23.pdf,True,https://proceedings.jacow.org/rupac2014/posters/thpsc23_poster.pdf,False,https://doi.org/10.18429/JACoW-RUPAC2014-THPSC23,368
rupac2014,,THPSC24,Fast Digital Phasemeter for Booster of NICA Project,A.S. Styuf; G.V. Karpov; BINP SB RAS; Novosibirsk; Russia; Measurement of phase difference of two signals is widely-spread task in various regions of science and engineering. For example; in heavy ions accelerators phase difference between high frequency accelerating voltage and first harmonics of beam signal has to be measured. In this case phase measurement is complicated due to fast changing of signals frequency and amplitude. This task can be easy solved if both signals are converted in digital form and processed in FPGA. Fast phase difference meter for frequency range 0.2-6 MHz is described in this paper. The device provides phase difference measurements with measurement time ~17 microseconds and error less than 1 Degree. Signals frequency can be changed with speed up to 20 MHz/sec; signal amplitude can be changed with speed up to 40 dB/sec. A key procedure of phase meter operation is forming of two orthogonal signals on base of reference signal. During quadrature detecting the signal integration for the time equaled the integer number of signal periods is performed. It allows effectively suppress high signal harmonics. Analog electronics contains programmable gain amplifier with gain range 22-50 dB and can work in wide range of signal amplitude. Phase meter electronics features and signal processing methods are represented in this paper. Phase meter parameters and results obtained in ion accelerator are also given.,,,https://proceedings.jacow.org/rupac2014/talks/thpsc24_talk.pdf,False,https://proceedings.jacow.org/rupac2014/papers/thpsc24.pdf,False,https://proceedings.jacow.org/rupac2014/posters/thpsc24_poster.pdf,False,https://doi.org/10.18429/JACoW-RUPAC2014-THPSC24,
rupac2014,,THPSC25,Extending VEPP-5 Control System by Middleware for Injection/extraction Automation,F.E. Emanov; D. Bolkhovityanov; A.R. Frolov; Ye.A. Gusev; BINP SB RAS; Novosibirsk; Russia; NSU; Novosibirsk; Russia,,CX and EPICS are used at VEPP-5 Injection complex. Each system is in charge of some part of accelerator devices. Middleware layer was added in order to make data processing and facility-level control actions more straightforward. Middleware is separated from clients layer by means of additional CX-server. Architectural approach is discussed by the example of complex injection/extraction automation.,https://proceedings.jacow.org/rupac2014/talks/thpsc25_talk.pdf,False,https://proceedings.jacow.org/rupac2014/papers/thpsc25.pdf,True,https://proceedings.jacow.org/rupac2014/posters/thpsc25_poster.pdf,False,https://doi.org/10.18429/JACoW-RUPAC2014-THPSC25,371
rupac2014,,THPSC26,Distributed Beam Loss Monitor Based on the Cherenkov Effect in Optical Fiber,Yu. Maltseva; F.E. Emanov; A.V. Petrenko; V.G. Prisekin; BINP SB RAS; Novosibirsk; Russia; NSU; Novosibirsk; Russia; CERN; Geneva; Switzerland,,A distributed beam loss monitor based on the Cherenkov effect in optical fiber has been implemented for the VEPP-5 electron and positron linacs and the 510 MeV damping ring at the Budker INP. The monitor operation is based on detection of the Cherenkov radiation generated in optical fiber by means of relativistic particles created in electromagnetic shower after highly relativistic beam particles (electrons or positrons) hit the vacuum pipe. The main advantage of the distributed monitor compared to local ones is that a long optical fiber section can be used instead of a large number of local beam loss monitors. In our experiments the Cherenkov light was detected by photomultiplier tube (PMT). Timing of PMT signal gives the location of the beam loss. In the experiment with 20 m long optical fiber we achieved 3 m spatial resolution. To improve spatial resolution optimization and selection process of optical fiber and PMT are needed and according to our theoretical estimations 0.5 m spatial resolution can be achieved. We also suggest similar techniques for detection of electron (or positron) losses due to Touschek effect in storage rings.,https://proceedings.jacow.org/rupac2014/talks/thpsc26_talk.pdf,False,https://proceedings.jacow.org/rupac2014/papers/thpsc26.pdf,True,https://proceedings.jacow.org/rupac2014/posters/thpsc26_poster.pdf,False,https://doi.org/10.18429/JACoW-RUPAC2014-THPSC26,374
rupac2014,,THPSC27,Modernization of VEPP-2000 Control System,NSU; Novosibirsk; Russia; D.E. Berkaev; O.V. Gorbatenko; A.P. Lysenko; Yu. A. Rogovsky; A.L. Romanov; A.I. Senchenko; P.Yu. Shatunov; Y.M. Shatunov; BINP SB RAS; Novosibirsk; Russia; Electron-positron collider VEPP-2000 delivered data for the high energy physics since the end of 2009. In the summer of 2013 the long shutdown was started dedicated to the deep upgrade of the wide range of subsystems. The main goal of the improvements is to reach or exceed design luminosity in the whole energy range from 200 MeV to 1000 MeV per bunch. The hardware of the accelerator complex consists of high current main field power supplies; low current power supplies for steering and multipole magnets; pulsed power supplies for channel's elements; RF subsystems; BPM and some other special subsystems (such as vacuum; temperature; etc.). The control system is based on CANbas; CAMAC and VME devices. The wide range of software corresponding to specific hardware subsystems forms complicated interacting system that manages all parts of the VEPP-2000 accelerator facility. Automation software is running on several TCP/IP connected PC platforms under operating system Linux and uses client-server techniques. The paper presents general overview and changes made in architecture; implementation and functionality of hardware and software of the VEPP-2000 collider control system.,,,https://proceedings.jacow.org/rupac2014/talks/thpsc27_talk.pdf,False,https://proceedings.jacow.org/rupac2014/papers/thpsc27.pdf,True,https://proceedings.jacow.org/rupac2014/posters/thpsc27_poster.pdf,True,https://doi.org/10.18429/JACoW-RUPAC2014-THPSC27,377
rupac2014,,THPSC28,Development of Automation System of the Ion Source,A.M. Koshkarev; Y.I. Belchenko; A.N. Kvashnin; A.L. Sanin; P.V. Zubarev; BINP SB RAS; Novosibirsk; Russia; To operate a source of negative hydrogen ions an automatic distributed control system was developed. This system consists of master controller (Slab C8051F120) and a set of peripheral local controllers (PLC) based on microcontroller Slab C8051F350. Using an optical link between PLC and master controller there was created a system resistant to high-voltage breakdowns of the ion source. To control the system; a special programming language has been created. It includes procedures for checking the necessary parameters; setting the value of the physical quantities to simplify the experiment; verifying the lock status and protection. This system provides two programmable timers; as well as procedures in emergency situations; such as: lack of water; poor vacuum. It can be operated in semi-automatic mode: the script asks operator about preferable actions and then it continues actions depending on the response. All scripts are performed by master controller; and this makes system very rapid (for example system response time is 1 ms).,,,https://proceedings.jacow.org/rupac2014/talks/thpsc28_talk.pdf,False,https://proceedings.jacow.org/rupac2014/papers/thpsc28.pdf,True,https://proceedings.jacow.org/rupac2014/posters/thpsc28_poster.pdf,False,https://doi.org/10.18429/JACoW-RUPAC2014-THPSC28,380
rupac2014,,THPSC29,Controller for RF Stations for Booster of NICA Project,G.A. Fatkin; A.M. Batrakov; I.V. Ilyin; G.Y. Kurkin; A.M. Pilan; M.Yu. Vasilyev; BINP SB RAS; Novosibirsk; Russia; NSU; Novosibirsk; Russia,,Intellectual Controller for RF stations based on CPU module,https://proceedings.jacow.org/rupac2014/talks/thpsc29_talk.pdf,False,https://proceedings.jacow.org/rupac2014/papers/thpsc29.pdf,True,https://proceedings.jacow.org/rupac2014/posters/thpsc29_poster.pdf,True,https://doi.org/10.18429/JACoW-RUPAC2014-THPSC29,383
rupac2014,,THPSC30,Development of an Integrated Tomography Experiment Control Environment,I.A. Khokhriakov; F. Beckmann; HZG; Geesthacht; Germany; The Helmholtz-Zentrum Geesthacht is operating beamlines optimized for materials research using synchrotron radiation at the Deutsches Elektronen-Synchrotron DESY in Hamburg and beamlines using neutrons at the FRM II in Munich. With the beginning of the operation of the 3rd generation synchrotron-radiation source PETRA III; Hamburg; and the design and planning of the new neutron source ESS; Lund; there is a strong demand to increase the data throughput; to make optimal use of the beamtime; together with a full controlled experiment. Especially in tomography the data pipeline from the experiment to the 3D reconstruction has to be redesigned. Furthermore; the extensive progress in hardware in recent years makes it now possible to develop nearly real time tomography experiment control system. Such system can perform all the routines that are necessary for the experiment and provide real time feedback to the user. This feedback can be used for instant monitoring and/or for real time reconstruction. The most important task for such system is the collection of the data. The data can be divided into three main groups: 1) static data; 2) data collected during the experiment; 3) persistent data. Finally all data is stored in the NeXus format. This data can be interpreted on the fly; for instance to generate a feedback or to perform a reconstruction. This system is now in an approbation stage at IBL (P05) and HEMS (P07) beamlines; PETRA III; DESY; Hamburg; Germany.,,,https://proceedings.jacow.org/rupac2014/talks/thpsc30_talk.pdf,False,https://proceedings.jacow.org/rupac2014/papers/thpsc30.pdf,False,https://proceedings.jacow.org/rupac2014/posters/thpsc30_poster.pdf,False,https://doi.org/10.18429/JACoW-RUPAC2014-THPSC30,
