conference_code,session_name,paper_id,title,authors,institutions,abstract,presentation_url,presentation_available,paper_url,paper_available,poster_url,poster_available,doi,page_number
rupac2014,,WEPSB27,Design of Multifunctional Facility Based on ECR Ion Source for Material Science,"A.V. Ziiatdinova; T. Kulevoy; MEPhI; Moscow; Russia; S.L. Andrianov; B.B. Chalykh; G. Kropachev; R.P. Kuibeda; T. Kulevoy; A.V. Ziiatdinova; ITEP; Moscow; Russia; INFN/LNL; Legnaro (PD); Italy; The traditional experimental method for new materials radiation resistance investigation is a reactor irradiation. However; there are some difficulties during steel exposure in reactor. Simulation method based on ion irradiation allows accelerating the defect generation in the material under investigation. Also a modification of materials by ion beams represents the great practical interest for modern material science. Experiments in both directions are ongoing in ITEP. The paper presents the design of the test-bench based on ECR ion source and electrostatic acceleration which is under development in ITEP. This paper describes the results of beam dynamics simulation in the transport channels of the test-bench. Simulation was carried out in the ""real"" fields Continuous ion beam achievable at the test-bench enables beam fluence on the target up to 1016 particles/m2.",,,https://proceedings.jacow.org/rupac2014/talks/wepsb27_talk.pdf,False,https://proceedings.jacow.org/rupac2014/papers/wepsb27.pdf,True,https://proceedings.jacow.org/rupac2014/posters/wepsb27_poster.pdf,False,https://doi.org/10.18429/JACoW-RUPAC2014-WEPSB27,220
rupac2014,,WEPSB28,Design Studies of the Superconducting Cyclotrons for Proton Therapy,G.A. Karamysheva; S.A. Kostromin; N.A. Morozov; E. Samsonov; E. Syresin; JINR; Dubna; Moscow Region; Russia; JINR/DLNP; Dubna; Moscow region; Russia; Different projects of the cyclotrons for proton therapy were considered in order to provide Medical Technical Complex at JINR; Dubna by proton beam. Our projects can be used for development of the accelerator for proton therapy for the other medical centers. We propose project of the superconducting cyclotron accelerating protons up to energy 250 MeV and superconducting synchrocyclotron which can be used as the 70 MeV protons source for radiation therapy of the shallow-allocated tumors. Conceptual designs of cyclotrons are considered. Main parameters of the magnetic and accelerating systems are chosen. Main aspects of the beam dynamics are studied by means of simulation of the acceleration in the main region of radii; in the extraction region and simulation of the particles capture into acceleration in the very center of the machine.,,,https://proceedings.jacow.org/rupac2014/talks/wepsb28_talk.pdf,False,https://proceedings.jacow.org/rupac2014/papers/wepsb28.pdf,False,https://proceedings.jacow.org/rupac2014/posters/wepsb28_poster.pdf,False,https://doi.org/10.18429/JACoW-RUPAC2014-WEPSB28,
rupac2014,,WEPSB29,The Induction Synchrotron with a Constant Magnetic Field,JINR; Dubna; Moscow Region; Russia; In this report possibility of cyclic acceleration of the charged particles in constant in time a magnetic field is discussed. The closed orbit of particles is formed by a set of magnetic dipoles. In each section of dipoles the radial dispersion of trajectories of a beam depends on the azimuthal length of a dipole and has the small size (on the order of several centimeters). As the dipole section has radial focusing and vertical defocusing; using quadrupole lenses between dipole sections it is possible to organize alternating-sing focusing on all perimeter of the accelerator. Particles are accelerated by electric field of the induction sections which powering up is made at bunch approach. The inductor of sections are remagnetized in the range of time between a beam bunches. Stability of longitudinal oscillations is defined by a form of a table of accelerating induction pulses. Such accelerator is able to afford to expand the range of parameters of accelerated particles on their charge and atomic weight as doesn't demand compliance of a resonance of HF-system to the frequency of the circular frequency of accelerated particles.,,,https://proceedings.jacow.org/rupac2014/talks/wepsb29_talk.pdf,False,https://proceedings.jacow.org/rupac2014/papers/wepsb29.pdf,True,https://proceedings.jacow.org/rupac2014/posters/wepsb29_poster.pdf,False,https://doi.org/10.18429/JACoW-RUPAC2014-WEPSB29,223
rupac2014,,WEPSB30,The Compact Induction Accelerator of Electrons for Radiation Technologies,JINR; Dubna; Moscow Region; Russia; The electron accelerator with energy <10 MEV uses a rectangular pulse of the accelerating induction voltage and a trapezoidal pulse of a leading magnetic field. For preservation of radius of an equilibrium orbit to constants special ratios between amplitude-time characteristics of a magnetic induction and the accelerating voltage of inductors are carried out. The accelerator contains alternating-sign focusing in dipole magnets and rectilinear accelerator parts. Total cross-section of inductors of accelerating section is equal to S=WL/Bc; (W-energy of electrons; L-perimeter of an orbit; B<2Bs; Bs-индукция of saturation of inductors; c - velocity of light),,,https://proceedings.jacow.org/rupac2014/talks/wepsb30_talk.pdf,False,https://proceedings.jacow.org/rupac2014/papers/wepsb30.pdf,True,https://proceedings.jacow.org/rupac2014/posters/wepsb30_poster.pdf,False,https://doi.org/10.18429/JACoW-RUPAC2014-WEPSB30,226
rupac2014,,WEPSB31,Project of Demonstration Center of the Proton Therapy at DLNP JINR,E. Syresin; G.A. Karamysheva; M.Y. Kazarinov; N.A. Morozov; G.V. Mytzin; N.G. Shakun; JINR; Dubna; Moscow Region; Russia; STU; Bratislava; Slovak Republic; JINR is one of the leading proton therapy research centers of the in Russia. The modern technique of 3D conformal proton radiotherapy was first effectuated in Russia in this center; and now it is effectively used in regular treatment sessions. A special Medico-Technical Complex was created at JINR on the basis of the phasotron used for proton treatment. About 100 patients undergo a course of fractionated treatment here every year. During last 14 years were treated by proton beams about more than 1000 patients . A project of the demonstration center of the proton therapy is discussed on base of a superconducting 250 MeV synchrocyclotron. The superconducting synchrocyclotron is planned to install instead of phasotron in Medical Technical Complex of DLNP. The new transport channel is designed for beam delivery to the JINR medical cabin.,,,https://proceedings.jacow.org/rupac2014/talks/wepsb31_talk.pdf,False,https://proceedings.jacow.org/rupac2014/papers/wepsb31.pdf,True,https://proceedings.jacow.org/rupac2014/posters/wepsb31_poster.pdf,False,https://doi.org/10.18429/JACoW-RUPAC2014-WEPSB31,228
rupac2014,,WEPSB32,Positron Annihilation Spectroscopy at LEPTA Facility,P. Horodek; I.N. Meshkov; JINR/DLNP; Dubna; Moscow region; Russia; A.G. Kobets; O. Orlov; A.A. Sidorin; JINR; Dubna; Moscow Region; Russia; Since 2009 year the LEPTA facility at Joint Institute for Nuclear Research in Dubna is operated with positron beam. Today it is developed into two directions. The first one is getting orthopositronium flux in flight. Slow positrons from 22Na source are accumulated in Surko trap and then are injected into the ring where they should overlap with electrons from the sigle-pass electron beam. In this way the flux of orthopositronium atoms will appear and will be observed in the process of registration of gamma quanta from annihilation process. The second group of works focuses on using the positron injector for Positron Annihilation Spectroscopy (PAS) applications. This method is dedicated to detection of structural defects as vacancies in the solid body lattice. The latest progress of this technique is strictly connected with measurements of PAS characteristics using positron beams. The progress in the LEPTA development; the first results obtained in the PAS; idea and actual state of works concerning the construction of the pulsed positron beam will be presented. The creation of pulsed positron beams is the modern tendency in the PAS domain. It allows to measure the lifetimes of annihilating positron in the depth ca. 1 mkm under the surface. It makes possible the identification of kind of defect.,,,https://proceedings.jacow.org/rupac2014/talks/wepsb32_talk.pdf,False,https://proceedings.jacow.org/rupac2014/papers/wepsb32.pdf,True,https://proceedings.jacow.org/rupac2014/posters/wepsb32_poster.pdf,False,https://doi.org/10.18429/JACoW-RUPAC2014-WEPSB32,231
rupac2014,,WEPSB33,Development of the Equipment for the Prototype of a Complex of  Radiotherapy at the Nuclotron-M,JINR/VBLHEP; Dubna; Moscow region; Russia; JINR; Dubna; Moscow Region; Russia; The report deals with the construction of the carbon beam transport line for biomedical research at the Nuclotron accelerator complex; JINR; Dubna. We have studied the scheme and modes of magneto-optical elements of the channel. Used electronics described. We are discussed the compilation and realization of the plan of treating a tumor located at a depth up to 30 cm. Choice of beam scanning schemes and their optimization are shown.,,,https://proceedings.jacow.org/rupac2014/talks/wepsb33_talk.pdf,False,https://proceedings.jacow.org/rupac2014/papers/wepsb33.pdf,True,https://proceedings.jacow.org/rupac2014/posters/wepsb33_poster.pdf,False,https://doi.org/10.18429/JACoW-RUPAC2014-WEPSB33,234
rupac2014,,WEPSB34,Characteristics of Control of Collimators IRIS in the Robotic Radiosurgical System CYBERKNIFE,MEPhI; Moscow; Russia; In work performed the investigation of depending permissible deviation size of the aperture in the case of intersecting beams profiles from the rated size of the aperture collimator IRIS. Determined the dependence permissible deviation collimator aperture size associated with the change of output factors with aperture size; of the rated size of the collimator aperture IRIS. It is found that the needed accuracy of the installation of a given size aperture the collimator for minimum IRIS collimator does not exceed the accuracy of the aperture the installation on the manufacturer's specifications.,,,https://proceedings.jacow.org/rupac2014/talks/wepsb34_talk.pdf,False,https://proceedings.jacow.org/rupac2014/papers/wepsb34.pdf,False,https://proceedings.jacow.org/rupac2014/posters/wepsb34_poster.pdf,False,https://doi.org/10.18429/JACoW-RUPAC2014-WEPSB34,
rupac2014,,WEPSB35,Thermal Simulations of the Biperiodical Accelerating Structure with the Operating Frequency 27 GHz,Yu.D. Kliuchevskaia; S.M. Polozov; MEPhI; Moscow; Russia; Biperiodical accelerating structure (BAS) represents an accelerating structure based on disk loaded waveguide (DLW) with π/2 operation mode. The 1 cm band structure will have very compact transverse size. Such characteristics give it perspective to use in medical accelerators. The results of beam dynamics simulation and electrodynamics study was discussed early. It will important to study the BAS electrodynamics taking into account thermal processes in structure and to design the cooling system. It is important because of the high pulse RF power (about 1.5 MW) necessary for the beam acceleration. The simulation results which are defined using CST code will presented in report. Calculation and determination of the thermolysis coefficient depending on speed; temperature and the water flow direction will make.,,,https://proceedings.jacow.org/rupac2014/talks/wepsb35_talk.pdf,False,https://proceedings.jacow.org/rupac2014/papers/wepsb35.pdf,True,https://proceedings.jacow.org/rupac2014/posters/wepsb35_poster.pdf,False,https://doi.org/10.18429/JACoW-RUPAC2014-WEPSB35,237
rupac2014,,WEPSB36,A prototype of a Phased Array for Deep Thermoradiotherapy,A.M. Fadeev; A.A. Blinnikov; S.M. Ivanov; S.M. Polozov; MEPhI; Moscow; Russia; It is proven that hyperthermia increases radiation and chemotherapy efficiency. In oncology; the generation of a higher temperature at a tumor-involved region of the body is called hyperthermia. The thermoradiotherapy is widely and effective uses. A phased array of eight dipoles for the hyperthermia treatment of deep-seated tumors is proposed earlier. The power and phase coherently delivered to the radiating elements can be varied; so that the electromagnetic field is increased at the tumor location and decreased in the normal tissues. The prototype of the phased array of two dipoles and the RF power scheme are presented and results of experiments are discussed. Measured and simulated temperature distributions along the line connecting two dipoles are discussed in this paper.,,,https://proceedings.jacow.org/rupac2014/talks/wepsb36_talk.pdf,False,https://proceedings.jacow.org/rupac2014/papers/wepsb36.pdf,True,https://proceedings.jacow.org/rupac2014/posters/wepsb36_poster.pdf,False,https://doi.org/10.18429/JACoW-RUPAC2014-WEPSB36,240
rupac2014,,WEPSB37,Interdisciplinary Glossary – Particle Accelerators and Medicine,V.S. Dyubkov; V.V. Dmitriyeva; V.G. Nikitaev; MEPhI; Moscow; Russia; MEPHI; Moscow; Russia; A general concept of a new interdisciplinary glossary; which includes particle accelerator terminology used in medicine; as well as relevant medical concepts; is presented. Its structure and usage rules are described. An example; illustrating the quickly searching technique of relevant information in this Glossary; is considered. A website address; where one can get an access to the Glossary; is specified. Glossary can be refined and supplemented.,,,https://proceedings.jacow.org/rupac2014/talks/wepsb37_talk.pdf,False,https://proceedings.jacow.org/rupac2014/papers/wepsb37.pdf,True,https://proceedings.jacow.org/rupac2014/posters/wepsb37_poster.pdf,False,https://doi.org/10.18429/JACoW-RUPAC2014-WEPSB37,243
rupac2014,,WEPSB38,Multifunctional Extraction Channel Development Heavy Ion RFQ (Radio Frequency Quadrupole),E. Khabibullina; T. Kulevoy; MEPhI; Moscow; Russia; B.B. Chalykh; R. Gavrilin; A. Golubev; G. Kropachev; R.P. Kuibeda; T. Kulevoy; S.A. Visotski; ITEP; Moscow; Russia; INFN/LNL; Legnaro (PD); Italy; In the ITEP the Heavy Ion RFQ HIP-1 (Heavy Ion Prototype) provides ion beams for two different experimental programs. The first one is successfully ongoing and it is aimed to irradiation resistance investigation of reactor construction materials. Samples of new materials for reactors are irradiated by beams of iron; vanadium ions accelerated by the linac. The structure changes are investigated by both transmission electron microscope and atom-probe tomography. The second one is under development and it is aimed to investigate ion beam interaction with plasma and metal vapor targets. On the basis of beam dynamics simulation the design of new RFQ-output line for both experiments realization was developed. Details of beam dynamics simulation and output line design are presented and discussed in this paper.,,,https://proceedings.jacow.org/rupac2014/talks/wepsb38_talk.pdf,False,https://proceedings.jacow.org/rupac2014/papers/wepsb38.pdf,True,https://proceedings.jacow.org/rupac2014/posters/wepsb38_poster.pdf,False,https://doi.org/10.18429/JACoW-RUPAC2014-WEPSB38,245
rupac2014,,WEPSB39,Industrial Prototype of Compact CW Linac,D.S. Yurov; A.S. Alimov; B.S. Ishkanov; V.P. Sakharov; MSU; Moscow; Russia; N.I. Pakhomov; V.I. Shvedunov; M.V. Lomonosov Moscow State University (MSU); Skobeltsyn Institute of Nuclear Physics; Moscow; Russia; A compact continuous-wave linear accelerator for industrial applications with an output electron energy of 1 MeV and design average beam current of 25 mA is described. The results of beam dynamics; accelerating structure; and RF system simulation are presented; accelerator construction and first results of its commissioning are described.,,,https://proceedings.jacow.org/rupac2014/talks/wepsb39_talk.pdf,False,https://proceedings.jacow.org/rupac2014/papers/wepsb39.pdf,True,https://proceedings.jacow.org/rupac2014/posters/wepsb39_poster.pdf,False,https://doi.org/10.18429/JACoW-RUPAC2014-WEPSB39,248
rupac2014,,WEPSB40,Design of a Linear Accelerator with a Magnetic Mirror on the Beam Energy of 45 MeV,V.I. Shvedunov; A.N. Ermakov; B.S. Ishkanov; A.N. Kamanin; V.V. Khankin; L.Yu. Ovchinnikova; N.I. Pakhomov; I.Yu. Vladimirov; MSU; Moscow; Russia; A.I. Karev; V.G. Raevsky; LPI; Moscow; Russia; I.V. Shvedunov; N.V. Shvedunov; D.S. Yurov; MSU SINP; Moscow; Russia; The results of calculation and optimization of pulsed linear accelerator with magnetic mirror on the beam energy; adjustable in the range of 20 - 45 MeV; designed for explosives detection and other applications are presented. The accelerator consists of an electron gun with an off-axis placed cathode with a beam hole on axis; of about 1.6 m long section of standing wave bi-periodic accelerating structure; operating at 2856 MHz; which is optimized to achieve the capture coefficient of more than 50% and of the energy spectrum width of about 2%; of a movable dispersion free magnetic mirror made with rare earth permanent magnet material. Accelerator provides acceleration of the beam with a pulse current of 100 mA to an energy of 45 MeV with RF power consumption less than 10 MW.,,,https://proceedings.jacow.org/rupac2014/talks/wepsb40_talk.pdf,False,https://proceedings.jacow.org/rupac2014/papers/wepsb40.pdf,True,https://proceedings.jacow.org/rupac2014/posters/wepsb40_poster.pdf,False,https://doi.org/10.18429/JACoW-RUPAC2014-WEPSB40,251
rupac2014,,WEPSB41,The X-ray System with Sub-system of Shaping of Fun-Shaped Beam and its Application in the Custom Inspection Systems,"Yu.N. Gavrish; A.M. Fialkovskiy; P.O. Klinovskiy; K.V. Kotenko; V.P. Malyshev; NIIEFA; St. Petersburg; Russia; The analytical survey of X-ray sources based on linear electron accelerators applied in the customs inspection systems (IDK) was carried out on the grounds of requirements to customs inspection systems. The test results of the linear electron accelerator IDK-6/9 MeV which allows to generate the X-ray mode with energies of 6 and 9 MeV are given in this article. The questions of unification of linear electron accelerators for different IDK are also studied. It is proved that the JSC ""D.V. Efremov Scientific Research Institute of Electrophysical Apparatus"" has the necessary scientific and technical potential and is ready to work out and to produce the X-ray sources for Automobile; Sea and Railway Inspection Systems (IDK). In addition to that the JSC ""D.V. Efremov Scientific Research Institute of Electrophysical Apparatus"" is ready to organize the serial production of X-ray sources for inspection systems.",,,https://proceedings.jacow.org/rupac2014/talks/wepsb41_talk.pdf,False,https://proceedings.jacow.org/rupac2014/papers/wepsb41.pdf,True,https://proceedings.jacow.org/rupac2014/posters/wepsb41_poster.pdf,False,https://doi.org/10.18429/JACoW-RUPAC2014-WEPSB41,254
rupac2014,,WEPSB42,Histogram Based Bremsstrahlung Radiation Source Model for the CyberKnife Medical Linear Accelerator,A.V. Dalechina; A.I. Ksenofontov; NRNU; Moscow; Russia; N.N. Burdenko Neurosurgical Institute; Moscow; Russia; The accuracy of dose calculations is of fundamental importance in treatment planning of radiation therapy. The dose distributions must be calculated and verified by an accurate algorithm. The Monte Carlo simulation (statistical method; based on random sampling) of radiation transport is the only method that makes it possible to perform high-precision dose calculations in the case of a complex geometry. The main bottleneck for the application of this method in practical planning of radiation therapy is the lack of a general virtual source model of the accelerator radiation source. There are several approaches that have been described in the literature*. The goal of this work is to build a source model; based on histogram distributions; to represent the 6 MV photon beams from the Cyberknife stereotactic radiosurgery system** for Monte Carlo treatment planning dose calculations. The transport of particles in treatment head of Cyberknife was simulated. Energy; radial and angular distributions were calculated. Source model was created on the base of the cumulative histograms. This approach provides producing an unlimited number of particles for the next dosimetric planning. Results of source modelling were verified in comparison with full-scale simulation without model. Good agreement was shown with calculations using the source model of the linear accelerator treatment head.; *Chetty I.J. et al. Report of the AAPM Task Group No. 105// Med. Phys. 2007.  **Francescon P.; Cora S.; Cavedon C. Total scatter factors of small beams // Med. Phys. 2008.,,,https://proceedings.jacow.org/rupac2014/talks/wepsb42_talk.pdf,False,https://proceedings.jacow.org/rupac2014/papers/wepsb42.pdf,True,https://proceedings.jacow.org/rupac2014/posters/wepsb42_poster.pdf,False,https://doi.org/10.18429/JACoW-RUPAC2014-WEPSB42,256
rupac2014,,WEPSB43,Magnetic Buncher Accelerator UELV-10-10-T-1 for Studying Fluorescence and Radiation-Physical Researches,"Y.S. Pavlov; V.A. Danilichev; V.V. Dobrohotov; O.N. Nepomnyaschy; V.A. Pavlov; IPCE RAS; Moscow; Russia; Accelerator UELV-10-10-T-1 is equipped with special system of injection and magnetic buncher with the purpose of generation picoseconds the beam duration 50 ps with the current 150 A at energy 10 MeV for studying fluorescence and radiation-physical researches. For maintenance of the magnetic bunching the accelerator works in the mode of the reserved energy when duration of the pulse of injection (2; 5 nanoseconds) is much less than time of filling of a wave guide energy (100 nanoseconds). At a pulse microwave of capacity 10 MW the energy which has been saved up in the wave guide; makes about 2 J. It provides an opportunity of a cutting collimator separately chosen bunch after scan of ""package"" by a rotary magnet. After an output from the accelerator the package electrons from 3-5 bunches acts in magnetic buncher consisting of two electromagnets. In buncher the beam is scanning as ""fan""; and then focused. At a current of the beam 30 A in the pulse duration 2; 5 nanoseconds distinction on energy between the adjacent bunches makes of 300 keV; that provides an opportunity of the cutting collimator the separate chosen bunch after space scanning with a rotary magnet. At a magnetic bunching electrons in ""head"" of a bunch have the big energy and are transported on trajectories with the big radius than ""tail"" electrons. Thus ""compression"" of the bunch on time is attain and accordingly the charge of a bunch increases.",,,https://proceedings.jacow.org/rupac2014/talks/wepsb43_talk.pdf,False,https://proceedings.jacow.org/rupac2014/papers/wepsb43.pdf,True,https://proceedings.jacow.org/rupac2014/posters/wepsb43_poster.pdf,False,https://doi.org/10.18429/JACoW-RUPAC2014-WEPSB43,259
rupac2014,,WEPSB44,Neutron Radiation Monitoring of the Therapeutic Proton Beam Transportation,RAS/INR; Moscow; Russia; A monitoring system online controls a therapeutic proton beam by measuring a secondary neutron radiation from the beam losses. The system consists of neutron detectors in the transport path passage from Linac to the facility of proton therapy and terminal controller connected to the computer. The neutron detectors measure a level of the secondary neutron radiation in real time along of the transport channel; near the formative elements. The system of the neutron detectors registers temporal variations of the beam intensity in local areas transport medical channel. These changes arise are due to changes in operating mode of the channels or instability of the elements forming the beam. The monitoring system allows to determine a intensity and temporal structure of the therapeutic beam and to detect mode and instability of the formative elements.,,,https://proceedings.jacow.org/rupac2014/talks/wepsb44_talk.pdf,False,https://proceedings.jacow.org/rupac2014/papers/wepsb44.pdf,True,https://proceedings.jacow.org/rupac2014/posters/wepsb44_poster.pdf,False,https://doi.org/10.18429/JACoW-RUPAC2014-WEPSB44,262
rupac2014,,WEPSB45,Small-Size High-Performance ARSA Accelerators for On-Line Testing for ECB for Radiation Hardness,VNIIEF; Sarov; Russia; S.P. Pukhov; A.V. Rodigin; A.L. Yur’yev; RFNC – VNIIEF; Sarov; Russia; A small-size high-performance pulsed accelerator ARSA with the voltage up to 1.3MeV is developed. The accelerator is distinguished for stability of characteristics (spread no more than ±10%); high dose rate of bremsstrahlung (up to 1.5*1010 R/s in a spot 1 cm in diameter); potentiality of intense operation (hundreds of shots a day); electro-magnetic compatibility with radio electronics. There is developed a fiber-optic monitor-dosimeter functionally connected with ARSA control panel ensuring pulse measurement of bremsstrahlung; accumulation of the prescribed dose; reading of data to the computer. To monitor the shape of bremsstrahlung pulses a separate channel is provided.,,,https://proceedings.jacow.org/rupac2014/talks/wepsb45_talk.pdf,False,https://proceedings.jacow.org/rupac2014/papers/wepsb45.pdf,True,https://proceedings.jacow.org/rupac2014/posters/wepsb45_poster.pdf,False,https://doi.org/10.18429/JACoW-RUPAC2014-WEPSB45,264
